id,conversation_id,created_at,date,time,timezone,user_id,username,name,place,tweet,language,mentions,urls,photos,replies_count,retweets_count,likes_count,hashtags,cashtags,link,retweet,quote_url,video,thumbnail,near,geo,source,user_rt_id,user_rt,retweet_id,reply_to,retweet_date,translate,trans_src,trans_dest
938989673958871041,938988533083021317,2017-12-07 23:32:38 Eastern Standard Time,2017-12-07,23:32:38,-0500,1621424731,danmentos,dan mentos,,@pixelatedboat “what’s the most you’ve ever lost on a bitcoin”  https://t.co/dDGHYAa8Zp,en,[],[],['https://pbs.twimg.com/media/DQf2IUwV4AAyZGX.jpg'],5,169,1075,[],[],https://twitter.com/DanMentos/status/938989673958871041,False,,1,https://pbs.twimg.com/media/DQf2IUwV4AAyZGX.jpg,,,,,,,"[{'screen_name': 'pixelatedboat', 'name': 'pixelatedboat aka “mr tweets”', 'id': '2999158160'}]",,,,
938988533083021317,938988533083021317,2017-12-07 23:28:06 Eastern Standard Time,2017-12-07,23:28:06,-0500,2999158160,pixelatedboat,pixelatedboat aka “mr tweets”,,"John McAfee: Bitcoin now at $16,600.00. Those of you in the old school who believe this is a bubble simply have not understood the new mathematics of the Blockchain.  Gas station manager: Sure man, sure. Just ... just put the gun down, and we’ll find you some pants",en,[],[],[],20,932,5941,[],[],https://twitter.com/pixelatedboat/status/938988533083021317,False,,0,,,,,,,,[],,,,
938986647072337922,938986647072337922,2017-12-07 23:20:36 Eastern Standard Time,2017-12-07,23:20:36,-0500,70739029,jon_bois,Jon Bois,,i’ve decided to become a bitcoin guy. either that or a guy who has a brand loyalty for paper towels. haven’t decided,en,[],[],[],33,119,995,[],[],https://twitter.com/jon_bois/status/938986647072337922,False,,0,,,,,,,,[],,,,
938971186289025024,938971186289025024,2017-12-07 22:19:10 Eastern Standard Time,2017-12-07,22:19:10,-0500,14338147,satoshilite,Charlie Lee,,Many wrote me today telling me to contact Steam to convince them to support Litecoin. Remember that they use @BitPay to help them accept Bitcoin. So lets instead convince BitPay that they should add Litecoin support because Litecoin is a great coin for payments.  https://t.co/f9jW2Uh5Do,en,"[{'screen_name': 'bitpay', 'name': 'bitpay', 'id': '915465450'}]",['https://twitter.com/SteamDB/status/938459631449493504'],[],89,355,1601,[],[],https://twitter.com/SatoshiLite/status/938971186289025024,False,https://twitter.com/SteamDB/status/938459631449493504,0,,,,,,,,[],,,,
938970868142804992,938970868142804992,2017-12-07 22:17:54 Eastern Standard Time,2017-12-07,22:17:54,-0500,204998743,polificcion,Carlos Andrés Vera,,6 años en cana y este HP se llevó suave 300 millones. Mucho más rentable ser de Alianza País que invertir en Bitcoin.  https://t.co/QfiNehqAHe,es,[],['https://twitter.com/jacquelinerodas/status/938794332315897856'],[],27,280,290,[],[],https://twitter.com/Polificcion/status/938970868142804992,False,https://twitter.com/jacquelinerodas/status/938794332315897856,0,,,,,,,,[],,,,
938965919132540928,938965919132540928,2017-12-07 21:58:14 Eastern Standard Time,2017-12-07,21:58:14,-0500,135575282,morningmoneyben,Ben White,,"Fires are raging, bitcoin is a crazy bubble, everyone is a demented sex criminal. There’s your evening briefing goodnight and good luck.",en,[],[],[],16,310,1374,[],[],https://twitter.com/morningmoneyben/status/938965919132540928,False,,0,,,,,,,,[],,,,
938965312145412096,938965312145412096,2017-12-07 21:55:50 Eastern Standard Time,2017-12-07,21:55:50,-0500,807095,nytimes,The New York Times,,Why has Bitcoin’s price gone up so fast? [Corrected link]  https://t.co/PYamZVGPXN,en,[],['http://nyti.ms/2BLG2Ax'],[],52,148,284,[],[],https://twitter.com/nytimes/status/938965312145412096,False,,0,,,,,,,,[],,,,
938962424291610624,938962424291610624,2017-12-07 21:44:21 Eastern Standard Time,2017-12-07,21:44:21,-0500,22680719,paulvigna,Paul Vigna,,Here are your top 10 apps in Apple's App Store right now:  10 Amazon 9 Bitmoji 8 Google Maps 7 Snapchat 6 Facebook 5 Gmail 4 Instagram 3 Messenger 2 YouTube 1 Coinbase  That's a little surreal. #bitcoin,en,[],[],[],30,381,896,['bitcoin'],[],https://twitter.com/paulvigna/status/938962424291610624,False,,0,,,,,,,,[],,,,
938962309107425280,938962309107425280,2017-12-07 21:43:54 Eastern Standard Time,2017-12-07,21:43:54,-0500,1598709350,danheld,Dan Held,,Coinbase is the #1 app in the App Store! #bitcoin #Appstore  https://t.co/u7WyCiU5Z0,en,[],[],['https://pbs.twimg.com/media/DQfdO_3U8AAUNAj.jpg'],37,403,955,"['bitcoin', 'appstore']",[],https://twitter.com/danheld/status/938962309107425280,False,,1,https://pbs.twimg.com/media/DQfdO_3U8AAUNAj.jpg,,,,,,,[],,,,
938961895964528641,938961895964528641,2017-12-07 21:42:15 Eastern Standard Time,2017-12-07,21:42:15,-0500,19725981,dragonflyjonez,🎅🏿America Is Musty🎅🏿,,This is now a bitcoin expert account. Gonna post a avi in a dress shirt with my arms folded and my sleeves rolled up. The rolled up sleeves mean you should listen to my financial advice bc I take risks that pay off,en,[],[],[],35,197,719,[],[],https://twitter.com/DragonflyJonez/status/938961895964528641,False,,0,,,,,,,,[],,,,
938961761171947526,938961761171947526,2017-12-07 21:41:43 Eastern Standard Time,2017-12-07,21:41:43,-0500,750773413,theracedraft,Racial Draft,,when you're looking to invest in Bitcoin and old money is saying it's a bubble but new money is saying it's going to a milli  https://t.co/RHlnjIk8tc,en,[],[],['https://pbs.twimg.com/tweet_video_thumb/DQfcvKOUIAA7IZ1.jpg'],7,146,459,[],[],https://twitter.com/TheRaceDraft/status/938961761171947526,False,,1,https://pbs.twimg.com/tweet_video_thumb/DQfcvKOUIAA7IZ1.jpg,,,,,,,[],,,,
938960175377145856,938960175377145856,2017-12-07 21:35:25 Eastern Standard Time,2017-12-07,21:35:25,-0500,23618940,lopp,Jameson Lopp,,It's odd that we still have to explain why Bitcoin isn't a Ponzi scheme. Ponzi schemes guarantee profits to early investors. Long term HODLers who have seen most of their wealth evaporate overnight know full well that profits are not guaranteed.,en,[],[],[],43,180,802,[],[],https://twitter.com/lopp/status/938960175377145856,False,,0,,,,,,,,[],,,,
938958928708276224,938958928708276224,2017-12-07 21:30:28 Eastern Standard Time,2017-12-07,21:30:28,-0500,3220553311,jctwritesstuff,JC Tarp,,The fuck is a bitcoin and can I eat it?,en,[],[],[],28,296,636,[],[],https://twitter.com/jctwritesstuff/status/938958928708276224,False,,0,,,,,,,,[],,,,
938957749613871104,938957749613871104,2017-12-07 21:25:47 Eastern Standard Time,2017-12-07,21:25:47,-0500,145947376,onemanatatime,"Alunaut (🌎, 🌎)",,"I bought 21,000,000 Bitcoin in 2008 for $0.01. RT this and I'll give 1,000,000 BTC to 21 lucky people who retweeted.",en,[],[],[],254,1530,1087,[],[],https://twitter.com/onemanatatime/status/938957749613871104,False,,0,,,,,,,,[],,,,
938956554161741825,938956554161741825,2017-12-07 21:21:02 Eastern Standard Time,2017-12-07,21:21:02,-0500,25105695,marcymane,marcymane.eth,,🌊😢 #bitcoin I’m the first person with it  https://t.co/jWhPZtrCxb,en,[],[],[],19,161,590,['bitcoin'],[],https://twitter.com/MARCYMANE/status/938956554161741825,False,,1,https://pbs.twimg.com/ext_tw_video_thumb/938956476315402240/pu/img/CoicLlETT9FO9rbn.jpg,,,,,,,[],,,,
938956533085417472,936216690836242432,2017-12-07 21:20:57 Eastern Standard Time,2017-12-07,21:20:57,-0500,877155737713209344,btc,BTC Times,,"This has been a crazy week:  $11,000 - $12,000: 6 days $12,000 - $13,000: 17 hours $13,000 - $14,000: 4 hours $14,000 - $15,000: 10 hours $15,000 - $16,000: 5 hours $16,000 - $17,000: 2 hours $17,000 - $18,000: 30 minutes $18,000 - $19,000: 3 minutes  #Bitcoin $BTC #Crypto",en,[],[],[],26,213,504,"['bitcoin', 'crypto']",['btc'],https://twitter.com/btc/status/938956533085417472,False,,0,,,,,,,,[],,,,
938951328637779968,938951328637779968,2017-12-07 21:00:16 Eastern Standard Time,2017-12-07,21:00:16,-0500,1691181,tailopez,Tai Lopez,,Don’t get greedy. Remember to lock in your gains with Bitcoin. Sell enough to at least get back your principal. Pigs get fat. Hogs get slaughtered.,en,[],[],[],43,867,2785,[],[],https://twitter.com/tailopez/status/938951328637779968,False,,0,,,,,,,,[],,,,
938946048436908032,938946048436908032,2017-12-07 20:39:17 Eastern Standard Time,2017-12-07,20:39:17,-0500,1643500784,francispouliot_,NAKED FACE (offline),,"The most legitimate and common criticism of Bitcoin is that if the world suffers a major catastrophe (e.g. global internet, electric or magnetic event) Bitcoin would also be disrupte/destroyed.  Think about it: the most serious threat to Bitcoin is the end of the world.",en,[],[],[],57,310,987,[],[],https://twitter.com/francispouliot_/status/938946048436908032,False,,0,,,,,,,,[],,,,
938938539282190337,938938539282190337,2017-12-07 20:09:27 Eastern Standard Time,2017-12-07,20:09:27,-0500,961445378,officialmcafee,John McAfee,,"Bitcoin now at $16,600.00. Those of you in the old school who believe this is a bubble simply have not understood the new mathematics of the Blockchain, or you did not cared enough to try. Bubbles are mathematically impossible in this new paradigm. So are corrections and all else  https://t.co/go9v0w92zk",en,[],[],['https://pbs.twimg.com/media/DQfHnliX4AAj-y8.png'],1154,1953,4622,[],[],https://twitter.com/officialmcafee/status/938938539282190337,False,,1,https://pbs.twimg.com/media/DQfHnliX4AAj-y8.png,,,,,,,[],,,,
938935738237718528,938935738237718528,2017-12-07 19:58:19 Eastern Standard Time,2017-12-07,19:58:19,-0500,2150245242,chainbody,hi,,when boonk figure Out how to steal bitcoin its over for U,en,[],[],[],2,177,672,[],[],https://twitter.com/Chainbody/status/938935738237718528,False,,0,,,,,,,,[],,,,
938935566875463681,938935566875463681,2017-12-07 19:57:38 Eastern Standard Time,2017-12-07,19:57:38,-0500,49375869,ryanbetlach33,Ryan Betlach,,"Bought 1,500 bitcoin in 2011 for $2.87 each. I will pick 5 random people who retweet this and give one to each of you. Merry Christmas. 🎅 #Bitcoin",en,[],[],[],15,396,111,['bitcoin'],[],https://twitter.com/RyanBetlach33/status/938935566875463681,False,,0,,,,,,,,[],,,,
938932705697427458,938932705697427458,2017-12-07 19:46:16 Eastern Standard Time,2017-12-07,19:46:16,-0500,2260491445,coinmarketcap,CoinMarketCap,,"The price of Bitcoin has crossed $18,000!  https://t.co/fi55d4aaQr        #CoinMarketCap #bitcoin #cryptocurrency #blockchain #crypto  https://t.co/dLHpzsicmT",en,[],['http://www.coinmarketcap.com/bitcoin'],['https://pbs.twimg.com/media/DQfCQ--W0AI7D4F.jpg'],44,232,428,"['coinmarketcap', 'bitcoin', 'cryptocurrency', 'blockchain', 'crypto']",[],https://twitter.com/CoinMarketCap/status/938932705697427458,False,,1,https://pbs.twimg.com/media/DQfCQ--W0AI7D4F.jpg,,,,,,,[],,,,
938932399739518976,938932399739518976,2017-12-07 19:45:03 Eastern Standard Time,2017-12-07,19:45:03,-0500,14293310,time,TIME,,Hackers steal $70 million in Bitcoin  https://t.co/W1rSrBI6NE,en,[],['http://ti.me/2jpWZcX'],[],27,141,179,[],[],https://twitter.com/TIME/status/938932399739518976,False,,0,,,,,,,,[],,,,
938929885988507649,938929885988507649,2017-12-07 19:35:03 Eastern Standard Time,2017-12-07,19:35:03,-0500,500497164,billratchet,ron fudgebucket,,i bought 3000 bitcoin in 1991 for 20 cents each.. for christmas i will be donating none of this money to charity but one lucky person who RT’s this will get a Hand Job. Go,en,[],[],[],21,1833,6386,[],[],https://twitter.com/BillRatchet/status/938929885988507649,False,,0,,,,,,,,[],,,,
938920220965601280,938920220965601280,2017-12-07 18:56:39 Eastern Standard Time,2017-12-07,18:56:39,-0500,19062153,stacyherbert,Stacy Herbert 🇸🇻,,I bought 5 million bitcoin in 2010 at $1.26. I’m going to give 100 fake bitcoin to 100 random people. Retweet this to enter my fake bitcoin draw. You could win! Just retweet.,en,[],[],[],66,368,221,[],[],https://twitter.com/stacyherbert/status/938920220965601280,False,,0,,,,,,,,[],,,,
938916609779003393,938916609779003393,2017-12-07 18:42:18 Eastern Standard Time,2017-12-07,18:42:18,-0500,18856867,zerohedge,zerohedge,,World's Largest Online Seller Of Gold Is Now Accepting Bitcoin  https://t.co/YbqL8QAh0p,en,[],['http://www.zerohedge.com/news/2017-12-07/worlds-largest-online-seller-gold-now-accepting-bitcoin'],[],35,376,527,[],[],https://twitter.com/zerohedge/status/938916609779003393,False,,0,,,,,,,,[],,,,
938915867261394944,938915867261394944,2017-12-07 18:39:21 Eastern Standard Time,2017-12-07,18:39:21,-0500,737408880502771712,davidletternan,David Letter fan,,"I bought 3,500 bitcoin in 2011 for $2.78 each. I will pick 50 random people who retweet this and give one to each of you. Merry Christmas 🎅 #Bitcoin",en,[],[],[],1185,9888,3567,['bitcoin'],[],https://twitter.com/DavidLetternan/status/938915867261394944,False,,0,,,,,,,,[],,,,
938912073647452161,938912073647452161,2017-12-07 18:24:17 Eastern Standard Time,2017-12-07,18:24:17,-0500,5637562,neilstrauss,Neil Strauss,,"Before listening to the skeptics saying that Bitcoin is a bubble or not “real” money (ha!), consider these Newsweek predictions about the Internet in 1995. Besides, the coming blockchain revolution is as much about Bitcoin as the Internet era is about newsgroups.  https://t.co/FI5tmVtqw8",en,[],[],"['https://pbs.twimg.com/media/DQevjFJVQAEmCFB.jpg', 'https://pbs.twimg.com/media/DQevjFPUEAA3NoC.jpg', 'https://pbs.twimg.com/media/DQevjFLUEAA0OM7.jpg']",78,492,992,[],[],https://twitter.com/neilstrauss/status/938912073647452161,False,,1,https://pbs.twimg.com/media/DQevjFJVQAEmCFB.jpg,,,,,,,[],,,,
938911513431158785,938911513431158785,2017-12-07 18:22:03 Eastern Standard Time,2017-12-07,18:22:03,-0500,361289499,bitcoinmagazine,Bitcoin Magazine,,It’s A Wonderful Life for #Bitcoin Evangelist as Community Expresses Its Gratitude  https://t.co/G44tDmIR1k #THANKYOUANDREAS @aantonop #blockchain,en,"[{'screen_name': 'aantonop', 'name': 'andreas', 'id': '1469101279'}]",['https://bitcoinmagazine.com/articles/its-wonderful-life-bitcoin-evangelist-community-expresses-its-gratitude/'],[],30,152,430,"['bitcoin', 'thankyouandreas', 'blockchain']",[],https://twitter.com/BitcoinMagazine/status/938911513431158785,False,,0,,,,,,,,[],,,,
938910031038201856,938910031038201856,2017-12-07 18:16:10 Eastern Standard Time,2017-12-07,18:16:10,-0500,14338147,satoshilite,Charlie Lee,,"People going 🦇💩 crazy over Bitcoin today and upset at Litecoin not performing as well. Here's some perspective. BTC is up 20x this past year, but LTC is up 25x!",en,[],[],[],371,1249,6080,[],[],https://twitter.com/SatoshiLite/status/938910031038201856,False,,0,,,,,,,,[],,,,
938896099351212033,938896099351212033,2017-12-07 17:20:48 Eastern Standard Time,2017-12-07,17:20:48,-0500,21615467,tylerfbradley,tylerbu//y,,2017 mission: find a sugar daddy  2018 mission: find a bitcoin daddy,en,[],[],[],57,4101,16402,[],[],https://twitter.com/tylerfbradley/status/938896099351212033,False,,0,,,,,,,,[],,,,
938886923392831489,938886923392831489,2017-12-07 16:44:20 Eastern Standard Time,2017-12-07,16:44:20,-0500,19132398,brucefenton,Bruce Fenton,,Why you might not have gained from buying Bitcoin in 2013  https://t.co/swqK1Oc9mA,en,[],['https://www.pscp.tv/w/bPhb0jFlVmpZWE9SQXJuS0x8MXZBeFJNYmVPWVBKbCVQ9GqYhuOWPzVfXOGszzyj0835F5F5CAK8mT52kaNx'],[],118,517,1295,[],[],https://twitter.com/brucefenton/status/938886923392831489,False,,0,,,,,,,,[],,,,
938882398925725696,938882398925725696,2017-12-07 16:26:22 Eastern Standard Time,2017-12-07,16:26:22,-0500,249972054,doomric,E,,Put $14.00 into bitcoin last Thursday sitting on $22.00 now lmaoo idk how y’all do that 9-5 shit,en,[],[],[],300,26530,110017,[],[],https://twitter.com/Doomric/status/938882398925725696,False,,0,,,,,,,,[],,,,
938877751846514688,938877751846514688,2017-12-07 16:07:54 Eastern Standard Time,2017-12-07,16:07:54,-0500,18856867,zerohedge,zerohedge,,BOOM: GOLDMAN SACHS IS SAID TO DECIDE TO CLEAR BITCOIN FUTURES,en,[],[],[],40,356,640,[],[],https://twitter.com/zerohedge/status/938877751846514688,False,,0,,,,,,,,[],,,,
938874538804183040,938874538804183040,2017-12-07 15:55:08 Eastern Standard Time,2017-12-07,15:55:08,-0500,934149470,boomboxcartel,BOOMBOX CARTEL,,buys .0000001 bitcoin:  “Investor | Entrepreneur  👊🏼 Hard work pays off 💼 Living the Life✨”,en,[],[],[],19,558,2274,[],[],https://twitter.com/BoomboxCartel/status/938874538804183040,False,,0,,,,,,,,[],,,,
938872997011603457,938872997011603457,2017-12-07 15:49:00 Eastern Standard Time,2017-12-07,15:49:00,-0500,25244278,dollabillgates,Myneuver,,Me after i invested $7 into Bitcoin yesterday  https://t.co/VrOW401M0b,en,[],[],[],169,9800,19214,[],[],https://twitter.com/DOLLABILLGATES/status/938872997011603457,False,,1,https://pbs.twimg.com/ext_tw_video_thumb/938872962031034368/pu/img/79yNFd3O6-lM08JD.jpg,,,,,,,[],,,,
938872744644575233,938872744644575233,2017-12-07 15:48:00 Eastern Standard Time,2017-12-07,15:48:00,-0500,192399262,brent_rooker19,Brent Rooker,,I have bought 0 Bitcoin in my life and tbh I don’t even know what a Bitcoin is. I will randomly pick 5 people who retweet this and give you absolutely nothing. Good luck!,en,[],[],[],15,196,746,[],[],https://twitter.com/Brent_Rooker19/status/938872744644575233,False,,0,,,,,,,,[],,,,
938866281893244928,938866281893244928,2017-12-07 15:22:19 Eastern Standard Time,2017-12-07,15:22:19,-0500,11912362,worldstar,WORLDSTARHIPHOP,,#Bitcoin be like.. 😂💰💯  https://t.co/ZqZDQvD4q4,en,[],[],['https://pbs.twimg.com/media/DQeF5ioU8AAAnV3.jpg'],22,324,1601,['bitcoin'],[],https://twitter.com/WORLDSTAR/status/938866281893244928,False,,1,https://pbs.twimg.com/media/DQeF5ioU8AAAnV3.jpg,,,,,,,[],,,,
938864041249988613,938864041249988613,2017-12-07 15:13:25 Eastern Standard Time,2017-12-07,15:13:25,-0500,1333467482,coindesk,CoinDesk,,The Bulgarian Government Is Sitting on $3 Billion in Bitcoin  https://t.co/U0n4xJiExf  https://t.co/aY3FIeYdT4,en,[],['http://bit.ly/2A0xGV5'],['https://pbs.twimg.com/media/DQeD3mQXcAE8uIA.jpg'],51,373,517,[],[],https://twitter.com/CoinDesk/status/938864041249988613,False,,1,https://pbs.twimg.com/media/DQeD3mQXcAE8uIA.jpg,,,,,,,[],,,,
938863892494663680,938863892494663680,2017-12-07 15:12:49 Eastern Standard Time,2017-12-07,15:12:49,-0500,110396781,ajplus,AJ+,,"The price of Bitcoin has skyrocketed to around a record $19K today, making it worth more than companies like Wal-Mart, AT&amp;T and Coca-Cola. What exactly is Bitcoin again?  https://t.co/bPyPus36F0",en,[],['https://youtu.be/S9tLfZYoLOY'],[],10,167,241,[],[],https://twitter.com/ajplus/status/938863892494663680,False,,0,,,,,,,,[],,,,
938859025483141121,938859025483141121,2017-12-07 14:53:29 Eastern Standard Time,2017-12-07,14:53:29,-0500,1413027896,charliebilello,Charlie Bilello,,"Poll Results: higher the price of Bitcoin, less people believe it's a bubble, more people believe it's undervalued.  https://t.co/F8hEOLHYNB",en,[],[],['https://pbs.twimg.com/media/DQd_TokX0AAFdNZ.jpg'],59,281,635,[],[],https://twitter.com/charliebilello/status/938859025483141121,False,,1,https://pbs.twimg.com/media/DQd_TokX0AAFdNZ.jpg,,,,,,,[],,,,
938856753046753280,938856753046753280,2017-12-07 14:44:27 Eastern Standard Time,2017-12-07,14:44:27,-0500,492981803,byron,Reckful,,investing in bitcoin is investing in human stupidity  infinite value,en,[],[],[],119,215,2230,[],[],https://twitter.com/Byron/status/938856753046753280,False,,0,,,,,,,,[],,,,
938852905884327936,938852905884327936,2017-12-07 14:29:10 Eastern Standard Time,2017-12-07,14:29:10,-0500,20239153,darwynstheory,darwynmetzger.ethᵍᵐ ⚫️,,"On the 12th day of X-mas 2017 gave to me...  12 Players Kneeling 11x Bitcoin Run-up  10 Notched iPhones 90,000 Acres Burning 8.1 Mexican Earthquake 7 Mar-a-lago Visits 6 Weinstein Lawsuits FAAAAKKE NEWS 4 Mueller Indictments 3 Lethal Hurricanes Vine 2.0 …&amp; A Tax Break for the 1%",en,[],[],[],7,432,914,[],[],https://twitter.com/DarwynsTheory/status/938852905884327936,False,,0,,,,,,,,[],,,,
938852407362060288,938852407362060288,2017-12-07 14:27:11 Eastern Standard Time,2017-12-07,14:27:11,-0500,66112328,chukxoo,Čhukwudi,,Bought 358 bitcoin in 2012 for $8.13 each. I will randomly pick 4 people who retweet this and give one to each of you. Merry Christmas. 🎅 #Bitcoin,en,[],[],[],167,2250,701,['bitcoin'],[],https://twitter.com/Chukxoo/status/938852407362060288,False,,0,,,,,,,,[],,,,
938852291452522496,938852291452522496,2017-12-07 14:26:43 Eastern Standard Time,2017-12-07,14:26:43,-0500,227682918,bopinion,Bloomberg Opinion,,Will Bitcoin boil the oceans? @eiaine says concerns about its energy use are overblown  https://t.co/egIhGVWzSW  https://t.co/Gc834IduwC,en,"[{'screen_name': 'eiaine', 'name': 'eiaine@bitcoinhackers.org 🐤🇮🇨', 'id': '21455761'}]",['https://bloom.bg/2kuIYxX'],['https://pbs.twimg.com/media/DQd5Lr8VwAAwNJ5.jpg'],49,184,336,[],[],https://twitter.com/bopinion/status/938852291452522496,False,,1,https://pbs.twimg.com/media/DQd5Lr8VwAAwNJ5.jpg,,,,,,,[],,,,
938852135684288513,938852135684288513,2017-12-07 14:26:06 Eastern Standard Time,2017-12-07,14:26:06,-0500,14338147,satoshilite,Charlie Lee,,"I will be on the Glenn Beck TV show today at 5pm ET. It will be mostly about Bitcoin futures and how that affect things, but maybe I will also mention Litecoin. We'll see!  You can watch it here:  https://t.co/oLP8qrFt20",en,[],['https://premium.theblaze.com/tv/'],[],198,338,1785,[],[],https://twitter.com/SatoshiLite/status/938852135684288513,False,,0,,,,,,,,[],,,,
938851148169076736,938851148169076736,2017-12-07 14:22:11 Eastern Standard Time,2017-12-07,14:22:11,-0500,854165191180795904,hondadeal4vets,Joseph Urban,,"What is growing faster, JoeU or Bitcoin ?",en,[],[],[],34,184,1687,[],[],https://twitter.com/hondadeal4vets/status/938851148169076736,False,,0,,,,,,,,[],,,,
938847562387410945,938847562387410945,2017-12-07 14:07:56 Eastern Standard Time,2017-12-07,14:07:56,-0500,428151039,vxschmid,Valentin Schmid,,Another aspect of #Bitcoin : Wealth redistribution without the use of force.   https://t.co/Kj1zX7BbnZ,en,[],['https://www.theepochtimes.com/is-bitcoin-just-a-brilliant-wealth-redistribution-scheme-3_2377636.html'],[],31,154,338,['bitcoin'],[],https://twitter.com/vxschmid/status/938847562387410945,False,,0,,,,,,,,[],,,,
938839708607614978,938839708607614978,2017-12-07 13:36:43 Eastern Standard Time,2017-12-07,13:36:43,-0500,19132398,brucefenton,Bruce Fenton,,"BREAKING:  Coinbase unavailable.  The company now has more customers than Charles Schwab and has opened as many as 300,000 accounts in a day.  Today has unprecedented volume and demand.  There are litterally so many people trying to buy Bitcoin that exchanges are crashing.  https://t.co/ZzMKkplyga",en,[],[],['https://pbs.twimg.com/media/DQdtvFsW0AAFrFa.jpg'],28,173,271,[],[],https://twitter.com/brucefenton/status/938839708607614978,False,,1,https://pbs.twimg.com/media/DQdtvFsW0AAFrFa.jpg,,,,,,,[],,,,
938838975422304257,938838975422304257,2017-12-07 13:33:49 Eastern Standard Time,2017-12-07,13:33:49,-0500,877155737713209344,btc,BTC Times,,10 companies that are now worth less than #Bitcoin:  1. Wal-Mart @Walmart  2. Visa @Visa  3. Intel @intel  4. AT&amp;T @ATT  5. Coca-Cola @CocaCola  6. Home Depot @HomeDepot  7. Verizon @verizon  8. Toyota @Toyota  9. Comcast @comcast  10. Walt Disney @Disney   #CryptoCurrencies,en,"[{'screen_name': 'walmart', 'name': 'walmart', 'id': '17137891'}, {'screen_name': 'visa', 'name': 'visa', 'id': '551373363'}, {'screen_name': 'intel', 'name': 'intel', 'id': '2803191'}, {'screen_name': 'att', 'name': 'at&t', 'id': '14620190'}, {'screen_name': 'cocacola', 'name': 'coca-cola', 'id': '26787673'}, {'screen_name': 'homedepot', 'name': 'the home depot', 'id': '14791918'}, {'screen_name': 'verizon', 'name': 'verizon', 'id': '59889953'}, {'screen_name': 'toyota', 'name': 'toyota usa', 'id': '14219877'}, {'screen_name': 'comcast', 'name': 'comcast', 'id': '89587925'}, {'screen_name': 'disney', 'name': 'disney', 'id': '67418441'}]",[],[],48,819,1457,"['bitcoin', 'cryptocurrencies']",[],https://twitter.com/btc/status/938838975422304257,False,,0,,,,,,,,[],,,,
938834012507983873,938834012507983873,2017-12-07 13:14:05 Eastern Standard Time,2017-12-07,13:14:05,-0500,3108351,wsj,The Wall Street Journal,,"Bitcoin jumps 40% in about 40 hours, to more than $16,000  https://t.co/wCz8rbz4zX",en,[],['http://on.wsj.com/2BKXSmT'],[],27,143,170,[],[],https://twitter.com/WSJ/status/938834012507983873,False,,0,,,,,,,,[],,,,
938830553477824512,938830553477824512,2017-12-07 13:00:21 Eastern Standard Time,2017-12-07,13:00:21,-0500,1854401,vinnylingham,Vinny Lingham,,"#1 most important rule about owning Bitcoin. If you don’t own the private keys, you don’t own the Bitcoin. Do NOT leave your coins on exchanges!",en,[],[],[],109,631,1876,[],[],https://twitter.com/VinnyLingham/status/938830553477824512,False,,0,,,,,,,,[],,,,
938827968553672704,938827968553672704,2017-12-07 12:50:04 Eastern Standard Time,2017-12-07,12:50:04,-0500,34713362,business,Bloomberg,,"Bitcoin soars to almost $20,000 on Coinbase exchange  https://t.co/Yv9G75GQa0  https://t.co/mbLZnK1uTd",en,[],['https://bloom.bg/2kx53f8'],['https://pbs.twimg.com/media/DQdjD45VQAAPaHS.jpg'],25,169,228,[],[],https://twitter.com/business/status/938827968553672704,False,,1,https://pbs.twimg.com/media/DQdjD45VQAAPaHS.jpg,,,,,,,[],,,,
938826635477794816,938826635477794816,2017-12-07 12:44:47 Eastern Standard Time,2017-12-07,12:44:47,-0500,2259434528,cobie,Cobie,,"Just heard someone say ""Bitcoin is crashing, it's down to 16000 on coinbase"" and now I know what true happiness is. When bitcoin ""crashing"" is going down to SIXTEEN THOUSAND.",en,[],[],[],29,143,822,[],[],https://twitter.com/cobie/status/938826635477794816,False,,0,,,,,,,,[],,,,
