id,conversation_id,created_at,date,time,timezone,user_id,username,name,place,tweet,language,mentions,urls,photos,replies_count,retweets_count,likes_count,hashtags,cashtags,link,retweet,quote_url,video,thumbnail,near,geo,source,user_rt_id,user_rt,retweet_id,reply_to,retweet_date,translate,trans_src,trans_dest
941819877974687745,941819877974687745,2017-12-15 18:58:51 Eastern Standard Time,2017-12-15,18:58:51,-0500,727071292805910528,therealxinxi,"Xinxi Wang, PhD",,Litecoin: The Bitcoin rival whose price has risen five times faster than its big brother' | via @telegraph  https://t.co/xMFSSdNIDy,en,"[{'screen_name': 'telegraph', 'name': 'the telegraph', 'id': '16343974'}]",['http://www.telegraph.co.uk/technology/0/litecoin-bitcoin-rival-whose-price-has-risen-five-times-faster/'],[],26,299,810,[],[],https://twitter.com/TheRealXinxi/status/941819877974687745,False,,0,,,,,,,,[],,,,
941818563219808257,941818563219808257,2017-12-15 18:53:38 Eastern Standard Time,2017-12-15,18:53:38,-0500,7218712,stellabelle,Ƨ and 776 others,,1/2 That moment when you realize #Bitcoin is not in a bubble but a new technology adoption S curve. #btc $btc $bitcoin #notabubble  https://t.co/hMwFUhFLf6,en,[],[],['https://pbs.twimg.com/media/DRIC_L8U8AAxgUU.jpg'],21,279,496,"['bitcoin', 'btc', 'notabubble']",['btc'],https://twitter.com/stellabelle/status/941818563219808257,False,,1,https://pbs.twimg.com/media/DRIC_L8U8AAxgUU.jpg,,,,,,,[],,,,
941806095193972736,941806095193972736,2017-12-15 18:04:05 Eastern Standard Time,2017-12-15,18:04:05,-0500,1643500784,francispouliot_,NAKED FACE (offline),,"Once the ""Bitcoin bubble"" grows large enough it will not pop. It will become the atmosphere.",en,[],[],[],34,308,1023,[],[],https://twitter.com/francispouliot_/status/941806095193972736,False,,0,,,,,,,,[],,,,
941798931197022208,941798931197022208,2017-12-15 17:35:37 Eastern Standard Time,2017-12-15,17:35:37,-0500,339061487,apompliano,Pomp 🌪,,"If you can't answer ""YES"" to the following questions, don't buy Bitcoin or other crypto assets:  1. Have you read the Bitcoin white paper? 2. Can you explain how blockchain works? 3. Do you know utility of what you're buying? 4. Can you afford to lose everything?",en,[],[],[],76,244,598,[],[],https://twitter.com/APompliano/status/941798931197022208,False,,0,,,,,,,,[],,,,
941792580940988416,941792580940988416,2017-12-15 17:10:23 Eastern Standard Time,2017-12-15,17:10:23,-0500,574032254,coinbase,Coinbase,,Bitcoin SegWit Update  https://t.co/3YPQPlg9tc,en,[],['https://blog.coinbase.com/bitcoin-segwit-update-3ab0484e4526'],[],175,289,881,[],[],https://twitter.com/coinbase/status/941792580940988416,False,,0,,,,,,,,[],,,,
941790926074236928,941790926074236928,2017-12-15 17:03:49 Eastern Standard Time,2017-12-15,17:03:49,-0500,16892481,nxthompson,nxthompson,,Wow. Bitcoin now uses roughly 5X as much energy as Google. All of Google. @jetjocko digs in.  https://t.co/GS5qn8pm2A,en,"[{'screen_name': 'jetjocko', 'name': 'adam rogers', 'id': '18955413'}]",['https://www.wired.com/story/bitcoin-global-warming/'],[],35,665,726,[],[],https://twitter.com/nxthompson/status/941790926074236928,False,,0,,,,,,,,[],,,,
941787630697570304,941787630697570304,2017-12-15 16:50:43 Eastern Standard Time,2017-12-15,16:50:43,-0500,22668801,piques15,Piques,,Giving away 1 Bitcoin. RT for a chance win 🤙🏻  https://t.co/bTdqz2mTkT,en,[],[],"['https://pbs.twimg.com/media/DRHm2kOVAAAkA7v.jpg', 'https://pbs.twimg.com/media/DRHm2jqVwAEMkbI.jpg']",65,1828,1313,[],[],https://twitter.com/piques15/status/941787630697570304,False,,1,https://pbs.twimg.com/media/DRHm2kOVAAAkA7v.jpg,,,,,,,[],,,,
941782698514894849,941782698514894849,2017-12-15 16:31:07 Eastern Standard Time,2017-12-15,16:31:07,-0500,26574283,cnbcnow,CNBC Now,,BREAKING: TD Ameritrade to allow bitcoin futures trading Monday  https://t.co/xPnb23x2ZT,en,[],['http://cnbc.com/id/104902270'],[],26,447,582,[],[],https://twitter.com/CNBCnow/status/941782698514894849,False,,0,,,,,,,,[],,,,
941782698229723136,941782698229723136,2017-12-15 16:31:07 Eastern Standard Time,2017-12-15,16:31:07,-0500,20402945,cnbc,CNBC,,BREAKING: TD Ameritrade to allow bitcoin futures trading Monday  https://t.co/E2Q5DsFCzl,en,[],['http://cnbc.com/id/104902270'],[],80,1406,2085,[],[],https://twitter.com/CNBC/status/941782698229723136,False,,0,,,,,,,,[],,,,
941779123386638338,941779123386638338,2017-12-15 16:16:55 Eastern Standard Time,2017-12-15,16:16:55,-0500,1372200414,peterbrannen1,Peter🌲Brannen,,"Imagine being a photon forged in the center of a star, crossing 93 million miles of space, hitting a cycad leaf in a Carboniferous jungle, being stored as chemical enrgy, being buried for 315 million yrs, being dug up burned &amp; released again as waste heat in a bitcoin transaction",en,[],[],[],277,5144,15545,[],[],https://twitter.com/PeterBrannen1/status/941779123386638338,False,,0,,,,,,,,[],,,,
941773697605603329,941773697605603329,2017-12-15 15:55:21 Eastern Standard Time,2017-12-15,15:55:21,-0500,57689645,tracemayer,Trace Mayer,,"#Bitcoin now a solid top-15 world currency surpassing India. $18k $BTC &amp; $300B market cap only tip of speculation network effect. 7 more to grow deep. Still a healthy uptrend. 200DMA $5,085 &amp; rising ~$70/day. $18k/5.1k=3.53x; starting to overstretch. Onward &amp; upward. 🚂 🚀 🐂  https://t.co/hX1PaGQvlI",en,[],[],['https://pbs.twimg.com/media/DRHZbyFV4AEVgrP.jpg'],36,267,570,['bitcoin'],['btc'],https://twitter.com/TraceMayer/status/941773697605603329,False,,1,https://pbs.twimg.com/media/DRHZbyFV4AEVgrP.jpg,,,,,,,[],,,,
941769537896280067,941769537896280067,2017-12-15 15:38:49 Eastern Standard Time,2017-12-15,15:38:49,-0500,22790881,briankrebs,briankrebs,,"Former Mariposa botnet code author and Darkode crime forum founder is CTO of hacked Bitcoin mining firm NiceHash, which was robbed of ~$52M in BTC on Dec. 6. What we know so far about the investigation  https://t.co/siiplwrWle  https://t.co/f8D0xaMoXX",en,[],['https://krebsonsecurity.com/2017/12/former-botmaster-darkode-founder-is-cto-of-hacked-bitcoin-mining-firm-nicehash/'],['https://pbs.twimg.com/media/DRHWZrpXUAAlnIH.jpg'],12,251,274,[],[],https://twitter.com/briankrebs/status/941769537896280067,False,,1,https://pbs.twimg.com/media/DRHWZrpXUAAlnIH.jpg,,,,,,,[],,,,
941769498742394880,941769498742394880,2017-12-15 15:38:40 Eastern Standard Time,2017-12-15,15:38:40,-0500,915465450,bitpay,BitPay,,"BitPay Will Process Payments on Multiple Blockchains, Starting with Bitcoin Cash | The BitPay Blog  https://t.co/xt6ikB8lsS #BitcoinCash #Bitcoin #Segwit  https://t.co/snIeIigsBu",en,[],['https://blog.bitpay.com/multiple-blockchains/'],['https://pbs.twimg.com/media/DRHWQTOW4AEdXB8.jpg'],326,620,1292,"['bitcoincash', 'bitcoin', 'segwit']",[],https://twitter.com/BitPay/status/941769498742394880,False,,1,https://pbs.twimg.com/media/DRHWQTOW4AEdXB8.jpg,,,,,,,[],,,,
941761730060759040,941761730060759040,2017-12-15 15:07:48 Eastern Standard Time,2017-12-15,15:07:48,-0500,21263333,jimmysong,Jimmy Song (송재준),,"Announcement #3:  I am writing a book for @OReillyMedia titled Programming Bitcoin!  And yes, I want a honey badger on the cover.",en,"[{'screen_name': 'oreillymedia', 'name': ""o'reilly media"", 'id': '11069462'}]",[],[],85,171,1542,[],[],https://twitter.com/jimmysong/status/941761730060759040,False,,0,,,,,,,,[],,,,
941734517575995393,941734517575995393,2017-12-15 13:19:40 Eastern Standard Time,2017-12-15,13:19:40,-0500,176758255,rogerkver,Roger Ver,,My favorite thing about ICOs is that they allow entrepreneurs anywhere in the world to connect with investors anywhere in the world without going through a bank or middleman.  This wasn't possible before the invention of Bitcoin.   https://t.co/FONfwvzhPD,en,[],['https://www.nagaico.com/'],[],119,254,1008,[],[],https://twitter.com/rogerkver/status/941734517575995393,False,,0,,,,,,,,[],,,,
941731879568408577,941731879568408577,2017-12-15 13:09:11 Eastern Standard Time,2017-12-15,13:09:11,-0500,23618940,lopp,Jameson Lopp,,"No, @BitGo has no plans to support: Bitcoin Platinum Bitcoin Diamond Bitcoin Ruby Bitcoin Cash Plus Bitcoin Clashic Bitcoin Uranium Bitcoin Silver Bitcoin Hot Bitcoin God BitcoinG BitcoinStake Bitcoin Blue Bitcoin Faith Bitcoin Pizza Super Bitcoin Lightning Bitcoin UnitedBitcoin",en,"[{'screen_name': 'bitgo', 'name': 'bitgo', 'id': '2294954370'}]",[],[],113,191,869,[],[],https://twitter.com/lopp/status/941731879568408577,False,,0,,,,,,,,[],,,,
941718868149420032,941718868149420032,2017-12-15 12:17:29 Eastern Standard Time,2017-12-15,12:17:29,-0500,44634001,kelangdbn,Spica,,クルーグマン「Bitcoinは明らかにバブル　10年前の住宅バブル以上の確実さ」  https://t.co/Sv3PeYtQAk 誰もその仕組を理解してない。価値を支えるものがない。しかし住宅と違い新規供給のコストが極めて高いためすぐには弾けない。こんなものに価値がないと皆が気づいた時にそれは来る。,ja,[],['http://www.businessinsider.com/paul-krugman-says-bitcoin-is-a-bubble-2017-12'],[],3,266,239,[],[],https://twitter.com/Kelangdbn/status/941718868149420032,False,,0,,,,,,,,[],,,,
941715062871470091,941715062871470091,2017-12-15 12:02:21 Eastern Standard Time,2017-12-15,12:02:21,-0500,705277074983002112,nebeusworld,Nebeus,,Need money now?  Why not use Nebeus tokens (NBTK) as collateral for loans and get 3x leverage for crypto-trading!  Learn more about the innovative platform’s advantages now at  https://t.co/SxexIeBQAZ   #ICO #Nebeus #bitcoin #cryptocurrency #NebeusICO  https://t.co/ruCEdxDE06,en,[],['http://goo.gl/jW8VrQ'],['https://pbs.twimg.com/media/DRGk24eXcAErbUp.jpg'],0,340,324,"['ico', 'nebeus', 'bitcoin', 'cryptocurrency', 'nebeusico']",[],https://twitter.com/NebeusWorld/status/941715062871470091,False,,1,https://pbs.twimg.com/media/DRGk24eXcAErbUp.jpg,,,,,,,[],,,,
941714490055364609,941714490055364609,2017-12-15 12:00:05 Eastern Standard Time,2017-12-15,12:00:05,-0500,859484337850523648,crypto_rand,Crypto Rand,,"Some key points about #Security on $Crypto:  - Have a different mail for each exchange/account. - Activate 2FA everywhere. Print the recovery codes. - Keep the passwords on paper. - Don't trade using public WiFi's. - Bookmark the exchanges/wallets, avoid third links.  #Bitcoin",en,[],[],[],93,893,2271,"['security', 'bitcoin']",['crypto'],https://twitter.com/crypto_rand/status/941714490055364609,False,,0,,,,,,,,[],,,,
941710621699174400,941710621699174400,2017-12-15 11:44:43 Eastern Standard Time,2017-12-15,11:44:43,-0500,259725229,valaafshar,Vala Afshar,,"By 2020, #Bitcoin could be using as much energy as the entire world  https://t.co/emelG6GImQ",en,[],[],[],28,185,167,['bitcoin'],[],https://twitter.com/ValaAfshar/status/941710621699174400,False,,1,https://pbs.twimg.com/ext_tw_video_thumb/940983331075821568/pu/img/DhYkgpGGXZfXPA21.jpg,,,,,,,[],,,,
941688199323189249,941688199323189249,2017-12-15 10:15:37 Eastern Standard Time,2017-12-15,10:15:37,-0500,176758255,rogerkver,Roger Ver,,The philosophy of Bitcoin Core vs Bitcoin Cash.  https://t.co/Sq0niedhOO,en,[],[],"['https://pbs.twimg.com/media/DRGMap1VoAACYfH.jpg', 'https://pbs.twimg.com/media/DRGMap5VAAAkupf.jpg']",281,234,920,[],[],https://twitter.com/rogerkver/status/941688199323189249,False,,1,https://pbs.twimg.com/media/DRGMap1VoAACYfH.jpg,,,,,,,[],,,,
941684321366237185,941684321366237185,2017-12-15 10:00:12 Eastern Standard Time,2017-12-15,10:00:12,-0500,339061487,apompliano,Pomp 🌪,,"Truth about crypto:  1. Yes, it is a bubble 2. No, that is not a bad thing 3. Yes, great tech will prevail 4. Yes, people will also be scammed 5. No, this isn't new phenomenon 6. Yes, it happened during dot com 7. No, you can't kill Bitcoin 8. Yes, you need to learn about it",en,[],[],[],31,441,1223,[],[],https://twitter.com/APompliano/status/941684321366237185,False,,0,,,,,,,,[],,,,
941682708908036096,941682708908036096,2017-12-15 09:53:48 Eastern Standard Time,2017-12-15,09:53:48,-0500,20374262,maxkeiser,BITCOIN AMBASSADOR 🇸🇻,,SOV of $USD collapses near 100% since 1913. $USD collapses near 100% against #Bitcoin since 2009. ($USD experiencing a hyperinflationary collapse against BTC). BTC volatility will drop to acceptable norms (and become MOE) once BTC grabs homeostatic parity with fiat (at $100k).  https://t.co/Rzi1aRvgzW,en,[],[],['https://pbs.twimg.com/media/DRGHa0wXkAAPJ-A.jpg'],27,207,366,['bitcoin'],"['usd', 'usd']",https://twitter.com/maxkeiser/status/941682708908036096,False,,1,https://pbs.twimg.com/media/DRGHa0wXkAAPJ-A.jpg,,,,,,,[],,,,
941673348051951616,941673348051951616,2017-12-15 09:16:36 Eastern Standard Time,2017-12-15,09:16:36,-0500,922238025555435521,cryptox10,Crypto - X,,"Comment, like &amp; share this post for a chance to win 500 FREE CWX tokens! The Crypto-X ICO is LIVE! 0.001ETH gets you 25% bonus on tokens until December 24th 2017!  https://t.co/8BYS8vKZH7  https://t.co/oABqCH32a4 #contest #free #bitcoin #eth #ico #crowdsale #tokensale #win #trading  https://t.co/EhjGq89Oku",en,[],"['http://crypto-x.io/ico', 'http://t.me/cwxcryptox']",[],422,434,438,"['contest', 'free', 'bitcoin', 'eth', 'ico', 'crowdsale', 'tokensale', 'win', 'trading']",[],https://twitter.com/CryptoX10/status/941673348051951616,False,,1,https://pbs.twimg.com/ext_tw_video_thumb/941672911475302401/pu/img/f7W7DatDWyj-ATo8.jpg,,,,,,,[],,,,
941657150232907777,941657150232907777,2017-12-15 08:12:14 Eastern Standard Time,2017-12-15,08:12:14,-0500,23618940,lopp,Jameson Lopp,,"Bitcoin transaction fees clearly aren't high enough to incentivize many service providers to use block space more efficiently via techniques such as transaction batching and Segregated Witness. If you disagree, let your service provider know!",en,[],[],[],54,154,735,[],[],https://twitter.com/lopp/status/941657150232907777,False,,0,,,,,,,,[],,,,
941654841755086849,941654841755086849,2017-12-15 08:03:04 Eastern Standard Time,2017-12-15,08:03:04,-0500,705277074983002112,nebeusworld,Nebeus,,"We aim to develop an open eco-system enabling the consumption and creation of financial services and products in a secure, transparent and friendly environment.  Learn more at  https://t.co/7nn6NRVRa4  #ICO #Nebeus #bitcoin #cryptocurrency #NebeusICO  https://t.co/3WScEki3MR",en,[],['http://goo.gl/XMbfhB'],['https://pbs.twimg.com/media/DRFuFiSW0AAPnHp.jpg'],1,349,328,"['ico', 'nebeus', 'bitcoin', 'cryptocurrency', 'nebeusico']",[],https://twitter.com/NebeusWorld/status/941654841755086849,False,,1,https://pbs.twimg.com/media/DRFuFiSW0AAPnHp.jpg,,,,,,,[],,,,
941649245530218497,941649245530218497,2017-12-15 07:40:49 Eastern Standard Time,2017-12-15,07:40:49,-0500,20374262,maxkeiser,BITCOIN AMBASSADOR 🇸🇻,,"Bank’s earnings will start to deteriorate in 2018 as #Bitcoin eats into profits. Simultaneously, rising rates will curb (earnings-boosting) stock-buybacks; resulting in a collapse of bank stocks with much of that money flowing into Bitcoin. Rinse. Repeat.  https://t.co/F1PgwWolNf",en,[],[],['https://pbs.twimg.com/tweet_video_thumb/DRFo_AYXcAA7eUM.jpg'],20,200,418,['bitcoin'],[],https://twitter.com/maxkeiser/status/941649245530218497,False,,1,https://pbs.twimg.com/tweet_video_thumb/DRFo_AYXcAA7eUM.jpg,,,,,,,[],,,,
941646594713284608,941646594713284608,2017-12-15 07:30:17 Eastern Standard Time,2017-12-15,07:30:17,-0500,877155737713209344,btc,BTC Times,,“It’s a bubble!” #Bitcoin  https://t.co/JpXkPyPb8N,en,[],[],['https://pbs.twimg.com/media/DRFmlUWXcAEPbSr.jpg'],44,200,644,['bitcoin'],[],https://twitter.com/btc/status/941646594713284608,False,,1,https://pbs.twimg.com/media/DRFmlUWXcAEPbSr.jpg,,,,,,,[],,,,
941636885893603328,941636885893603328,2017-12-15 06:51:43 Eastern Standard Time,2017-12-15,06:51:43,-0500,2799211554,whalepanda,WhalePanda,,New mainstream media fud: 20% of all Bitcoin is controlled by 112 people and that's dangerous. They're using the rich list from @bitinfocharts. They don't seem to grasp the idea of cold storage wallets from exchanges. Example: Number 1 on the list is @bitfinex cold wallet.  https://t.co/rfTcX81B3C,en,"[{'screen_name': 'bitinfocharts', 'name': 'bitinfocharts', 'id': '2203160492'}, {'screen_name': 'bitfinex', 'name': 'bitfinex', 'id': '886832413'}]",[],['https://pbs.twimg.com/media/DRFdWaeW0AAfUAn.jpg'],61,227,586,[],[],https://twitter.com/WhalePanda/status/941636885893603328,False,,1,https://pbs.twimg.com/media/DRFdWaeW0AAfUAn.jpg,,,,,,,[],,,,
941634409194762241,941634409194762241,2017-12-15 06:41:52 Eastern Standard Time,2017-12-15,06:41:52,-0500,500979852,shaibu__,Kofi•,,"I know you want to put that in a song and say “I bit the coin, fr3 me bitcoin” ah well we’re waiting  https://t.co/TIeOnvj8V5",en,[],['https://twitter.com/amgmedikal/status/941632541815164928'],[],56,713,404,[],[],https://twitter.com/shaibu__/status/941634409194762241,False,https://twitter.com/amgmedikal/status/941632541815164928,0,,,,,,,,[],,,,
941633905362210816,941633905362210816,2017-12-15 06:39:52 Eastern Standard Time,2017-12-15,06:39:52,-0500,14338147,satoshilite,Charlie Lee,,"Whenever I want to show the censorship resistance feature of Bitcoin/Litecoin, I make a donation to WikiLeaks. No company or government can stop me. That's what makes crypto-currency valuable! @JulianAssange @wikileaks  https://t.co/VdRAWDjMGC",en,"[{'screen_name': 'julianassange', 'name': 'julian assange', 'id': '1057707312536866821'}, {'screen_name': 'wikileaks', 'name': 'wikileaks', 'id': '16589206'}]",['https://twitter.com/JulianAssange/status/941602539996418048'],[],139,1066,3649,[],[],https://twitter.com/SatoshiLite/status/941633905362210816,False,https://twitter.com/JulianAssange/status/941602539996418048,0,,,,,,,,[],,,,
941629901249138688,941629901249138688,2017-12-15 06:23:57 Eastern Standard Time,2017-12-15,06:23:57,-0500,2250286856,garcia_itaipu,Felippe,,"Culpados pela confusão em São Januário para a imprensa: Eurico, Vasco, torcida do Vasco, Eurico, Vasco, torcida do Vasco...  Culpados pela confusão no Maracanã para a imprensa: Falta de educação do brasileiro, crise econômica, PM, corrupção, Temer, Trump, bitcoin...",pt,[],[],[],37,1474,2361,[],[],https://twitter.com/Garcia_Itaipu/status/941629901249138688,False,,0,,,,,,,,[],,,,
941623464024268800,941623464024268800,2017-12-15 05:58:22 Eastern Standard Time,2017-12-15,05:58:22,-0500,20562637,businessinsider,Business Insider,,A woman from New York faces 90 years in prison after sending bitcoin to ISIS  https://t.co/sGAvilIID7  https://t.co/Np4ytxpsvB,en,[],['http://read.bi/2B6rQTD'],['https://pbs.twimg.com/media/DRFRjN1XcAA1_vW.jpg'],6,111,183,[],[],https://twitter.com/BusinessInsider/status/941623464024268800,False,,1,https://pbs.twimg.com/media/DRFRjN1XcAA1_vW.jpg,,,,,,,[],,,,
941618596639371264,941618596639371264,2017-12-15 05:39:02 Eastern Standard Time,2017-12-15,05:39:02,-0500,127363644,wolfofcryptosph,Wolf Of CryptoSphere,,Another Successful Prediction. BTC / USD profit $1000+ and the only guy who gave you the numbers + 100% correct time frame.  #BTC #BITCOIN #LTC #LITECOIN #XMR #MONERO #XRP #RIPPLE #XVG  https://t.co/JtM9OAJ2I9,en,[],[],['https://pbs.twimg.com/media/DRFMqUVWsAATqAp.jpg'],3,15221,1824,"['btc', 'bitcoin', 'ltc', 'litecoin', 'xmr', 'monero', 'xrp', 'ripple', 'xvg']",[],https://twitter.com/WolfOfCryptoSph/status/941618596639371264,False,,1,https://pbs.twimg.com/media/DRFMqUVWsAATqAp.jpg,,,,,,,[],,,,
941613319336726531,941613319336726531,2017-12-15 05:18:04 Eastern Standard Time,2017-12-15,05:18:04,-0500,14717442,xentagz,Dennis Parker,,Keanu Reeves (NEO): #Bitcoin Will Destroy The ‘New World Order’  https://t.co/mKmP9kly88,en,[],['http://yournewswire.com/keanu-reeves-bitcoin-new-world-order/'],[],31,226,500,['bitcoin'],[],https://twitter.com/Xentagz/status/941613319336726531,False,,0,,,,,,,,[],,,,
941600368588476416,941600368588476416,2017-12-15 04:26:36 Eastern Standard Time,2017-12-15,04:26:36,-0500,388983706,defendassange,Defend Assange Campaign,,Bitcoin is the real Occupy Wall Street.,en,[],[],[],856,6803,16680,[],[],https://twitter.com/DefendAssange/status/941600368588476416,False,,0,,,,,,,,[],,,,
941598405725265920,941598405725265920,2017-12-15 04:18:48 Eastern Standard Time,2017-12-15,04:18:48,-0500,31372089,oriel_morrison,Oriel Morrison,,Our chat with @SatoshiLite ... #crypto #litecoin #Bitcoin @dan_murphy This cryptocurrency creator doesn't like to speculate on prices  https://t.co/Pun9IIbJKu@,en,"[{'screen_name': 'satoshilite', 'name': 'charlie lee', 'id': '14338147'}, {'screen_name': 'dan_murphy', 'name': 'dan murphy', 'id': '27547277'}]",['https://www.cnbc.com/video/2017/12/14/this-cryptocurrency-creator-doesnt-like-to-speculate-on-prices.html?__source=sharebar%7Ctwitter&par=sharebar'],[],63,177,607,"['crypto', 'litecoin', 'bitcoin']",[],https://twitter.com/Oriel_Morrison/status/941598405725265920,False,,0,,,,,,,,[],,,,
941594590498476032,941594590498476032,2017-12-15 04:03:39 Eastern Standard Time,2017-12-15,04:03:39,-0500,705277074983002112,nebeusworld,Nebeus,,"Reliable legal framework, top attorneys, first-class advocacy of your interests. What's not to love?  Learn more at  https://t.co/ENuQaX5fl0  #ICO #Nebeus #bitcoin #cryptocurrency #NebeusICO  https://t.co/dSlvmT9yCl",en,[],['http://goo.gl/5bBNo4'],['https://pbs.twimg.com/media/DRE3ScdXcAAr_kH.jpg'],0,350,327,"['ico', 'nebeus', 'bitcoin', 'cryptocurrency', 'nebeusico']",[],https://twitter.com/NebeusWorld/status/941594590498476032,False,,1,https://pbs.twimg.com/media/DRE3ScdXcAAr_kH.jpg,,,,,,,[],,,,
941578575894867968,941578575894867968,2017-12-15 03:00:00 Eastern Standard Time,2017-12-15,03:00:00,-0500,2395318063,_kevin_pham,Kevin Pham,,"Bitcoin's killer app can be found in Venezuela, it's called: ""not dying.""",en,[],[],[],19,249,926,[],[],https://twitter.com/_Kevin_Pham/status/941578575894867968,False,,0,,,,,,,,[],,,,
941527651109531648,941527651109531648,2017-12-14 23:37:39 Eastern Standard Time,2017-12-14,23:37:39,-0500,254873869,libyaliberty,Hend Amry,,naturally 2017 ends at the intersection of ISIS and bitcoin.  https://t.co/ADk0800qhm,en,[],['https://twitter.com/abc/status/941526258353168384'],[],23,905,2813,[],[],https://twitter.com/LibyaLiberty/status/941527651109531648,False,https://twitter.com/abc/status/941526258353168384,0,,,,,,,,[],,,,
941527494175358978,941527494175358978,2017-12-14 23:37:02 Eastern Standard Time,2017-12-14,23:37:02,-0500,14293310,time,TIME,,A New York woman has been accused of laundering bitcoin to support ISIS  https://t.co/nkwbIpFI98,en,[],['http://ti.me/2AqWFkq'],[],54,561,476,[],[],https://twitter.com/TIME/status/941527494175358978,False,,0,,,,,,,,[],,,,
941526258353168384,941526258353168384,2017-12-14 23:32:07 Eastern Standard Time,2017-12-14,23:32:07,-0500,28785486,abc,ABC News,,"NYC woman charged with laundering more than $85,000, using Bitcoin and other cryptocurrencies, to support ISIS.  https://t.co/d4odmIsxFr  https://t.co/MIqHLQ1WF3",en,[],['http://abcn.ws/2B1zQoE'],['https://pbs.twimg.com/media/DRD5JCqVAAAvZpC.jpg'],35,174,163,[],[],https://twitter.com/ABC/status/941526258353168384,False,,1,https://pbs.twimg.com/media/DRD5JCqVAAAvZpC.jpg,,,,,,,[],,,,
941523130815672320,941523130815672320,2017-12-14 23:19:41 Eastern Standard Time,2017-12-14,23:19:41,-0500,61417559,erikvoorhees,Erik Voorhees,,"Money being controlled and managed by the government will, some day, appear as arbitrary and distasteful as religion or speech being similarly handled. #Bitcoin",en,[],[],[],55,617,1757,['bitcoin'],[],https://twitter.com/ErikVoorhees/status/941523130815672320,False,,0,,,,,,,,[],,,,
941500094494527488,941500094494527488,2017-12-14 21:48:09 Eastern Standard Time,2017-12-14,21:48:09,-0500,2360241314,jackmallers,Jack Mallers,,"Watch the GDAX sell wall get obliterated. Visual representation of:  Institutional investors: Hey this BTC thing might be important. Wait till CME futs so we can fill our longs before moon, ok?  The world: Oh ok sur... Wait, in Bitcoin we don't have to give a shit about you! Cya!  https://t.co/7lEbWW8alu",en,[],[],[],103,575,1595,[],[],https://twitter.com/jackmallers/status/941500094494527488,False,,1,https://pbs.twimg.com/ext_tw_video_thumb/941498422498070528/pu/img/e5lLDqtoxuMtg33M.jpg,,,,,,,[],,,,
941495542898716673,941495542898716673,2017-12-14 21:30:04 Eastern Standard Time,2017-12-14,21:30:04,-0500,3108351,wsj,The Wall Street Journal,,"A Long Island woman is accused of stealing more than $85,000 and converting it to bitcoin to support Islamic State  https://t.co/AFkQof1Cwn",en,[],['http://on.wsj.com/2BoYmTj'],[],31,324,321,[],[],https://twitter.com/WSJ/status/941495542898716673,False,,0,,,,,,,,[],,,,
941488024386498561,941488024386498561,2017-12-14 21:00:11 Eastern Standard Time,2017-12-14,21:00:11,-0500,1691181,tailopez,Tai Lopez,,"If the worlds millionaires put 1% of their assets into Bitcoin than the coin price would justifiably be around $60,000.",en,[],[],[],31,160,800,[],[],https://twitter.com/tailopez/status/941488024386498561,False,,0,,,,,,,,[],,,,
941486839399157767,941486839399157767,2017-12-14 20:55:29 Eastern Standard Time,2017-12-14,20:55:29,-0500,29769998,billbrowder,Bill Browder,,Looks like my congressional testimony that Bitcoin is a gift from god for Russian money launderers and needs regulation didn’t help the price today  https://t.co/b8SGMhLA1L,en,[],['https://www.investopedia.com/news/bitcoin-price-and-altcoins-fall-after-highs-week/'],[],50,426,1054,[],[],https://twitter.com/Billbrowder/status/941486839399157767,False,,0,,,,,,,,[],,,,
941484224267390979,941484224267390979,2017-12-14 20:45:05 Eastern Standard Time,2017-12-14,20:45:05,-0500,14293310,time,TIME,,"This couple invested in bitcoin at $800. Now it's $17,000 and they're donating everything to a cancer hospital  https://t.co/9motDDDINd",en,[],['http://ti.me/2ytyTT6'],[],17,186,704,[],[],https://twitter.com/TIME/status/941484224267390979,False,,0,,,,,,,,[],,,,
