id,conversation_id,created_at,date,time,timezone,user_id,username,name,place,tweet,language,mentions,urls,photos,replies_count,retweets_count,likes_count,hashtags,cashtags,link,retweet,quote_url,video,thumbnail,near,geo,source,user_rt_id,user_rt,retweet_id,reply_to,retweet_date,translate,trans_src,trans_dest
940106813709598721,940106813709598721,2017-12-11 01:31:45 Eastern Standard Time,2017-12-11,01:31:45,-0500,410949708,andrewmpearce,andy,,"""not now sweetie, mommy's trading bitcoin""  https://t.co/Gi7bcCgqNN",en,[],[],['https://pbs.twimg.com/media/DQvuEwWUEAAQSjM.jpg'],12,184,606,[],[],https://twitter.com/andrewmpearce/status/940106813709598721,False,,1,https://pbs.twimg.com/media/DQvuEwWUEAAQSjM.jpg,,,,,,,[],,,,
940083168689889280,940083168689889280,2017-12-10 23:57:47 Eastern Standard Time,2017-12-10,23:57:47,-0500,57689645,tracemayer,Trace Mayer,,"Well, isn't that cute. There is a first time for everything. #Bitcoin just had its first trading halt on a major global market @CBOE. Any idea how much more of this is going to happen?  https://t.co/NVgSgceKzX",en,"[{'screen_name': 'cboe', 'name': 'cboe', 'id': '16827489'}]",[],['https://pbs.twimg.com/media/DQvYhNiVwAIk7V1.jpg'],35,159,420,['bitcoin'],[],https://twitter.com/TraceMayer/status/940083168689889280,False,,1,https://pbs.twimg.com/media/DQvYhNiVwAIk7V1.jpg,,,,,,,[],,,,
940067667393748992,940067667393748992,2017-12-10 22:56:12 Eastern Standard Time,2017-12-10,22:56:12,-0500,57689645,tracemayer,Trace Mayer,,"Approached by 3 serious players wanting #Bitcoin source. Even offered $50k/BTC for large batch if closed deal this week. To be honest, I thought a good leg pulling. But after @CBOE futures started not so sure. Perhaps just #HODL wild ride. Like everyone. On like Donkey Kong! 🚀🚂  https://t.co/yAa0KY0ExE",en,"[{'screen_name': 'cboe', 'name': 'cboe', 'id': '16827489'}]",[],['https://pbs.twimg.com/media/DQvKbV8VAAMfNK9.jpg'],30,153,419,"['bitcoin', 'hodl']",[],https://twitter.com/TraceMayer/status/940067667393748992,False,,1,https://pbs.twimg.com/media/DQvKbV8VAAMfNK9.jpg,,,,,,,[],,,,
940059941305327618,940059941305327618,2017-12-10 22:25:30 Eastern Standard Time,2017-12-10,22:25:30,-0500,18856867,zerohedge,zerohedge,,"Bitcoin Futures Top $18,000, Soar 20% From Open - Halted for Second Time  https://t.co/qCOHjDMQwC",en,[],['http://www.zerohedge.com/news/2017-12-10/cboe-website-crashes-futures-trading-begins-bitcoin-price-squeezed-10-higher'],[],16,297,399,[],[],https://twitter.com/zerohedge/status/940059941305327618,False,,0,,,,,,,,[],,,,
940057701958148099,940057701958148099,2017-12-10 22:16:36 Eastern Standard Time,2017-12-10,22:16:36,-0500,18856867,zerohedge,zerohedge,,"BITCOIN FUTURES RISE 20% FROM OPEN, THRESHOLD FOR TRADING HALT",en,[],[],[],42,341,843,[],[],https://twitter.com/zerohedge/status/940057701958148099,False,,0,,,,,,,,[],,,,
940057594869170178,940057594869170178,2017-12-10 22:16:10 Eastern Standard Time,2017-12-10,22:16:10,-0500,2260407860,bitcoinerrorlog,John Carvalho,,"Bitcoin traders have had years of grueling training: 24/7 market, extreme volatility, mass liquidations, fomo, fud, and more. Welcome Wall St, and good luck... you're gonna fucking need it. #whostheboss #bitcoin  https://t.co/bTAUnJT49N",en,[],['https://twitter.com/business/status/940055147626995713'],[],24,163,479,"['whostheboss', 'bitcoin']",[],https://twitter.com/BitcoinErrorLog/status/940057594869170178,False,https://twitter.com/business/status/940055147626995713,0,,,,,,,,[],,,,
940057096329904130,940057096329904130,2017-12-10 22:14:11 Eastern Standard Time,2017-12-10,22:14:11,-0500,213083094,dodonpahchi,pahchi,,cody looks like he bought bitcoin back in sf4,en,[],[],[],10,574,1188,[],[],https://twitter.com/dodonpahchi/status/940057096329904130,False,,0,,,,,,,,[],,,,
940057081393983488,940057081393983488,2017-12-10 22:14:08 Eastern Standard Time,2017-12-10,22:14:08,-0500,2979792383,bitcoin_pizza,Bitcoin Pizza 🍕,,"The #Bitcoin pizza is worth $165,203,350 today. (+20% from yesterday)",en,[],[],[],18,148,356,['bitcoin'],[],https://twitter.com/bitcoin_pizza/status/940057081393983488,False,,0,,,,,,,,[],,,,
940055147626995713,940055147626995713,2017-12-10 22:06:27 Eastern Standard Time,2017-12-10,22:06:27,-0500,34713362,business,Bloomberg,,"Bitcoin futures rally trips Cboe circuit breaker, triggering a brief halt  https://t.co/StLjw9uVSZ  https://t.co/5lGZlL2Uzh",en,[],['https://bloom.bg/2yegj1m'],['https://pbs.twimg.com/media/DQu_LHMVwAIjl62.jpg'],17,117,187,[],[],https://twitter.com/business/status/940055147626995713,False,,1,https://pbs.twimg.com/media/DQu_LHMVwAIjl62.jpg,,,,,,,[],,,,
940052080395354113,940052080395354113,2017-12-10 21:54:15 Eastern Standard Time,2017-12-10,21:54:15,-0500,2214652482,rampcapitalllc,Ramp Capital,,I will give out zero Bitcoin to everyone who RTs this,en,[],[],[],36,227,544,[],[],https://twitter.com/RampCapitalLLC/status/940052080395354113,False,,0,,,,,,,,[],,,,
940040619354857472,940040619354857472,2017-12-10 21:08:43 Eastern Standard Time,2017-12-10,21:08:43,-0500,327577091,justinwolfers,Justin Wolfers,,Here’s my fundamentals based model for the price of bitcoin:  0 / 0 = ¯\_(ツ)_/¯,en,[],[],[],16,217,811,[],[],https://twitter.com/JustinWolfers/status/940040619354857472,False,,0,,,,,,,,[],,,,
940037778615681024,940037778615681024,2017-12-10 20:57:26 Eastern Standard Time,2017-12-10,20:57:26,-0500,23193379,russellrhoads,Russell Rhoads,,On the first day of trading at @Cboe in 1973 911 options traded.  First day of $VIX futures in 2004 saw 461 contracts traded.  3 hours into the first #bitcoin futures session and volume is just over 1000 contracts.,en,"[{'screen_name': 'cboe', 'name': 'cboe', 'id': '16827489'}]",[],[],16,131,209,['bitcoin'],['vix'],https://twitter.com/RussellRhoads/status/940037778615681024,False,,0,,,,,,,,[],,,,
940028769619685377,940028769619685377,2017-12-10 20:21:38 Eastern Standard Time,2017-12-10,20:21:38,-0500,16827489,cboe,Cboe,,Cboe #BitcoinFutures $XBT trades over 800 contracts in the first 2 hours post launch #bitcoin @GeminiDotCom    https://t.co/kHiZo8DR9m]  https://t.co/oCCxRZcPnC,en,"[{'screen_name': 'geminidotcom', 'name': 'geminidotcom', 'id': '1043265417584758789'}]",['http://bit.ly/2yXI0iE'],['https://pbs.twimg.com/media/DQunLtaUEAIQD7l.jpg'],62,558,968,"['bitcoinfutures', 'bitcoin']",['xbt'],https://twitter.com/CBOE/status/940028769619685377,False,,1,https://pbs.twimg.com/media/DQunLtaUEAIQD7l.jpg,,,,,,,[],,,,
940022413638668288,940022413638668288,2017-12-10 19:56:22 Eastern Standard Time,2017-12-10,19:56:22,-0500,18856867,zerohedge,zerohedge,,Bitcoin Spot vs Future (XBT)   https://t.co/qCOHjDvfF4  https://t.co/0EDRzUO8l7,en,[],['http://www.zerohedge.com/news/2017-12-10/cboe-website-crashes-futures-trading-begins-bitcoin-price-squeezed-10-higher'],['https://pbs.twimg.com/media/DQuhXHvVAAAIPNO.jpg'],14,137,227,[],[],https://twitter.com/zerohedge/status/940022413638668288,False,,1,https://pbs.twimg.com/media/DQuhXHvVAAAIPNO.jpg,,,,,,,[],,,,
940017474304692224,940017474304692224,2017-12-10 19:36:45 Eastern Standard Time,2017-12-10,19:36:45,-0500,3179873194,cryptohustle,฿TF%$Brrrrrr!,,Isn't it ironic that banks are trading #bitcoin.,en,[],[],[],31,139,705,['bitcoin'],[],https://twitter.com/CryptoHustle/status/940017474304692224,False,,0,,,,,,,,[],,,,
940012944011563008,940012944011563008,2017-12-10 19:18:45 Eastern Standard Time,2017-12-10,19:18:45,-0500,1854401,vinnylingham,Vinny Lingham,,"I get the feeling that the biggest beneficiary of Bitcoin futures will be the alt coins &amp; tokens. Once/if the BTC price stabilizes as a result of the futures, crypto traders will need to look elsewhere for eye-popping yields...",en,[],[],[],86,258,959,[],[],https://twitter.com/VinnyLingham/status/940012944011563008,False,,0,,,,,,,,[],,,,
940011093329448961,940011093329448961,2017-12-10 19:11:23 Eastern Standard Time,2017-12-10,19:11:23,-0500,2812149204,ynakamura56,Yuji Nakamura,,"Still early, but some perspective: CBOE bitcoin futures traded $9.1 million notional in first hour. During same period about $170 million traded on Bitfinex.  https://t.co/DbHpDjj4z9",en,[],[],['https://pbs.twimg.com/media/DQuWiVoUMAA509R.jpg'],22,238,475,[],[],https://twitter.com/ynakamura56/status/940011093329448961,False,,1,https://pbs.twimg.com/media/DQuWiVoUMAA509R.jpg,,,,,,,[],,,,
940005435016384512,940005435016384512,2017-12-10 18:48:54 Eastern Standard Time,2017-12-10,18:48:54,-0500,57689645,tracemayer,Trace Mayer,,#Bitcoin futures launched 15 min ago. @CBOE site is down. @coinbase is down. Lots of exchange are down. Guess they do not know how to scale. #Bitcoin network is up and has not experienced any downtime. Go figure. Go $BTC.,en,"[{'screen_name': 'cboe', 'name': 'cboe', 'id': '16827489'}, {'screen_name': 'coinbase', 'name': 'coinbase', 'id': '574032254'}]",[],[],87,659,1891,"['bitcoin', 'bitcoin']",['btc'],https://twitter.com/TraceMayer/status/940005435016384512,False,,0,,,,,,,,[],,,,
940005136608481280,940005136608481280,2017-12-10 18:47:43 Eastern Standard Time,2017-12-10,18:47:43,-0500,34713362,business,Bloomberg,,Bitcoin just landed on Wall Street with the start of futures trading  https://t.co/wWA6PF5Nmr  https://t.co/WnlAjJjWwZ,en,[],['https://bloom.bg/2AqUTDX'],['https://pbs.twimg.com/media/DQuRsFnVwAAmjRC.jpg'],17,178,215,[],[],https://twitter.com/business/status/940005136608481280,False,,1,https://pbs.twimg.com/media/DQuRsFnVwAAmjRC.jpg,,,,,,,[],,,,
940003711857729536,940003711857729536,2017-12-10 18:42:03 Eastern Standard Time,2017-12-10,18:42:03,-0500,2568108282,nickszabo4,Nick Szabo,,Bitcoin itself is still up as usual. Trusted third parties are reliability risks.  https://t.co/lmszIiQtd7,en,[],['https://twitter.com/Melt_Dem/status/939998141000032256'],[],29,399,1359,[],[],https://twitter.com/NickSzabo4/status/940003711857729536,False,https://twitter.com/Melt_Dem/status/939998141000032256,0,,,,,,,,[],,,,
940002222284435456,940002222284435456,2017-12-10 18:36:08 Eastern Standard Time,2017-12-10,18:36:08,-0500,40129171,schuldensuehner,Holger Zschaepitz,,Nobody was quite sure what would happen when the futures markets opened on Sunday night. What we know now: The #Bitcoin price is relatively stable while Cboe website crashed!  https://t.co/c7pAhhnl2a,en,[],[],['https://pbs.twimg.com/media/DQuO2qsWsAExhFJ.jpg'],23,193,347,['bitcoin'],[],https://twitter.com/Schuldensuehner/status/940002222284435456,False,,1,https://pbs.twimg.com/media/DQuO2qsWsAExhFJ.jpg,,,,,,,[],,,,
939999516102676481,939999516102676481,2017-12-10 18:25:23 Eastern Standard Time,2017-12-10,18:25:23,-0500,20402945,cnbc,CNBC,,Bitcoin surges higher as futures trading begins on CBOE  https://t.co/T9qLdaqfhG,en,[],['http://cnb.cx/2nP1Too'],[],25,152,221,[],[],https://twitter.com/CNBC/status/939999516102676481,False,,0,,,,,,,,[],,,,
939998155684368384,939998155684368384,2017-12-10 18:19:59 Eastern Standard Time,2017-12-10,18:19:59,-0500,18856867,zerohedge,zerohedge,,Cboe Website Crashes As Futures Trading Begins; Bitcoin Price Squeezed 10% Higher  https://t.co/qCOHjDvfF4,en,[],['http://www.zerohedge.com/news/2017-12-10/cboe-website-crashes-futures-trading-begins-bitcoin-price-squeezed-10-higher'],[],21,295,388,[],[],https://twitter.com/zerohedge/status/939998155684368384,False,,0,,,,,,,,[],,,,
939998141000032256,939998141000032256,2017-12-10 18:19:55 Eastern Standard Time,2017-12-10,18:19:55,-0500,2363290915,melt_dem,Meltem Demir◎rs,,bitcoin futures launched 15 min ago. CBOE site is down. @coinbase is down. everything is down. CRAZY.,en,"[{'screen_name': 'coinbase', 'name': 'coinbase', 'id': '574032254'}]",[],[],35,200,633,[],[],https://twitter.com/Melt_Dem/status/939998141000032256,False,,0,,,,,,,,[],,,,
939997767455399937,939997767455399937,2017-12-10 18:18:26 Eastern Standard Time,2017-12-10,18:18:26,-0500,380648579,afp,AFP News Agency,,"#BREAKING Bitcoin makes debut on major stock exchange at $15,000 per unit",en,[],[],[],17,199,191,['breaking'],[],https://twitter.com/AFP/status/939997767455399937,False,,0,,,,,,,,[],,,,
939996639330258950,939996639330258950,2017-12-10 18:13:57 Eastern Standard Time,2017-12-10,18:13:57,-0500,1333467482,coindesk,CoinDesk,,"Bitcoin spikes $1.2k in minutes after CBOE futures start ($14,509 at 22:59 to $15,732 at 23:06) #bitcoinfutures  https://t.co/UZL4IK39MH",en,[],[],['https://pbs.twimg.com/media/DQuJ9gVXcAEAeMn.jpg'],25,264,435,['bitcoinfutures'],[],https://twitter.com/CoinDesk/status/939996639330258950,False,,1,https://pbs.twimg.com/media/DQuJ9gVXcAEAeMn.jpg,,,,,,,[],,,,
939996269208113152,939996269208113152,2017-12-10 18:12:29 Eastern Standard Time,2017-12-10,18:12:29,-0500,19337489,bkbriankelly,Brrrian Kelly,,snapshot of #bitcoin futures on the open.  Historic day!  https://t.co/ZtRWz2iajt,en,[],[],['https://pbs.twimg.com/media/DQuJntCWkAAjNMz.jpg'],16,130,316,['bitcoin'],[],https://twitter.com/BKBrianKelly/status/939996269208113152,False,,1,https://pbs.twimg.com/media/DQuJntCWkAAjNMz.jpg,,,,,,,[],,,,
939995908556587008,939995908556587008,2017-12-10 18:11:03 Eastern Standard Time,2017-12-10,18:11:03,-0500,1367531,foxnews,Fox News,,"North Korea is hacking bitcoin exchanges as currency value soars, expert says  https://t.co/jBDuJAYBjG",en,[],['http://fxn.ws/2ApQlxL'],[],66,159,221,[],[],https://twitter.com/FoxNews/status/939995908556587008,False,,0,,,,,,,,[],,,,
939994838719782912,939994838719782912,2017-12-10 18:06:48 Eastern Standard Time,2017-12-10,18:06:48,-0500,817817720221794305,richardheartwin,Richard Heart PulseX.com is live! Sacrifice open!,,#Bitcoin already broke the CBOE website lol.  https://t.co/cqIN05TZwy,en,[],['http://www.cboe.com/delayedquote/advanced-charts?ticker=XBT%2fF8'],[],36,186,664,['bitcoin'],[],https://twitter.com/RichardHeartWin/status/939994838719782912,False,,0,,,,,,,,[],,,,
939994293372162049,939994293372162049,2017-12-10 18:04:38 Eastern Standard Time,2017-12-10,18:04:38,-0500,1333467482,coindesk,CoinDesk,,"BREAKING: Bitcoin Futures Launch Could Rekindle Push for ETF, CBOE Says  https://t.co/fPigw90o9F  https://t.co/HY1ShtA0nH",en,[],['http://bit.ly/2Bs6cMs'],['https://pbs.twimg.com/media/DQuH05WXkAAaNKF.jpg'],17,182,287,[],[],https://twitter.com/CoinDesk/status/939994293372162049,False,,1,https://pbs.twimg.com/media/DQuH05WXkAAaNKF.jpg,,,,,,,[],,,,
939994204264157184,939994204264157184,2017-12-10 18:04:17 Eastern Standard Time,2017-12-10,18:04:17,-0500,96927042,irishroundtable,JVH,,"I was the first one in the world to trade #Bitcoin futures.  Losing trade, but still FIRST!  https://t.co/osHCPgIOns",en,[],[],['https://pbs.twimg.com/media/DQuHsrQW4AAmjht.jpg'],51,154,643,['bitcoin'],[],https://twitter.com/Irishroundtable/status/939994204264157184,False,,1,https://pbs.twimg.com/media/DQuHsrQW4AAmjht.jpg,,,,,,,[],,,,
939994063780110341,939526347730407424,2017-12-10 18:03:43 Eastern Standard Time,2017-12-10,18:03:43,-0500,381289719,nntaleb,Nassim Nicholas Taleb,,Note that Bitcoin has a limited number of natural sellers. The entire concept is very concave supply (it costs more and more to extract). The number of producers shrinks with time.,en,[],[],[],53,249,762,[],[],https://twitter.com/nntaleb/status/939994063780110341,False,,0,,,,,,,,[],,,,
939991165889167360,939991165889167360,2017-12-10 17:52:12 Eastern Standard Time,2017-12-10,17:52:12,-0500,9926812,waynevaughan,Wayne Vaughan,,The launch of #bitcoin futures gives every anti-Bitcoin person on Wall Street the opportunity to put their money where their mouth is. Short it or shut up.,en,[],[],[],20,128,411,['bitcoin'],[],https://twitter.com/WayneVaughan/status/939991165889167360,False,,0,,,,,,,,[],,,,
939981563428790272,939981563428790272,2017-12-10 17:14:03 Eastern Standard Time,2017-12-10,17:14:03,-0500,877155737713209344,btc,BTC Times,,More things that did not exist on Christmas Day 10 years ago:  Bitcoin Instagram Snapchat iPad Kickstarter Pinterest App Store Angry Birds Siri Google Chrome  WhatsApp Candy Crush Alexa Tinder Apple Watch Facebook Messenger Starbucks Pumpkin Spice Lattes,en,[],[],[],8,174,505,[],[],https://twitter.com/btc/status/939981563428790272,False,,0,,,,,,,,[],,,,
939975357586751488,939975357586751488,2017-12-10 16:49:23 Eastern Standard Time,2017-12-10,16:49:23,-0500,1854401,vinnylingham,Vinny Lingham,,"Bitcoin is positioning itself for another big run, if it breaches $17,000 will most likely head up quickly towards $25,000, on extended FOMO. Futures will be the deciding factor, imho.",en,[],[],[],80,188,649,[],[],https://twitter.com/VinnyLingham/status/939975357586751488,False,,0,,,,,,,,[],,,,
939969376014364673,939969376014364673,2017-12-10 16:25:37 Eastern Standard Time,2017-12-10,16:25:37,-0500,14338147,satoshilite,Charlie Lee,,I will be on @SquawkAlley tomorrow morning around 8:30am PST to talk about Bitcoin futures. Maybe I will mention Litecoin. 🐔🗣️ 😂,en,[],[],[],285,537,3178,[],[],https://twitter.com/SatoshiLite/status/939969376014364673,False,,0,,,,,,,,[],,,,
939966088338698241,939966088338698241,2017-12-10 16:12:33 Eastern Standard Time,2017-12-10,16:12:33,-0500,29769998,billbrowder,Bill Browder,,"While my Silicon Valley friends are excited about future of Bitcoin, Russian gangsters use it to evade sanctions   https://t.co/ElWx8iC2zr",en,[],['https://www.economist.com/news/europe/21732155-cheap-electricity-and-frozen-winters-cool-massive-computer-servers-why-siberia-great-place'],[],86,1379,1742,[],[],https://twitter.com/Billbrowder/status/939966088338698241,False,,0,,,,,,,,[],,,,
939957769926352896,939957769926352896,2017-12-10 15:39:30 Eastern Standard Time,2017-12-10,15:39:30,-0500,97334517,allstarcharts,J.C. Parets,,I was with a futures broker last night and he was showing me all the emails from every major bank that he trades for telling him not to take any orders on #bitcoin futures. The banks are scared to death. I love that $BTC.X $BCOIN,en,[],[],[],24,156,390,['bitcoin'],"['btc.x', 'bcoin']",https://twitter.com/allstarcharts/status/939957769926352896,False,,0,,,,,,,,[],,,,
939957570781044738,939957570781044738,2017-12-10 15:38:43 Eastern Standard Time,2017-12-10,15:38:43,-0500,20902138,alistairmilne,Alistair Milne,,"Bitcoin’ers seem very preoccupied by how Wall Street will change Bitcoin Truth is, Wall Street is more likely to be changed by Bitcoin than the reverse Let’s see how well they sail in our 24/7 disparate market",en,[],[],[],29,166,660,[],[],https://twitter.com/alistairmilne/status/939957570781044738,False,,0,,,,,,,,[],,,,
939952738577739776,939952738577739776,2017-12-10 15:19:31 Eastern Standard Time,2017-12-10,15:19:31,-0500,14338147,satoshilite,Charlie Lee,,"Fiat is to gold as lightning network is to Bitcoin.  Fiat was effectively a layer 2 solution to scaling gold. It was backed and settled to gold until that backing was removed. Unlike fiat though, LN's settlement to Bitcoin is cryptographically secured and cannot be removed!",en,[],[],[],225,1713,5406,[],[],https://twitter.com/SatoshiLite/status/939952738577739776,False,,0,,,,,,,,[],,,,
939946004501139457,939946004501139457,2017-12-10 14:52:45 Eastern Standard Time,2017-12-10,14:52:45,-0500,2178242827,disruptepreneur,Jeremy Gardner,,"Evolution of banker outlook on #bitcoin: 2013: ""Bitcoin is a joke."" 2014: ""Bitcoin is dead."" 2015: ""Blockchains not Bitcoin."" 2016: ""Bitcoin will fail"" 2017: ""BITCOIN IS GOING TO CRASH THE GLOBAL ECONOMY""  🤔  https://t.co/QgauNIuK1o",en,[],['https://twitter.com/TIME/status/939942811994083328'],[],146,1510,3181,['bitcoin'],[],https://twitter.com/Disruptepreneur/status/939946004501139457,False,https://twitter.com/TIME/status/939942811994083328,0,,,,,,,,[],,,,
939942811994083328,939942811994083328,2017-12-10 14:40:04 Eastern Standard Time,2017-12-10,14:40:04,-0500,14293310,time,TIME,,Deutsche Bank economist says a bitcoin crash would endanger global markets  https://t.co/WOw0WrCueg,en,[],['http://ti.me/2ArHRX7'],[],97,173,266,[],[],https://twitter.com/TIME/status/939942811994083328,False,,0,,,,,,,,[],,,,
939933684098060289,939933684098060289,2017-12-10 14:03:48 Eastern Standard Time,2017-12-10,14:03:48,-0500,923690210365509632,thegreyshutter,EK,,"If Manchester United had bought bitcoin with 75 million pounds this summer, they would have been able to afford Messi, Ronaldo and Neymar by the January transfer window instead of being stuck with misfiring Lukaku!  😂😂😂😂😂😂😂 #ManchesterDerby #GooooCity #MUNMCI #officialFPL",en,[],[],[],26,589,724,"['manchesterderby', 'goooocity', 'munmci', 'officialfpl']",[],https://twitter.com/thegreyshutter/status/939933684098060289,False,,0,,,,,,,,[],,,,
939932133707210753,939932133707210753,2017-12-10 13:57:38 Eastern Standard Time,2017-12-10,13:57:38,-0500,40742821,tuurdemeester,Tuur Demeester,,"Can't get enough of these #LightningNetwork demos. I imagine this is what it felt like in 1969, watching the moon landing over and over. #Bitcoin  https://t.co/qkXW0V8Lpc",en,[],['https://twitter.com/joaodealmeida94/status/939721796902883328'],[],25,161,602,"['lightningnetwork', 'bitcoin']",[],https://twitter.com/TuurDemeester/status/939932133707210753,False,https://twitter.com/joaodealmeida94/status/939721796902883328,0,,,,,,,,[],,,,
939926258946854914,939926258946854914,2017-12-10 13:34:17 Eastern Standard Time,2017-12-10,13:34:17,-0500,1643500784,francispouliot_,NAKED FACE (offline),,"The false belief that Bitcoin mining is a waste can be entirely cured by Frederic Bastiat's economic essay (1850) ""What is seen and what is not seen""  You see: electricity consumption  You don't see: middlemen disappearing, decentralized consensus       https://t.co/0T1Os9ThK1",en,[],['http://www.econlib.org/library/Bastiat/basEss1.html'],[],20,231,653,[],[],https://twitter.com/francispouliot_/status/939926258946854914,False,,0,,,,,,,,[],,,,
939924533514874881,939924533514874881,2017-12-10 13:27:26 Eastern Standard Time,2017-12-10,13:27:26,-0500,14338147,satoshilite,Charlie Lee,,I now understand why Roger didn't appreciate Bitcoin being digital gold. He doesn't understand why gold was valuable in the first place! SMH  https://t.co/M1UGynsXJi,en,[],['https://twitter.com/rogerkver/status/939916815563739137'],[],121,274,1490,[],[],https://twitter.com/SatoshiLite/status/939924533514874881,False,https://twitter.com/rogerkver/status/939916815563739137,0,,,,,,,,[],,,,
939921492787191808,939921492787191808,2017-12-10 13:15:21 Eastern Standard Time,2017-12-10,13:15:21,-0500,78523300,realjameswoods,James Woods,,#Bitcoin is the #BeanieBabies of the modern era. Good luck!   https://t.co/G3w4KeLOLY,en,[],['https://www.theatlantic.com/business/archive/2017/12/bitcoin-bubble/547952/'],[],278,325,1341,"['bitcoin', 'beaniebabies']",[],https://twitter.com/RealJamesWoods/status/939921492787191808,False,,0,,,,,,,,[],,,,
939919947865583616,939919947865583616,2017-12-10 13:09:13 Eastern Standard Time,2017-12-10,13:09:13,-0500,78523300,realjameswoods,James Woods,,"In all seriousness I bought Apple in the 80’s because I believed in the concept of the simple GUI. IBM and Microsoft at the time were still DOS. I bought stock in a product because I BELIEVED in it. If you believe in @Bitcoin, buy it! I simply don’t believe in it. So, we cool?",en,"[{'screen_name': 'bitcoin', 'name': 'bitcoin', 'id': '357312062'}]",[],[],306,420,3632,[],[],https://twitter.com/RealJamesWoods/status/939919947865583616,False,,0,,,,,,,,[],,,,
939919419387596802,939919419387596802,2017-12-10 13:07:07 Eastern Standard Time,2017-12-10,13:07:07,-0500,961445378,officialmcafee,John McAfee,,"In the long term, don't be afraid of Bitcoin Futures:  https://t.co/bmosNFHkxR",en,[],[],['https://pbs.twimg.com/media/DQtDuEIXcAgcQf2.jpg'],132,525,1182,[],[],https://twitter.com/officialmcafee/status/939919419387596802,False,,1,https://pbs.twimg.com/media/DQtDuEIXcAgcQf2.jpg,,,,,,,[],,,,
939918485949366272,939918485949366272,2017-12-10 13:03:24 Eastern Standard Time,2017-12-10,13:03:24,-0500,46954727,fatjew,The Fat Jewish,,"BUT GUYS, YOU CAN’T SNORT COCAINE WITH A ROLLED UP BITCOIN",en,[],[],[],20,232,940,[],[],https://twitter.com/FATJEW/status/939918485949366272,False,,0,,,,,,,,[],,,,
939913080024076288,939913080024076288,2017-12-10 12:41:55 Eastern Standard Time,2017-12-10,12:41:55,-0500,389524718,janeygak,bibi janey,,"""Bitcoin is the future of money.""  ""The US dollar and other fiat are printed without any backing but bitcoin is finite...""  This was just broadcast to millions on Iran's National News station. They ended the piece by interviewing some bitcoin sellers 😉  https://t.co/F8jXnMwHkm",en,[],[],[],32,179,457,[],[],https://twitter.com/janeygak/status/939913080024076288,False,,1,https://pbs.twimg.com/ext_tw_video_thumb/939910376740683776/pu/img/Kf84hfEKQ-jzzY7S.jpg,,,,,,,[],,,,
939911730494193664,939911730494193664,2017-12-10 12:36:33 Eastern Standard Time,2017-12-10,12:36:33,-0500,78523300,realjameswoods,James Woods,,"I’ve never trusted the concept of the Federal Reserve either, just for the record. I like tangible stuff, things that have real value. But I’m older and certainly old fashioned. I’m happy to admit I’m probably wrong about #Bitcoin, but I’m still never touching it.",en,[],[],[],477,562,3686,['bitcoin'],[],https://twitter.com/RealJamesWoods/status/939911730494193664,False,,0,,,,,,,,[],,,,
939909936749752320,939909936749752320,2017-12-10 12:29:26 Eastern Standard Time,2017-12-10,12:29:26,-0500,78523300,realjameswoods,James Woods,,"Two things tell me #Bitcoin is poison: 1) people are being really nasty who disagree with me (like liberals often do when they invariably have no cogent argument on the facts) and 2) the populace at large doesn’t easily grasp the concept, which is important.",en,[],[],[],507,568,3181,['bitcoin'],[],https://twitter.com/RealJamesWoods/status/939909936749752320,False,,0,,,,,,,,[],,,,
