id,conversation_id,created_at,date,time,timezone,user_id,username,name,place,tweet,language,mentions,urls,photos,replies_count,retweets_count,likes_count,hashtags,cashtags,link,retweet,quote_url,video,thumbnail,near,geo,source,user_rt_id,user_rt,retweet_id,reply_to,retweet_date,translate,trans_src,trans_dest
953680964328280064,953680964328280064,2018-01-17 12:30:35 Eastern Standard Time,2018-01-17,12:30:35,-0500,176758255,rogerkver,Roger Ver,,Bitcoin was working great until Blockstream used censorship and lies to hijack the network in order to intentionally break BTC’s functionality. They are now trying to sell us a solution to the problem they intentionally created in the first place!  https://t.co/gY6Rdp7DWM,en,[],['https://twitter.com/blockstream/status/953424395099189249'],[],347,267,919,[],[],https://twitter.com/rogerkver/status/953680964328280064,False,https://twitter.com/blockstream/status/953424395099189249,0,,,,,,,,[],,,,
953678746577506304,953678746577506304,2018-01-17 12:21:46 Eastern Standard Time,2018-01-17,12:21:46,-0500,20374262,maxkeiser,🇸🇻 BITCOIN AMBASSADOR 🌋,,What’s the difference between #Bitcoin and Wall St.? One is an out of control regulatory nightmare creating huge bubbles and systemic risks. The other is a crypto currency.,en,[],[],[],42,299,784,['bitcoin'],[],https://twitter.com/maxkeiser/status/953678746577506304,False,,0,,,,,,,,[],,,,
953676793860558848,953676793860558848,2018-01-17 12:14:00 Eastern Standard Time,2018-01-17,12:14:00,-0500,357312062,bitcoin,Bitcoin,,Japan’s Largest Bank to Launch Cryptocurrency Exchange   https://t.co/5hnFp5p0P4,en,[],['https://news.bitcoin.com/japans-largest-bank-to-launch-cryptocurrency-exchange/'],[],42,526,1029,[],[],https://twitter.com/Bitcoin/status/953676793860558848,False,,0,,,,,,,,[],,,,
953673493551505408,953673493551505408,2018-01-17 12:00:53 Eastern Standard Time,2018-01-17,12:00:53,-0500,2377815434,clickhole,ClickHole,,"Silicon Valley To The Rescue: In Response To Trump Deporting DACA Dreamers, Tech Entrepreneurs Have Released A New App That Links Your Bitcoin Wallet To Your Smart Watch  https://t.co/CaFqxGZXCC  https://t.co/rWEn03wTtc",en,[],['http://clckhl.co/e8U8Cat'],['https://pbs.twimg.com/media/DTwg_NNWsAIdzqc.jpg'],7,203,593,[],[],https://twitter.com/ClickHole/status/953673493551505408,False,,1,https://pbs.twimg.com/media/DTwg_NNWsAIdzqc.jpg,,,,,,,[],,,,
953669761807933440,953669761807933440,2018-01-17 11:46:04 Eastern Standard Time,2018-01-17,11:46:04,-0500,57689645,tracemayer,Trace Mayer,,"Current #Bitcoin run very similar to Jan-Mar 2013 run ($7-&gt;$266-&gt;$90; $700-$20k-&gt;$9k) with backlogged new accounts, etc. then Silk Road catalyst (salable supply shock) for $100-&gt;$1,200. Mountain of #WallStreet money lining up. What are potential 2018 $BTC scenarios? @ToneVays? 😎  https://t.co/PqrinsGSFz",en,"[{'screen_name': 'tonevays', 'name': 'tone vays (#arrestfauci 🤡🌎)', 'id': '2577886615'}]",[],['https://pbs.twimg.com/media/DTwdcs7VoAAandI.jpg'],56,415,938,"['bitcoin', 'wallstreet']",['btc'],https://twitter.com/TraceMayer/status/953669761807933440,False,,1,https://pbs.twimg.com/media/DTwdcs7VoAAandI.jpg,,,,,,,[],,,,
953665553805144064,953665553805144064,2018-01-17 11:29:20 Eastern Standard Time,2018-01-17,11:29:20,-0500,2449847450,parabolictrav,SentimentTrav,,"The wealthiest people to emerge from Bitcoin in 10 years will be a function of the following: 1. Length of time from original investment, 2. Percentage of personal net worth committed, and 3. Least amount sell actions taken.",en,[],[],[],45,170,854,[],[],https://twitter.com/parabolictrav/status/953665553805144064,False,,0,,,,,,,,[],,,,
953660189093384192,953660189093384192,2018-01-17 11:08:01 Eastern Standard Time,2018-01-17,11:08:01,-0500,20402945,cnbc,CNBC,,Billionaire Mark Cuban says the Dallas Mavericks will accept bitcoin next season  https://t.co/Pe7kg737ct,en,[],['http://cnb.cx/2DGxtZV'],[],72,313,632,[],[],https://twitter.com/CNBC/status/953660189093384192,False,,0,,,,,,,,[],,,,
953658222589734914,953658222589734914,2018-01-17 11:00:13 Eastern Standard Time,2018-01-17,11:00:13,-0500,5438512,ryanshrout,Ryan Shrout,,Bitcoin is now worth exactly half of what it was worth 30 days ago. Can we have GPUs for gaming now please?  https://t.co/9ghgzD6JTt,en,[],[],['https://pbs.twimg.com/media/DTwTES0U0AEFJQg.jpg'],55,411,2027,[],[],https://twitter.com/ryanshrout/status/953658222589734914,False,,1,https://pbs.twimg.com/media/DTwTES0U0AEFJQg.jpg,,,,,,,[],,,,
953655627649306624,953655627649306624,2018-01-17 10:49:54 Eastern Standard Time,2018-01-17,10:49:54,-0500,357312062,bitcoin,Bitcoin,,"In times like these, it's important to remember that Bitcoin is not a get-rich-quick scheme. As long as the fundamentals of utility and adoption continue to grow, then Bitcoin is still strong.",en,[],[],[],161,663,2065,[],[],https://twitter.com/Bitcoin/status/953655627649306624,False,,0,,,,,,,,[],,,,
953646075734315008,953646075734315008,2018-01-17 10:11:56 Eastern Standard Time,2018-01-17,10:11:56,-0500,820282353436200960,bitstein,Bitstein,,"If you aren't in Bitcoin for the long run, you will get rekt by people who are.",en,[],[],[],21,297,1397,[],[],https://twitter.com/bitstein/status/953646075734315008,False,,0,,,,,,,,[],,,,
953642689819426818,953642689819426818,2018-01-17 09:58:29 Eastern Standard Time,2018-01-17,09:58:29,-0500,175754840,msttrader,Alan Farley,,Here you go #Bitcoin owners.  https://t.co/ab8zZiCFst,en,[],[],['https://pbs.twimg.com/media/DTwE9ShUQAABYwk.jpg'],14,395,1203,['bitcoin'],[],https://twitter.com/msttrader/status/953642689819426818,False,,1,https://pbs.twimg.com/media/DTwE9ShUQAABYwk.jpg,,,,,,,[],,,,
953641857644457991,953641857644457991,2018-01-17 09:55:11 Eastern Standard Time,2018-01-17,09:55:11,-0500,3019768474,rmcunliffe,Rachel Cunliffe,,"Bitcoin has plummeted to below $10,000. A month ago it was near $20,000. Now seems like a good time to revisit this brilliant @cityam piece by @DrRajPersaud   https://t.co/pBadVn5bDw",en,"[{'screen_name': 'cityam', 'name': 'city a.m.', 'id': '45840503'}, {'screen_name': 'drrajpersaud', 'name': 'raj persaud', 'id': '543893301'}]",['http://www.cityam.com/277415/spot-symptoms-stay-sane-and-run-bitcoin-bubble'],[],26,211,503,[],[],https://twitter.com/RMCunliffe/status/953641857644457991,False,,0,,,,,,,,[],,,,
953641794797035521,953641794797035521,2018-01-17 09:54:56 Eastern Standard Time,2018-01-17,09:54:56,-0500,877305698,jkaraian,Jason Karaian,,"If you got bitcoin for Christmas, it’s now worth a quarter less than when Santa delivered it  https://t.co/mz9t0v4A9s",en,[],['https://qz.com/1181655'],[],27,170,396,[],[],https://twitter.com/jkaraian/status/953641794797035521,False,,0,,,,,,,,[],,,,
953641104271986688,953641104271986688,2018-01-17 09:52:11 Eastern Standard Time,2018-01-17,09:52:11,-0500,259725229,valaafshar,Vala Afshar,,Did not exist in 2003:  Facebook Twitter  iPhone📱 iPad Android Alibaba Apple App Store Uber Airbnb Blockchain Square Stripe Spotify Dropbox Instagram Snapchat WhatsApp Pinterest  Kickstarter Messenger Quora Tumblr BuzzFeed Hulu Tinder Nest Fitbit Oculus Tencent Kindle Bitcoin 4G,en,[],[],[],45,500,808,[],[],https://twitter.com/ValaAfshar/status/953641104271986688,False,,0,,,,,,,,[],,,,
953639311550877696,953639311550877696,2018-01-17 09:45:04 Eastern Standard Time,2018-01-17,09:45:04,-0500,3226282347,thisisinsider,Insider,,"#Bitcoin falls below $10,000 as cryptocurrency 'bloodbath' enters a 2nd day  https://t.co/uEOsntY8TQ  https://t.co/9tdCV56wtn",en,[],['http://insder.co/2DJgZQs'],['https://pbs.twimg.com/media/DTwB5fgV4AAau5E.jpg'],42,327,676,['bitcoin'],[],https://twitter.com/thisisinsider/status/953639311550877696,False,,1,https://pbs.twimg.com/media/DTwB5fgV4AAau5E.jpg,,,,,,,[],,,,
953636872147931136,953636872147931136,2018-01-17 09:35:22 Eastern Standard Time,2018-01-17,09:35:22,-0500,275686563,verge,The Verge,,"Bitcoin drops 50 percent from its peak value as it falls below $10,000  https://t.co/m9zOVX6xVa  https://t.co/UQ8xBK4HFZ",en,[],['https://www.theverge.com/2018/1/17/16900448/bitcoin-drop-below-100000-half-peak-bitconnect?utm_campaign=theverge&utm_content=chorus&utm_medium=social&utm_source=twitter'],['https://pbs.twimg.com/media/DTv_rgdWsAA4t5w.jpg'],22,176,280,[],[],https://twitter.com/verge/status/953636872147931136,False,,1,https://pbs.twimg.com/media/DTv_rgdWsAA4t5w.jpg,,,,,,,[],,,,
953636115684216832,953636115684216832,2018-01-17 09:32:22 Eastern Standard Time,2018-01-17,09:32:22,-0500,832376964,solomonjake,Jake Solomon,,Checking your bitcoin account right now:  https://t.co/mqwt1BpkJj,en,[],[],['https://pbs.twimg.com/tweet_video_thumb/DTv-6a3XUAc43Ag.jpg'],13,223,575,[],[],https://twitter.com/SolomonJake/status/953636115684216832,False,,1,https://pbs.twimg.com/tweet_video_thumb/DTv-6a3XUAc43Ag.jpg,,,,,,,[],,,,
953635581807898624,953635581807898624,2018-01-17 09:30:15 Eastern Standard Time,2018-01-17,09:30:15,-0500,24410456,jeffmacke,Jeff Macke,,Bitcoin: may have been expecting a bit more support at 10k.  https://t.co/MSIO6OcM2v,en,[],[],['https://pbs.twimg.com/tweet_video_thumb/DTv-gMeU0AAtJVM.jpg'],8,137,487,[],[],https://twitter.com/JeffMacke/status/953635581807898624,False,,1,https://pbs.twimg.com/tweet_video_thumb/DTv-gMeU0AAtJVM.jpg,,,,,,,[],,,,
953634522935037958,953634522935037958,2018-01-17 09:26:02 Eastern Standard Time,2018-01-17,09:26:02,-0500,17006157,paulkrugman,Paul Krugman,,"So Bitcoin just lost half its value. Where does it now stand relative to fundamentals? Hard to say, because there aren't any fundamentals. More than ever, this looks like a pure bubble  https://t.co/L9LbDyuZKD",en,[],['https://www.bloomberg.com/news/articles/2018-01-17/bitcoin-steadies-from-26-slump-as-traders-brave-volatility'],[],161,591,1106,[],[],https://twitter.com/paulkrugman/status/953634522935037958,False,,0,,,,,,,,[],,,,
953634516194811905,953634516194811905,2018-01-17 09:26:00 Eastern Standard Time,2018-01-17,09:26:00,-0500,20402945,cnbc,CNBC,,"Bitcoin dips below $10,000. Watch it trade in real-time  https://t.co/bOTj11ADCe",en,[],['https://www.pscp.tv/CNBC/1BRKjLZObBjJw'],[],76,177,226,[],[],https://twitter.com/CNBC/status/953634516194811905,False,,0,,,,,,,,[],,,,
953634425098694656,953634425098694656,2018-01-17 09:25:39 Eastern Standard Time,2018-01-17,09:25:39,-0500,2436389418,swiftonsecurity,SwiftOnSecurity,,I’m confident the 4 people who control the price of Bitcoin will pump it up again,en,[],[],[],30,284,1422,[],[],https://twitter.com/SwiftOnSecurity/status/953634425098694656,False,,0,,,,,,,,[],,,,
953632734462832641,953632734462832641,2018-01-17 09:18:56 Eastern Standard Time,2018-01-17,09:18:56,-0500,23618940,lopp,Jameson Lopp,,Ubitex MyBitcoin Bitcoin7 Bitscalper Bitcoin Savings &amp; Trust Bitcoin Rain GBL BASIC-MINING Butterfly Labs MintPal Gemcoin GAW Miners / Paycoin Bitconnect Scammers have wanted your BTC ever since it had an exchange rate. Learn from history. Don't be greedy. Don't be a victim.,en,[],[],[],120,456,1210,[],[],https://twitter.com/lopp/status/953632734462832641,False,,0,,,,,,,,[],,,,
953632468132823042,953632468132823042,2018-01-17 09:17:52 Eastern Standard Time,2018-01-17,09:17:52,-0500,34713362,business,Bloomberg,,"Bitcoin tumbled below $10,000, bringing its loss to almost 50 percent from a record set only a month ago  https://t.co/d2NwCOampz  https://t.co/nUFz0Zcji8",en,[],['https://bloom.bg/2mLnSK3'],['https://pbs.twimg.com/media/DTv7rL1VAAIwtOn.jpg'],13,180,137,[],[],https://twitter.com/business/status/953632468132823042,False,,1,https://pbs.twimg.com/media/DTv7rL1VAAIwtOn.jpg,,,,,,,[],,,,
953631590214709250,953631590214709250,2018-01-17 09:14:23 Eastern Standard Time,2018-01-17,09:14:23,-0500,19038934,cbcalerts,CBC News Alerts,,"Bitcoin plunge accelerates as cryptocurrency falls below $10,000 US for 1st time since December; more than $30B in value wiped out in last 24 hours. Bitcoin down more than 50% from all-time high of $19,783. Background:  https://t.co/ESKf6aJlHu",en,[],['http://cbc.ca/1.4489156'],[],51,308,342,[],[],https://twitter.com/CBCAlerts/status/953631590214709250,False,,0,,,,,,,,[],,,,
953629347453329408,953629347453329408,2018-01-17 09:05:28 Eastern Standard Time,2018-01-17,09:05:28,-0500,69620713,markets,Bloomberg Markets,,"Bitcoin drops under $10,000  https://t.co/KfLM7AIbzI  https://t.co/nQitimtvLo",de,[],['https://www.bloomberg.com/news/articles/2018-01-17/did-bitcoin-just-burst-how-it-compares-to-history-s-big-bubbles'],['https://pbs.twimg.com/media/DTv41SEW0AEtBZg.jpg'],12,187,162,[],[],https://twitter.com/markets/status/953629347453329408,False,,1,https://pbs.twimg.com/media/DTv41SEW0AEtBZg.jpg,,,,,,,[],,,,
953624919937437696,953624919937437696,2018-01-17 08:47:53 Eastern Standard Time,2018-01-17,08:47:53,-0500,25970676,edgaralbarran,lcda. edgar albarrán 🌹,,"Acaba de nacer en el hospital universitario de Maracaibo, Bitcoin Segundo Montiel Romero.",es,[],[],[],15,180,199,[],[],https://twitter.com/edgaralbarran/status/953624919937437696,False,,0,,,,,,,,[],,,,
953612027276283905,953612027276283905,2018-01-17 07:56:39 Eastern Standard Time,2018-01-17,07:56:39,-0500,34713362,business,Bloomberg,,Did bitcoin just burst? This is how it compares to history's big bubbles  https://t.co/hfdrvzcOhM  https://t.co/SiEzn7px6X,en,[],['https://bloom.bg/2mPv9bT'],['https://pbs.twimg.com/media/DTvpFYzV4AUeK5Y.jpg'],122,372,397,[],[],https://twitter.com/business/status/953612027276283905,False,,1,https://pbs.twimg.com/media/DTvpFYzV4AUeK5Y.jpg,,,,,,,[],,,,
953607152698122240,953607152698122240,2018-01-17 07:37:17 Eastern Standard Time,2018-01-17,07:37:17,-0500,742143,bbcworld,BBC News (World),,"Bitcoin dips below $10,000  https://t.co/eHJr1Kz2ay",en,[],['http://bbc.in/2Dc9S2e'],[],26,185,241,[],[],https://twitter.com/BBCWorld/status/953607152698122240,False,,0,,,,,,,,[],,,,
953602681372905472,953602681372905472,2018-01-17 07:19:30 Eastern Standard Time,2018-01-17,07:19:30,-0500,20402945,cnbc,CNBC,,"Bitcoin drops below $10,000 with $36 billion of value wiped off in a day as cryptocurrency sell-off deepens  https://t.co/RaUnYx4EKD",en,[],['http://cnb.cx/2FK8bdQ'],[],28,132,148,[],[],https://twitter.com/CNBC/status/953602681372905472,False,,0,,,,,,,,[],,,,
953600344612884480,953600344612884480,2018-01-17 07:10:13 Eastern Standard Time,2018-01-17,07:10:13,-0500,5988062,theeconomist,The Economist,,The rise and fall of Bitcoin  https://t.co/jALIAAphMZ,en,[],['http://econ.st/2DIifU7'],[],15,269,441,[],[],https://twitter.com/TheEconomist/status/953600344612884480,False,,0,,,,,,,,[],,,,
953599006655045632,953599006655045632,2018-01-17 07:04:54 Eastern Standard Time,2018-01-17,07:04:54,-0500,61417559,erikvoorhees,Erik Voorhees,,World’s fourth largest bank planning to launch Cryptocurrency exchange   https://t.co/ZUkMm6YiqC via @BTCTN #bitcoin,en,"[{'screen_name': 'btctn', 'name': 'bitcoin news', 'id': '3367334171'}]",['https://news.bitcoin.com/japans-largest-bank-to-launch-cryptocurrency-exchange/'],[],57,644,1128,['bitcoin'],[],https://twitter.com/ErikVoorhees/status/953599006655045632,False,,0,,,,,,,,[],,,,
953560883103457280,953560883103457280,2018-01-17 04:33:25 Eastern Standard Time,2018-01-17,04:33:25,-0500,34713362,business,Bloomberg,,Did bitcoin just burst? This is how it compares to history's big bubbles  https://t.co/GqsYs89g3K  https://t.co/Si61M6o6pD,en,[],['https://bloom.bg/2re9w9N'],['https://pbs.twimg.com/media/DTu6kZYW4AAm4qA.jpg'],15,202,223,[],[],https://twitter.com/business/status/953560883103457280,False,,1,https://pbs.twimg.com/media/DTu6kZYW4AAm4qA.jpg,,,,,,,[],,,,
953557846406279170,953557846406279170,2018-01-17 04:21:21 Eastern Standard Time,2018-01-17,04:21:21,-0500,946732615524007937,bitcoincryptomm,Bitcoin Crypto Mastermind,,BIG NEWS: my business partner thinks bitcoin will drop to $8500. He’s excited to be buying it cheap. Also as my mentors have been saying for last few months - bitconnect is a Ponzi scheme. It shut down today. Be sure to listen to sharp people.  https://t.co/Nec0xvpg21,en,[],[],[],102,245,844,[],[],https://twitter.com/BitcoinCryptoMM/status/953557846406279170,False,,1,https://pbs.twimg.com/ext_tw_video_thumb/953557777690972160/pu/img/pcXsJnsX9SXrNbvD.jpg,,,,,,,[],,,,
953556251753017344,953556251753017344,2018-01-17 04:15:01 Eastern Standard Time,2018-01-17,04:15:01,-0500,18856867,zerohedge,zerohedge,,Mapping Bitcoin's Legality Around The World  https://t.co/06jrT4KBIC,en,[],['https://www.zerohedge.com/news/2018-01-16/mapping-bitcoins-legality-around-world'],[],12,159,162,[],[],https://twitter.com/zerohedge/status/953556251753017344,False,,0,,,,,,,,[],,,,
953552168577064960,953552168577064960,2018-01-17 03:58:47 Eastern Standard Time,2018-01-17,03:58:47,-0500,2724621665,comendadormbf,Dr Marcio B Fasano ✨,,"In celebration of 5,000 followers, I will be giving away .5BTC AND a Trezor Black hardware wallet (shipping to most places).   👋🏻To enter just retweet, like &amp; follow.   #bitcoin #btc #litecoin #ltc #ethereum #eth #dash #xrp #ripple #xvg #verge #trx #tron #cryptocurrency #crypto  https://t.co/2SCgnksvKH",en,[],[],['https://pbs.twimg.com/media/DTuyog-WAAAN06l.jpg'],108,408,479,"['bitcoin', 'btc', 'litecoin', 'ltc', 'ethereum', 'eth', 'dash', 'xrp', 'ripple', 'xvg', 'verge', 'trx', 'tron', 'cryptocurrency', 'crypto']",[],https://twitter.com/ComendadorMBF/status/953552168577064960,False,,1,https://pbs.twimg.com/media/DTuyog-WAAAN06l.jpg,,,,,,,[],,,,
953527221637058561,953527221637058561,2018-01-17 02:19:39 Eastern Standard Time,2018-01-17,02:19:39,-0500,807095,nytimes,The New York Times,,"""The Bitcoin bubble may ultimately turn out to be a distraction from the true significance of the blockchain.""  https://t.co/B15gUByS6H",en,[],['http://nyti.ms/2FLPqH4'],[],23,154,308,[],[],https://twitter.com/nytimes/status/953527221637058561,False,,0,,,,,,,,[],,,,
953522025112457216,953522025112457216,2018-01-17 01:59:01 Eastern Standard Time,2018-01-17,01:59:01,-0500,2799211554,whalepanda,WhalePanda,,If multiple people who have been in the #Bitcoin / $Crypto community for a while tell you that something is a ponzi/scam... Maybe next time you should listen to them? They've seen it all before multiple times with every large influx of new users. Stay safe  https://t.co/GzUxLn843o,en,[],['https://techcrunch.com/2018/01/16/bitconnect-which-has-been-accused-of-running-a-ponzi-scheme-shuts-down/'],[],54,269,904,['bitcoin'],['crypto'],https://twitter.com/WhalePanda/status/953522025112457216,False,,0,,,,,,,,[],,,,
953513630535946241,953513630535946241,2018-01-17 01:25:39 Eastern Standard Time,2018-01-17,01:25:39,-0500,22797665,davidshapiro61,David Shapiro,,"Not sure who the more miserable are - Arsenal supporters or Bitcoin investors. Bitcoin half the value it was a month ago. Yeah, yeah it is still up if you bought it long ago. That’s like celebrating Arsenal’s victories in the early 2000s.",en,[],[],[],35,144,303,[],[],https://twitter.com/davidshapiro61/status/953513630535946241,False,,0,,,,,,,,[],,,,
953481232653811712,953481232653811712,2018-01-16 23:16:55 Eastern Standard Time,2018-01-16,23:16:55,-0500,104745960,yoshitaka_kitao,北尾吉孝,,Ripple’s Implied Market Capitalization Now Greater Than Bitcoin -  https://t.co/xOCZMeXrvv,en,[],['https://discover.coinsquare.io/investing/ripple-implied-market-capitalization/'],[],14,219,409,[],[],https://twitter.com/yoshitaka_kitao/status/953481232653811712,False,,0,,,,,,,,[],,,,
953481210767929348,953481210767929348,2018-01-16 23:16:50 Eastern Standard Time,2018-01-16,23:16:50,-0500,104745960,yoshitaka_kitao,北尾吉孝,,Ripple Becomes First Cryptocurrency After Bitcoin to Surpass $100 Billion  https://t.co/tYtd4baQtH,en,[],['https://www.ccn.com/ripple-becomes-first-cryptocurrency-apart-from-bitcoin-to-surpass-121-billion/'],[],4,222,451,[],[],https://twitter.com/yoshitaka_kitao/status/953481210767929348,False,,0,,,,,,,,[],,,,
953481166161522688,953481166161522688,2018-01-16 23:16:39 Eastern Standard Time,2018-01-16,23:16:39,-0500,104745960,yoshitaka_kitao,北尾吉孝,,Bitcoin No Longer Top Dog Because Of How It Is Defined  https://t.co/wXpUjMZBqW via @Cointelegraph,en,"[{'screen_name': 'cointelegraph', 'name': 'cointelegraph', 'id': '2207129125'}]",['https://cointelegraph.com/news/bitcoin-no-longer-top-dog-because-of-how-it-is-defined'],[],3,207,374,[],[],https://twitter.com/yoshitaka_kitao/status/953481166161522688,False,,0,,,,,,,,[],,,,
953476847521722370,953476847521722370,2018-01-16 22:59:29 Eastern Standard Time,2018-01-16,22:59:29,-0500,605106202,awkwafina,nora,,When you ask men to explain:  1. Bitcoin 2. Which PS4 Games Suck 3. China &amp; The Global Economy 4. Black Mirror  5. Why They Didn’t Like Hillary Either  https://t.co/4Y4RKAg4Xr,en,[],[],['https://pbs.twimg.com/media/DTtuI43XcAAydlG.jpg'],21,200,1198,[],[],https://twitter.com/awkwafina/status/953476847521722370,False,,1,https://pbs.twimg.com/media/DTtuI43XcAAydlG.jpg,,,,,,,[],,,,
953470200317382659,953470200317382659,2018-01-16 22:33:05 Eastern Standard Time,2018-01-16,22:33:05,-0500,807095,nytimes,The New York Times,,"""The Bitcoin bubble may ultimately turn out to be a distraction from the true significance of the blockchain.""  https://t.co/iPO8ZCTMb0",en,[],['http://nyti.ms/2B5TvT0'],[],23,150,295,[],[],https://twitter.com/nytimes/status/953470200317382659,False,,0,,,,,,,,[],,,,
953468852293197826,953468852293197826,2018-01-16 22:27:43 Eastern Standard Time,2018-01-16,22:27:43,-0500,390266895,legendofcrypto,Crypto Boss,,"Just a few months ago Bitcoin going to $10,000 was a huge celebration  Now Bitcoin is at $10,000 and its the end of the world",en,[],[],[],115,966,3353,[],[],https://twitter.com/LegendOfCrypto/status/953468852293197826,False,,0,,,,,,,,[],,,,
953466381340614656,953466381340614656,2018-01-16 22:17:54 Eastern Standard Time,2018-01-16,22:17:54,-0500,14338147,satoshilite,Charlie Lee,,"Turns out it was a ponzi after all. ☹️ Sorry for those that got caught up in this. Ponzis work because people are easily fooled. Remember pirate@40's Bitcoin Savings and Trust? I stupidly ""invested"" in that ponzi. 🤦‍♂️  https://t.co/nMnH7o3Yuf",en,[],['https://twitter.com/SatoshiLite/status/936306965860401152'],[],301,613,2629,[],[],https://twitter.com/SatoshiLite/status/953466381340614656,False,https://twitter.com/SatoshiLite/status/936306965860401152,0,,,,,,,,[],,,,
953461714821009408,953461714821009408,2018-01-16 21:59:21 Eastern Standard Time,2018-01-16,21:59:21,-0500,93295809,jamesgrickards,Jim Rickards,,"Bitcoin whales have not lost a dime in the meltdown. They sold futures. For every dollar lost on coins, they make a dollar on futures. It's little guys who piled in who got hurt. Bitcoin's not the future; it's the same old scam.  https://t.co/CiZWzMmLyv",en,[],[],['https://pbs.twimg.com/media/DTtfgS5UMAAeMx1.jpg'],95,238,622,[],[],https://twitter.com/JamesGRickards/status/953461714821009408,False,,1,https://pbs.twimg.com/media/DTtfgS5UMAAeMx1.jpg,,,,,,,[],,,,
953452399766724609,953452399766724609,2018-01-16 21:22:21 Eastern Standard Time,2018-01-16,21:22:21,-0500,294306372,palmerluckey,Palmer Luckey,,"Oh no, Bitcoin has ""crashed"" to where it was at the start of December!  That is only double what it was a month before, and only 10x what it was a year ago!",en,[],[],[],37,190,797,[],[],https://twitter.com/PalmerLuckey/status/953452399766724609,False,,0,,,,,,,,[],,,,
953452045209518081,953452045209518081,2018-01-16 21:20:56 Eastern Standard Time,2018-01-16,21:20:56,-0500,291438698,legionhoops,Legion Hoops,,"Mark Cuban has announced the Dallas Mavericks will accept cryptocurrency next season, including Bitcoin and Ether. Interesting.",en,[],[],[],71,1557,3723,[],[],https://twitter.com/LegionHoops/status/953452045209518081,False,,0,,,,,,,,[],,,,
953449221117509633,953449221117509633,2018-01-16 21:09:43 Eastern Standard Time,2018-01-16,21:09:43,-0500,180212381,milessuter,Miles Suter,,If you have been panic selling your $BTC amidst all the *amazing* lightning announcements you don’t understand #bitcoin.   It’s happening.,en,[],[],[],22,194,738,['bitcoin'],['btc'],https://twitter.com/milessuter/status/953449221117509633,False,,0,,,,,,,,[],,,,
953442551318679554,953442551318679554,2018-01-16 20:43:12 Eastern Standard Time,2018-01-16,20:43:12,-0500,859484337850523648,crypto_rand,Crypto Rand,,"Since @CNBC showed its audience how to buy $XRP step by step, the price has dropped a 70%. #Bitcoin #Ethereum #CryptoCurrency  https://t.co/b0Np6dEMpU",en,"[{'screen_name': 'cnbc', 'name': 'cnbc', 'id': '20402945'}]",[],['https://pbs.twimg.com/media/DTtN3OwXUAILGSN.jpg'],88,266,780,"['bitcoin', 'ethereum', 'cryptocurrency']",['xrp'],https://twitter.com/crypto_rand/status/953442551318679554,False,,1,https://pbs.twimg.com/media/DTtN3OwXUAILGSN.jpg,,,,,,,[],,,,
953440270170972160,953440270170972160,2018-01-16 20:34:09 Eastern Standard Time,2018-01-16,20:34:09,-0500,941466099928809472,bitcoinprivate,Bitcoin Private [BTCP],,"Community, we feel we owe it to you to provide a #BitcoinPrivate pre-fork roadmap so you have a clearer view of what is to come. While the actual code for Bitcoin Private is finished, there are still a few tasks ahead of us. See below for our pre-fork roadmap:  https://t.co/JOqAQXUxqi",en,[],[],['https://pbs.twimg.com/media/DTtJrmKU8AA5DMq.jpg'],126,639,1297,['bitcoinprivate'],[],https://twitter.com/bitcoinprivate/status/953440270170972160,False,,1,https://pbs.twimg.com/media/DTtJrmKU8AA5DMq.jpg,,,,,,,[],,,,
