id,conversation_id,created_at,date,time,timezone,user_id,username,name,place,tweet,language,mentions,urls,photos,replies_count,retweets_count,likes_count,hashtags,cashtags,link,retweet,quote_url,video,thumbnail,near,geo,source,user_rt_id,user_rt,retweet_id,reply_to,retweet_date,translate,trans_src,trans_dest
968250476423729153,968250476423729153,2018-02-26 17:24:37 Eastern Standard Time,2018-02-26,17:24:37,-0500,16912124,ericgarland,Eric Garland,,"Sweet Felony Magic, here's news about Bitcoin! The IRS is about to get 13,000 identities from Coinbase! 😍  https://t.co/nro0PbwVXR",en,[],['https://arstechnica.com/tech-policy/2018/02/coinbase-we-will-send-data-on-13000-users-to-irs/'],[],15,152,309,[],[],https://twitter.com/ericgarland/status/968250476423729153,False,,0,,,,,,,,[],,,,
968240524120469508,968240524120469508,2018-02-26 16:45:04 Eastern Standard Time,2018-02-26,16:45:04,-0500,21263333,jimmysong,Jimmy Song (송재준),,What percent of your friends own Bitcoin?,en,[],[],[],121,198,301,[],[],https://twitter.com/jimmysong/status/968240524120469508,False,,0,,,,,,,,[],,,,
968219257845645312,968219257845645312,2018-02-26 15:20:34 Eastern Standard Time,2018-02-26,15:20:34,-0500,251433567,noiseymusic,NOISEY,,50 Cent's Bitcoin name is 0.000049,en,[],[],[],6,224,716,[],[],https://twitter.com/NoiseyMusic/status/968219257845645312,False,,0,,,,,,,,[],,,,
968211582634332160,968211582634332160,2018-02-26 14:50:04 Eastern Standard Time,2018-02-26,14:50:04,-0500,572478728,nejc_kodric,Nejc Kodrič,,"Being a ""Bitcoiner"" is to own one bitcoin (100,000,000 Satoshi) or more.  It may sound silly now, but in 10 years it may not.",en,[],[],[],53,238,920,[],[],https://twitter.com/nejc_kodric/status/968211582634332160,False,,0,,,,,,,,[],,,,
968138343346089984,968138343346089984,2018-02-26 09:59:02 Eastern Standard Time,2018-02-26,09:59:02,-0500,61417559,erikvoorhees,Erik Voorhees,,"Wow - major news in cryptoland today. Circle, backed by Goldman Sachs, bought Poloniex! (one of the largest digital asset exchanges in the world) That wouldn't have been cheap...  https://t.co/OL8CvyZqg7 via @FortuneMagazine #bitcoin #ethereum #blockchain",en,"[{'screen_name': 'fortunemagazine', 'name': 'fortune', 'id': '25053299'}]",['http://for.tn/2CEcgxl'],[],85,553,939,"['bitcoin', 'ethereum', 'blockchain']",[],https://twitter.com/ErikVoorhees/status/968138343346089984,False,,0,,,,,,,,[],,,,
968121079842660352,968121079842660352,2018-02-26 08:50:26 Eastern Standard Time,2018-02-26,08:50:26,-0500,11492932,collincrypto,Collin Crypto,,Circle buys $crypto exchange Poloniex for an estimated $400 million. #bitcoin #ethereum    https://t.co/w8OVzZxn0w,en,[],['http://fortune.com/2018/02/26/circle-cryptocurrency-trade-bitcoin/'],[],46,232,335,"['bitcoin', 'ethereum']",['crypto'],https://twitter.com/CollinCrypto/status/968121079842660352,False,,0,,,,,,,,[],,,,
968120611426963458,968120611426963458,2018-02-26 08:48:35 Eastern Standard Time,2018-02-26,08:48:35,-0500,361289499,bitcoinmagazine,Bitcoin Magazine,,Bitcoin Core 0.16.0 Is Released: Here’s What’s New  https://t.co/qnDdUttqOf #bitcoin #blockchain #TechnologyNews,en,[],['https://bitcoinmagazine.com/articles/bitcoin-core-0160-released-heres-whats-new/'],[],32,230,375,"['bitcoin', 'blockchain', 'technologynews']",[],https://twitter.com/BitcoinMagazine/status/968120611426963458,False,,0,,,,,,,,[],,,,
968120246086307841,968120246086307841,2018-02-26 08:47:08 Eastern Standard Time,2018-02-26,08:47:08,-0500,948119493040943104,themossland,Mossland,,"Now you can purchase house with Bitcoin in Northern Ireland !  Hagan Homes, the largest house-builders in Northern Ireland, starts to accept Bitcoin as their payment method.  Will this fuel the industry !?   https://t.co/x5WCJBHy3F  https://t.co/6XKwQKgyFJ",en,[],['http://bit.ly/2FBvhE5'],['https://pbs.twimg.com/media/DW90ILOWAAAFsAm.jpg'],8,205,221,[],[],https://twitter.com/TheMossland/status/968120246086307841,False,,1,https://pbs.twimg.com/media/DW90ILOWAAAFsAm.jpg,,,,,,,[],,,,
968088293186433024,968088293186433024,2018-02-26 06:40:09 Eastern Standard Time,2018-02-26,06:40:09,-0500,933672480044175360,denaro_io,Denaro,,"Denaro accepts BTC, ETH, LTC and USD.  Choose the currency that works for you and get your tokens.  #Crypto #Blockchain #ICO #FinTech #CryptoNews #Bitcoin #Ethereum #BTC #ETH  https://t.co/6A4wBXIzLe",en,[],[],['https://pbs.twimg.com/media/DW9XJ54X4AA_rMO.jpg'],12,623,715,"['crypto', 'blockchain', 'ico', 'fintech', 'cryptonews', 'bitcoin', 'ethereum', 'btc', 'eth']",[],https://twitter.com/Denaro_io/status/968088293186433024,False,,1,https://pbs.twimg.com/media/DW9XJ54X4AA_rMO.jpg,,,,,,,[],,,,
968078246087659521,968078246087659521,2018-02-26 06:00:14 Eastern Standard Time,2018-02-26,06:00:14,-0500,4839528448,bitcoincoreorg,Bitcoin Core Project,,Bitcoin Core 0.16.0 Released  https://t.co/slIfNyPIVZ,en,[],['https://lists.linuxfoundation.org/pipermail/bitcoin-core-dev/2018-February/000052.html'],[],170,726,1730,[],[],https://twitter.com/bitcoincoreorg/status/968078246087659521,False,,0,,,,,,,,[],,,,
968074240330223616,968074240330223616,2018-02-26 05:44:19 Eastern Standard Time,2018-02-26,05:44:19,-0500,872093043305963521,dentcoin,DENT,,"DENT Android App is now LIVE on Google Play Store, Enjoy! Download link:  https://t.co/BXphYsHhG5 Press release:  https://t.co/OJkaljNmqb #dentcoin #blockchain #bitcoin #ethereum #btc #eth #mwc2018 #mwc18 #gsma #google #samsung #lg #5g  https://t.co/yGV04FOb1h",en,[],"['http://bit.ly/2sVPUIj', 'http://bit.ly/2Cm0U5E']",['https://pbs.twimg.com/media/DW9KAdSXkAIo18M.jpg'],37,257,567,"['dentcoin', 'blockchain', 'bitcoin', 'ethereum', 'btc', 'eth', 'mwc2018', 'mwc18', 'gsma', 'google', 'samsung', 'lg', '5g']",[],https://twitter.com/dentcoin/status/968074240330223616,False,,1,https://pbs.twimg.com/media/DW9KAdSXkAIo18M.jpg,,,,,,,[],,,,
967829511726301184,967829511726301184,2018-02-25 13:31:51 Eastern Standard Time,2018-02-25,13:31:51,-0500,18856867,zerohedge,zerohedge,,"Bitcoin Slides As Coinbase Informs 13,000 Customers Of Imminent Data Handover To IRS  https://t.co/cRsRipPUO6",en,[],['https://www.zerohedge.com/news/2018-02-25/bitcoin-slides-coinbase-informs-13000-customers-imminent-data-handover-irs'],[],34,216,240,[],[],https://twitter.com/zerohedge/status/967829511726301184,False,,0,,,,,,,,[],,,,
967822290829312000,967822290829312000,2018-02-25 13:03:10 Eastern Standard Time,2018-02-25,13:03:10,-0500,872093043305963521,dentcoin,DENT,,"Getting DENT for ANDROID ready for launch tomorrow, Monday 26. February! Looks promising for an afternoon launch UK time! #dentcoin #mwc2018 #wmc18 #gsma #btc #bitcoin #cryptocurrency #mobile #revolution #topup #samsung #lg #5g  https://t.co/5tdsKURXBu  #google #android  https://t.co/gDJenCHZGT",en,[],['https://www.dentwireless.com'],['https://pbs.twimg.com/media/DW5k-K5W4AY5rp7.jpg'],49,310,659,"['dentcoin', 'mwc2018', 'wmc18', 'gsma', 'btc', 'bitcoin', 'cryptocurrency', 'mobile', 'revolution', 'topup', 'samsung', 'lg', '5g', 'google', 'android']",[],https://twitter.com/dentcoin/status/967822290829312000,False,,1,https://pbs.twimg.com/media/DW5k-K5W4AY5rp7.jpg,,,,,,,[],,,,
967815625258274821,967815625258274821,2018-02-25 12:36:40 Eastern Standard Time,2018-02-25,12:36:40,-0500,3367334171,btctn,Bitcoin News,,Venezuelan Government Opens School to Teach Citizens About Cryptocurrencies  https://t.co/4EOnLQNrzI #Bitcoin  https://t.co/2CzIncFRdR,en,[],['http://ift.tt/2sSvVKv'],['https://pbs.twimg.com/media/DW5fLj-XUAERm-R.jpg'],44,246,440,['bitcoin'],[],https://twitter.com/BTCTN/status/967815625258274821,False,,1,https://pbs.twimg.com/media/DW5fLj-XUAERm-R.jpg,,,,,,,[],,,,
967761012777566208,967761012777566208,2018-02-25 08:59:40 Eastern Standard Time,2018-02-25,08:59:40,-0500,390266895,legendofcrypto,Crypto Boss,,#Bitcoin vs Banks  https://t.co/Z3B0RIJoQ8,nl,[],[],[],57,864,1559,['bitcoin'],[],https://twitter.com/LegendOfCrypto/status/967761012777566208,False,,1,https://pbs.twimg.com/ext_tw_video_thumb/967760779217747968/pu/img/MIWpVlQqyFsMKMmk.jpg,,,,,,,[],,,,
967732225792933888,967732225792933888,2018-02-25 07:05:16 Eastern Standard Time,2018-02-25,07:05:16,-0500,2207129125,cointelegraph,Cointelegraph,,Northern Ireland property developer starts accepting #Bitcoin  https://t.co/6jHfWycTAL,en,[],['https://cointelegraph.com/news/northern-ireland-property-developer-to-accept-bitcoin-as-payment-option'],[],15,261,478,['bitcoin'],[],https://twitter.com/Cointelegraph/status/967732225792933888,False,,0,,,,,,,,[],,,,
967673001931104256,967673001931104256,2018-02-25 03:09:56 Eastern Standard Time,2018-02-25,03:09:56,-0500,933672480044175360,denaro_io,Denaro,,"Offering unprecedented levels of security and protection, cryptocurrencies are something we all need to pay attention to.  Join  https://t.co/Mp4dxhch5g  #Crypto #Blockchain #ICO #FinTech #CryptoNews #Bitcoin #Ethereum #BTC #ETH #Denaro  https://t.co/kcaocpVLjb",en,[],['http://Denaro.io'],['https://pbs.twimg.com/media/DW3dcSEW0AAVg4w.jpg'],15,546,639,"['crypto', 'blockchain', 'ico', 'fintech', 'cryptonews', 'bitcoin', 'ethereum', 'btc', 'eth', 'denaro']",[],https://twitter.com/Denaro_io/status/967673001931104256,False,,1,https://pbs.twimg.com/media/DW3dcSEW0AAVg4w.jpg,,,,,,,[],,,,
967608757306802177,967608757306802177,2018-02-24 22:54:39 Eastern Standard Time,2018-02-24,22:54:39,-0500,777319354387922945,landm_marius,Marius BitcoinTAF.com 🏄‍♂️,,"The price target for Litecoin by the end of the year will be an ""astonishingly HIGH"" amount - people will be in awe. For now, it will follow Bitcoin path. If Litecoin is now $210 x 340% that gives you $924 but expect Litecoin to BREAK away from bitcoin to reach $1400 pretty soon.",en,[],[],[],61,175,623,[],[],https://twitter.com/LandM_Marius/status/967608757306802177,False,,0,,,,,,,,[],,,,
967607295956758528,967607295956758528,2018-02-24 22:48:51 Eastern Standard Time,2018-02-24,22:48:51,-0500,144396561,dyatlovassincdt,Uranium Centrifuge Haver,,"Periodic reminder that Bitcoin mining is not ""solving equations"". It's thousands of GPUs and specially-built chips burning electricity to yell random 64 digit numbers at each other in the hope one of them is the secret word of the day  https://t.co/U20hzANGDm",en,[],[],['https://pbs.twimg.com/media/DW2hp2ZU0AAXc78.jpg'],134,3886,11931,[],[],https://twitter.com/dyatlovassincdt/status/967607295956758528,False,,1,https://pbs.twimg.com/media/DW2hp2ZU0AAXc78.jpg,,,,,,,[],,,,
967557414596702208,967557414596702208,2018-02-24 19:30:38 Eastern Standard Time,2018-02-24,19:30:38,-0500,247857712,peterlbrandt,Peter Brandt,,What's next for #Bitcoin? $BTCUSD Violation of parabolic advance could produce 12-24 mos of chop before new advance gains traction  https://t.co/yyO9a9X3xR,en,[],[],['https://pbs.twimg.com/media/DW1zk0GVMAAlhsI.jpg'],237,280,795,['bitcoin'],['btcusd'],https://twitter.com/PeterLBrandt/status/967557414596702208,False,,1,https://pbs.twimg.com/media/DW1zk0GVMAAlhsI.jpg,,,,,,,[],,,,
967556217127211008,967556217127211008,2018-02-24 19:25:53 Eastern Standard Time,2018-02-24,19:25:53,-0500,339061487,apompliano,Pomp 🌪,,Growing up kids use to yell “cash” or “money” when hitting a jump shot in pickup basketball.  Someone just told me his son and friends are now yelling “Bitcoin!”  😭😭😭,en,[],[],[],109,265,1269,[],[],https://twitter.com/APompliano/status/967556217127211008,False,,0,,,,,,,,[],,,,
967545758680539137,967545758680539137,2018-02-24 18:44:19 Eastern Standard Time,2018-02-24,18:44:19,-0500,20374262,maxkeiser,🇸🇻 BITCOIN AMBASSADOR 🌋,,"If you’re spending more than a few hours a week as a crypto-investor, you’re doing it wrong. 1. Never have less than 75% of your port in #Bitcoin 2. Dollar cost average 3. Never use margin. 4. Remember, 99% of what you hear from traders is BS.",en,[],[],[],57,175,715,['bitcoin'],[],https://twitter.com/maxkeiser/status/967545758680539137,False,,0,,,,,,,,[],,,,
967514786811478017,967514786811478017,2018-02-24 16:41:15 Eastern Standard Time,2018-02-24,16:41:15,-0500,22682896,charlieshrem,Charlie Shrem,,Just HODL it ! #bitcoin  https://t.co/Q5b7DzvvYk,en,[],[],['https://pbs.twimg.com/media/DW1NjrzU8AA6X65.jpg'],44,331,1446,['bitcoin'],[],https://twitter.com/CharlieShrem/status/967514786811478017,False,,1,https://pbs.twimg.com/media/DW1NjrzU8AA6X65.jpg,,,,,,,[],,,,
967496496273870849,967496496273870849,2018-02-24 15:28:34 Eastern Standard Time,2018-02-24,15:28:34,-0500,18262138,clubtrillion,Mark Titus,,"Dream scenario: Arizona gets the death penalty, it becomes the most toxic job in sports, and they have no choice but to hire me. I then hire @tatefrazier and we militarize the 7% and Friends of the Program, drop bags via untraceable Bitcoin, and build a damn dynasty.  https://t.co/LkJhVoe4na",en,"[{'screen_name': 'tatefrazier', 'name': 'tate frazier', 'id': '143239904'}]",['https://twitter.com/thecvail/status/967493733133488129'],[],54,154,1949,[],[],https://twitter.com/clubtrillion/status/967496496273870849,False,https://twitter.com/thecvail/status/967493733133488129,0,,,,,,,,[],,,,
967491263757828097,967491263757828097,2018-02-24 15:07:47 Eastern Standard Time,2018-02-24,15:07:47,-0500,612750924,thomassanders,Thomas Sanders,,"NEW VID: ""MONEY Explained by Non-Experts"" Why is our money green? What is a bitcoin? How DO you get rich?? All these questions and more shall be answered!! Please enjoy!!  https://t.co/1Hnfoxgyj0  https://t.co/oijXMtoSkd",en,[],['https://youtu.be/FApBWHvUzMs'],[],139,218,2316,[],[],https://twitter.com/ThomasSanders/status/967491263757828097,False,,1,https://pbs.twimg.com/media/DWxD1JRWsAE_WCC.jpg,,,,,,,[],,,,
967454565678301184,967454565678301184,2018-02-24 12:41:57 Eastern Standard Time,2018-02-24,12:41:57,-0500,14338147,satoshilite,Charlie Lee,,Coinbase and GDAX now supports Segwit 'M' addresses for Litecoin. 👏  FYI: Litecoin has switched to 'M' addresses to prevent confusion with Bitcoin's '3' addresses used for multisig and SegWit.  https://t.co/xC6DMJHsWA,en,[],['https://twitter.com/coinbase/status/967083954686881792'],[],206,848,2973,[],[],https://twitter.com/SatoshiLite/status/967454565678301184,False,https://twitter.com/coinbase/status/967083954686881792,0,,,,,,,,[],,,,
967452883716276225,967452883716276225,2018-02-24 12:35:16 Eastern Standard Time,2018-02-24,12:35:16,-0500,2227582476,verretor,Ben Verret,,Nonsensical tweet by Cobra about PoW change. Bitcoin mempool suddenly fills up. BCash hashrate goes up. BU and BitcoinABC nodes go up in number simultaneously. Jihan tweets after 8 days of silence.  Something's fishy.  https://t.co/ymJwv4dqdh,en,[],[],"['https://pbs.twimg.com/media/DW0UPcZUMAAe7S6.jpg', 'https://pbs.twimg.com/media/DW0Ur2fU0AEN1aj.jpg', 'https://pbs.twimg.com/media/DW0U0UgVwAA43Wo.jpg', 'https://pbs.twimg.com/media/DW0U75AVAAAdySt.jpg']",38,138,362,[],[],https://twitter.com/verretor/status/967452883716276225,False,,1,https://pbs.twimg.com/media/DW0UPcZUMAAe7S6.jpg,,,,,,,[],,,,
967450479633543168,967450479633543168,2018-02-24 12:25:43 Eastern Standard Time,2018-02-24,12:25:43,-0500,941466099928809472,bitcoinprivate,Bitcoin Private [BTCP],,The Bitcoin Private testnet is now operational for our partners and the public to use. See instructions on our GitHub repo:  https://t.co/EAEXrgH6bh,en,[],['https://github.com/BTCPrivate/BitcoinPrivate/'],[],65,268,640,[],[],https://twitter.com/bitcoinprivate/status/967450479633543168,False,,0,,,,,,,,[],,,,
967449567431135233,967449567431135233,2018-02-24 12:22:05 Eastern Standard Time,2018-02-24,12:22:05,-0500,2199605117,rnr_0,Romano,,The next altcoin bull cycle will be so glorious.  Just think about how hard it pumped with bitcoin at $2k. Let alone $10 - $20k.  With so many new uneducated people bringing in an irresponsible amount of money.  We will al feel like a genius within a couple weeks.,en,[],[],[],59,216,1213,[],[],https://twitter.com/RNR_0/status/967449567431135233,False,,0,,,,,,,,[],,,,
967447228796325888,967447228796325888,2018-02-24 12:12:48 Eastern Standard Time,2018-02-24,12:12:48,-0500,2336915726,flyingheadofbtc,CEO of Bitcoin,,"Crystal ball hypothesis 2018:  1) By end of May BTC has recovered to ~16k  2) Higher low retest of the last bottom before that (btfd)  3) March, April, May will be Altcoin months  4) Bitcoin will make a substantial new ATH in 2018  5) Fundamentally strong Alts will remain strong",en,[],[],[],49,202,891,[],[],https://twitter.com/flyingheadofbtc/status/967447228796325888,False,,0,,,,,,,,[],,,,
967443937412567042,967443937412567042,2018-02-24 11:59:43 Eastern Standard Time,2018-02-24,11:59:43,-0500,3291691,chamath,Chamath Palihapitiya,,"JPMorgan Chase, Citigroup and Bank of America banned the use of their credit cards to buy Bitcoin but they will happily let you use it to buy an AR-15-style semiautomatic rifle — the kind of gun used in mass shootings all over the US...🤔  Cc @jpmorgan, @Citi, @BankofAmerica  https://t.co/1fX32xmx3q",en,"[{'screen_name': 'jpmorgan', 'name': 'j.p. morgan', 'id': '1155522630'}, {'screen_name': 'citi', 'name': 'citi', 'id': '79320096'}, {'screen_name': 'bankofamerica', 'name': 'bank of america', 'id': '204881628'}]",['https://twitter.com/karl_mcdonnell/status/965975668369453056'],[],83,658,1553,[],[],https://twitter.com/chamath/status/967443937412567042,False,https://twitter.com/karl_mcdonnell/status/965975668369453056,0,,,,,,,,[],,,,
967432856745193473,967432856745193473,2018-02-24 11:15:41 Eastern Standard Time,2018-02-24,11:15:41,-0500,14717442,xentagz,Dennis Parker,,Andreas Antonopoulos - 51% #Bitcoin Attack  https://t.co/4YcAkHSY6W,en,[],[],[],117,1527,3262,['bitcoin'],[],https://twitter.com/Xentagz/status/967432856745193473,False,,1,https://pbs.twimg.com/ext_tw_video_thumb/967432579950501888/pu/img/PBcTp5NHbt2o7f0d.jpg,,,,,,,[],,,,
967415099756556288,967415099756556288,2018-02-24 10:05:08 Eastern Standard Time,2018-02-24,10:05:08,-0500,859484337850523648,crypto_rand,Crypto Rand,,#Bitcoin bullish scenarios of a potential Inverse Head &amp; Shoulders pattern. $BTCUSD $BTC #CryptoCurrencies  https://t.co/EAXMUJ2E5m,en,[],[],['https://pbs.twimg.com/media/DWzygssWsAAQaIi.jpg'],95,341,1055,"['bitcoin', 'cryptocurrencies']","['btcusd', 'btc']",https://twitter.com/crypto_rand/status/967415099756556288,False,,1,https://pbs.twimg.com/media/DWzygssWsAAQaIi.jpg,,,,,,,[],,,,
967310699822186496,967310699822186496,2018-02-24 03:10:17 Eastern Standard Time,2018-02-24,03:10:17,-0500,1449926671,satoshitrader,Satoshi Trader,,nicely painted #bitcoin chart  https://t.co/5qfaXGlHry,en,[],[],['https://pbs.twimg.com/media/DWyT8mVXUAEAnGk.jpg'],21,249,746,['bitcoin'],[],https://twitter.com/SatoshiTrader/status/967310699822186496,False,,1,https://pbs.twimg.com/media/DWyT8mVXUAEAnGk.jpg,,,,,,,[],,,,
967288367049093120,967288367049093120,2018-02-24 01:41:32 Eastern Standard Time,2018-02-24,01:41:32,-0500,2266631022,digibytecoin,DigiByte,,Great post by Josiah on DigiByte vs Bitcoin Transaction Fees!  https://t.co/Qz6yjAGdm5 #DGB #DigiByte,en,[],['https://goo.gl/EK7Zsz'],[],18,193,441,"['dgb', 'digibyte']",[],https://twitter.com/DigiByteCoin/status/967288367049093120,False,,0,,,,,,,,[],,,,
967216067176169472,967216067176169472,2018-02-23 20:54:15 Eastern Standard Time,2018-02-23,20:54:15,-0500,4350834554,tradesatoshi,Trade Satoshi,,Tradesatoshi will be supporting Bitcoin Private fork For each ZCL and BTC you hold at Tradesatoshi at the moment of the fork you will receive 1 $BTCP For more information visit  https://t.co/iLWM9jYfNE,en,[],['https://btcprivate.org/'],[],192,388,833,[],['btcp'],https://twitter.com/TradeSatoshi/status/967216067176169472,False,,0,,,,,,,,[],,,,
967160225378660352,967160225378660352,2018-02-23 17:12:21 Eastern Standard Time,2018-02-23,17:12:21,-0500,1469101279,aantonop,Andreas,,"Received notice from Coinbase today, that my account is one of the 13,000 that they will have to turn over to the IRS under the court order.  Not surprised, I knew I would be in that group. In case you were wondering, I've filed &amp; paid taxes for my bitcoin income, gains/losses.",en,[],[],[],113,278,1292,[],[],https://twitter.com/aantonop/status/967160225378660352,False,,0,,,,,,,,[],,,,
967118286184828928,967118286184828928,2018-02-23 14:25:42 Eastern Standard Time,2018-02-23,14:25:42,-0500,1469101279,aantonop,Andreas,,"Annual ""Corruption Index"" shows more than 85% of humanity lives under very corrupt governments.   This is why decentralization of power matters. This is why bitcoin.   #theother6billion   https://t.co/brtkblKWeD  https://t.co/8SSse0Nac9",en,[],['http://www.transparency.org/cpi2017'],['https://pbs.twimg.com/media/DWvk5cFVMAAkXrg.jpg'],151,1418,2554,['theother6billion'],[],https://twitter.com/aantonop/status/967118286184828928,False,,1,https://pbs.twimg.com/media/DWvk5cFVMAAkXrg.jpg,,,,,,,[],,,,
967115282232655872,967115282232655872,2018-02-23 14:13:46 Eastern Standard Time,2018-02-23,14:13:46,-0500,52160722,nathanielpopper,Nathaniel Popper,,"Interesting estimate of how much the biggest Bitcoin mining company, Bitmain, made last year in profits -- $4 billion. For comparison sake, that is the same that Goldman Sachs brought in.  https://t.co/voEizsUDiW",en,[],['https://www.cnbc.com/2018/02/23/secretive-chinese-bitcoin-mining-company-may-have-made-as-much-money-as-nvidia-last-year.html'],[],30,475,825,[],[],https://twitter.com/nathanielpopper/status/967115282232655872,False,,0,,,,,,,,[],,,,
967063652070248448,967063652070248448,2018-02-23 10:48:36 Eastern Standard Time,2018-02-23,10:48:36,-0500,1333467482,coindesk,CoinDesk,,Georgia Becomes Latest State to Consider Bitcoin for Tax Payments  https://t.co/jcjg7mpnmp  https://t.co/SaD3DULhXf,en,[],['http://bit.ly/2omb8dI'],['https://pbs.twimg.com/media/DWuzRBrXUAgQWVZ.jpg'],25,341,593,[],[],https://twitter.com/CoinDesk/status/967063652070248448,False,,1,https://pbs.twimg.com/media/DWuzRBrXUAgQWVZ.jpg,,,,,,,[],,,,
967053241241538562,967053241241538562,2018-02-23 10:07:14 Eastern Standard Time,2018-02-23,10:07:14,-0500,509218789,0xvaccaro,Luca ⚡💡 Vaccaro,,#LightningNetwork bigger and bigger on Bitcoin Testnet #recksplorer 2832 nodes &amp; 15747 channels  https://t.co/zLlgD5AD4f,en,[],[],['https://pbs.twimg.com/media/DWuoxWgX0AET7AC.jpg'],42,388,928,"['lightningnetwork', 'recksplorer']",[],https://twitter.com/0xVaccaro/status/967053241241538562,False,,1,https://pbs.twimg.com/media/DWuoxWgX0AET7AC.jpg,,,,,,,[],,,,
967049019854852101,967049019854852101,2018-02-23 09:50:27 Eastern Standard Time,2018-02-23,09:50:27,-0500,20374262,maxkeiser,🇸🇻 BITCOIN AMBASSADOR 🌋,,Bank of America admits it can’t compete with #Bitcoin. Going long crypto and short banks will make some folks huge bundles of moola. 😀  https://t.co/3rmzP7DSo3,en,[],['https://www.ft.com/content/99fdd3e4-1821-11e8-9e9c-25c814761640'],[],16,190,412,['bitcoin'],[],https://twitter.com/maxkeiser/status/967049019854852101,False,,0,,,,,,,,[],,,,
967028388258025472,967028388258025472,2018-02-23 08:28:28 Eastern Standard Time,2018-02-23,08:28:28,-0500,1381911,darrenheitner,Darren Heitner,,"Yahoo report says former Clemson player Jaron Blossomgame received a payment from a sports agency by Venmo while in school for $1,100.  By Venmo!  Better believe some are currently being paid Bitcoin, right?",en,[],[],[],34,137,404,[],[],https://twitter.com/DarrenHeitner/status/967028388258025472,False,,0,,,,,,,,[],,,,
966970385710440448,966970385710440448,2018-02-23 04:38:00 Eastern Standard Time,2018-02-23,04:38:00,-0500,5988062,theeconomist,The Economist,,Bitcoin is not the only digital currency to have fallen  https://t.co/5Xe9NvWfgi  https://t.co/80tGIKHD7Q,en,[],['http://econ.st/2EHrTKm'],['https://pbs.twimg.com/media/DWtecKGXkAANau3.jpg'],31,136,215,[],[],https://twitter.com/TheEconomist/status/966970385710440448,False,,1,https://pbs.twimg.com/media/DWtecKGXkAANau3.jpg,,,,,,,[],,,,
966891479984521216,966891479984521216,2018-02-22 23:24:27 Eastern Standard Time,2018-02-22,23:24:27,-0500,9980812,igrigorik,Ilya Grigorik,,"""The Bitcoin blockchain data are now available for exploration with BigQuery + updated every 10 minutes"":  https://t.co/xFA2gkYmyc - neat-o! this will enable some interesting experiments..  https://t.co/XB1AMxv7BX",en,[],['http://bit.ly/2CeiZlR'],['https://pbs.twimg.com/media/DWsWPCmUMAI5ne0.jpg'],2,149,348,[],[],https://twitter.com/igrigorik/status/966891479984521216,False,,1,https://pbs.twimg.com/media/DWsWPCmUMAI5ne0.jpg,,,,,,,[],,,,
966845043171643392,966845043171643392,2018-02-22 20:19:56 Eastern Standard Time,2018-02-22,20:19:56,-0500,2149792819,adda_boi,Mr. Beastcoin,,If I could go back in time I’d:  Kill hitler   Invest in bitcoin   See ‘The Hangover’ in theaters (again)   Invent the iPhone   Invent google  Invent a time machine   A hundred dollars,en,[],[],[],9,195,2150,[],[],https://twitter.com/adda_boi/status/966845043171643392,False,,0,,,,,,,,[],,,,
966796610431799301,966796610431799301,2018-02-22 17:07:28 Eastern Standard Time,2018-02-22,17:07:28,-0500,3367334171,btctn,Bitcoin News,,Venezuela Orders Government Services to Accept Any Cryptocurrency  https://t.co/ope9Xim6EH #Bitcoin  https://t.co/NMzlINg4RF,en,[],['http://ift.tt/2CEzmUx'],['https://pbs.twimg.com/media/DWrAZKAW4AcEWwm.jpg'],44,269,496,['bitcoin'],[],https://twitter.com/BTCTN/status/966796610431799301,False,,1,https://pbs.twimg.com/media/DWrAZKAW4AcEWwm.jpg,,,,,,,[],,,,
966778996275884033,966778996275884033,2018-02-22 15:57:29 Eastern Standard Time,2018-02-22,15:57:29,-0500,782300925155237889,nickisonlinet,Nick C.,,why invest bitcoin when you can invest in T-Pose coin #SuperMarioOdyssey #NintendoSwitch  https://t.co/R3KxHMxbuz,en,[],[],['https://pbs.twimg.com/media/DWqwX34V4AAL5T3.jpg'],9,364,1251,"['supermarioodyssey', 'nintendoswitch']",[],https://twitter.com/nickisonlinet/status/966778996275884033,False,,1,https://pbs.twimg.com/media/DWqwX34V4AAL5T3.jpg,,,,,,,[],,,,
