id,conversation_id,created_at,date,time,timezone,user_id,username,name,place,tweet,language,mentions,urls,photos,replies_count,retweets_count,likes_count,hashtags,cashtags,link,retweet,quote_url,video,thumbnail,near,geo,source,user_rt_id,user_rt,retweet_id,reply_to,retweet_date,translate,trans_src,trans_dest
951837677053194242,951837677053194242,2018-01-12 10:26:01 Eastern Standard Time,2018-01-12,10:26:01,-0500,1643500784,francispouliot_,NAKED FACE (offline),,Twitter as a private company already has load of internal policies which the @Bitcoin account is in clear violation of. It's at best brand theft / impersonation and at worst a phishing attack. Please @jack @TwitterSupport look into the numerous reports filed against it.,en,"[{'screen_name': 'bitcoin', 'name': 'bitcoin', 'id': '357312062'}, {'screen_name': 'jack', 'name': 'jack⚡️', 'id': '12'}, {'screen_name': 'twittersupport', 'name': 'twitter support', 'id': '17874544'}]",[],[],21,141,431,[],[],https://twitter.com/francispouliot_/status/951837677053194242,False,,0,,,,,,,,[],,,,
951837415962038273,951837415962038273,2018-01-12 10:24:58 Eastern Standard Time,2018-01-12,10:24:58,-0500,1681071876,kahnvictor,KAHN 🍞,,o B de LGBT é de Bitcoin  https://t.co/uD7zq8FTd8,pt,[],['https://twitter.com/jornalextra/status/951546757225250816'],[],6,275,382,[],[],https://twitter.com/kahnvictor/status/951837415962038273,False,https://twitter.com/jornalextra/status/951546757225250816,0,,,,,,,,[],,,,
951811869915910144,951811869915910144,2018-01-12 08:43:28 Eastern Standard Time,2018-01-12,08:43:28,-0500,2279705827,actualidadpanam,Act Panamericana,,Lo que indican los indicadores: Bitcoin: ↙️ Salario mínimo: ⬇️ Pasaje de transmilenio:⬆️⬆️⬆️⬆️,es,[],[],[],8,396,850,[],[],https://twitter.com/actualidadpanam/status/951811869915910144,False,,0,,,,,,,,[],,,,
951811287255797761,951811287255797761,2018-01-12 08:41:09 Eastern Standard Time,2018-01-12,08:41:09,-0500,14688396,drhercouet,Thomas Hercouët,,J'ai trouvé une discussion sur Twitter où des gens pas d'accord entre eux se parlent respectueusement. J'ai l'impression d'avoir miné un Bitcoin.  https://t.co/reT28r0F0C,fr,[],[],['https://pbs.twimg.com/media/DTWDCKzWkAA4NFh.jpg'],18,225,1203,[],[],https://twitter.com/DrHercouet/status/951811287255797761,False,,1,https://pbs.twimg.com/media/DTWDCKzWkAA4NFh.jpg,,,,,,,[],,,,
951805479625396225,951805479625396225,2018-01-12 08:18:04 Eastern Standard Time,2018-01-12,08:18:04,-0500,4721466387,whalepool,Whalepool,,We now have evidence that @coinbase updating to SegWit and batching txs would instantly help the congestion on the Bitcoin network. How much longer are we going to wait until @brian_armstrong does his damn job?  https://t.co/8bEuV2RhO4,en,"[{'screen_name': 'coinbase', 'name': 'coinbase', 'id': '574032254'}, {'screen_name': 'brian_armstrong', 'name': 'brian armstrong', 'id': '14379660'}]",['https://twitter.com/CivEkonom/status/951693684692701184'],[],27,186,523,[],[],https://twitter.com/whalepool/status/951805479625396225,False,0,0,,,,,,,,[],,,,
951805423295848448,951805423295848448,2018-01-12 08:17:51 Eastern Standard Time,2018-01-12,08:17:51,-0500,23618940,lopp,Jameson Lopp,,"It's not a new revelation that a significant cause of bitcoin network congestion is from popular services such as @blockchain, @coinbase, and @gemini who are using block space inefficiently. If you don't want to contribute to the problem, don't use them.  https://t.co/f1AO2ePRMw",en,"[{'screen_name': 'blockchain', 'name': 'blockchain.com', 'id': '125304737'}, {'screen_name': 'coinbase', 'name': 'coinbase', 'id': '574032254'}, {'screen_name': 'gemini', 'name': 'gemini', 'id': '2815661158'}]",['https://twitter.com/lopp/statuses/886301832741613577'],[],57,264,759,[],[],https://twitter.com/lopp/status/951805423295848448,False,https://twitter.com/lopp/statuses/886301832741613577,0,,,,,,,,[],,,,
951763599525122048,951763599525122048,2018-01-12 05:31:39 Eastern Standard Time,2018-01-12,05:31:39,-0500,15168247,pavolrusnak,Pavol Rusnak,,"Stop using @coinbase, they are ignorant, irresponsible and incompetent. Withdraw all your coins now, later you might not get this chance when this rotten VC empire falls appart. Tell your friends about other ways how to get into #Bitcoin. Don't keep that just for yourself!  https://t.co/JPa8qaCAUF",en,"[{'screen_name': 'coinbase', 'name': 'coinbase', 'id': '574032254'}]",['https://twitter.com/JordanTuwiner/status/951698069967589376'],[],42,224,559,['bitcoin'],[],https://twitter.com/pavolrusnak/status/951763599525122048,False,https://twitter.com/JordanTuwiner/status/951698069967589376,0,,,,,,,,[],,,,
951697019017588736,951697019017588736,2018-01-12 01:07:05 Eastern Standard Time,2018-01-12,01:07:05,-0500,3367334171,btctn,Bitcoin News,,Russia Drafts Bill to Legalize Cryptocurrency Trading on Approved Exchanges  https://t.co/6bsHa5bNP5 #Bitcoin  https://t.co/8OhnetH9XM,en,[],['http://ift.tt/2Fu5MUs'],['https://pbs.twimg.com/media/DTUbZP1WAAIHdat.jpg'],30,235,421,['bitcoin'],[],https://twitter.com/BTCTN/status/951697019017588736,False,,1,https://pbs.twimg.com/media/DTUbZP1WAAIHdat.jpg,,,,,,,[],,,,
951695120004296704,951695120004296704,2018-01-12 00:59:32 Eastern Standard Time,2018-01-12,00:59:32,-0500,2338229497,yourbtcc,BTCC,,"The first peer-to-peer #bitcoin transaction was when Satoshi Nakamoto sent Hal Finney 10 BTC on January 12th, 2009. Approximately 300,000,000 transactions have occurred since the first bitcoin block was mined on January 3rd, 2009. ✍️💻🤓  https://t.co/vjpJPIgQby",en,[],[],['https://pbs.twimg.com/media/DTUZfnOUMAAmMRu.jpg'],46,352,733,['bitcoin'],[],https://twitter.com/YourBTCC/status/951695120004296704,False,,1,https://pbs.twimg.com/media/DTUZfnOUMAAmMRu.jpg,,,,,,,[],,,,
951691580213096448,951691580213096448,2018-01-12 00:45:28 Eastern Standard Time,2018-01-12,00:45:28,-0500,119633489,justicemate,Eli Afram,,"If you think that your $10,000 transaction is more important than a poor person's $15 dollar transaction. Then you are the personification of everything I am fighting against. You are also, what the original Bitcoin implementation was designed to combat. #BitcoinCash",en,[],[],[],91,284,1060,['bitcoincash'],[],https://twitter.com/justicemate/status/951691580213096448,False,,0,,,,,,,,[],,,,
951685556047613952,951685556047613952,2018-01-12 00:21:32 Eastern Standard Time,2018-01-12,00:21:32,-0500,357312062,bitcoin,Bitcoin,,"Median transaction fee on Bitcoin Core: $15.932 Median transaction fee on Bitcoin Cash: $0.0291  Bitcoin Core is 54,749% more expensive to use than Bitcoin Cash  https://t.co/dayZVkoMJL",en,[],[],['https://pbs.twimg.com/media/DTUNxWaVAAArPjm.jpg'],259,227,645,[],[],https://twitter.com/Bitcoin/status/951685556047613952,False,,1,https://pbs.twimg.com/media/DTUNxWaVAAArPjm.jpg,,,,,,,[],,,,
951669936648105985,951669936648105985,2018-01-11 23:19:28 Eastern Standard Time,2018-01-11,23:19:28,-0500,2386122979,htmlcoin,HTMLCOIN,,#BreakingNews #htmlcoin #NewExchanges?! New &amp; important #Blockchain partnership?! #html Blockchain rebranding?! Exciting Updates coming in the next 48 hours! #bitcoin #ethereum #cryptocurrency #altcoins #braceyourselves #fintech @htmlcoin,en,"[{'screen_name': 'htmlcoin', 'name': 'htmlcoin', 'id': '2386122979'}]",[],[],83,300,513,"['breakingnews', 'htmlcoin', 'newexchanges', 'blockchain', 'html', 'bitcoin', 'ethereum', 'cryptocurrency', 'altcoins', 'braceyourselves', 'fintech']",[],https://twitter.com/HTMLCOIN/status/951669936648105985,False,,0,,,,,,,,[],,,,
951654316225556480,951654316225556480,2018-01-11 22:17:24 Eastern Standard Time,2018-01-11,22:17:24,-0500,1333467482,coindesk,CoinDesk,,KFC Canada Is Accepting Bitcoin for Fried Chicken  https://t.co/Bm21UaMBrP  https://t.co/qIw9ccjSGd,en,[],['http://bit.ly/2DlFOC3'],['https://pbs.twimg.com/media/DTT0jngXcAAXo8P.jpg'],169,1291,2652,[],[],https://twitter.com/CoinDesk/status/951654316225556480,False,,1,https://pbs.twimg.com/media/DTT0jngXcAAXo8P.jpg,,,,,,,[],,,,
951628000059047936,951628000059047936,2018-01-11 20:32:50 Eastern Standard Time,2018-01-11,20:32:50,-0500,910043982306041856,pundixlabs,Pundi X Labs | We are hiring!,,"Pundi X (PXS) is proud to be listed as one of the leading token issuers, having “the Hottest Cryptocurrency Partnerships of 2018” by @realcoincentral ✊ https://t.co/gZLTlIJPlC. #CryptoNews #CryptocurrencyNews #blockchaintechnology #Qtum #XEM #xlm #Etherum #btc #bitcoin",en,"[{'screen_name': 'realcoincentral', 'name': 'coincentral', 'id': '890298366562893825'}]",['https://medium.com/pundix/pundi-x-is-featured-in-partnerships-that-will-help-form-2018-on-coin-central-54a74afc58e4'],[],6,249,245,"['cryptonews', 'cryptocurrencynews', 'blockchaintechnology', 'qtum', 'xem', 'xlm', 'etherum', 'btc', 'bitcoin']",[],https://twitter.com/PundiXLabs/status/951628000059047936,False,,0,,,,,,,,[],,,,
951622173277523968,951622173277523968,2018-01-11 20:09:41 Eastern Standard Time,2018-01-11,20:09:41,-0500,123954416,kimmymonte,kim,,"Moms in my neighborhood are all like hi would you mind watching my infant daughter, Bitcoin, while i take my older son, Woke, to the doctor to see if he’s allergic to elephants he’s 156 Sunday’s old.",en,[],[],[],10,281,1544,[],[],https://twitter.com/KimmyMonte/status/951622173277523968,False,,0,,,,,,,,[],,,,
951599531300413442,951599531300413442,2018-01-11 18:39:42 Eastern Standard Time,2018-01-11,18:39:42,-0500,23618940,lopp,Jameson Lopp,,"The value of the average bitcoin transaction rose from $4,000 to $80,000 in 2017.  https://t.co/9bBhuz8gbW  https://t.co/tKNhWpdWPJ",en,[],"['https://coinmetrics.io/charts/#assets=btc_left=avgTxValue_zoom=1483212225306.1226,1514946768979.5918']",['https://pbs.twimg.com/media/DTTCownVQAA7jlg.jpg'],31,173,500,[],[],https://twitter.com/lopp/status/951599531300413442,False,,1,https://pbs.twimg.com/media/DTTCownVQAA7jlg.jpg,,,,,,,[],,,,
951597160566575105,951597160566575105,2018-01-11 18:30:17 Eastern Standard Time,2018-01-11,18:30:17,-0500,877671962016919553,profesorcrypto,Professor Crypto,,"Dear noobs,       Bitcoin is NOT naturally going down. It is being pushed down via whales placing spoofy sell orders on exchanges to make noobs and risk managers sell to ""buy back lower"". They are stealing your bags and will make you buy back at a higher price.     Retweet this.",en,[],[],[],144,1636,2445,[],[],https://twitter.com/ProfesorCrypto/status/951597160566575105,False,,0,,,,,,,,[],,,,
951579999122927618,951579999122927618,2018-01-11 17:22:05 Eastern Standard Time,2018-01-11,17:22:05,-0500,2259434528,cobie,Cobie,,Kodak makes a scam miner. KFC makes a bitcoin bucket. DJs shout out bitcoin in clubs. Ripple pumps. Things Ive never heard of in the top 10. People that can't spell are learning how to margin trade  I'm close to officially calling the top on this motherfucker.,en,[],[],[],125,383,2195,[],[],https://twitter.com/cobie/status/951579999122927618,False,,0,,,,,,,,[],,,,
951565290218905600,951565290218905600,2018-01-11 16:23:39 Eastern Standard Time,2018-01-11,16:23:39,-0500,14710235,neerajka,Neeraj K. Agrawal,,KFC Canada is livestreaming the current bitcoin price of a bucket of fried chicken on Facebook  https://t.co/pqlzA0s10Y  https://t.co/k1idhvTydq,en,[],['https://www.facebook.com/KFCCanada/videos/1758453490840478/?business_id=10153271315728619'],['https://pbs.twimg.com/media/DTSjerQWkAEWrTS.jpg'],22,151,409,[],[],https://twitter.com/NeerajKA/status/951565290218905600,False,,1,https://pbs.twimg.com/media/DTSjerQWkAEWrTS.jpg,,,,,,,[],,,,
951559348492349446,951559348492349446,2018-01-11 16:00:02 Eastern Standard Time,2018-01-11,16:00:02,-0500,28384755,forever21,Forever 21,,NO we do not currently accept #Bitcoin pls stop asking us lol,en,[],[],[],441,1943,8542,['bitcoin'],[],https://twitter.com/Forever21/status/951559348492349446,False,,0,,,,,,,,[],,,,
951550065411313664,951550065411313664,2018-01-11 15:23:09 Eastern Standard Time,2018-01-11,15:23:09,-0500,199678183,kfc_canada,KFC Canada,,"KFC Canada presents The #Bitcoin Bucket. Sure, we don’t know exactly what Bitcoins are, or how they work, but that shouldn’t come between you and some finger lickin’ good chicken.  https://t.co/2OKuCHk5Hb  https://t.co/UwaduB8toi",en,[],['https://www.facebook.com/KFCCanada/videos/1758453490840478/?business_id=10153271315728619'],['https://pbs.twimg.com/media/DTSVgQJWkAARTd0.jpg'],572,3447,6505,['bitcoin'],[],https://twitter.com/kfc_canada/status/951550065411313664,False,,1,https://pbs.twimg.com/media/DTSVgQJWkAARTd0.jpg,,,,,,,[],,,,
951548156277346304,951548156277346304,2018-01-11 15:15:34 Eastern Standard Time,2018-01-11,15:15:34,-0500,65671142,c_holler,Claudius Holler,,"„Butter kostet jetzt 2 Euro“ „Waaas? Das sind ja 4 Maaahk!“ „Nanü! 10 Ostmark?“ „Krass, immerhin 0,0001 Bitcoin“ „0,0002 Bitcoin!“ „Aber die Transaktionsgebühr!“ „Und die Energie“ „Ich nehme Margarine“ „Hauptsache low carb“ „Das Internet hat meinen Job geklaut“ „Frauen“ „Hitler“",de,[],[],[],27,384,1827,[],[],https://twitter.com/C_Holler/status/951548156277346304,False,,0,,,,,,,,[],,,,
951545538058563584,951545538058563584,2018-01-11 15:05:09 Eastern Standard Time,2018-01-11,15:05:09,-0500,1469101279,aantonop,Andreas,,Bitcoin Q&amp;A: Lightning and onion routing  https://t.co/4sKkToN7jn,en,[],['https://youtu.be/D-nKuInDq6g'],[],16,204,546,[],[],https://twitter.com/aantonop/status/951545538058563584,False,,0,,,,,,,,[],,,,
951541244341182465,951541244341182465,2018-01-11 14:48:06 Eastern Standard Time,2018-01-11,14:48:06,-0500,1333467482,coindesk,CoinDesk,,Arizona Lawmakers Want to Let People Pay Taxes in Bitcoin  https://t.co/yZYRTbZCzA  https://t.co/RHHRmqKveJ,en,[],['http://bit.ly/2mj1SVX'],['https://pbs.twimg.com/media/DTSNt5DV4AAp6zF.jpg'],51,386,841,[],[],https://twitter.com/CoinDesk/status/951541244341182465,False,,1,https://pbs.twimg.com/media/DTSNt5DV4AAp6zF.jpg,,,,,,,[],,,,
951532695024218112,951532695024218112,2018-01-11 14:14:07 Eastern Standard Time,2018-01-11,14:14:07,-0500,120835612,chumeltorres,Chumel Torres,,Quiero ser un hombre lo suficientemente existoso para que mi hijo tenga la oportunidad de tirar su dinero jugándole al Bitcoin.,es,[],[],[],52,436,3540,[],[],https://twitter.com/ChumelTorres/status/951532695024218112,False,,0,,,,,,,,[],,,,
951498841617920000,951498841617920000,2018-01-11 11:59:36 Eastern Standard Time,2018-01-11,11:59:36,-0500,1854401,vinnylingham,Vinny Lingham,,"How times have changed! Instead of Bitcoin killing MoneyGram &amp; Western Union, Ripple is saving them! 😂 #storeofvalue  https://t.co/H4428Hblxj",en,[],['https://twitter.com/moneygram/status/951472445592088579'],[],47,213,588,['storeofvalue'],[],https://twitter.com/VinnyLingham/status/951498841617920000,False,https://twitter.com/moneygram/status/951472445592088579,0,,,,,,,,[],,,,
951485125627400192,951485125627400192,2018-01-11 11:05:06 Eastern Standard Time,2018-01-11,11:05:06,-0500,19407053,entrepreneur,Entrepreneur,,Warren Buffett Says Bitcoin 'Definitely Will Come to a Bad Ending'  https://t.co/aVvM7d0ZoF,en,[],['http://entm.ag/mth'],[],17,148,192,[],[],https://twitter.com/Entrepreneur/status/951485125627400192,False,,0,,,,,,,,[],,,,
951476040647426048,951476040647426048,2018-01-11 10:29:00 Eastern Standard Time,2018-01-11,10:29:00,-0500,941466099928809472,bitcoinprivate,Bitcoin Private [BTCP],,"Bitcoin Private:  anonymous, decentralized, fast, open source, community-driven coin. More details coming soon...  #BTCP #bitcoinprivate #zclassic #ZCL  https://t.co/1Sr6JYSxEz",en,[],[],['https://pbs.twimg.com/media/DTRRZhdWkAI0vNX.jpg'],127,707,1340,"['btcp', 'bitcoinprivate', 'zclassic', 'zcl']",[],https://twitter.com/bitcoinprivate/status/951476040647426048,False,,1,https://pbs.twimg.com/media/DTRRZhdWkAI0vNX.jpg,,,,,,,[],,,,
951465107007115264,951465107007115264,2018-01-11 09:45:33 Eastern Standard Time,2018-01-11,09:45:33,-0500,22682896,charlieshrem,Charlie Shrem,,We live in a time with free information and now a free financial system #bitcoin. Let’s start judging people based on themselves and not by the governments that claim to represent them.,en,[],[],[],42,215,789,['bitcoin'],[],https://twitter.com/CharlieShrem/status/951465107007115264,False,,0,,,,,,,,[],,,,
951462241475457024,951462241475457024,2018-01-11 09:34:10 Eastern Standard Time,2018-01-11,09:34:10,-0500,935007382827962369,magicalcrypto,Magical Crypto Friends,,"The Magical Crypto Friends Show Episode 02: Proof of Kitties is now live! Watch the 4 most popular guys in $Crypto talk about Litecoin, Kitties, Proof of work and Bitcoin ""Experts"" $BTC $XMR $LTC  https://t.co/bjP9asKzER",en,[],['https://youtu.be/Geiwb63nMYw'],[],78,183,627,[],"['crypto', 'btc', 'xmr', 'ltc']",https://twitter.com/magicalcrypto/status/951462241475457024,False,,0,,,,,,,,[],,,,
951456249161371649,951456249161371649,2018-01-11 09:10:21 Eastern Standard Time,2018-01-11,09:10:21,-0500,20374262,maxkeiser,🇸🇻 BITCOIN AMBASSADOR 🌋,,"Keep in mind, Buffett has never created or invented anything in his life. Converting insurance premiums into long term equity positions via $BRKA is a profitable business model, but a Rhesus monkey could do same. His comments regarding #Bitcoin are worthless. #Ignore",en,[],[],[],68,341,1099,"['bitcoin', 'ignore']",['brka'],https://twitter.com/maxkeiser/status/951456249161371649,False,,0,,,,,,,,[],,,,
951453878456762369,951453878456762369,2018-01-11 09:00:56 Eastern Standard Time,2018-01-11,09:00:56,-0500,889088560267239424,daneelproject,Daneel,,"Hey Daneel Family, We got featured in @BitScreener Great Article!! @daneelproject #AI #cryptocurrency #Blockchain #Daneel #TokenSale #ICO #Bitcoin #investors  https://t.co/naEBMqtACn",en,"[{'screen_name': 'bitscreener', 'name': 'bitscreener', 'id': '881023755572568064'}, {'screen_name': 'daneelproject', 'name': 'daneel', 'id': '889088560267239424'}]",['https://bitscreener.com/press-release/daneel-offers-artificial-intelligence-solution-for-crypto-investors-flooded-by-confusion'],[],8,277,293,"['ai', 'cryptocurrency', 'blockchain', 'daneel', 'tokensale', 'ico', 'bitcoin', 'investors']",[],https://twitter.com/daneelproject/status/951453878456762369,False,,0,,,,,,,,[],,,,
951452137094967301,951452137094967301,2018-01-11 08:54:01 Eastern Standard Time,2018-01-11,08:54:01,-0500,900521261842825216,andy_hoffman_cg,Andy Hoffman,,"1) Does anyone realize that this whole fake South Korea news redux started at 7 pm EST; when, just as #Bitcoin was about to re-take $15,000, BCash ""magically"" pumped $300 within minutes, causing BTC to fall to the low-mid $14,000s...",en,[],[],[],29,146,410,['bitcoin'],[],https://twitter.com/Andy_Hoffman_CG/status/951452137094967301,False,,0,,,,,,,,[],,,,
951447329353207808,951447329353207808,2018-01-11 08:34:55 Eastern Standard Time,2018-01-11,08:34:55,-0500,17006157,paulkrugman,Paul Krugman,,Bitcoin conference won't accept Bitcoin because it's too clunky and expensive. Yay!  https://t.co/DSgZgyv9Qn,en,[],['https://news.bitcoin.com/miami-bitcoin-conference-stops-accepting-bitcoin-due-to-fees-and-congestion/'],[],172,691,1672,[],[],https://twitter.com/paulkrugman/status/951447329353207808,False,,0,,,,,,,,[],,,,
951437023478362112,951437023478362112,2018-01-11 07:53:57 Eastern Standard Time,2018-01-11,07:53:57,-0500,3473608753,bokujyuumai,墨汁うまい(Bokujyuumai),,速報:韓国政府の公式発表によると現時点での「取引禁止と即座の決定はない」とのこと #ビットコイン #仮想通貨 #Bitcoin $BTC #ブロックチェーン #イーサリアム #リップル #韓国  https://t.co/VxB8WPiyFB,ja,[],['https://twitter.com/iamjosephyoung/status/951428854085689344'],[],0,211,246,"['ビットコイン', '仮想通貨', 'bitcoin', 'ブロックチェーン', 'イーサリアム', 'リップル', '韓国']",['btc'],https://twitter.com/bokujyuumai/status/951437023478362112,False,0,0,,,,,,,,[],,,,
951408350817849345,951408350817849345,2018-01-11 06:00:01 Eastern Standard Time,2018-01-11,06:00:01,-0500,91478624,forbes,Forbes,,"Goldman Sachs caves, gives in to cryptocurrency, and says Bitcoin could be akin to gold  https://t.co/i8p2x5CC9z  https://t.co/WoESWVyZRy",en,[],['http://on.forbes.com/6013DKj4h'],['https://pbs.twimg.com/media/DTQU2iNW0AAMhSx.jpg'],16,146,201,[],[],https://twitter.com/Forbes/status/951408350817849345,False,,1,https://pbs.twimg.com/media/DTQU2iNW0AAMhSx.jpg,,,,,,,[],,,,
951372797254578176,951372797254578176,2018-01-11 03:38:45 Eastern Standard Time,2018-01-11,03:38:45,-0500,857813126326218752,cryptohornhairs,"HornHairs 🌊,🌊",,Thanks @CNBCfastmoney!! Without you guys I would have never known how to lose a third of my Bitcoin in less than a week!!  😂 You can't make this stuff up.  $XRP #Ripple  https://t.co/Y67QS2gjod,en,"[{'screen_name': 'cnbcfastmoney', 'name': ""cnbc's fast money"", 'id': '16732770'}]",[],"['https://pbs.twimg.com/media/DTPyW_XX4AAJQJp.jpg', 'https://pbs.twimg.com/media/DTPzXHiWkAAtSmN.jpg']",80,195,752,['ripple'],['xrp'],https://twitter.com/CryptoHornHairs/status/951372797254578176,False,,1,https://pbs.twimg.com/media/DTPyW_XX4AAJQJp.jpg,,,,,,,[],,,,
951351927484420096,951351927484420096,2018-01-11 02:15:49 Eastern Standard Time,2018-01-11,02:15:49,-0500,859484337850523648,crypto_rand,Crypto Rand,,"Reasons why #Bitcoin is droping:  - Not a single rebrand since 2009 - No ""huge news"" or ""strategic partnerships"" - Not enough airdrops - Not enough PhD graduates on the team - Team not doing bounties... - Logo is not cool - Satoshi is not being communicative",en,[],[],[],149,309,1463,['bitcoin'],[],https://twitter.com/crypto_rand/status/951351927484420096,False,,0,,,,,,,,[],,,,
951338922935635969,951338922935635969,2018-01-11 01:24:08 Eastern Standard Time,2018-01-11,01:24:08,-0500,2313671966,nemofficial,Symbol & NEM,,"Japan's biggest e-commerce and internet giant, DMM Group, has unveiled the new crypto exchange, DMM Bitcoin. This will start accepting new accounts on January 11, 2018!   https://t.co/CYG8jlnkIx  https://t.co/vsqQMRPBJB",en,[],['http://bit.ly/2CRvcK7'],['https://pbs.twimg.com/media/DTPVsprVAAA08DA.png'],20,298,645,[],[],https://twitter.com/NEMofficial/status/951338922935635969,False,,1,https://pbs.twimg.com/media/DTPVsprVAAA08DA.png,,,,,,,[],,,,
951336985477566466,951336985477566466,2018-01-11 01:16:26 Eastern Standard Time,2018-01-11,01:16:26,-0500,14338147,satoshilite,Charlie Lee,,Korea bans Bitcoin FUD is the new China bans Bitcoin FUD. 🤦‍♂️,en,[],[],[],533,2208,7313,[],[],https://twitter.com/SatoshiLite/status/951336985477566466,False,,0,,,,,,,,[],,,,
951313437631680512,951313437631680512,2018-01-10 23:42:52 Eastern Standard Time,2018-01-10,23:42:52,-0500,1333467482,coindesk,CoinDesk,,"Bitcoin has fallen below $13,000 on CoinDesk's Price Index after reports that South Korea may ban cryptocurrency exchanges  https://t.co/68u8s66Bqm  https://t.co/nmud7QgbUC",en,[],['http://bit.ly/2D2TpRa'],['https://pbs.twimg.com/media/DTO-h1qX0AAczsV.jpg'],119,191,241,[],[],https://twitter.com/CoinDesk/status/951313437631680512,False,,1,https://pbs.twimg.com/media/DTO-h1qX0AAczsV.jpg,,,,,,,[],,,,
951313169628016640,951133199685468161,2018-01-10 23:41:48 Eastern Standard Time,2018-01-10,23:41:48,-0500,3029020913,ezcoinaccess,Tim Tayshun,,"@SatoshiLite We just launched this BTM, our 12th, today in Newport Beach 🌴 California, and enabled LTC sales across our Network 👍😀 #BlockchainBTM  Chevron/ Subway 301 East Coast Hwy, Newport Beach, CA 92660 Buy bitcoin/ Litecoin 24/7/365 #cryptocurrency  #Instantly  #Litecoin  #AtomicSwap  https://t.co/KUqiQgwQww",en,[],[],['https://pbs.twimg.com/media/DTO-R8_VwAAGgr2.jpg'],56,191,446,"['blockchainbtm', 'cryptocurrency', 'instantly', 'litecoin', 'atomicswap']",[],https://twitter.com/ezCoinAccess/status/951313169628016640,False,,1,https://pbs.twimg.com/media/DTO-R8_VwAAGgr2.jpg,,,,,,,"[{'screen_name': 'SatoshiLite', 'name': 'Charlie Lee', 'id': '14338147'}]",,,,
951306407546163202,951306407546163202,2018-01-10 23:14:56 Eastern Standard Time,2018-01-10,23:14:56,-0500,100731315,actualidadrt,RT en Español,,ÚLTIMA HORA: El bitcóin se desploma tras el anuncio de un proyecto de ley para prohibir las criptomonedas en Corea del Sur   https://t.co/ul5ssVLBuY  https://t.co/iLMWQfVjmg,es,[],['https://es.rt.com/5kbr'],['https://pbs.twimg.com/media/DTO4IX3WkAAGzo7.png'],24,418,250,[],[],https://twitter.com/ActualidadRT/status/951306407546163202,False,,1,https://pbs.twimg.com/media/DTO4IX3WkAAGzo7.png,,,,,,,[],,,,
951305777058230273,951305777058230273,2018-01-10 23:12:26 Eastern Standard Time,2018-01-10,23:12:26,-0500,2415752418,lowstrife,lowstrife,,"Asia uses ""ban bitcoin"" for the 23rd time  It's super effective  fucking lol",en,[],[],[],13,182,723,[],[],https://twitter.com/lowstrife/status/951305777058230273,False,,0,,,,,,,,[],,,,
951301601695760389,951301601695760389,2018-01-10 22:55:50 Eastern Standard Time,2018-01-10,22:55:50,-0500,26574283,cnbcnow,CNBC Now,,"BREAKING: Bitcoin plunges 11% after South Korea, one of the world's biggest cryptocurrency markets, readies a bill to ban trading  https://t.co/YIar0rICKe  https://t.co/eiMFMmGB58",en,[],['https://www.cnbc.com/2018/01/10/south-korea-official-reportedly-readying-bill-to-ban-all-cryptocurrency-trading.html'],['https://pbs.twimg.com/media/DTOzo61WkAA3b4H.png'],87,358,338,[],[],https://twitter.com/CNBCnow/status/951301601695760389,False,,1,https://pbs.twimg.com/media/DTOzo61WkAA3b4H.png,,,,,,,[],,,,
951292265468633088,951292265468633088,2018-01-10 22:18:44 Eastern Standard Time,2018-01-10,22:18:44,-0500,2479432609,kameyama66,DMM会長　亀山敬司,,俺はFXもBitcoinも買ったことはないんだけど、流行りものなので始めます。ご利用お待ちしてまーす！  https://t.co/BDu2jJzmOj,ja,[],['https://bitdays.jp/?p=2064'],[],26,236,536,[],[],https://twitter.com/kameyama66/status/951292265468633088,False,,0,,,,,,,,[],,,,
