id,conversation_id,created_at,date,time,timezone,user_id,username,name,place,tweet,language,mentions,urls,photos,replies_count,retweets_count,likes_count,hashtags,cashtags,link,retweet,quote_url,video,thumbnail,near,geo,source,user_rt_id,user_rt,retweet_id,reply_to,retweet_date,translate,trans_src,trans_dest
960431213029847040,960431213029847040,2018-02-05 03:33:39 Eastern Standard Time,2018-02-05,03:33:39,-0500,2787936004,abdullahciftcib,Abdullah Çiftçi,,"2008 krizini ilk bilen New York Üniversitesi Öğretim Görevlisi Nouriel  Roubini'nin Bloomberg röportajından; ""Bitcoin insanlık tarihinin en büyük balonudur ve bu bütün balonların anasıdır"" ""Bu bir sahtekarlık"" veri madenciliğindeki yüksek enerji tüketimi de çevresel bir felaket.  https://t.co/1tSKZhLCuM",tr,[],[],['https://pbs.twimg.com/media/DVQi4BIWsAA25RN.jpg'],28,287,563,[],[],https://twitter.com/abdullahciftcib/status/960431213029847040,False,,1,https://pbs.twimg.com/media/DVQi4BIWsAA25RN.jpg,,,,,,,[],,,,
960395159719604224,960395159719604224,2018-02-05 01:10:24 Eastern Standard Time,2018-02-05,01:10:24,-0500,14558138,dgwbirch,"Dave ""Woking 9 to 5"" Birch",,"So, basically, your bank will let you open a betting account but not a bitcoin account. I don’t remember voting for them to be moral arbiters over different ways to throw away your own money. It’s this sort of thing that gives bankers a bad (well, worse) name.",en,[],[],[],31,162,389,[],[],https://twitter.com/dgwbirch/status/960395159719604224,False,,0,,,,,,,,[],,,,
960363285206810624,960363285206810624,2018-02-04 23:03:44 Eastern Standard Time,2018-02-04,23:03:44,-0500,14338147,satoshilite,Charlie Lee,,"To the scammer that replies to my posts scamming for LTC, why don't you do some good with your skills? Create fake @rogerkver and @bitcoin accounts and always reply to their posts with ""I changed my mind, Bcash is a scam!"" 😂  I bet people will donate coins to you in that case.",en,"[{'screen_name': 'rogerkver', 'name': 'roger ver', 'id': '176758255'}, {'screen_name': 'bitcoin', 'name': 'bitcoin', 'id': '357312062'}]",[],[],298,471,3500,[],[],https://twitter.com/SatoshiLite/status/960363285206810624,False,,0,,,,,,,,[],,,,
960342317138837504,960342317138837504,2018-02-04 21:40:25 Eastern Standard Time,2018-02-04,21:40:25,-0500,5637562,neilstrauss,Neil Strauss,,*Bitcoin hits 18k* “I wish I got bitcoin when it was at 7k” *Bitcoin drops to 7k* “Bitcoin is crashing. I’m getting out.”,en,[],[],[],197,2731,8720,[],[],https://twitter.com/neilstrauss/status/960342317138837504,False,,0,,,,,,,,[],,,,
960314767222112257,960314767222112257,2018-02-04 19:50:56 Eastern Standard Time,2018-02-04,19:50:56,-0500,927910572427022341,trvon,TrVon🇺🇸,,Bitcoin Market Cycle  https://t.co/5EYVDunVzT,en,[],[],['https://pbs.twimg.com/tweet_video_thumb/DVOSlruX0AA_KT1.jpg'],48,240,501,[],[],https://twitter.com/TrVon/status/960314767222112257,False,,1,https://pbs.twimg.com/tweet_video_thumb/DVOSlruX0AA_KT1.jpg,,,,,,,[],,,,
960293587740176387,960293587740176387,2018-02-04 18:26:47 Eastern Standard Time,2018-02-04,18:26:47,-0500,4721466387,whalepool,Whalepool,,Super Bowl commercial shows @TDAmeritrade shilling #bitcoin futures  https://t.co/mVYjl7sUpW,en,"[{'screen_name': 'tdameritrade', 'name': 'td ameritrade', 'id': '16816021'}]",[],['https://pbs.twimg.com/media/DVOl15RXUAAPOxS.jpg'],23,183,511,['bitcoin'],[],https://twitter.com/whalepool/status/960293587740176387,False,,1,https://pbs.twimg.com/media/DVOl15RXUAAPOxS.jpg,,,,,,,[],,,,
960293138651910145,960293138651910145,2018-02-04 18:25:00 Eastern Standard Time,2018-02-04,18:25:00,-0500,15803479,dwaltchack,"Derek Waltchack 🎈 (🐸,🐸)",,#bitcoin in the #superbowl  https://t.co/jjRBPd7Dtu,en,[],[],['https://pbs.twimg.com/media/DVOlhN_UMAAz5qW.jpg'],40,371,1037,"['bitcoin', 'superbowl']",[],https://twitter.com/dwaltchack/status/960293138651910145,False,,1,https://pbs.twimg.com/media/DVOlhN_UMAAz5qW.jpg,,,,,,,[],,,,
960292318887665664,960292318887665664,2018-02-04 18:21:44 Eastern Standard Time,2018-02-04,18:21:44,-0500,2449847450,parabolictrav,SentimentTrav,,"Bitcoin is by far the coolest asset. It’s fiat price is either going up exponentially, or it’s BTC price is going down exponentially so you can accumulate more. It’s constant winning with this thing. And it does it so fast you don’t have to waste any time. Absolutely glorious.",en,[],[],[],61,168,881,[],[],https://twitter.com/parabolictrav/status/960292318887665664,False,,0,,,,,,,,[],,,,
960287271491600384,960287271491600384,2018-02-04 18:01:41 Eastern Standard Time,2018-02-04,18:01:41,-0500,3367334171,btctn,Bitcoin News,,Japan’s Leading Low-Cost Airline Clarifies Plan to Accept Bitcoin  https://t.co/kZ7sUgevCQ #Bitcoin  https://t.co/SNgxOq3r2p,en,[],['http://ift.tt/2E0SON0'],['https://pbs.twimg.com/media/DVOgLs5WsAAIs7L.jpg'],28,262,497,['bitcoin'],[],https://twitter.com/BTCTN/status/960287271491600384,False,,1,https://pbs.twimg.com/media/DVOgLs5WsAAIs7L.jpg,,,,,,,[],,,,
960272518031519744,960272518031519744,2018-02-04 17:03:03 Eastern Standard Time,2018-02-04,17:03:03,-0500,2238979286,cryptodarock,Rob DaRock,,#Bitcoin Market Cycle  https://t.co/WOpARtWvVs,en,[],[],['https://pbs.twimg.com/tweet_video_thumb/DVOSlruX0AA_KT1.jpg'],378,7887,17126,['bitcoin'],[],https://twitter.com/CryptoDaRock/status/960272518031519744,False,,1,https://pbs.twimg.com/tweet_video_thumb/DVOSlruX0AA_KT1.jpg,,,,,,,[],,,,
960256887001362432,960256887001362432,2018-02-04 16:00:57 Eastern Standard Time,2018-02-04,16:00:57,-0500,65375759,zeynep,zeynep tufekci,,"This is going to end in tears and destruction—and as usual that price won't be paid by the most vulnerable. The tech underlying Bitcoin and blockchain in general maybe interesting with some real uses, but this is a classic speculative asset bubble.  https://t.co/d3G3EDwRaH  https://t.co/nO8tRLVxl3",en,[],['https://www.washingtonpost.com/business/economy/bitcoin-is-my-potential-pension-what-is-driving-people-in-kentucky-to-join-the-craze/2018/02/03/aaaea3be-05dc-11e8-b48c-b07fea957bd5_story.html'],['https://pbs.twimg.com/media/DVOD4pEW4AIjrdO.jpg'],12,108,245,[],[],https://twitter.com/zeynep/status/960256887001362432,False,,1,https://pbs.twimg.com/media/DVOD4pEW4AIjrdO.jpg,,,,,,,[],,,,
960240450870358016,960240450870358016,2018-02-04 14:55:38 Eastern Standard Time,2018-02-04,14:55:38,-0500,2347466953,smileygnome,SmileyGnome BTC 🏧,,I am convinced that #Bitcoin is in a bubble just like #cellphones.   Let me explain:,en,[],[],[],41,276,606,"['bitcoin', 'cellphones']",[],https://twitter.com/SmileyGnome/status/960240450870358016,False,,0,,,,,,,,[],,,,
960235236973047813,960235236973047813,2018-02-04 14:34:55 Eastern Standard Time,2018-02-04,14:34:55,-0500,961445378,officialmcafee,John McAfee,,"Please God people - get a perspective about the market! The price of Bitcoin today is still higher than it was just three months ago! In a long term view, Bicoin is still climbing. Forget about these short term ups and downs. If you are a short term investor, you need to get real",en,[],[],[],780,1962,7287,[],[],https://twitter.com/officialmcafee/status/960235236973047813,False,,0,,,,,,,,[],,,,
960227618573332480,960227618573332480,2018-02-04 14:04:39 Eastern Standard Time,2018-02-04,14:04:39,-0500,951601536584396800,bobrasx,Bob Ras,,"CoinField is glad to offer Ripple XRP as XRP/CAD &amp; XRP/BTC pairs for the first time in Canada along with fiver other top coins: Bitcoin, Bitcoin Cash, Dash, Ethereum &amp; Litecoin.  @Ripple @Bitcoin @Dashpay @litecoin @ethereumproject @VitalikButerin @BankXRP @Ripple_XRP1 @xrptips  https://t.co/0ku0deQyIu",en,"[{'screen_name': 'ripple', 'name': 'ripple', 'id': '1051053836'}, {'screen_name': 'bitcoin', 'name': 'bitcoin', 'id': '357312062'}, {'screen_name': 'dashpay', 'name': 'dash', 'id': '2338506822'}, {'screen_name': 'litecoin', 'name': 'litecoin', 'id': '385562752'}, {'screen_name': 'ethereumproject', 'name': 'ethereum project', 'id': '973132577577099264'}, {'screen_name': 'vitalikbuterin', 'name': 'vitalik.eth', 'id': '295218901'}, {'screen_name': 'bankxrp', 'name': '𝗕𝗮𝗻𝗸xrp', 'id': '937342499093471232'}, {'screen_name': 'ripple_xrp1', 'name': 'xrp official ⚡️', 'id': '730814414367162368'}, {'screen_name': 'xrptips', 'name': 'iov.tips', 'id': '4914336781'}]",[],"['https://pbs.twimg.com/media/DVNoKxlVAAAcdW6.jpg', 'https://pbs.twimg.com/media/DVNoKxmVwAE7lEv.jpg']",21,249,507,[],[],https://twitter.com/bobrasX/status/960227618573332480,False,,1,https://pbs.twimg.com/media/DVNoKxlVAAAcdW6.jpg,,,,,,,[],,,,
960224894955982849,960224894955982849,2018-02-04 13:53:49 Eastern Standard Time,2018-02-04,13:53:49,-0500,339061487,apompliano,Pomp 🌪,,"Bitcoin's best quality is a high resistance to death.  Every time it should have been killed, it came back stronger.  You can't destroy an idea supported by a decentralized network.",en,[],[],[],38,201,741,[],[],https://twitter.com/APompliano/status/960224894955982849,False,,0,,,,,,,,[],,,,
960199103480320001,960177364155150337,2018-02-04 12:11:20 Eastern Standard Time,2018-02-04,12:11:20,-0500,88567911,brian__todd,BrianTodd.eth,,@PFTCommenter I’m telling people Randy Moss is responsible for the Bitcoin crash because to be in the HOF in this league you need to have straight cash homie.,en,[],[],[],8,157,1166,[],[],https://twitter.com/BRIAN__TODD/status/960199103480320001,False,,0,,,,,,,,"[{'screen_name': 'PFTCommenter', 'name': 'PFT Commenter', 'id': '858716964'}]",,,,
960193950144344064,960193950144344064,2018-02-04 11:50:51 Eastern Standard Time,2018-02-04,11:50:51,-0500,61417559,erikvoorhees,Erik Voorhees,,Krugman will only tweet sections of Bitcoin's price history that show it going down... despite the objective fact that it is the single best performing asset on Earth over the past decade (ie since it was born).  https://t.co/SOMXhdPgD0,en,[],['https://twitter.com/xiobus/status/960162659202142208'],[],48,353,1015,[],[],https://twitter.com/ErikVoorhees/status/960193950144344064,False,https://twitter.com/xiobus/status/960162659202142208,0,,,,,,,,[],,,,
960193474762100736,960193474762100736,2018-02-04 11:48:58 Eastern Standard Time,2018-02-04,11:48:58,-0500,927910572427022341,trvon,TrVon🇺🇸,,Bitcoin the last 3 months  https://t.co/jJoQKoNRmD,en,[],[],[],57,381,793,[],[],https://twitter.com/TrVon/status/960193474762100736,False,,1,https://pbs.twimg.com/ext_tw_video_thumb/960106282228297728/pu/img/lqUNA-mlItRMiNTL.jpg,,,,,,,[],,,,
960189767832031232,960189767832031232,2018-02-04 11:34:14 Eastern Standard Time,2018-02-04,11:34:14,-0500,889088560267239424,daneelproject,Daneel,,Let yourself be seduced by Daneel in 45 seconds! Discover all its features and how it will help you to better manage your #cryptocurrency investments:  https://t.co/9rsPr8gKOm   #AI #ICO #Bitcoin #SaleIsOpen,en,[],['https://youtu.be/5O-k4LH2r8k'],[],7,335,369,"['cryptocurrency', 'ai', 'ico', 'bitcoin', 'saleisopen']",[],https://twitter.com/daneelproject/status/960189767832031232,False,,0,,,,,,,,[],,,,
960186614390706184,960186614390706184,2018-02-04 11:21:42 Eastern Standard Time,2018-02-04,11:21:42,-0500,56562803,peterschiff,Peter Schiff,,"It’s Sunday morning and #Bitcoin’s price is already down another $1,000 per coin.  As the price goes down these $1,000 daily drops become more significant.  Of course the most meaningful $1,000 drop will be the last, from $1,000 to 0!",en,[],[],[],523,189,699,['bitcoin'],[],https://twitter.com/PeterSchiff/status/960186614390706184,False,,0,,,,,,,,[],,,,
960181846523957249,960181846523957249,2018-02-04 11:02:46 Eastern Standard Time,2018-02-04,11:02:46,-0500,259725229,valaafshar,Vala Afshar,,"When @Patriots and @Eagles played in 2005 #SuperBowl these companies,  products didn’t exist:  Twitter  iPhone📱 iPad Android YouTube AWS Apple App Store Kindle Uber Airbnb Blockchain Bitcoin Spotify Instagram Snapchat WhatsApp Pinterest  Messenger Tumblr Hulu Nest Fitbit Oculus",en,"[{'screen_name': 'patriots', 'name': 'new england patriots', 'id': '31126587'}, {'screen_name': 'eagles', 'name': 'philadelphia eagles', 'id': '180503626'}]",[],[],12,154,224,['superbowl'],[],https://twitter.com/ValaAfshar/status/960181846523957249,False,,0,,,,,,,,[],,,,
960171439042252800,960171439042252800,2018-02-04 10:21:24 Eastern Standard Time,2018-02-04,10:21:24,-0500,2436389418,swiftonsecurity,SwiftOnSecurity,,"Bitcoin: The trusted non-fiat currency, where your entire life savings is secured by a T-Mobile employee at an airport kiosk who just finished doing heroin inside the baggage claim machine.",en,[],[],[],16,197,748,[],[],https://twitter.com/SwiftOnSecurity/status/960171439042252800,False,,0,,,,,,,,[],,,,
960143664470220807,960143664470220807,2018-02-04 08:31:02 Eastern Standard Time,2018-02-04,08:31:02,-0500,961445378,officialmcafee,John McAfee,,"Look at Bitcoin's history. The more severe the dip, the more extreme the bounce. This has happened dozens of times in the past. But look at Bitcoin's year over year performance. Extrapolate and you see that my prediction of $1 mil in 2020 is conservative.   https://t.co/DO68C9giAg",en,[],['https://www.bitsonline.com/john-mcafee-bet-bitcoin/'],[],523,1212,3645,[],[],https://twitter.com/officialmcafee/status/960143664470220807,False,,0,,,,,,,,[],,,,
960136906934767621,960136906934767621,2018-02-04 08:04:11 Eastern Standard Time,2018-02-04,08:04:11,-0500,23618940,lopp,Jameson Lopp,,"""Bitcoin cultists"" have voluntarily chosen to free themselves from a system that was imposed upon them without their consent. Meanwhile, ""esteemed economists"" like Krugman disparage us for daring to challenge the status quo.  https://t.co/EcwMdHmNui",en,[],['https://twitter.com/paulkrugman/status/959801709794078720'],[],46,223,750,[],[],https://twitter.com/lopp/status/960136906934767621,False,https://twitter.com/paulkrugman/status/959801709794078720,0,,,,,,,,[],,,,
960106476940484608,960106476940484608,2018-02-04 06:03:16 Eastern Standard Time,2018-02-04,06:03:16,-0500,826738836260667392,itsmedegam,Degam,,#bitcoin in the last three months (source unknown)  https://t.co/sSwTvqMQkv,en,[],[],[],121,2356,4153,['bitcoin'],[],https://twitter.com/ItsMeDegam/status/960106476940484608,False,,1,https://pbs.twimg.com/ext_tw_video_thumb/960106282228297728/pu/img/lqUNA-mlItRMiNTL.jpg,,,,,,,[],,,,
960077503472852992,960077503472852992,2018-02-04 04:08:08 Eastern Standard Time,2018-02-04,04:08:08,-0500,2259434528,cobie,Cobie,,"Old finance guy @ $400 ""bitcoin is a worthless scam""  Old finance guy after -55% crash to $8,000 ""see? Told you!""  🤔🤔🤔🤔",en,[],[],[],88,867,3951,[],[],https://twitter.com/cobie/status/960077503472852992,False,,0,,,,,,,,[],,,,
960058226275442688,960058226275442688,2018-02-04 02:51:32 Eastern Standard Time,2018-02-04,02:51:32,-0500,5988062,theeconomist,The Economist,,People are buying Bitcoin because they expect other people to buy it from them at a higher price. This is foolish  https://t.co/vbdVZuaA2U,en,[],['http://econ.st/2EBrnue'],[],70,336,572,[],[],https://twitter.com/TheEconomist/status/960058226275442688,False,,0,,,,,,,,[],,,,
960019583825408001,960019583825408001,2018-02-04 00:17:59 Eastern Standard Time,2018-02-04,00:17:59,-0500,14611051,drwasho,Washington Sanchez 🦇🔊,,Quality memes from r/Bitcoin  https://t.co/qdoAzAL2Db,en,[],[],[],76,2100,4293,[],[],https://twitter.com/drwasho/status/960019583825408001,False,,1,https://pbs.twimg.com/ext_tw_video_thumb/960019370830266368/pu/img/AWGepCTDBh3T1kd2.jpg,,,,,,,[],,,,
960014658903166977,960014658903166977,2018-02-03 23:58:25 Eastern Standard Time,2018-02-03,23:58:25,-0500,18469669,saifedean,Saifedean.com,,"Here we find the nocoiner bragging that if you listened to him &amp; avoided buying Bitcoin at $500 he'd have saved you from watching it drop to $8,000 after 5 years.  This is how nocoiners actually think.  https://t.co/2wbKzAmRcB",en,[],['https://twitter.com/steve_hanke/status/959530873363329026'],[],31,188,811,[],[],https://twitter.com/saifedean/status/960014658903166977,False,https://twitter.com/steve_hanke/status/959530873363329026,0,,,,,,,,[],,,,
959916923483025409,959916923483025409,2018-02-03 17:30:03 Eastern Standard Time,2018-02-03,17:30:03,-0500,3108351,wsj,The Wall Street Journal,,"Citigroup, JPMorgan Chase and Bank of America plan to ban purchases of bitcoin with credit cards issued by them  https://t.co/Ff1fvBnnr4",en,[],['http://on.wsj.com/2FIzYdI'],[],54,176,224,[],[],https://twitter.com/WSJ/status/959916923483025409,False,,0,,,,,,,,[],,,,
959871288599875585,959871288599875585,2018-02-03 14:28:43 Eastern Standard Time,2018-02-03,14:28:43,-0500,95115126,rory_macdonald,Rory MacDonald,,"i just realized in 2015 i had a flip phone, i was also holding bitcoin simultaneously. i think if i would have got myself a fanny pack, a bluetooth ear piece and a socks under sandals combo, there would be no stopping me that year",en,[],[],[],70,370,2830,[],[],https://twitter.com/rory_macdonald/status/959871288599875585,False,,0,,,,,,,,[],,,,
959871120701886464,959871120701886464,2018-02-03 14:28:03 Eastern Standard Time,2018-02-03,14:28:03,-0500,19767495,gossithedog,Kevin Beaumont,,"Meanwhile over in BitCoin, land of free money.  https://t.co/hleWzihvWY",en,[],[],"['https://pbs.twimg.com/media/DVIlqVdW4AAJJsh.jpg', 'https://pbs.twimg.com/media/DVIlqU4XkAI2ecL.jpg', 'https://pbs.twimg.com/media/DVIlqUvWkAAl_3v.jpg', 'https://pbs.twimg.com/media/DVIlqUyXUAEETKt.jpg']",14,113,216,[],[],https://twitter.com/GossiTheDog/status/959871120701886464,False,,1,https://pbs.twimg.com/media/DVIlqVdW4AAJJsh.jpg,,,,,,,[],,,,
959869064515637249,959869064515637249,2018-02-03 14:19:53 Eastern Standard Time,2018-02-03,14:19:53,-0500,176758255,rogerkver,Roger Ver,,"""Bitcoin Cash is everything that Bitcoin was supposed to be, before it was taken over by a small group of radically minded “Core developers”, largely through propaganda and censorship.""  https://t.co/O94zTx1WwJ",en,[],['https://news.bitcoin.com/12-reasons-bitcoin-cash-real-bitcoin/'],[],804,440,1302,[],[],https://twitter.com/rogerkver/status/959869064515637249,False,,0,,,,,,,,[],,,,
959867146837942273,959867146837942273,2018-02-03 14:12:15 Eastern Standard Time,2018-02-03,14:12:15,-0500,2509810398,nulltxnews,Null TX,,Bitcoin May Come to eBay as Platform Drops PayPal as Main Payment Option  https://t.co/hyjvVRMSn0,en,[],['http://ift.tt/2EfUa9M'],[],37,236,450,[],[],https://twitter.com/nulltxnews/status/959867146837942273,False,,0,,,,,,,,[],,,,
959860999930118144,959860999930118144,2018-02-03 13:47:50 Eastern Standard Time,2018-02-03,13:47:50,-0500,7347012,polemitis,Antonis Polemitis,,"I have no idea what the right price for bitcoin is but I am impressed that a number of Very Serious People who cried ""bubble"" at $300 are currently taking victory laps at the drop to [puts on glasses], $8,000.",en,[],[],[],32,250,1171,[],[],https://twitter.com/polemitis/status/959860999930118144,False,,0,,,,,,,,[],,,,
959845698685386752,959845698685386752,2018-02-03 12:47:02 Eastern Standard Time,2018-02-03,12:47:02,-0500,935681220851089408,justreach2ram,Ramkrish,,#trx #bitcoin #verge #sether  https://t.co/2WzcSQqjL8,und,[],[],['https://pbs.twimg.com/media/DVIOku-VAAAg7di.jpg'],2,147,327,"['trx', 'bitcoin', 'verge', 'sether']",[],https://twitter.com/justreach2ram/status/959845698685386752,False,,1,https://pbs.twimg.com/media/DVIOku-VAAAg7di.jpg,,,,,,,[],,,,
959845189438332928,959845189438332928,2018-02-03 12:45:00 Eastern Standard Time,2018-02-03,12:45:00,-0500,2561715571,shapeshift_io,ShapeShift 🦊,,Mark Cuban Confirms Dallas Mavericks Will Accept Bitcoin For Tickets 🤠🏀🎟  https://t.co/buPuFseIB0,en,[],['http://bit.ly/2nz3bRN'],[],20,257,541,[],[],https://twitter.com/ShapeShift_io/status/959845189438332928,False,,0,,,,,,,,[],,,,
959837782922420226,959837782922420226,2018-02-03 12:15:35 Eastern Standard Time,2018-02-03,12:15:35,-0500,14717442,xentagz,Dennis Parker,,Milton Friedman predicted #Bitcoin 25 years ago (retweet)  https://t.co/dRGDrJ7qzs,en,[],[],[],188,2748,4558,['bitcoin'],[],https://twitter.com/Xentagz/status/959837782922420226,False,,1,https://pbs.twimg.com/ext_tw_video_thumb/959837600939954176/pu/img/7t-iXqDZw5VsA1AA.jpg,,,,,,,[],,,,
959801709794078720,959801709794078720,2018-02-03 09:52:14 Eastern Standard Time,2018-02-03,09:52:14,-0500,17006157,paulkrugman,Paul Krugman,,"I am surely not the only person experiencing a fair bit of cryptofreude -- pleasure in watching the Bitcoin etc bubble deflate. Bitcoin cultists tend, after all, to be nasty as well as crazy; not all of them, but surely above the average 1/",en,[],[],[],590,375,1472,[],[],https://twitter.com/paulkrugman/status/959801709794078720,False,,0,,,,,,,,[],,,,
959796130195427328,959796130195427328,2018-02-03 09:30:04 Eastern Standard Time,2018-02-03,09:30:04,-0500,379305414,unocoin,Unocoin: India’s Bitcoin Exchange 🥇🇮🇳🟠📱,,"Unocoin is coming soon with Bitcoin Cash, Litecoin, Ripple, Ethereum, and Stellar.   Sign-up with India’s leading cryptocurrency and blockchain company to buy &amp; sell cryptocurrency.  Download App:  https://t.co/EG9C3PsDOU (Android),   https://t.co/v1grJCuzjM (iOS)  https://t.co/emFi0uPPfU",en,[],"['https://goo.gl/KxLnff', 'https://goo.gl/94LrWL']",['https://pbs.twimg.com/media/DVHhfksW4AA0r2s.jpg'],123,288,828,[],[],https://twitter.com/Unocoin/status/959796130195427328,False,,1,https://pbs.twimg.com/media/DVHhfksW4AA0r2s.jpg,,,,,,,[],,,,
959791233953599489,959791233953599489,2018-02-03 09:10:36 Eastern Standard Time,2018-02-03,09:10:36,-0500,933672480044175360,denaro_io,Denaro,,"We’d also like to remind you that our Pre-Sale is running on a bonus system that decreases over the duration of the sale, so the sooner you buy, the better the price you get.   https://t.co/hXwy6Aph0k  #Ethereum #ico #bitcoin #DNO #Litecoin",en,[],['https://Denaro.io'],[],12,459,541,"['ethereum', 'ico', 'bitcoin', 'dno', 'litecoin']",[],https://twitter.com/Denaro_io/status/959791233953599489,False,,0,,,,,,,,[],,,,
959754860479614978,959754860479614978,2018-02-03 06:46:04 Eastern Standard Time,2018-02-03,06:46:04,-0500,98726426,dlbiller,David Biller,,Crypto makes its #Rio Carnaval debut. #bitcoin  https://t.co/x9M1RLQITz,en,[],[],['https://pbs.twimg.com/media/DVG77pEX0AAHtjI.jpg'],25,364,1395,"['rio', 'bitcoin']",[],https://twitter.com/DLBiller/status/959754860479614978,False,,1,https://pbs.twimg.com/media/DVG77pEX0AAHtjI.jpg,,,,,,,[],,,,
959732992028667904,959732992028667904,2018-02-03 05:19:10 Eastern Standard Time,2018-02-03,05:19:10,-0500,20902138,alistairmilne,Alistair Milne,,"I estimate that Bitcoin is at ~1-6% adoption, depending on the country Adoption may temporarily slow down, but it won't stop here (far too early) Anyone betting that the price will not correlate to an adoption curve is going to be disappointed  https://t.co/GC14tqrgbE",en,[],[],"['https://pbs.twimg.com/media/DVGmzbgX4AUd4LN.jpg', 'https://pbs.twimg.com/media/DVGmzyOWkAAZsX4.jpg']",34,297,693,[],[],https://twitter.com/alistairmilne/status/959732992028667904,False,,1,https://pbs.twimg.com/media/DVGmzbgX4AUd4LN.jpg,,,,,,,[],,,,
959723189650604032,959723189650604032,2018-02-03 04:40:13 Eastern Standard Time,2018-02-03,04:40:13,-0500,2267175300,cryptosqueeze,Squeeze,,At $19k per #Bitcoin = *Cries in Lambo* At $8k per #Bitcoin = *Cries in Mercedes* Still better than completely missing out and being a salty nocoiner bitch.  $BTC,en,[],[],[],33,174,1272,"['bitcoin', 'bitcoin']",['btc'],https://twitter.com/cryptoSqueeze/status/959723189650604032,False,,0,,,,,,,,[],,,,
959722355248414720,959722355248414720,2018-02-03 04:36:54 Eastern Standard Time,2018-02-03,04:36:54,-0500,2267175300,cryptosqueeze,Squeeze,,"Nocoiners are rejoicing that #Bitcoin has crashed 60% from its peak. ""Told you it's a scam"" ""Told you you're gonna lose money buying that ponzi"" ""Thank god I didnt invest in that fake money""  But the fact is, $BTC investors are still up by 1050% from 2017. Even at current prices",en,[],[],[],35,155,632,['bitcoin'],['btc'],https://twitter.com/cryptoSqueeze/status/959722355248414720,False,,0,,,,,,,,[],,,,
959682947958833152,959682947958833152,2018-02-03 02:00:19 Eastern Standard Time,2018-02-03,02:00:19,-0500,1333467482,coindesk,CoinDesk,,Goldman Sachs Inadvertently Bought a Stake in a Bitcoin Trading Desk  https://t.co/GCT4lYHzTk by @johndetrixhe,en,"[{'screen_name': 'johndetrixhe', 'name': 'john ethan detrixhe', 'id': '156036434'}]",['http://bit.ly/2DWzXqv'],[],65,224,428,[],[],https://twitter.com/CoinDesk/status/959682947958833152,False,,0,,,,,,,,[],,,,
959679820845207552,959679820845207552,2018-02-03 01:47:53 Eastern Standard Time,2018-02-03,01:47:53,-0500,5988062,theeconomist,The Economist,,People are buying Bitcoin because they expect other people to buy it from them at a higher price. This is foolish  https://t.co/z6YcqBIvgE,en,[],['http://econ.st/2BPpmYo'],[],56,293,467,[],[],https://twitter.com/TheEconomist/status/959679820845207552,False,,0,,,,,,,,[],,,,
959676030662381568,959676030662381568,2018-02-03 01:32:50 Eastern Standard Time,2018-02-03,01:32:50,-0500,20902138,alistairmilne,Alistair Milne,,The more parasitical financial institutions fight it ... the more you should want to own it ... Bitcoin,en,[],[],[],18,146,621,[],[],https://twitter.com/alistairmilne/status/959676030662381568,False,,0,,,,,,,,[],,,,
959568555883708416,959568555883708416,2018-02-02 18:25:46 Eastern Standard Time,2018-02-02,18:25:46,-0500,2999158160,pixelatedboat,pixelatedboat aka “mr tweets”,,"You (invested all your money in Bitcoin) -  Poor Me (invested all my money in grappling hooks, knockout gas, and the blueprints for Fort Knox) - Will be rich at 0700 hours next Wednesday",en,[],[],[],26,320,3027,[],[],https://twitter.com/pixelatedboat/status/959568555883708416,False,,0,,,,,,,,[],,,,
