id,conversation_id,created_at,date,time,timezone,user_id,username,name,place,tweet,language,mentions,urls,photos,replies_count,retweets_count,likes_count,hashtags,cashtags,link,retweet,quote_url,video,thumbnail,near,geo,source,user_rt_id,user_rt,retweet_id,reply_to,retweet_date,translate,trans_src,trans_dest
955538565747810304,955538565747810304,2018-01-22 15:32:01 Eastern Standard Time,2018-01-22,15:32:01,-0500,2449847450,parabolictrav,SentimentTrav,,"Crowdcharting: The Bitcoin S Curve. This is something @NateAmarose and I have been working on. If you have any thoughts or updates to this concept, please reply in the comments with your ideas. $BTC  https://t.co/GVF8pEl4Cb",en,[],[],['https://pbs.twimg.com/media/DUK_8eWVwAAEoZL.jpg'],95,207,622,[],['btc'],https://twitter.com/parabolictrav/status/955538565747810304,False,,1,https://pbs.twimg.com/media/DUK_8eWVwAAEoZL.jpg,,,,,,,[],,,,
955529988756922369,955529988756922369,2018-01-22 14:57:56 Eastern Standard Time,2018-01-22,14:57:56,-0500,19132398,brucefenton,Bruce Fenton,,"In January 2015, when Bitcoin was at €200, a professor hid one Bitcoin in a DNA sequence and challenged his students to decode the DNA sequence to reveal the private key.  Now a Belgian PhD student has decoded it and won the Bitcoin.    https://t.co/aY5fyNwKkF",en,[],['https://www.ebi.ac.uk/about/news/press-releases/belgian-phd-student-decodes-dna-wins-bitcoin'],[],23,509,1616,[],[],https://twitter.com/brucefenton/status/955529988756922369,False,,0,,,,,,,,[],,,,
955521782659846144,955521782659846144,2018-01-22 14:25:20 Eastern Standard Time,2018-01-22,14:25:20,-0500,475094271,maxekaplan,Max Kaplan,,"Last year, banks made $6.4 bil on overdraft fees. Interest rates on savings accounts are at an all time low. Bank transfers take 3-5 working days. The system is flawed and outdated. Our traditional banking system will not be able to compete with #Bitcoin &amp; the lightning network",en,[],[],[],19,182,462,['bitcoin'],[],https://twitter.com/maxekaplan/status/955521782659846144,False,,0,,,,,,,,[],,,,
955519937619034112,955519937619034112,2018-01-22 14:18:00 Eastern Standard Time,2018-01-22,14:18:00,-0500,357312062,bitcoin,Bitcoin,,Bitcoin billboard spotted in Toronto  https://t.co/CICBSUxE8e,en,[],[],['https://pbs.twimg.com/media/DUJ01ycVoAEte1F.jpg'],65,344,960,[],[],https://twitter.com/Bitcoin/status/955519937619034112,False,,1,https://pbs.twimg.com/media/DUJ01ycVoAEte1F.jpg,,,,,,,[],,,,
955513696368975872,955513696368975872,2018-01-22 13:53:12 Eastern Standard Time,2018-01-22,13:53:12,-0500,1856523530,capitalandceleb,CCN - Capital & Celeb News,,"‘One Bitcoin Will Be Worth $1 Million,’ Cryptocurrency Pioneer Tells PayPal CEO  https://t.co/8wpPbUmFp6",en,[],['https://www.ccn.com/one-bitcoin-will-be-worth-1-million-says-cryptocurrency-pioneer/'],[],23,243,370,[],[],https://twitter.com/CapitalAndCeleb/status/955513696368975872,False,,0,,,,,,,,[],,,,
955512317625749506,955512317625749506,2018-01-22 13:47:43 Eastern Standard Time,2018-01-22,13:47:43,-0500,859484337850523648,crypto_rand,Crypto Rand,,"Simulation of the #Bitcoin price for the whole 2018 shows 55,000$ as target   https://t.co/Wnz9huFjuz",en,[],['https://medium.com/@xoelop/weve-simulated-the-bitcoin-price-for-the-whole-2018-you-won-t-believe-the-result-4a602679dac2'],[],60,359,824,['bitcoin'],[],https://twitter.com/crypto_rand/status/955512317625749506,False,,0,,,,,,,,[],,,,
955502545618653184,955502545618653184,2018-01-22 13:08:53 Eastern Standard Time,2018-01-22,13:08:53,-0500,4826176219,cremedelacrypto,Spencer Bogart,,"Woah  ""[Bitcoin's] mere existence is an insurance policy that will remind governments that the last object establishment could control, namely, the currency, is no longer their monopoly. This gives us, the crowd, an insurance policy against an Orwellian future"" -@nntaleb",en,"[{'screen_name': 'nntaleb', 'name': 'nassim nicholas taleb', 'id': '381289719'}]",[],[],39,434,1274,[],[],https://twitter.com/CremeDeLaCrypto/status/955502545618653184,False,,0,,,,,,,,[],,,,
955489357779144704,955489357779144704,2018-01-22 12:16:29 Eastern Standard Time,2018-01-22,12:16:29,-0500,176758255,rogerkver,Roger Ver,,Scaling Bitcoin on chain is an ultimate long term solution thanks to Moore’s Law.  https://t.co/IXAAuADftC,en,[],[],['https://pbs.twimg.com/media/DUKUfjxV4AEkOMt.jpg'],205,275,877,[],[],https://twitter.com/rogerkver/status/955489357779144704,False,,1,https://pbs.twimg.com/media/DUKUfjxV4AEkOMt.jpg,,,,,,,[],,,,
955479901238382593,955479901238382593,2018-01-22 11:38:55 Eastern Standard Time,2018-01-22,11:38:55,-0500,1475038004,ansellindner,Ansel Lindner,,"Spammers drove up fees in #bitcoin, which stimulated the #lightning network. Scaling arrived quickly, forcing them to stop spamming. The incentives worked beautifully. Attackers sealed their own fate.",en,[],[],[],18,163,528,"['bitcoin', 'lightning']",[],https://twitter.com/AnselLindner/status/955479901238382593,False,,0,,,,,,,,[],,,,
955465379178012673,955465379178012673,2018-01-22 10:41:12 Eastern Standard Time,2018-01-22,10:41:12,-0500,61417559,erikvoorhees,Erik Voorhees,,"""[Bitcoin's] mere existence is an insurance policy that will remind governments that the last object establishment could control, namely, the currency, is no longer their monopoly."" - Taleb @nntaleb  https://t.co/Qf2iU1EZWV #bitcoin",en,"[{'screen_name': 'nntaleb', 'name': 'nassim nicholas taleb', 'id': '381289719'}]",['https://medium.com/opacity/bitcoin-1537e616a074'],[],32,333,857,['bitcoin'],[],https://twitter.com/ErikVoorhees/status/955465379178012673,False,,0,,,,,,,,[],,,,
955457158392397825,955457158392397825,2018-01-22 10:08:32 Eastern Standard Time,2018-01-22,10:08:32,-0500,20152310,ziggamon,Sergej Kotliar,,Check out  https://t.co/H6LeHNaZax.  It’s a new tool I’ve helped create (code by @0xB10C). Helps you see how well optimized bitcoin transactions are.   Just paste a tx id and see if you’re overpaying for your bitcoin transactions and withdrawals.  Feedback welcome!  https://t.co/4jUMGky7SS,en,"[{'screen_name': '0xb10c', 'name': 'b10c', 'id': '309584661'}]",['http://transactionfee.info'],['https://pbs.twimg.com/media/DUJ3NpKVwAEqcH0.jpg'],19,172,389,[],[],https://twitter.com/ziggamon/status/955457158392397825,False,,1,https://pbs.twimg.com/media/DUJ3NpKVwAEqcH0.jpg,,,,,,,[],,,,
955435110962290690,955435110962290690,2018-01-22 08:40:56 Eastern Standard Time,2018-01-22,08:40:56,-0500,23618940,lopp,Jameson Lopp,,Great thread. Bitcoin can only fail if we all agree to allow it to fail. This becomes less likely every day that the ecosystem around it grows.  https://t.co/LSmeufi0B4,en,[],['https://twitter.com/AriannaSimpson/status/955412826314756096'],[],21,158,580,[],[],https://twitter.com/lopp/status/955435110962290690,False,https://twitter.com/AriannaSimpson/status/955412826314756096,0,,,,,,,,[],,,,
955428513229754368,955428513229754368,2018-01-22 08:14:43 Eastern Standard Time,2018-01-22,08:14:43,-0500,2799211554,whalepanda,WhalePanda,,"According to Zhao Dong, China's biggest #Bitcoin OTC trader and investor in Bitfinex, Tether has $1.8 billion in a USD bank account. At this moment 1.6 billion $USDT have been printed. An additional $1.1 billion is held in a Bitfinex USD bank account.  https://t.co/ceOwin0BSb  https://t.co/LTbXE9rKhQ",en,[],['http://news.8btc.com/zhaodong-bitfinex-and-tether-hold-3-billion-usd-usdt-soon-listed-on-bigone'],['https://pbs.twimg.com/media/DUJcvomWsAAh_8w.jpg'],90,261,503,['bitcoin'],['usdt'],https://twitter.com/WhalePanda/status/955428513229754368,False,,1,https://pbs.twimg.com/media/DUJcvomWsAAh_8w.jpg,,,,,,,[],,,,
955426982539522049,955426982539522049,2018-01-22 08:08:38 Eastern Standard Time,2018-01-22,08:08:38,-0500,381289719,nntaleb,Nassim Nicholas Taleb,,"Good point.  Avoid the verbalistic. Have the discipline to define a Ponzi scheme. Then you can see that Bitcoin, no matter what ""bubble"" characteristics you impart to it, will not be a Ponzi. And avoid reading ANY commentary on Bitcoin by a NYT subscriber or a tenured econ Prof.  https://t.co/CkWK6L6S1o",en,[],['https://twitter.com/JuergenStrobel/status/955425189650731014'],[],23,159,507,[],[],https://twitter.com/nntaleb/status/955426982539522049,False,https://twitter.com/JuergenStrobel/status/955425189650731014,0,,,,,,,,[],,,,
955412826314756096,955412826314756096,2018-01-22 07:12:23 Eastern Standard Time,2018-01-22,07:12:23,-0500,267485701,ariannasimpson,AriannaSimpson.eth,,"1/ It's become very in vogue to assert that there are good chances that bitcoin ""may fail"".This is basically a hedge statement that most investors feel compelled to make. It's also meaningless, because you can easily use it, sound thoughtful, &amp; not actually convey a real opinion.",en,[],[],[],25,217,762,[],[],https://twitter.com/AriannaSimpson/status/955412826314756096,False,,0,,,,,,,,[],,,,
955396635856637952,955396635856637952,2018-01-22 06:08:03 Eastern Standard Time,2018-01-22,06:08:03,-0500,381289719,nntaleb,Nassim Nicholas Taleb,,Moved my Bitcoin piece to Medium  https://t.co/3sBpj2AaBx,en,[],['https://medium.com/@nntaleb/bitcoin-1537e616a074'],[],35,209,646,[],[],https://twitter.com/nntaleb/status/955396635856637952,False,,0,,,,,,,,[],,,,
955395087374184448,955395087374184448,2018-01-22 06:01:53 Eastern Standard Time,2018-01-22,06:01:53,-0500,381289719,nntaleb,Nassim Nicholas Taleb,,I just published “Bitcoin”  https://t.co/O9a7VLowQ1,en,[],['https://medium.com/p/bitcoin-1537e616a074'],[],89,1036,2587,[],[],https://twitter.com/nntaleb/status/955395087374184448,False,,0,,,,,,,,[],,,,
955330827520393216,955330827520393216,2018-01-22 01:46:33 Eastern Standard Time,2018-01-22,01:46:33,-0500,14338147,satoshilite,Charlie Lee,,"Was at the Stanford Bitcoin Meetup. They thought Satoshi was speaking. Sadly, it was only the lite version.  It was fitting that I was talking about supply/demand and fees. This is what happens when demand outstrips supply and no fee. 😄  I had fun. Thanks Stanford Bitcoin Club!  https://t.co/9PaFeKAyzo",en,[],[],['https://pbs.twimg.com/media/DUIEUAIVAAAXmDX.jpg'],231,674,4814,[],[],https://twitter.com/SatoshiLite/status/955330827520393216,False,,1,https://pbs.twimg.com/media/DUIEUAIVAAAXmDX.jpg,,,,,,,[],,,,
955270391341223936,955270391341223936,2018-01-21 21:46:24 Eastern Standard Time,2018-01-21,21:46:24,-0500,57689645,tracemayer,Trace Mayer,,#Bitcoin settles ~2.5m BTC every day with appx. $2B (200 DMA) transactional amount. Includes neither #LightningNetwork txs or other layers nor hardware bearer devices like @OPENDIME. Exchange volume ~$30B/day. $BTC risk profile declines every day. Unstoppable network effects. 🚀  https://t.co/Z42Eh3cuIe,en,"[{'screen_name': 'opendime', 'name': 'opendime®', 'id': '2800457039'}]",[],['https://pbs.twimg.com/media/DUHNMjqU0AAz6Fr.jpg'],26,321,831,"['bitcoin', 'lightningnetwork']",['btc'],https://twitter.com/TraceMayer/status/955270391341223936,False,,1,https://pbs.twimg.com/media/DUHNMjqU0AAz6Fr.jpg,,,,,,,[],,,,
955268613426040832,955268613426040832,2018-01-21 21:39:20 Eastern Standard Time,2018-01-21,21:39:20,-0500,164425558,jonerlichman,Jon Erlichman,,Things that didn't exist when the Eagles &amp; Patriots played in the 2005 Super Bowl:  iPhone Instagram YouTube Snapchat Twitter iPad BuzzFeed Spotify Uber Alexa Airbnb Bitcoin Fitbit Lyft Waze WhatsApp Hashtags App Store Pinterest Google Maps Hulu Kindle Siri Dropbox Angry Birds,en,[],[],[],126,2166,3828,[],[],https://twitter.com/JonErlichman/status/955268613426040832,False,,0,,,,,,,,[],,,,
955249119173513217,955249119173513217,2018-01-21 20:21:52 Eastern Standard Time,2018-01-21,20:21:52,-0500,922497403378438144,cedexofficial,CedexOfficial,,#CEDEX #ICO Overview  https://t.co/uha2kvWDAt #diamond #exchange #blockchain #fintech #ethereum #bitcoin  https://t.co/Lw5xWptqxZ,en,[],['http://bit.ly/2F3wkLr'],['https://pbs.twimg.com/media/DUG5_wXVoAAaMrB.jpg'],12,342,332,"['cedex', 'ico', 'diamond', 'exchange', 'blockchain', 'fintech', 'ethereum', 'bitcoin']",[],https://twitter.com/CedexOfficial/status/955249119173513217,False,,1,https://pbs.twimg.com/media/DUG5_wXVoAAaMrB.jpg,,,,,,,[],,,,
955199373067145222,955184656453947392,2018-01-21 17:04:11 Eastern Standard Time,2018-01-21,17:04:11,-0500,961445378,officialmcafee,John McAfee,,"@a_m_faulkner Who cares what bottom Bitcoin hits? It will be back in less than a month. Fiat currencies are the water. Cryptocurrencies are the floating objects. Push one down as deep as you want. It will, with certainty, rush back to the top.",en,[],[],[],238,618,2606,[],[],https://twitter.com/officialmcafee/status/955199373067145222,False,,0,,,,,,,,"[{'screen_name': 'a_m_faulkner', 'name': 'Aaron M Faulkner', 'id': '1016977752'}]",,,,
955188462856138752,955188462856138752,2018-01-21 16:20:50 Eastern Standard Time,2018-01-21,16:20:50,-0500,764347014,susanoswrath,Æsir,,&gt;Ruining PC gaming for the sake of fucking monopoly money I hope Bitcoin crashes and burns and takes all you fuckers who do this with it  https://t.co/yUvDl5RuZb,en,[],[],['https://pbs.twimg.com/media/DUGC16nXUAI98Wc.jpg'],98,625,1322,[],[],https://twitter.com/SusanosWrath/status/955188462856138752,False,,1,https://pbs.twimg.com/media/DUGC16nXUAI98Wc.jpg,,,,,,,[],,,,
955188438734647296,955188438734647296,2018-01-21 16:20:44 Eastern Standard Time,2018-01-21,16:20:44,-0500,23618940,lopp,Jameson Lopp,,Bitcoin average DAILY value change: 2010: +0.82% 2011: +0.76% 2012: +0.26% 2013: +1.11% 2014: -0.25% 2015: +0.09% 2016: +0.22% 2017: +0.71%,en,[],[],[],56,668,1906,[],[],https://twitter.com/lopp/status/955188438734647296,False,,0,,,,,,,,[],,,,
955166898454515712,955166898454515712,2018-01-21 14:55:09 Eastern Standard Time,2018-01-21,14:55:09,-0500,2267910895,futementales,FUTEMENTALES,,Boto o pal Compra e venda de bitcoin  https://t.co/FIYwMa9qmu,pt,[],[],['https://pbs.twimg.com/media/DUFvJ9HWkAAjGbb.jpg'],4,370,701,[],[],https://twitter.com/FUTEMENTALES/status/955166898454515712,False,,1,https://pbs.twimg.com/media/DUFvJ9HWkAAjGbb.jpg,,,,,,,[],,,,
955145105194840064,955145105194840064,2018-01-21 13:28:33 Eastern Standard Time,2018-01-21,13:28:33,-0500,2259434528,cobie,Cobie,,"I believe Bitcoin will revisit &gt;15,000 within a month, but it is also true that we might not yet have seen the bottom. Don't let scary red candles sway your faith and exit through fear. Focus on securing the best entry you can. Gonna be a fun ride.",en,[],[],[],84,248,1358,[],[],https://twitter.com/cobie/status/955145105194840064,False,,0,,,,,,,,[],,,,
955137958159568898,955137958159568898,2018-01-21 13:00:09 Eastern Standard Time,2018-01-21,13:00:09,-0500,398088661,mepfuller,Matt Fuller,,"I go to some burger shop and see they accept Bitcoin.  Neat, I think, knowing the transfer fees would probably be, like, $20.  So I ask the cashier how I would pay in Bitcoin.  “Oh, I don’t know,” he says. “They never taught us. No one’s ever asked.”  https://t.co/ovqUaatox6",en,[],[],['https://pbs.twimg.com/media/DUFU5_tVAAAHSUe.jpg'],63,540,1813,[],[],https://twitter.com/MEPFuller/status/955137958159568898,False,,1,https://pbs.twimg.com/media/DUFU5_tVAAAHSUe.jpg,,,,,,,[],,,,
955123561982824448,955123561982824448,2018-01-21 12:02:57 Eastern Standard Time,2018-01-21,12:02:57,-0500,357312062,bitcoin,Bitcoin,,Bitcoin Cash is Bitcoin:  https://t.co/6OEAjdBqbF  https://t.co/HzBysBEPVs,en,[],['https://www.bitcoin.com/info/bitcoin-cash-is-bitcoin'],['https://pbs.twimg.com/media/DUFHqE5UMAAfVFb.png'],229,306,677,[],[],https://twitter.com/Bitcoin/status/955123561982824448,False,,1,https://pbs.twimg.com/media/DUFHqE5UMAAfVFb.png,,,,,,,[],,,,
955107964129566720,955107964129566720,2018-01-21 11:00:58 Eastern Standard Time,2018-01-21,11:00:58,-0500,1469101279,aantonop,Andreas,,"When people criticise Bitcoin and other cryptocurrencies, they say it will ""enable the dark net."" But governments don't really fear the dark net -- they just don't want us to have one too.  https://t.co/uPO2wdbMEp",en,[],['https://youtu.be/n4F-h4xuXMk?t=9m28s'],[],65,773,2003,[],[],https://twitter.com/aantonop/status/955107964129566720,False,,0,,,,,,,,[],,,,
955107120671797248,955102684230705158,2018-01-21 10:57:37 Eastern Standard Time,2018-01-21,10:57:37,-0500,17006157,paulkrugman,Paul Krugman,,"Cryptocurrencies have none of that. If people come to believe that Bitcoin is worthless, well, it's worthless. Its price rise has been driven purely by speculation -- by what Robert Shiller calls a natural Ponzi scheme, in which early entrants make money only bc others buy in 10/",en,[],[],[],65,162,397,[],[],https://twitter.com/paulkrugman/status/955107120671797248,False,,0,,,,,,,,[],,,,
955096781636878336,955096781636878336,2018-01-21 10:16:32 Eastern Standard Time,2018-01-21,10:16:32,-0500,253293158,theonevortex,Vortex,,Difference in marketing from $BCH to $BTC. Which looks more cypherpunk to you? #bitcoin  https://t.co/CC4r092J5c,en,[],[],"['https://pbs.twimg.com/media/DUEvbX3U8AAARGg.jpg', 'https://pbs.twimg.com/media/DUEvcLVVwAED6cV.jpg']",107,172,791,['bitcoin'],"['bch', 'btc']",https://twitter.com/theonevortex/status/955096781636878336,False,,1,https://pbs.twimg.com/media/DUEvbX3U8AAARGg.jpg,,,,,,,[],,,,
955089427381985283,955089427381985283,2018-01-21 09:47:18 Eastern Standard Time,2018-01-21,09:47:18,-0500,1297695480,kangbear_hyewon,🌼🐹강베어🐻💖🐻‍❄️MY BEST PART IS ALL FOR 🐹,,"นั่งกินข้าว อยู่ดีๆโต๊ะข้างๆก็เปิดประเด็นเรื่อง LGBTQ ละอีผช.แบบ ""ผมว่ามันผิด มันจะทำให้ประชากรสูญพันธุ์"" แล้ว ผญ คือดูอายมาก พยายามเถียงว่ามันเป็นสิทธิคนอื่น อี ผช.ก็เสียงดัง อ้างโน่นอ้างนี่ข่ม ผญ... ... กู ""คนโง่นี่มันเสียงดังเนาะ""/จิบน้ำ ... ผช เปลี่ยนไปพูดเรื่อง bitcoin แทน",th,[],[],[],15,16565,1304,[],[],https://twitter.com/kangbear_hyewon/status/955089427381985283,False,,0,,,,,,,,[],,,,
955058136800481281,955058136800481281,2018-01-21 07:42:58 Eastern Standard Time,2018-01-21,07:42:58,-0500,954314048006443010,gneuofficiel,Gneu.,,Gneu gneu gneu #bitcoin 💰  https://t.co/WsS5lgOGd1,cy,[],[],[],25,517,610,['bitcoin'],[],https://twitter.com/Gneuofficiel/status/955058136800481281,False,,1,https://pbs.twimg.com/ext_tw_video_thumb/955057712731181056/pu/img/Ipsa7skoaVHYyLCP.jpg,,,,,,,[],,,,
955047685630906368,955047685630906368,2018-01-21 07:01:26 Eastern Standard Time,2018-01-21,07:01:26,-0500,160910872,ricamconsult,Ricardo Amorim,,"Brasileiro é um povo engraçado. Não investe em Bolsa porque acha arriscado demais, mas investe em Bitcoin, que é muito mais arriscado do que a Bolsa.  https://t.co/5AfVqckt9I",pt,[],['http://owl.li/SNId30hUeeb'],[],111,290,1422,[],[],https://twitter.com/Ricamconsult/status/955047685630906368,False,,0,,,,,,,,[],,,,
954998877920247808,954998877920247808,2018-01-21 03:47:30 Eastern Standard Time,2018-01-21,03:47:30,-0500,2294954370,bitgo,BitGo,,The first 2MB bitcoin blocks were mined this weekend (see block 505253  https://t.co/0Eeh5Jk05E - 2.217 MB). These record block sizes were made possible by transactions with numerous segwit inputs created on BitGo with super low fees.  (photo credit  https://t.co/XYUnX6w6ix)  https://t.co/PvGqTcTPwz,en,[],"['https://blockchain.info/block-height/505253', 'http://segwit.party']",['https://pbs.twimg.com/media/DUDUNFqVQAAxlWP.jpg'],33,316,853,[],[],https://twitter.com/BitGo/status/954998877920247808,False,,1,https://pbs.twimg.com/media/DUDUNFqVQAAxlWP.jpg,,,,,,,[],,,,
954979497652228096,954979497652228096,2018-01-21 02:30:29 Eastern Standard Time,2018-01-21,02:30:29,-0500,5988062,theeconomist,The Economist,,People are buying Bitcoin because they expect other people to buy it from them at a higher price. This is foolish  https://t.co/FzlVsjeHpo,en,[],['http://econ.st/2FVTLr6'],[],78,529,754,[],[],https://twitter.com/TheEconomist/status/954979497652228096,False,,0,,,,,,,,[],,,,
954978501987270657,954978501987270657,2018-01-21 02:26:32 Eastern Standard Time,2018-01-21,02:26:32,-0500,219505926,julian_epp,Jules,,"In 2011, I bought 500 Bitcoin for $1 each and now they’re worth $12,000.  In the spirit of giving, I will send one to 10 random people who retweet this and follow me  https://t.co/5zQjQtt2e7",en,[],[],['https://pbs.twimg.com/media/DUDD3-XWAAAmdKK.jpg'],52,609,1071,[],[],https://twitter.com/Julian_Epp/status/954978501987270657,False,,1,https://pbs.twimg.com/media/DUDD3-XWAAAmdKK.jpg,,,,,,,[],,,,
954975927850688513,954975927850688513,2018-01-21 02:16:18 Eastern Standard Time,2018-01-21,02:16:18,-0500,2207129125,cointelegraph,Cointelegraph,,"Less than one percent of #Bitcoin transactions are related to money laundering, per a recent report.  https://t.co/KGpWOijzni",en,[],['https://cointelegraph.com/news/bitcoin-laundering-less-than-one-percent-of-all-transactions'],[],41,303,484,['bitcoin'],[],https://twitter.com/Cointelegraph/status/954975927850688513,False,,0,,,,,,,,[],,,,
954975831746424832,954975831746424832,2018-01-21 02:15:55 Eastern Standard Time,2018-01-21,02:15:55,-0500,2577886615,tonevays,Tone Vays (#ArrestFauci 🤡🌎),,"The 4hr $BTCUSD chart was provided some pretty good trade set up the last 7 days. But looks like it's time for #Bitcoin to take another Leg Down. A fall back under $11,000 makes $9,500 very likely &amp; since Double Bottoms are unicorns! Next Stop would be $7,500.  https://t.co/RF1TyGGtYP",en,[],[],['https://pbs.twimg.com/media/DUDBbu6VMAE1VLJ.jpg'],128,171,476,['bitcoin'],['btcusd'],https://twitter.com/ToneVays/status/954975831746424832,False,,1,https://pbs.twimg.com/media/DUDBbu6VMAE1VLJ.jpg,,,,,,,[],,,,
954935819525152768,954931333087637505,2018-01-20 23:36:55 Eastern Standard Time,2018-01-20,23:36:55,-0500,18469669,saifedean,Saifedean.com,,"Bitcoin matters not because it's fast, cheap, or easy; but only because nobody controls it. It grew spontaneously in the wilds of the internet without a central planner. After it, no alt could ever recreate this, as there's no spontaneous market demand for a less secure Bitcoin.",en,[],[],[],31,299,1052,[],[],https://twitter.com/saifedean/status/954935819525152768,False,,0,,,,,,,,[],,,,
954927494028816384,954927494028816384,2018-01-20 23:03:50 Eastern Standard Time,2018-01-20,23:03:50,-0500,33923443,6billionpeople,MarQuis Trill | Cryptocurrency & Blockchain Mentor,,"Stop chasing coins trying to get rich overnight! It took bitcoin 8 years to go from $0 - $12,500 Ripple 5 Years $0- $1.50 | Build yourself a solid portfolio with coins/token that have a great product, team, impact on the industry it’s targeting, strong community &amp; Wait! 💯",en,[],[],[],158,739,2567,[],[],https://twitter.com/6BillionPeople/status/954927494028816384,False,,0,,,,,,,,[],,,,
954894762934325249,954894762934325249,2018-01-20 20:53:47 Eastern Standard Time,2018-01-20,20:53:47,-0500,409775094,diddyaus,Diddy,,Y'all investing in bitcoin while i'm investing in these bad boys 😎😎😎😎😎😎  https://t.co/6amZTAzwwD,en,[],[],['https://pbs.twimg.com/media/DUB3mePV4AAJlE6.jpg'],18,262,770,[],[],https://twitter.com/diddyaus/status/954894762934325249,False,,1,https://pbs.twimg.com/media/DUB3mePV4AAJlE6.jpg,,,,,,,[],,,,
954894238512242688,954894238512242688,2018-01-20 20:51:42 Eastern Standard Time,2018-01-20,20:51:42,-0500,855182789058146304,dhgotwaves,DH,,Fuck Bitcoin we investing in box tops for education,en,[],[],[],6,582,1827,[],[],https://twitter.com/DHGOTWAVES/status/954894238512242688,False,,0,,,,,,,,[],,,,
954855165856829440,954855165856829440,2018-01-20 18:16:26 Eastern Standard Time,2018-01-20,18:16:26,-0500,933959470950109184,troopertoken,Trooper,,Trooper Airdrop is live now!! Get your 1000 Trooper ..  https://t.co/0cWWqSzqbZ #cryptocurrency #bitcoin #airdrop #ico #Trooper #Blockchain #waves #wavesplatform,en,[],['https://goo.gl/forms/5zVkVP7M4tDKVoir2'],[],238,1483,1122,"['cryptocurrency', 'bitcoin', 'airdrop', 'ico', 'trooper', 'blockchain', 'waves', 'wavesplatform']",[],https://twitter.com/TrooperToken/status/954855165856829440,False,,0,,,,,,,,[],,,,
954853555415941121,954853555415941121,2018-01-20 18:10:02 Eastern Standard Time,2018-01-20,18:10:02,-0500,899558268795842561,cryptocred,Cred,,"Harsh truth:  Most of you would make &amp; keep more money if you didn't trade and just held $BTC.  The decision to risk your precious Bitcoin in the hope of accumulating more is a serious one.  Either trade 'properly' and seriously, or sit on the sidelines.",en,[],[],[],71,191,923,[],['btc'],https://twitter.com/CryptoCred/status/954853555415941121,False,,0,,,,,,,,[],,,,
954840281609789441,954840281609789441,2018-01-20 17:17:17 Eastern Standard Time,2018-01-20,17:17:17,-0500,20374262,maxkeiser,🇸🇻 BITCOIN AMBASSADOR 🌋,,"Dear US Govt, Please stay shut so #Bitcoin hits my interim $28,000 target this quarter. Thank you. - #TheIndividuallySovereign",en,[],[],[],33,165,776,"['bitcoin', 'theindividuallysovereign']",[],https://twitter.com/maxkeiser/status/954840281609789441,False,,0,,,,,,,,[],,,,
954827070592442369,954827070592442369,2018-01-20 16:24:48 Eastern Standard Time,2018-01-20,16:24:48,-0500,428151039,vxschmid,Valentin Schmid,,@TraceMayer: People declare financial independence by holding #Bitcoin.  Watch the full interview here:  https://t.co/vqxFzivJyI   Other topics: #bch  #xrp  #gold  https://t.co/dnx1EbTV7z,en,[],['https://goo.gl/Cc9ybd'],[],35,240,448,"['bitcoin', 'bch', 'xrp', 'gold']",[],https://twitter.com/vxschmid/status/954827070592442369,False,,1,https://pbs.twimg.com/ext_tw_video_thumb/954825422184775680/pu/img/wVon6BGTxlZaZ_pz.jpg,,,,,,,[],,,,
