id,conversation_id,created_at,date,time,timezone,user_id,username,name,place,tweet,language,mentions,urls,photos,replies_count,retweets_count,likes_count,hashtags,cashtags,link,retweet,quote_url,video,thumbnail,near,geo,source,user_rt_id,user_rt,retweet_id,reply_to,retweet_date,translate,trans_src,trans_dest
965567414250475520,965567414250475520,2018-02-19 07:43:05 Eastern Standard Time,2018-02-19,07:43:05,-0500,2207129125,cointelegraph,Cointelegraph,,#Bitcoin price gets upside predictions after hitting $11k twice.  https://t.co/E9T53vG4vc,en,[],['https://cointelegraph.com/news/bitcoin-breaks-11k-as-new-support-forms-and-analysts-turn-bullish'],[],41,241,452,['bitcoin'],[],https://twitter.com/Cointelegraph/status/965567414250475520,False,,0,,,,,,,,[],,,,
965521195650174978,965521195650174978,2018-02-19 04:39:26 Eastern Standard Time,2018-02-19,04:39:26,-0500,14179278,tante,tante,,For the non-German crowd: German Blockchain/Bitcoin convention hosts Alice Weidel who's the chairwoman of Germany's fascist AfD party.  https://t.co/pIc8EIS6ZL,en,[],['https://twitter.com/Autofocus/status/965520737170804736'],[],19,247,176,[],[],https://twitter.com/tante/status/965521195650174978,False,https://twitter.com/Autofocus/status/965520737170804736,0,,,,,,,,[],,,,
965520737170804736,965520737170804736,2018-02-19 04:37:36 Eastern Standard Time,2018-02-19,04:37:36,-0500,18939309,autofocus,🦞 Lucie 🦞,,"You do you, Bitcoin / Blockchain community. I didn't expect any ethics in the first place.  https://t.co/o1zrrVgqjU",en,[],[],"['https://pbs.twimg.com/media/DWY33UbXUAA6wQw.jpg', 'https://pbs.twimg.com/media/DWY339VWkAEERCj.jpg']",12,162,292,[],[],https://twitter.com/Autofocus/status/965520737170804736,False,,1,https://pbs.twimg.com/media/DWY33UbXUAA6wQw.jpg,,,,,,,[],,,,
965429695071301632,965429695071301632,2018-02-18 22:35:50 Eastern Standard Time,2018-02-18,22:35:50,-0500,904485444183842816,stopanddecrypt,StopAndDecrypt 🖕,,"Fake Satoshi wants banks/governments to be the only ones running Bitcoin software (full nodes).  ""Big Corporate"" can ""help the poor in places like India, Pakistan, Africa"" by  ""subsidiz[ing] cash for the rest of society"".  ♻️Retweet if you run a full node to enforce consensus.  https://t.co/XHR6Nirvb1",en,[],[],[],46,151,212,[],[],https://twitter.com/StopAndDecrypt/status/965429695071301632,False,,1,https://pbs.twimg.com/ext_tw_video_thumb/965427035001761792/pu/img/qtCGjm651MXl2Yp6.jpg,,,,,,,[],,,,
965388454761672704,965388454761672704,2018-02-18 19:51:58 Eastern Standard Time,2018-02-18,19:51:58,-0500,190535830,strategi_bisnis,Strategi + Bisnis,,"Masa Depan Bitcoin, Cryptocurrency dan Robohnya Bank-bank Konvesional.  Kenapa kehadiran cyrptocurrency bisa membuat bank sentral dan bank-bank konvesional jadi punah, bagaikan relik dalam sejarah?  Klik gambar untuk simak sajian amazing dan anarkis ini :)",in,[],[],[],24,191,390,[],[],https://twitter.com/Strategi_Bisnis/status/965388454761672704,False,,0,,,,,,,,[],,,,
965370047395868672,965370047395868672,2018-02-18 18:38:49 Eastern Standard Time,2018-02-18,18:38:49,-0500,1434171020,dougpolkvids,Nice Doug Polk,,"One of the most important reasons why I believe #Bitcoin and many other digital currencies will succeed, is how likely the younger generation is to embrace the technology.  Old people hating bitcoin is not nearly as important as young people loving it.",en,[],[],[],161,531,2248,['bitcoin'],[],https://twitter.com/DougPolkVids/status/965370047395868672,False,,0,,,,,,,,[],,,,
965360723302891520,965360723302891520,2018-02-18 18:01:46 Eastern Standard Time,2018-02-18,18:01:46,-0500,844193096246149120,zeuszissou,z 🛡️,,The Truth About #BCash:  1) Those who support it have suspect motives. 2) Its main ”feature” has been rendered redundant by batching.  3) Without co-opting the real #Bitcoin brand it would be worthless. 4) It was created out of greed.  5) BCH is a shitcoin.,en,[],[],[],39,282,1072,"['bcash', 'bitcoin']",[],https://twitter.com/ZeusZissou/status/965360723302891520,False,,0,,,,,,,,[],,,,
965299643893600258,965299643893600258,2018-02-18 13:59:04 Eastern Standard Time,2018-02-18,13:59:04,-0500,2207129125,cointelegraph,Cointelegraph,,"Shark Tank’s Robert Herjavic thinks #Bitcoin and #Blockchain are “here to stay,” the former will grow beyond $20,000 in the short term.  https://t.co/QmeUqiEBIn",en,[],['https://cointelegraph.com/news/shark-tanks-herjavec-thinks-bitcoin-and-blockchain-are-here-to-stay'],[],27,231,446,"['bitcoin', 'blockchain']",[],https://twitter.com/Cointelegraph/status/965299643893600258,False,,0,,,,,,,,[],,,,
965297603196964864,965297603196964864,2018-02-18 13:50:57 Eastern Standard Time,2018-02-18,13:50:57,-0500,20374262,maxkeiser,🇸🇻 BITCOIN AMBASSADOR 🌋,,"First, #Bitcoin will replace fiat. Then it will replace the nation state. Then it will disappear from our consciousness - as the construct of money itself disappears. Where we’re going, we don’t need money.  https://t.co/35ALxESAiC",en,[],[],['https://pbs.twimg.com/tweet_video_thumb/DWVtCevWAAE7e8F.jpg'],56,185,545,['bitcoin'],[],https://twitter.com/maxkeiser/status/965297603196964864,False,,1,https://pbs.twimg.com/tweet_video_thumb/DWVtCevWAAE7e8F.jpg,,,,,,,[],,,,
965268486007283712,965268486007283712,2018-02-18 11:55:15 Eastern Standard Time,2018-02-18,11:55:15,-0500,2279681898,needacoin,Needacoin,,This is how the next few months will go -Bitcoin price will rise -You will get worried about your alts and sell for the almighty btc -I will buy those alts from you -Bitcoin will go sideways -Those altcoins you sold me will moon -You will be upset -You will buy them back from me,en,[],[],[],296,1520,5915,[],[],https://twitter.com/needacoin/status/965268486007283712,False,,0,,,,,,,,[],,,,
965261773677912065,965261773677912065,2018-02-18 11:28:35 Eastern Standard Time,2018-02-18,11:28:35,-0500,23618940,lopp,Jameson Lopp,,"We suspected this already due to prior node count cliffs, but evidence continues to mount that 80% of Bitcoin Unlimited nodes were owned by a single entity. Now there are fewer than 100 in operation.  https://t.co/zV9k8JE5Jy  https://t.co/oCNXLN8xeU",en,[],['https://coin.dance/nodes/unlimited'],['https://pbs.twimg.com/media/DWVL3ReU0AAkOwM.jpg'],34,151,490,[],[],https://twitter.com/lopp/status/965261773677912065,False,,1,https://pbs.twimg.com/media/DWVL3ReU0AAkOwM.jpg,,,,,,,[],,,,
965245627788595201,965245627788595201,2018-02-18 10:24:25 Eastern Standard Time,2018-02-18,10:24:25,-0500,859484337850523648,crypto_rand,Crypto Rand,,Understanding the market structure #Bitcoin #CryptoCurrency #Ethereum #Trading  https://t.co/Zq5478uWkk,en,[],[],['https://pbs.twimg.com/media/DWU9uIhWsAIncIv.jpg'],47,516,1192,"['bitcoin', 'cryptocurrency', 'ethereum', 'trading']",[],https://twitter.com/crypto_rand/status/965245627788595201,False,,1,https://pbs.twimg.com/media/DWU9uIhWsAIncIv.jpg,,,,,,,[],,,,
965152632842084352,965152632842084352,2018-02-18 04:14:53 Eastern Standard Time,2018-02-18,04:14:53,-0500,390266895,legendofcrypto,Crypto Boss,,#Bitcoin doesn't give a fuck  https://t.co/0UcG4n0D4g,en,[],[],[],31,546,1259,['bitcoin'],[],https://twitter.com/LegendOfCrypto/status/965152632842084352,False,,1,https://pbs.twimg.com/ext_tw_video_thumb/965152509588250624/pu/img/L9znLiCSl_oo908p.jpg,,,,,,,[],,,,
965114697753284608,965114697753284608,2018-02-18 01:44:09 Eastern Standard Time,2018-02-18,01:44:09,-0500,70586612,liberaldp,Liberal Demokrat Parti,,"Türkiye nin altı komple #bitcoin madeniymiş, dünya rezervlerinin %70 Türkiye de ama #Lozan yüzünden çıkartamıyoruz...",tr,[],[],[],71,1063,3548,"['bitcoin', 'lozan']",[],https://twitter.com/liberaLDP/status/965114697753284608,False,,0,,,,,,,,[],,,,
965077548315979776,965077548315979776,2018-02-17 23:16:32 Eastern Standard Time,2018-02-17,23:16:32,-0500,390266895,legendofcrypto,Crypto Boss,,Once the masses realize fiat is the real scam and Bitcoin is the future that's when the real FOMO begins.,en,[],[],[],42,237,804,[],[],https://twitter.com/LegendOfCrypto/status/965077548315979776,False,,0,,,,,,,,[],,,,
965045114430107648,965045114430107648,2018-02-17 21:07:39 Eastern Standard Time,2018-02-17,21:07:39,-0500,9880182,btcartgallery,Bitcoin Art Gallery,,Bitcoin Doesn't Give a Fuck by Tricky_Troll  https://t.co/JNtlxFhO6z  https://t.co/hzfWJkaoVG,en,[],['https://redd.it/7yaaz2'],[],19,534,1144,[],[],https://twitter.com/btcArtGallery/status/965045114430107648,False,,1,https://pbs.twimg.com/ext_tw_video_thumb/965045024198074368/pu/img/pDv1Of3x0At1vCxg.jpg,,,,,,,[],,,,
964994500127989760,964994500127989760,2018-02-17 17:46:32 Eastern Standard Time,2018-02-17,17:46:32,-0500,64929124,kingbach,King Bach,,Gimmie yo Bitcoin!!  https://t.co/ycrRcKT7Oi,ht,[],[],[],26,240,1166,[],[],https://twitter.com/KingBach/status/964994500127989760,False,,1,https://pbs.twimg.com/ext_tw_video_thumb/964994328996192257/pu/img/cQFRQ-ezllkMde_U.jpg,,,,,,,[],,,,
964983301214683136,964983301214683136,2018-02-17 17:02:02 Eastern Standard Time,2018-02-17,17:02:02,-0500,23618940,lopp,Jameson Lopp,,Bitcoin is not: A crypto republic Crypto democracy Crypto socialism Crypto communism  Bitcoin is crypto anarchy.,en,[],[],[],142,567,2170,[],[],https://twitter.com/lopp/status/964983301214683136,False,,0,,,,,,,,[],,,,
964967471362007040,964967471362007040,2018-02-17 15:59:08 Eastern Standard Time,2018-02-17,15:59:08,-0500,259725229,valaafshar,Vala Afshar,,Did not exist in 2003:  Facebook Twitter  iPhone📱 iPad Android YouTube AWS Apple App Store Uber Airbnb Blockchain Bitcoin Square Stripe Spotify Dropbox Instagram Snapchat WhatsApp Pinterest  Kickstarter Messenger Quora Tumblr HubSpot Hulu Box Nest Fitbit Oculus Dropbox Kindle 4G,en,[],[],[],47,655,993,[],[],https://twitter.com/ValaAfshar/status/964967471362007040,False,,0,,,,,,,,[],,,,
964954551206981632,964954551206981632,2018-02-17 15:07:47 Eastern Standard Time,2018-02-17,15:07:47,-0500,889088560267239424,daneelproject,Daneel,,Our ICO is still LIVE! Softcap reached and 10 % bonus available 😉 Want to know more? Visit our website :  https://t.co/71o6ix6gHr #AI #ICO #Bitcoin #ETH  https://t.co/i6wi2jOnzr,en,[],['http://www.daneel.io'],['https://pbs.twimg.com/media/DWQ0RO-X4AAM2GX.jpg'],9,314,363,"['ai', 'ico', 'bitcoin', 'eth']",[],https://twitter.com/daneelproject/status/964954551206981632,False,,1,https://pbs.twimg.com/media/DWQ0RO-X4AAM2GX.jpg,,,,,,,[],,,,
964914342583029761,964914342583029761,2018-02-17 12:28:01 Eastern Standard Time,2018-02-17,12:28:01,-0500,14710235,neerajka,Neeraj K. Agrawal,,"“Scam bitcoin company is double charging users”  ❤️10,573   🔁 5,729  “Visa takes blame for bitcoin company double charging”  ❤️29   🔁 5",en,[],[],[],23,193,970,[],[],https://twitter.com/NeerajKA/status/964914342583029761,False,,0,,,,,,,,[],,,,
964906776150777856,964906776150777856,2018-02-17 11:57:57 Eastern Standard Time,2018-02-17,11:57:57,-0500,23618940,lopp,Jameson Lopp,,"Lightning is the TCP/IP of BTC. It will ultimately enable far more than just ""fast payments"" as innovators build more layers on top. This isn't even Bitcoin's final form!  https://t.co/QOZlxG0H5a",en,[],[],['https://pbs.twimg.com/tweet_video_thumb/DWQJitrUMAACdTn.jpg'],81,566,1848,[],[],https://twitter.com/lopp/status/964906776150777856,False,,1,https://pbs.twimg.com/tweet_video_thumb/DWQJitrUMAACdTn.jpg,,,,,,,[],,,,
964881261805428737,964881261805428737,2018-02-17 10:16:34 Eastern Standard Time,2018-02-17,10:16:34,-0500,40742821,tuurdemeester,Tuur Demeester,,"Millennials and Generation Z grew up around open source, decentralized online protocols. That makes it much easier for them to understand Bitcoin (BitTorrent of money) and lightning (Tor for payments).",en,[],[],[],27,191,536,[],[],https://twitter.com/TuurDemeester/status/964881261805428737,False,,0,,,,,,,,[],,,,
964806940332347392,964806940332347392,2018-02-17 05:21:14 Eastern Standard Time,2018-02-17,05:21:14,-0500,2520888308,cryptobull,Crypto฿ull,,Bitcoin be like  https://t.co/OGPX3bwxAA,en,[],[],['https://pbs.twimg.com/tweet_video_thumb/DWOun2SWkAA3FM2.jpg'],30,176,680,[],[],https://twitter.com/CryptoBull/status/964806940332347392,False,,1,https://pbs.twimg.com/tweet_video_thumb/DWOun2SWkAA3FM2.jpg,,,,,,,[],,,,
964706955183837184,964706955183837184,2018-02-16 22:43:56 Eastern Standard Time,2018-02-16,22:43:56,-0500,267485701,ariannasimpson,AriannaSimpson.eth,,"If you wanted to be accurate, you would say this was Visa’s fault. Less accurately, you would blame Coinbase. But blaming bitcoin makes literally NO sense  https://t.co/qW63452wrv",en,[],['https://twitter.com/wsj/status/964687100510720000'],[],54,398,1577,[],[],https://twitter.com/AriannaSimpson/status/964706955183837184,False,https://twitter.com/wsj/status/964687100510720000,0,,,,,,,,[],,,,
964706564845092865,964706564845092865,2018-02-16 22:42:23 Eastern Standard Time,2018-02-16,22:42:23,-0500,949489183797657601,yakcoin,YAK Coin,,4600 YAK COIN to first 500 Twitter users.  TO ELIGIBLE. Please follow the rules. #BTCUSD #coinsmarkets @XVGWhaleReal #XLM #BTC #bitcoin #XRP #Airdrop #airdropalert #Airdrops #BittrexExchange #Poloniex  #cryptocurrency #CryptocurrencyNews #Coinbase #Coinmarketcap #Coinbase #Hitbtc  https://t.co/JufBEntNKN,en,"[{'screen_name': 'xvgwhalereal', 'name': 'xvgwhalereal', 'id': '948958633773223937'}]",[],['https://pbs.twimg.com/media/DWNTcD8VMAArT7k.jpg'],211,315,319,"['btcusd', 'coinsmarkets', 'xlm', 'btc', 'bitcoin', 'xrp', 'airdrop', 'airdropalert', 'airdrops', 'bittrexexchange', 'poloniex', 'cryptocurrency', 'cryptocurrencynews', 'coinbase', 'coinmarketcap', 'coinbase', 'hitbtc']",[],https://twitter.com/YAKCoin/status/964706564845092865,False,,1,https://pbs.twimg.com/media/DWNTcD8VMAArT7k.jpg,,,,,,,[],,,,
964701225718558721,964701225718558721,2018-02-16 22:21:10 Eastern Standard Time,2018-02-16,22:21:10,-0500,5988062,theeconomist,The Economist,,Bitcoin is not the only digital currency to have fallen  https://t.co/Y9vVzkh8MG  https://t.co/ALLuiVOOKZ,en,[],['http://econ.st/2o3E0qH'],['https://pbs.twimg.com/media/DWNOpqZVwAA4G7C.jpg'],38,175,250,[],[],https://twitter.com/TheEconomist/status/964701225718558721,False,,1,https://pbs.twimg.com/media/DWNOpqZVwAA4G7C.jpg,,,,,,,[],,,,
964683351155183617,964683351155183617,2018-02-16 21:10:08 Eastern Standard Time,2018-02-16,21:10:08,-0500,20374262,maxkeiser,🇸🇻 BITCOIN AMBASSADOR 🌋,,"#Bitcoin bounce off Fibonacci 68.1% successful. New ATH in the bag. $28,000 in play. $USD breaking down. #CREAM #CryptoRulesEverythingAroundMe  https://t.co/7OFYmegYJq  https://t.co/x4GO6Ahy5e",en,[],['http://stockcharts.com/school/doku.php?id=chart_school:chart_analysis:fibonacci_retracemen'],['https://pbs.twimg.com/tweet_video_thumb/DWM-YalWkAUrs8U.jpg'],55,332,972,"['bitcoin', 'cream', 'cryptoruleseverythingaroundme']",['usd'],https://twitter.com/maxkeiser/status/964683351155183617,False,,1,https://pbs.twimg.com/tweet_video_thumb/DWM-YalWkAUrs8U.jpg,,,,,,,[],,,,
964662247619522560,964662247619522560,2018-02-16 19:46:17 Eastern Standard Time,2018-02-16,19:46:17,-0500,918297315072409602,theskelemander,Skelemander™️,,"Why does everything popular have ""bit"" in it?  Bitmoji  Bitcoin  Charlie bit my finger",en,[],[],[],5,146,1294,[],[],https://twitter.com/TheSkelemander/status/964662247619522560,False,,0,,,,,,,,[],,,,
964658880436293633,964658880436293633,2018-02-16 19:32:54 Eastern Standard Time,2018-02-16,19:32:54,-0500,1854401,vinnylingham,Vinny Lingham,,"Bitcoin is a once-in-a-lifetime opportunity for anyone, including those who are otherwise incompetent, to become very wealthy! No skills required - just buy and hold! 😂",en,[],[],[],114,405,1524,[],[],https://twitter.com/VinnyLingham/status/964658880436293633,False,,0,,,,,,,,[],,,,
964613608507191296,964613608507191296,2018-02-16 16:33:00 Eastern Standard Time,2018-02-16,16:33:00,-0500,290180065,ericholthaus,Eric Holthaus,,"One Bitcoin transaction uses as much energy as a single U.S. household consumes in three weeks.  In total, Bitcoin now consumes about as much energy as Portugal.  And it’s about to get much, much worse than that.   https://t.co/XGuMQGROwZ",en,[],['https://grist.org/article/bitcoin-gobbles-up-clean-energy-just-when-the-real-world-needs-it-most/'],[],32,522,377,[],[],https://twitter.com/EricHolthaus/status/964613608507191296,False,,0,,,,,,,,[],,,,
964576417358008322,964576417358008322,2018-02-16 14:05:13 Eastern Standard Time,2018-02-16,14:05:13,-0500,1469101279,aantonop,Andreas,,Bitcoin Q&amp;A: Misconceptions about Lightning Network  https://t.co/gaHcEfijtW,en,[],['https://youtu.be/c4TjfaLgzj4'],[],28,278,634,[],[],https://twitter.com/aantonop/status/964576417358008322,False,,0,,,,,,,,[],,,,
964572311499100160,964572311499100160,2018-02-16 13:48:54 Eastern Standard Time,2018-02-16,13:48:54,-0500,940899643260620800,hodlwhale,HodlWhale,,"Nearly $1,000,000,000 in Bitcoin  This #Bitcoin address purchased nearly one billion dollars worth of $BTC at $9,400. And between 2/9 and 2/12 had purchased $344 Million worth at $8,400.  3Cbq7aT1tY8kMxWLbitaG7yT6bPbKChq64   Follow the money.",en,[],[],[],74,371,914,['bitcoin'],['btc'],https://twitter.com/HodlWhale/status/964572311499100160,False,,0,,,,,,,,[],,,,
964567119668174849,964567119668174849,2018-02-16 13:28:16 Eastern Standard Time,2018-02-16,13:28:16,-0500,14338147,satoshilite,Charlie Lee,,"Bitcoin Core supporters have caused BTC to be too expensive for the average person. For years, price was still reasonable. But then BlockstreamCore forced SegShit on us and sabotaged Segwit2x and caused BTC to be too expensive. Thanks to &gt;1mb blocks, price is back to sane levels.  https://t.co/eIZChjKxVr",en,[],[],['https://pbs.twimg.com/media/DWLUrNgVwAEnP0H.jpg'],362,538,2184,[],[],https://twitter.com/SatoshiLite/status/964567119668174849,False,,1,https://pbs.twimg.com/media/DWLUrNgVwAEnP0H.jpg,,,,,,,[],,,,
964565730783105026,964565730783105026,2018-02-16 13:22:45 Eastern Standard Time,2018-02-16,13:22:45,-0500,5988062,theeconomist,The Economist,,Bitcoin is not the only digital currency to have fallen  https://t.co/D58DAobQwP  https://t.co/kCdN1rIhIB,en,[],['http://econ.st/2EwKDfB'],['https://pbs.twimg.com/media/DWLTay7X0AEMff1.jpg'],38,155,190,[],[],https://twitter.com/TheEconomist/status/964565730783105026,False,,1,https://pbs.twimg.com/media/DWLTay7X0AEMff1.jpg,,,,,,,[],,,,
964534939046772736,964534939046772736,2018-02-16 11:20:24 Eastern Standard Time,2018-02-16,11:20:24,-0500,935221142616408064,grain_io,Grain.io,,"#Grain Webinar #2: Project updates, transparency and tech Q&amp;A -  https://t.co/o15fnsACD2 #blockchain #fintech #ethereum #bitcoin #work #payroll #smartcontracts",en,[],['https://youtu.be/e1U8mAklsgM'],[],7,713,727,"['grain', 'blockchain', 'fintech', 'ethereum', 'bitcoin', 'work', 'payroll', 'smartcontracts']",[],https://twitter.com/Grain_io/status/964534939046772736,False,,0,,,,,,,,[],,,,
964528446159298560,964528446159298560,2018-02-16 10:54:36 Eastern Standard Time,2018-02-16,10:54:36,-0500,61417559,erikvoorhees,Erik Voorhees,,Big news: Swiss financial regulator issues guidelines for ICOs and securities classification... And they’re pretty reasonable. ‘Crypto nation’ Switzerland issues guidelines to support market  https://t.co/CaeGlujQ5G via @financialtimes #bitcoin #ethereum #blockchain,en,"[{'screen_name': 'financialtimes', 'name': 'financial times', 'id': '4898091'}]",['https://www.ft.com/content/737b9634-1303-11e8-8cb6-b9ccc4c4dbbb'],[],53,618,1067,"['bitcoin', 'ethereum', 'blockchain']",[],https://twitter.com/ErikVoorhees/status/964528446159298560,False,,0,,,,,,,,[],,,,
964516909176840193,964516909176840193,2018-02-16 10:08:45 Eastern Standard Time,2018-02-16,10:08:45,-0500,779706763583090688,fxmentortrading,Marshal M. Natalie,,"In a street of Paris (rue Legouvé), this nice graffiti is still standing. #bitcoin  https://t.co/TqbixxEwem",fr,[],[],['https://pbs.twimg.com/media/DWKm9wsXUAEsdDx.jpg'],16,137,429,['bitcoin'],[],https://twitter.com/fxmentortrading/status/964516909176840193,False,,1,https://pbs.twimg.com/media/DWKm9wsXUAEsdDx.jpg,,,,,,,[],,,,
964483223026896897,964483223026896897,2018-02-16 07:54:54 Eastern Standard Time,2018-02-16,07:54:54,-0500,2207129125,cointelegraph,Cointelegraph,,".@LlewClaasen promises #Bitcoin will hit $40,000 by the end of 2018, says 90% of altcoins will fail  https://t.co/Zdk9e1r52x",en,"[{'screen_name': 'llewclaasen', 'name': 'llewclaasen', 'id': '10905652'}]",['https://cointelegraph.com/news/bitcoin-foundations-llew-claasen-says-bitcoin-will-hit-40000-90-of-altcoins-will-fail'],[],54,234,457,['bitcoin'],[],https://twitter.com/Cointelegraph/status/964483223026896897,False,,0,,,,,,,,[],,,,
964482699187703810,964482699187703810,2018-02-16 07:52:49 Eastern Standard Time,2018-02-16,07:52:49,-0500,894157566313410560,crypticsup,Cryptics,,Atari to Join the Cryptocurrency Game   https://t.co/yFLyMNp6uq  #Blockchain #AI #Cryptics #ICO #Crowdsale #Bitcoin #Token #TokenSale #Crypto #cryptoinvesting #Cryptocurrencies #ETH #Ethereum #Atari  https://t.co/sPOpDL7oPS,en,[],['https://cryptics.tech/atari-to-join-the-cryptocurrency-game/'],['https://pbs.twimg.com/media/DWKH4b0WAAIFcy6.png'],53,495,356,"['blockchain', 'ai', 'cryptics', 'ico', 'crowdsale', 'bitcoin', 'token', 'tokensale', 'crypto', 'cryptoinvesting', 'cryptocurrencies', 'eth', 'ethereum', 'atari']",[],https://twitter.com/Crypticsup/status/964482699187703810,False,,1,https://pbs.twimg.com/media/DWKH4b0WAAIFcy6.png,,,,,,,[],,,,
964474995757010945,964474995757010945,2018-02-16 07:22:12 Eastern Standard Time,2018-02-16,07:22:12,-0500,933672480044175360,denaro_io,Denaro,,"Take advantage of all that Denaro has to offer!  We are here to answer any questions and a big contest is almost finished, winner takes $ 50,000!   Find out more at:  https://t.co/l9cXSqg1N4   #Crypto #Blockchain #ICO #FinTech #CryptoNews #Bitcoin #Ethereum #BTC #ETH  https://t.co/N8BAd7tZWZ",en,[],['https://denaro.io/ico/referral'],['https://pbs.twimg.com/media/DWKA3bSW0AIHq81.jpg'],6,677,696,"['crypto', 'blockchain', 'ico', 'fintech', 'cryptonews', 'bitcoin', 'ethereum', 'btc', 'eth']",[],https://twitter.com/Denaro_io/status/964474995757010945,False,,1,https://pbs.twimg.com/media/DWKA3bSW0AIHq81.jpg,,,,,,,[],,,,
964471556683395072,964471556683395072,2018-02-16 07:08:32 Eastern Standard Time,2018-02-16,07:08:32,-0500,3473608753,bokujyuumai,墨汁うまい(Bokujyuumai),,速報:Zaifの10億BTC約2200兆円の売り板の原因はクレジットカード決済のビットコイン価格が0円だったことが原因の模様。動画のユーザ曰く「0円で2200兆円分のビットコインが買えてしまった」という。原因は不明 #ビットコイン #仮想通貨 #Bitcoin $BTC #ブロックチェーン #Zaif  https://t.co/WeojgM1qrI,ja,[],['https://twitter.com/aaaikknoruy/status/964467954464129024'],[],9,330,328,"['ビットコイン', '仮想通貨', 'bitcoin', 'ブロックチェーン', 'zaif']",['btc'],https://twitter.com/bokujyuumai/status/964471556683395072,False,0,0,,,,,,,,[],,,,
964469645297274880,964469645297274880,2018-02-16 07:00:57 Eastern Standard Time,2018-02-16,07:00:57,-0500,18856867,zerohedge,zerohedge,,"This should blow up half of fintwit: BofA: ""Bitcoin is the next lead indicator""  Yes, it's institutional now  https://t.co/MzVDeYXrtU",en,[],[],['https://pbs.twimg.com/media/DWJ8AnsVAAA5y8R.jpg'],11,127,255,[],[],https://twitter.com/zerohedge/status/964469645297274880,False,,1,https://pbs.twimg.com/media/DWJ8AnsVAAA5y8R.jpg,,,,,,,[],,,,
964467054056214528,964467054056214528,2018-02-16 06:50:39 Eastern Standard Time,2018-02-16,06:50:39,-0500,2227582476,verretor,Ben Verret,,Bitcoin fees have been lower than BCash fees in the past 3 hours.  https://t.co/a77c2fbqJn,en,[],[],['https://pbs.twimg.com/media/DWJ5qVKWsAAqdXh.jpg'],36,283,769,[],[],https://twitter.com/verretor/status/964467054056214528,False,,1,https://pbs.twimg.com/media/DWJ5qVKWsAAqdXh.jpg,,,,,,,[],,,,
964436734477066242,964436734477066242,2018-02-16 04:50:10 Eastern Standard Time,2018-02-16,04:50:10,-0500,859484337850523648,crypto_rand,Crypto Rand,,"This is the $AMZN chart during its first years of trading having a 95% retracement. Some people sold it at 5$, now it's worth 1,500$. Yes, +29,900%.  Don't be the guy who did the same with #Bitcoin. There is no easy way.  https://t.co/mI7rVeEdkf",en,[],[],['https://pbs.twimg.com/media/DWJb8N0XUAEUBLu.jpg'],43,404,1102,['bitcoin'],['amzn'],https://twitter.com/crypto_rand/status/964436734477066242,False,,1,https://pbs.twimg.com/media/DWJb8N0XUAEUBLu.jpg,,,,,,,[],,,,
964433750808563712,964433750808563712,2018-02-16 04:38:19 Eastern Standard Time,2018-02-16,04:38:19,-0500,2799211554,whalepanda,WhalePanda,,"RV: ""How do we promote $BCH?"" Marketing: ""We can talk about decentralization, on-chain scaling,..."" RV: ""I heard some people say there aren't enough women in #Bitcoin so... Booth babes!"" Marketing: ""Wow, you're a genius, that truly is Satoshi's vision"" RV: ""IKR""  https://t.co/k2IplJv66c",en,[],[],['https://pbs.twimg.com/media/DWJbTT3VAAEzfYx.jpg'],220,329,1553,['bitcoin'],['bch'],https://twitter.com/WhalePanda/status/964433750808563712,False,,1,https://pbs.twimg.com/media/DWJbTT3VAAEzfYx.jpg,,,,,,,[],,,,
964413176363151360,964413176363151360,2018-02-16 03:16:33 Eastern Standard Time,2018-02-16,03:16:33,-0500,2652239532,ledger,Ledger,,"Bitcoin explained by @TheEllenShow, featuring the Ledger Nano S (and a goat)!  https://t.co/DcpdolKTRq  https://t.co/f0tiqjHjvq",en,"[{'screen_name': 'theellenshow', 'name': 'ellen degeneres', 'id': '15846407'}]",['https://twitter.com/theellenshow/status/964287117466640389'],['https://pbs.twimg.com/media/DWJGSuAUMAUc7V7.jpg'],83,320,1301,[],[],https://twitter.com/Ledger/status/964413176363151360,False,https://twitter.com/theellenshow/status/964287117466640389,1,https://pbs.twimg.com/media/DWJGSuAUMAUc7V7.jpg,,,,,,,[],,,,
