id,conversation_id,created_at,date,time,timezone,user_id,username,name,place,tweet,language,mentions,urls,photos,replies_count,retweets_count,likes_count,hashtags,cashtags,link,retweet,quote_url,video,thumbnail,near,geo,source,user_rt_id,user_rt,retweet_id,reply_to,retweet_date,translate,trans_src,trans_dest
962399914637627393,962399914637627393,2018-02-10 13:56:34 Eastern Standard Time,2018-02-10,13:56:34,-0500,308265684,philcrypto77,Felipe,,"Most obvious signs you know very little about #bitcoin and #crypto... 1) ""It's all about blockchain, not Bitcoin"" 2) ""Tulips!"" 3)"" Bitcoin is only used for money laundering"" 4) ""Bitcoin is anonymous"" 5) ""Central banks will just create their own Bitcoin"" 6) ""Bitcoin is AOL""",en,[],[],[],59,265,847,"['bitcoin', 'crypto']",[],https://twitter.com/PhilCrypto77/status/962399914637627393,False,,0,,,,,,,,[],,,,
962369594286641152,962369594286641152,2018-02-10 11:56:05 Eastern Standard Time,2018-02-10,11:56:05,-0500,933672480044175360,denaro_io,Denaro,,"Today, we have more good news for you. The Denaro referral contest begins this Friday at 12pm UTC.   The best part: 1st place is rewarded with $50,000. To enter, visit  https://t.co/l9cXSqg1N4.    #Crypto #Blockchain #ICO #FinTech #CryptoNews #Bitcoin #Ethereum #BTC #ETH",en,[],['https://denaro.io/ico/referral'],[],20,392,428,"['crypto', 'blockchain', 'ico', 'fintech', 'cryptonews', 'bitcoin', 'ethereum', 'btc', 'eth']",[],https://twitter.com/Denaro_io/status/962369594286641152,False,,0,,,,,,,,[],,,,
962367446404554752,962367446404554752,2018-02-10 11:47:33 Eastern Standard Time,2018-02-10,11:47:33,-0500,16589206,wikileaks,WikiLeaks,,#ReleaseTheMemo2:  Know someone who has the censored Schiff FISA 'memo'? Send them here:  https://t.co/cLRcuIiQXz  WikiLeaks will match reward funds up to $1m sent to this unique Bitcoin address: 3DDm2AJVVdCdsAjPsX3KwkcW4fAywSvy7g  or marked 'memo2018-2':  https://t.co/lmsmphuH2N  https://t.co/8hSgvZGnec,en,[],"['https://wikileaks.org/#submit', 'https://wikileaks.org/donate']",['https://pbs.twimg.com/media/DVsCjIAWsAAzZLS.jpg'],105,617,833,['releasethememo2'],[],https://twitter.com/wikileaks/status/962367446404554752,False,,1,https://pbs.twimg.com/media/DVsCjIAWsAAzZLS.jpg,,,,,,,[],,,,
962328791803600896,962328791803600896,2018-02-10 09:13:57 Eastern Standard Time,2018-02-10,09:13:57,-0500,2415748447,devilscompiler,Noah Ruderman,,With #Bitcoin we can now send money  (a) to anyone in the world; (b) at the same speed as information; (c) whenever we want  None of these are possible with our current financial infrastructure.,en,[],[],[],44,222,828,['bitcoin'],[],https://twitter.com/devilscompiler/status/962328791803600896,False,,0,,,,,,,,[],,,,
962319475726082048,962319475726082048,2018-02-10 08:36:56 Eastern Standard Time,2018-02-10,08:36:56,-0500,20402945,cnbc,CNBC,,"Cryptocurrency market could hit $1 trillion this year with bitcoin surging to $50,000, experts say  https://t.co/ZJixGVdVvN",en,[],['http://cnb.cx/2EcBggW'],[],58,196,346,[],[],https://twitter.com/CNBC/status/962319475726082048,False,,0,,,,,,,,[],,,,
962159063265001472,962159063265001472,2018-02-09 21:59:31 Eastern Standard Time,2018-02-09,21:59:31,-0500,503285931,fatbtc,FatBTC,,"ReTweet To Vote, show the COMMUNITY POWER of your coin:  Step 1: Follow @FatBTC on Twitter Step 2: Retweet this post for @bitcoin_token to be listed next month. Step 3: Tell everyone to do the same and get your coin listed! @bitcoin_token FatBTC URL:  https://t.co/QTyJ4vssA7  https://t.co/pVqTosb2KJ",en,"[{'screen_name': 'fatbtc', 'name': 'fatbtc', 'id': '503285931'}, {'screen_name': 'bitcoin_token', 'name': 'bitcoinstandardtoken', 'id': '1304599416230346752'}, {'screen_name': 'bitcoin_token', 'name': 'bitcoinstandardtoken', 'id': '1304599416230346752'}]",['http://www.fatbtc.com'],['https://pbs.twimg.com/media/DVpGjwYV4AAcrfJ.jpg'],1347,1991,1223,[],[],https://twitter.com/FatBTC/status/962159063265001472,False,,1,https://pbs.twimg.com/media/DVpGjwYV4AAcrfJ.jpg,,,,,,,[],,,,
962105801232953344,962105801232953344,2018-02-09 18:27:52 Eastern Standard Time,2018-02-09,18:27:52,-0500,2158461846,wheelswordsmith,wheels,,while she never actually wrote it into the books jk rowling has confirmed that draco malfoy was a libertarian vape enthusiast deeply invested in bitcoin,en,[],[],[],72,9346,42018,[],[],https://twitter.com/wheelswordsmith/status/962105801232953344,False,,0,,,,,,,,[],,,,
962097582536318976,962097582536318976,2018-02-09 17:55:13 Eastern Standard Time,2018-02-09,17:55:13,-0500,600029236,50nerdsofgrey,50 Nerds of Grey,,"“Give me a name that makes me feel completely worthless,” she begged. “OK,” he said, “How about Bitcoin?”",en,[],[],[],19,436,1594,[],[],https://twitter.com/50NerdsofGrey/status/962097582536318976,False,,0,,,,,,,,[],,,,
962088937157201921,962088937157201921,2018-02-09 17:20:52 Eastern Standard Time,2018-02-09,17:20:52,-0500,41140413,devnullius,Crypto by Devvie,,Rabobank Fined $369M for Money Laundering After Calling Bitcoin a Risk for Money Laundering  https://t.co/F09FIf87kd,en,[],['https://www.reddit.com/r/Bitcoin/comments/7wfi6b/rabobank_fined_369m_for_money_laundering_after/'],[],20,213,436,[],[],https://twitter.com/devnullius/status/962088937157201921,False,,0,,,,,,,,[],,,,
962031425951166465,962031425951166465,2018-02-09 13:32:20 Eastern Standard Time,2018-02-09,13:32:20,-0500,20374262,maxkeiser,🇸🇻 BITCOIN AMBASSADOR 🌋,,Dow down. #Bitcoin up. 😀,en,[],[],[],38,217,980,['bitcoin'],[],https://twitter.com/maxkeiser/status/962031425951166465,False,,0,,,,,,,,[],,,,
962021864662011905,962021864662011905,2018-02-09 12:54:20 Eastern Standard Time,2018-02-09,12:54:20,-0500,57689645,tracemayer,Trace Mayer,,Two years ago 1 $BTC bought .33 ounces of $GOLD &amp; today 6.4. Ratio's 200DMA is 4.7 &amp; rising. When you #HODL either then fighting every central bank in the world. Why? Monetary sovereignty. 💪 Gold &amp; #Bitcoin are nobody's liability! The largest wealth transfer ever is in effect.  https://t.co/SsEU6HdTzR,en,[],[],['https://pbs.twimg.com/media/DVnJpujUMAUL_IQ.jpg'],23,273,695,"['hodl', 'bitcoin']","['btc', 'gold']",https://twitter.com/TraceMayer/status/962021864662011905,False,,1,https://pbs.twimg.com/media/DVnJpujUMAUL_IQ.jpg,,,,,,,[],,,,
962003342452056065,962003342452056065,2018-02-09 11:40:44 Eastern Standard Time,2018-02-09,11:40:44,-0500,1333467482,coindesk,CoinDesk,,Arizona Moves One Step Closer to Accepting Bitcoin for Taxes  https://t.co/Y4jQl1XfmD  https://t.co/t3ghzPes0j,en,[],['http://bit.ly/2H3Gpty'],['https://pbs.twimg.com/media/DVm48M5WkAAIWSw.jpg'],82,647,1297,[],[],https://twitter.com/CoinDesk/status/962003342452056065,False,,1,https://pbs.twimg.com/media/DVm48M5WkAAIWSw.jpg,,,,,,,[],,,,
961974964898402305,961974964898402305,2018-02-09 09:47:58 Eastern Standard Time,2018-02-09,09:47:58,-0500,349816997,maxseddon,max seddon,,Russian nuclear scientists under arrest for using the country's most powerful supercomputer to mine bitcoin  https://t.co/JfZRCGHBAz,en,[],['http://www.interfax.ru/russia/599218'],[],15,208,256,[],[],https://twitter.com/maxseddon/status/961974964898402305,False,,0,,,,,,,,[],,,,
961967600870699010,961967600870699010,2018-02-09 09:18:43 Eastern Standard Time,2018-02-09,09:18:43,-0500,339061487,apompliano,Pomp 🌪,,"""Cryptocurrencies are not backed by a physical commodity, but then neither is the dollar &amp; most other modern currencies"" - NY Fed  ""Recent developments....could lead European banks to hold positions in Bitcoin"" - ECB President  Crypto is a virus infecting everyone. Can't stop it.",en,[],[],[],34,239,786,[],[],https://twitter.com/APompliano/status/961967600870699010,False,,0,,,,,,,,[],,,,
961965556143403008,961965556143403008,2018-02-09 09:10:35 Eastern Standard Time,2018-02-09,09:10:35,-0500,933672480044175360,denaro_io,Denaro,,"We had a successful Denaro Pre-Sale 📊, and Public Sale has just started.  Thank you to everyone who is participating!  #Crypto #Blockchain #ICO #FinTech #CryptoNews #Bitcoin #Ethereum #BTC #ETH",en,[],[],[],32,463,525,"['crypto', 'blockchain', 'ico', 'fintech', 'cryptonews', 'bitcoin', 'ethereum', 'btc', 'eth']",[],https://twitter.com/Denaro_io/status/961965556143403008,False,,0,,,,,,,,[],,,,
961951690365816832,961951690365816832,2018-02-09 08:15:29 Eastern Standard Time,2018-02-09,08:15:29,-0500,742143,bbcworld,BBC News (World),,Russian nuclear scientists arrested for 'Bitcoin mining plot'  https://t.co/3xX4natdQ9,en,[],['http://bbc.in/2nPz4WF'],[],27,150,223,[],[],https://twitter.com/BBCWorld/status/961951690365816832,False,,0,,,,,,,,[],,,,
961912130399326208,961912130399326208,2018-02-09 05:38:18 Eastern Standard Time,2018-02-09,05:38:18,-0500,20902138,alistairmilne,Alistair Milne,,"A large Bitcoin ATM network added Bcash to its machines ... labelled as 'Bitcoin Cash' 100's of support tickets later, it was removed due to lost funds, complaints it wasn't Bitcoin, etc. Bcash passing off as Bitcoin is losing normal people money",en,[],[],[],170,626,2228,[],[],https://twitter.com/alistairmilne/status/961912130399326208,False,,0,,,,,,,,[],,,,
961896631842025472,961896631842025472,2018-02-09 04:36:42 Eastern Standard Time,2018-02-09,04:36:42,-0500,917342044565143560,peermountain,Peer Mountain,,GREAT NEWS! Peer Mountain has signed a Letter of Intent with Italian corporate information verification provider Affidaty.   #ico #blockchain #cryptocurrency #tokensale #bitcoin #ethereum #Technology #trust   https://t.co/FhoWzUxwUO,en,[],['http://ow.ly/hMjy30iiB8Q'],[],15,308,281,"['ico', 'blockchain', 'cryptocurrency', 'tokensale', 'bitcoin', 'ethereum', 'technology', 'trust']",[],https://twitter.com/PeerMountain/status/961896631842025472,False,,0,,,,,,,,[],,,,
961866658196348930,961866658196348930,2018-02-09 02:37:36 Eastern Standard Time,2018-02-09,02:37:36,-0500,24222556,tyler,Tyler Winklevoss,,Bitcoin is gaining currency in political campaign donations  - ABC News -  https://t.co/Ce71hLgCN9 via @ABC,en,"[{'screen_name': 'abc', 'name': 'abc news', 'id': '28785486'}]",['http://abcn.ws/2C4lwuC'],[],43,296,659,[],[],https://twitter.com/tyler/status/961866658196348930,False,,0,,,,,,,,[],,,,
961852284081614854,961852284081614854,2018-02-09 01:40:29 Eastern Standard Time,2018-02-09,01:40:29,-0500,936123195094024192,bubbletone_eng,Bubbletone Blockchain in Telecom,,#BubbleTone CEO Yury Morozov in #Forbes on the performance of #ICOs  https://t.co/Vc7EjyZls2 #blockchain #bitcoin #crypto,en,[],['http://ow.ly/VkM630iiu11'],[],12,308,410,"['bubbletone', 'forbes', 'icos', 'blockchain', 'bitcoin', 'crypto']",[],https://twitter.com/bubbletone_eng/status/961852284081614854,False,,0,,,,,,,,[],,,,
961831611355377664,961831611355377664,2018-02-09 00:18:20 Eastern Standard Time,2018-02-09,00:18:20,-0500,1376161898,iohk_charles,Charles Hoskinson,,Just wanted to mention that Forbes left off Satoshi Nakamoto from the rich list. His wealth would be more than 10 billion dollars worth of Bitcoin and around 2 billion dollars worth of Bitcoin Cash making him number 1 on the list. Satoshi will always be first.,en,[],[],[],91,384,2001,[],[],https://twitter.com/IOHK_Charles/status/961831611355377664,False,,0,,,,,,,,[],,,,
961800073683329024,961800073683329024,2018-02-08 22:13:01 Eastern Standard Time,2018-02-08,22:13:01,-0500,25163231,convertbond,Lawrence McDonald,,"Drawdowns*  Bitcoin: -58.3% Shanghai Comp: -13.2% China A Shares: -11.9% Nikkei 225: -12.6% Brazil: -11.6% Nasdaq: -10.4% S&amp;P 500: -10.2% Mexico: -9.4% Russell 2000: -9.3% Oil: -9.2% EuroStoxx 600: -7.2% India: -5.5% Gold: -3.5% Euro: -2.1%  *from recent highs, bloomberg data",en,[],[],[],21,220,336,[],[],https://twitter.com/Convertbond/status/961800073683329024,False,,0,,,,,,,,[],,,,
961762412436381697,961762412436381697,2018-02-08 19:43:22 Eastern Standard Time,2018-02-08,19:43:22,-0500,2207129125,cointelegraph,Cointelegraph,,"Dow Jones drops 1000 points again, but #Bitcoin doesn’t follow this time, staying at around $8000.  https://t.co/hTilI5SUZn",en,[],['https://cointelegraph.com/news/dow-jones-drops-another-1000-points-in-a-week-crypto-markets-dont-quite-follow'],[],48,364,731,['bitcoin'],[],https://twitter.com/Cointelegraph/status/961762412436381697,False,,0,,,,,,,,[],,,,
961725077644595202,961725077644595202,2018-02-08 17:15:01 Eastern Standard Time,2018-02-08,17:15:01,-0500,901920700583129088,bobsrepair,BobsRepair,,@BobsRepair meets Buy Bitcoin guy at the Satoshi Roundtable. #token #ico  #blockchain #bitcoin  https://t.co/sjPFoLEdZL,en,[],[],"['https://pbs.twimg.com/media/DVi72lDVAAA-wvp.jpg', 'https://pbs.twimg.com/media/DVi72lCU0AA9YGi.jpg']",14,357,412,"['token', 'ico', 'blockchain', 'bitcoin']",[],https://twitter.com/BobsRepair/status/961725077644595202,False,,1,https://pbs.twimg.com/media/DVi72lDVAAA-wvp.jpg,,,,,,,[],,,,
961720708542812160,961720708542812160,2018-02-08 16:57:39 Eastern Standard Time,2018-02-08,16:57:39,-0500,574032254,coinbase,Coinbase,,"We are continuing to hire senior software engineers to do open source work on core protocols: Bitcoin, Ethereum, Lightning Network or any digital currency protocol of interest.   Hiring in San Francisco, New York and London.   https://t.co/xykkxALzmV  https://t.co/IyGgidGmNB",en,[],"['http://coinbase.com/careers/765130', 'https://twitter.com/brian_armstrong/status/934563254101164033']",[],202,162,615,[],[],https://twitter.com/coinbase/status/961720708542812160,False,0,0,,,,,,,,[],,,,
961693996526505986,961693996526505986,2018-02-08 15:11:30 Eastern Standard Time,2018-02-08,15:11:30,-0500,176758255,rogerkver,Roger Ver,,"""The Bitcoin Core (BTC) network is in trouble due to high fees and slow transaction times. Bitcoin Cash (BCH) is the upgrade that solves these problems."" -  https://t.co/6EeRmpfaH7 front page",en,[],['http://Bitcoin.com'],[],717,255,819,[],[],https://twitter.com/rogerkver/status/961693996526505986,False,,0,,,,,,,,[],,,,
961681047170662400,961681047170662400,2018-02-08 14:20:03 Eastern Standard Time,2018-02-08,14:20:03,-0500,52160722,nathanielpopper,Nathaniel Popper,,"The price of Bitcoin may have fallen, but the mania hasn't cooled off on campus where all the elite universities are racing to create Bitcoin and blockchain classes  https://t.co/nj7uHB9IGg",en,[],['https://www.nytimes.com/2018/02/08/technology/cryptocurrencies-come-to-campus.html'],[],27,204,404,[],[],https://twitter.com/nathanielpopper/status/961681047170662400,False,,0,,,,,,,,[],,,,
961653570205618177,961653570205618177,2018-02-08 12:30:52 Eastern Standard Time,2018-02-08,12:30:52,-0500,17006157,paulkrugman,Paul Krugman,,"Judging from the latest market action, there seem to be investors thinking ""Oh my God, stocks are a bubble! Better buy something safe like Bitcoin!""",en,[],[],[],110,241,1273,[],[],https://twitter.com/paulkrugman/status/961653570205618177,False,,0,,,,,,,,[],,,,
961633903349059584,961633903349059584,2018-02-08 11:12:43 Eastern Standard Time,2018-02-08,11:12:43,-0500,935069224384499712,friendz_ico,Friendz,,We had a great time pitching at Blockchain &amp; Bitcoin Conference in Gibraltar!🚀  #crypto #sale #ethereum #ICO #cryptocurrency #blockchain #TokenSale #friendzico #friendz  https://t.co/Y9iqWSI94h,en,[],[],['https://pbs.twimg.com/media/DVhnmEYWkAAsos-.jpg'],18,1401,1493,"['crypto', 'sale', 'ethereum', 'ico', 'cryptocurrency', 'blockchain', 'tokensale', 'friendzico', 'friendz']",[],https://twitter.com/Friendz_ICO/status/961633903349059584,False,,1,https://pbs.twimg.com/media/DVhnmEYWkAAsos-.jpg,,,,,,,[],,,,
961612619437060096,961612619437060096,2018-02-08 09:48:09 Eastern Standard Time,2018-02-08,09:48:09,-0500,253293158,theonevortex,Vortex,,Got #Bitcoin?  https://t.co/t8GMCuw3Tw,und,[],[],['https://pbs.twimg.com/media/DVhVkuXVAAAmNuS.jpg'],34,596,1058,['bitcoin'],[],https://twitter.com/theonevortex/status/961612619437060096,False,,1,https://pbs.twimg.com/media/DVhVkuXVAAAmNuS.jpg,,,,,,,[],,,,
961610402869268480,961610402869268480,2018-02-08 09:39:20 Eastern Standard Time,2018-02-08,09:39:20,-0500,28351525,levraimcfly,Mcfly le turlupin du net,,Ce mec devrait investir dans le bitcoin.  https://t.co/2qLHMUeonQ,fr,[],['https://twitter.com/pierrecroce/status/961606102252179456'],[],7,680,4478,[],[],https://twitter.com/levraimcfly/status/961610402869268480,False,https://twitter.com/pierrecroce/status/961606102252179456,0,,,,,,,,[],,,,
961594361325727744,961594361325727744,2018-02-08 08:35:35 Eastern Standard Time,2018-02-08,08:35:35,-0500,4721466387,whalepool,Whalepool,,"European Central Bank goes bullish on bitcoin: “[…] recent developments, such as the listing of Bitcoin futures contracts by US exchanges, could lead European banks too to hold positions in Bitcoin, and therefore we will certainly look at that,” - ECB President Mario Draghi  https://t.co/lDgJU1H2X1",en,[],[],['https://pbs.twimg.com/media/DVhE7GQWkAAjMaG.jpg'],28,260,466,[],[],https://twitter.com/whalepool/status/961594361325727744,False,,1,https://pbs.twimg.com/media/DVhE7GQWkAAjMaG.jpg,,,,,,,[],,,,
961538173481385984,961538173481385984,2018-02-08 04:52:19 Eastern Standard Time,2018-02-08,04:52:19,-0500,935520196865019905,skychainglobal,Skychain,,Skychain Global - Gennady Popov at Blockchain &amp; Bitcoin Conference Gibra...  https://t.co/ZHaKzRo3w1 с помощью @YouTube,cs,"[{'screen_name': 'youtube', 'name': 'youtube', 'id': '10228272'}]",['https://youtu.be/R3FWMR7ZNAQ'],[],14,481,467,[],[],https://twitter.com/skychainglobal/status/961538173481385984,False,,0,,,,,,,,[],,,,
961534942613327872,961534942613327872,2018-02-08 04:39:29 Eastern Standard Time,2018-02-08,04:39:29,-0500,935520196865019905,skychainglobal,Skychain,,Meet us at #Blockchain &amp; #Bitcoin Conference #Gibraltar 2018!  #skychainglobal #ico #live #medicine #AI #NeuralNetworks  https://t.co/oIAqcY9ZfU,en,[],[],['https://pbs.twimg.com/media/DVgOrYeX0AEbmMU.jpg'],15,397,408,"['blockchain', 'bitcoin', 'gibraltar', 'skychainglobal', 'ico', 'live', 'medicine', 'ai', 'neuralnetworks']",[],https://twitter.com/skychainglobal/status/961534942613327872,False,,1,https://pbs.twimg.com/media/DVgOrYeX0AEbmMU.jpg,,,,,,,[],,,,
961518011298361344,961518011298361344,2018-02-08 03:32:12 Eastern Standard Time,2018-02-08,03:32:12,-0500,958884506533969920,market_demon,Market Demon,,Adakah bitcoin menepati ciri ciri matawang mengikut Islam?  So kita kena ketahui dulu apa ciri ciri matawang mengikut Islam.  Sheikh Imran mengenalpasti enam komoditi yang digunakan sebagai wang dalam Islam. Emas dan perak secara eksplisit disebut dalam al-Quran.,in,[],[],[],3,163,216,[],[],https://twitter.com/market_demon/status/961518011298361344,False,,0,,,,,,,,[],,,,
961516101321474048,961516101321474048,2018-02-08 03:24:37 Eastern Standard Time,2018-02-08,03:24:37,-0500,4919234126,cnledger,cnLedger,,"Next time people tell you bitcoin is banned in China, show him this pic.  https://t.co/MC3Q2yzBcx",en,[],[],['https://pbs.twimg.com/media/DVf9P4fU8AA2eUP.jpg'],280,2537,4751,[],[],https://twitter.com/cnLedger/status/961516101321474048,False,,1,https://pbs.twimg.com/media/DVf9P4fU8AA2eUP.jpg,,,,,,,[],,,,
961515695103234048,961515695103234048,2018-02-08 03:23:00 Eastern Standard Time,2018-02-08,03:23:00,-0500,804699627404619776,mediumsqueeze,Bitcoin 1984 🌃,,"Draghi stated:  “However, recent developments, such as the listing of Bitcoin futures contracts by US exchanges, could lead European banks too to hold positions in Bitcoin, and therefore we will certainly look at that.”  https://t.co/F7Adh9kn99",en,[],['https://www.ccn.com/european-banks-soon-hold-bitcoin-admits-ecb-president/'],[],22,258,477,[],[],https://twitter.com/MediumSqueeze/status/961515695103234048,False,,0,,,,,,,,[],,,,
961514004144443392,961514004144443392,2018-02-08 03:16:17 Eastern Standard Time,2018-02-08,03:16:17,-0500,1856523530,capitalandceleb,CCN - Capital & Celeb News,,"European Banks Could Soon Hold Bitcoin, Admits ECB President  https://t.co/QFY1FmMI1q",en,[],['https://www.ccn.com/european-banks-soon-hold-bitcoin-admits-ecb-president/'],[],48,493,730,[],[],https://twitter.com/CapitalAndCeleb/status/961514004144443392,False,,0,,,,,,,,[],,,,
961470750979862529,961470750979862529,2018-02-08 00:24:24 Eastern Standard Time,2018-02-08,00:24:24,-0500,3473608753,bokujyuumai,墨汁うまい(Bokujyuumai),,速報:約12時間メンテナンスにより鯖落ちしているBinanceは現在データコピー中により更に10時間の長期メンテナンスが必要という見積もり。今回の不測の事態により取引開始前の30分間に各種通貨の引き出し猶予を与える #ビットコイン #仮想通貨 #Bitcoin #ブロックチェーン #イーサリアム #アルトコイン  https://t.co/z9m632QPRe,ja,[],['https://twitter.com/cz_binance/status/961461370834206720'],[],8,197,214,"['ビットコイン', '仮想通貨', 'bitcoin', 'ブロックチェーン', 'イーサリアム', 'アルトコイン']",[],https://twitter.com/bokujyuumai/status/961470750979862529,False,0,0,,,,,,,,[],,,,
961407619901599744,961407619901599744,2018-02-07 20:13:33 Eastern Standard Time,2018-02-07,20:13:33,-0500,961388181672353792,ccreditors,Carbon Creditors,,"5,000,000 initial carbon credit token giveaway! Follow, retweet and like this post, and comment with your waves address to receive your share of carbon credit!   #tokens #cryptocurrencies #cryptocontracts #bitcoin #altcoins #WavesPlatform #blockchain #hodl",en,[],[],[],1830,857,854,"['tokens', 'cryptocurrencies', 'cryptocontracts', 'bitcoin', 'altcoins', 'wavesplatform', 'blockchain', 'hodl']",[],https://twitter.com/CCreditors/status/961407619901599744,False,,0,,,,,,,,[],,,,
961385125241085955,961385125241085955,2018-02-07 18:44:10 Eastern Standard Time,2018-02-07,18:44:10,-0500,2800803747,nopara73,nopara73,,"""It's funny, because it's true."" 1. Open a bank account. Forget about it. A few years later you are broke. 2. Create a Bitcoin wallet. Forget about it. A few years later you are a millionaire.  https://t.co/I6Q3oh1BJ4",en,[],['https://twitter.com/nopara73/status/961375453238976518'],[],7,164,455,[],[],https://twitter.com/nopara73/status/961385125241085955,False,https://twitter.com/nopara73/status/961375453238976518,0,,,,,,,,[],,,,
961353052350394370,961348747421614080,2018-02-07 16:36:43 Eastern Standard Time,2018-02-07,16:36:43,-0500,14338147,satoshilite,Charlie Lee,,Merchant processors: Aliant Payments @AliantPayment BTCPay @BtcpayServer BitcoinPay @bitcoin_pay Coin Gate @CoinGatecom Coin Payments @CoinPaymentsNET Cointopay @Cointopay GoCoin @GoCoin LitePal @LitePalOfficial LitePay @LitePayInc ... and more to come!  🐔🚀🌕  #PayWithLitecoin  https://t.co/z6kppdyp5J,en,"[{'screen_name': 'btcpayserver', 'name': 'btcpay server', 'id': '939032087239131136'}, {'screen_name': 'bitcoin_pay', 'name': 'bitcoinpay', 'id': '2507209382'}, {'screen_name': 'coingatecom', 'name': 'coingate', 'id': '2278063088'}, {'screen_name': 'coinpaymentsnet', 'name': 'coinpayments', 'id': '1674504678'}, {'screen_name': 'cointopay', 'name': 'cointopay.com crypto', 'id': '2300506278'}, {'screen_name': 'gocoin', 'name': 'gocoin.com', 'id': '15836377'}]",[],['https://pbs.twimg.com/tweet_video_thumb/DVdpfdDVwAAvGRU.jpg'],86,445,1488,['paywithlitecoin'],[],https://twitter.com/SatoshiLite/status/961353052350394370,False,,1,https://pbs.twimg.com/tweet_video_thumb/DVdpfdDVwAAvGRU.jpg,,,,,,,[],,,,
961308573497221120,961308573497221120,2018-02-07 13:39:58 Eastern Standard Time,2018-02-07,13:39:58,-0500,176758255,rogerkver,Roger Ver,,Bitcoin (BCH) facts:  https://t.co/b69GEUyc6I,en,[],[],['https://pbs.twimg.com/media/DVdBDERU8AAwkSo.jpg'],652,290,1011,[],[],https://twitter.com/rogerkver/status/961308573497221120,False,,1,https://pbs.twimg.com/media/DVdBDERU8AAwkSo.jpg,,,,,,,[],,,,
961297809541656576,961297809541656576,2018-02-07 12:57:12 Eastern Standard Time,2018-02-07,12:57:12,-0500,1327359720,lisaabramowicz1,Lisa Abramowicz,,"Nearly 20 percent of people who own cryptocurrencies such as Bitcoin went into debt to buy it, or bought it on margin.  https://t.co/Gomp8Ino6I",en,[],['https://www.bloomberg.com/news/articles/2018-02-07/bitcoin-on-credit-for-20-percent-of-owners-that-s-a-yes'],[],28,173,174,[],[],https://twitter.com/lisaabramowicz1/status/961297809541656576,False,,0,,,,,,,,[],,,,
961287909381951488,961287909381951488,2018-02-07 12:17:52 Eastern Standard Time,2018-02-07,12:17:52,-0500,935069224384499712,friendz_ico,Friendz,,Friendz team just landed in Gibraltar! Come see us tomorrow at Blockchain and Bitcoin Conference!!!  #crypto #sale #ethereum #ICO #cryptocurrency #blockchain #TokenSale #friendzico #friendz  https://t.co/OMxncCyDOb,en,[],['https://twitter.com/Blockchain_Conf/status/956909353675583488'],[],9,1376,1448,"['crypto', 'sale', 'ethereum', 'ico', 'cryptocurrency', 'blockchain', 'tokensale', 'friendzico', 'friendz']",[],https://twitter.com/Friendz_ICO/status/961287909381951488,False,https://twitter.com/Blockchain_Conf/status/956909353675583488,0,,,,,,,,[],,,,
961284360493289472,961284360493289472,2018-02-07 12:03:45 Eastern Standard Time,2018-02-07,12:03:45,-0500,3367334171,btctn,Bitcoin News,,Leading Australian Banks Allow Customers to Purchase Cryptocurrencies  https://t.co/u1Z4VqZKAE #Bitcoin  https://t.co/SD0XfHZbQd,en,[],['http://ift.tt/2EmE6mX'],['https://pbs.twimg.com/media/DVcrB7fX0AEa9uI.jpg'],28,304,568,['bitcoin'],[],https://twitter.com/BTCTN/status/961284360493289472,False,,1,https://pbs.twimg.com/media/DVcrB7fX0AEa9uI.jpg,,,,,,,[],,,,
961259674480926723,961259674480926723,2018-02-07 10:25:40 Eastern Standard Time,2018-02-07,10:25:40,-0500,234470296,jaredctate,Jared Tate ©️,,Yesterday's #USSenate #crypto hearing looked very promising for real #blockchain technology such as #Bitcoin &amp; #DigiByte:  https://t.co/XKWtcFGumI,en,[],['https://techcrunch.com/2018/02/06/virtual-currencies-oversight-hearing-sec-cftc-bitcoin/'],[],33,220,482,"['ussenate', 'crypto', 'blockchain', 'bitcoin', 'digibyte']",[],https://twitter.com/jaredctate/status/961259674480926723,False,,0,,,,,,,,[],,,,
