id,conversation_id,created_at,date,time,timezone,user_id,username,name,place,tweet,language,mentions,urls,photos,replies_count,retweets_count,likes_count,hashtags,cashtags,link,retweet,quote_url,video,thumbnail,near,geo,source,user_rt_id,user_rt,retweet_id,reply_to,retweet_date,translate,trans_src,trans_dest
957733020177485825,957733020177485825,2018-01-28 16:52:00 Eastern Standard Time,2018-01-28,16:52:00,-0500,1469101279,aantonop,Andreas,,"The internet enabled the free flow of information, terrifying those who wanted to control communication. #Bitcoin enables the free flow of value, terrifying those who want to control your money.  Generations to come will see it as normal.  https://t.co/0w7P5oxoYo",en,[],['https://youtu.be/ONvg9SbauMg?t=10m24s'],[],152,2625,5200,['bitcoin'],[],https://twitter.com/aantonop/status/957733020177485825,False,,0,,,,,,,,[],,,,
957718463396462592,957718463396462592,2018-01-28 15:54:09 Eastern Standard Time,2018-01-28,15:54:09,-0500,1540951016,malwaretechblog,Marcus Hutchins,,Bitcoin Cash is a bit like setting up a burger stand outside the entrance to burger king and telling everyone you're the real burger king.,en,[],[],[],185,931,3573,[],[],https://twitter.com/MalwareTechBlog/status/957718463396462592,False,,0,,,,,,,,[],,,,
957693180673232899,957693180673232899,2018-01-28 14:13:42 Eastern Standard Time,2018-01-28,14:13:42,-0500,945249630085963776,deboer1988,Mdb,,#Ripple (#XRP) vs #Bitcoin (#BTC) vs #Ethereum (#ETH). Which will be market leader by the end of 2018? Please retweet to keep pole alive🙏. Feel free to explain your choice.,en,[],[],[],76,299,232,"['ripple', 'xrp', 'bitcoin', 'btc', 'ethereum', 'eth']",[],https://twitter.com/deboer1988/status/957693180673232899,False,,0,,,,,,,,[],,,,
957643602229911552,957643602229911552,2018-01-28 10:56:41 Eastern Standard Time,2018-01-28,10:56:41,-0500,941466099928809472,bitcoinprivate,Bitcoin Private [BTCP],,We are pleased to inform our community that the fork simulation was a total success! Tune in to our live-stream later today (details to come) for our first official Bitcoin Private conference and for the major announcement!,en,[],[],[],87,388,1022,[],[],https://twitter.com/bitcoinprivate/status/957643602229911552,False,,0,,,,,,,,[],,,,
957641831713525770,957641831713525770,2018-01-28 10:49:39 Eastern Standard Time,2018-01-28,10:49:39,-0500,176758255,rogerkver,Roger Ver,,"I wish BTC all the luck in the world, but it isn't the Bitcoin described in the Bitcoin white paper, and it isn't the Bitcoin that I devoted the last 7 years of my life to promoting.     Bitcoin is BCH  https://t.co/sWkGZbl8zX",en,[],[],['https://pbs.twimg.com/media/DUo5hNjW4AIaPv7.jpg'],1143,566,1998,[],[],https://twitter.com/rogerkver/status/957641831713525770,False,,1,https://pbs.twimg.com/media/DUo5hNjW4AIaPv7.jpg,,,,,,,[],,,,
957629551013744642,957629551013744642,2018-01-28 10:00:51 Eastern Standard Time,2018-01-28,10:00:51,-0500,205789121,money,Money,,"Meet Litecoin, a faster Bitcoin that gamers love  https://t.co/J9NE97LWWi",en,[],['http://money.us/2FlUi4G'],[],107,876,2399,[],[],https://twitter.com/Money/status/957629551013744642,False,,0,,,,,,,,[],,,,
957617261317107713,957617261317107713,2018-01-28 09:12:01 Eastern Standard Time,2018-01-28,09:12:01,-0500,19132398,brucefenton,Bruce Fenton,,"If you had invested $100 in Bitcoin on this day in 2011...  you'd have likely sold at $200.  Buying is easy, HODLing takes skill.",en,[],[],[],102,707,2930,[],[],https://twitter.com/brucefenton/status/957617261317107713,False,,0,,,,,,,,[],,,,
957588570843295744,957588570843295744,2018-01-28 07:18:01 Eastern Standard Time,2018-01-28,07:18:01,-0500,5988062,theeconomist,The Economist,,People are buying Bitcoin because they expect other people to buy it from them at a higher price. This is foolish  https://t.co/hUnvqpD9Fx,en,[],['http://econ.st/2ngJIo9'],[],87,557,887,[],[],https://twitter.com/TheEconomist/status/957588570843295744,False,,0,,,,,,,,[],,,,
957558637282541569,957558637282541569,2018-01-28 05:19:04 Eastern Standard Time,2018-01-28,05:19:04,-0500,1856523530,capitalandceleb,CCN - Capital & Celeb News,,Indian Bitcoin Exchange Zebpay Adds Litecoin Support  https://t.co/KGDmDZT4zT,en,[],['https://www.ccn.com/popular-indian-bitcoin-trading-platform-adds-litecoin-support/'],[],43,441,1318,[],[],https://twitter.com/CapitalAndCeleb/status/957558637282541569,False,,0,,,,,,,,[],,,,
957515906367873024,957515906367873024,2018-01-28 02:29:16 Eastern Standard Time,2018-01-28,02:29:16,-0500,66106683,simondixontwitt,Simon Dixon (Beware Impersonators),,I think #Bitcoin Companies are more likely to acquire banks than banks are to acquire $BTC companies in the next 5 years. This is disruption at the highest level.  https://t.co/0vOKIZizNV,en,[],[],['https://pbs.twimg.com/media/DUnHonoXUAALEiY.jpg'],45,296,788,['bitcoin'],['btc'],https://twitter.com/SimonDixonTwitt/status/957515906367873024,False,,1,https://pbs.twimg.com/media/DUnHonoXUAALEiY.jpg,,,,,,,[],,,,
957480357833728000,957480357833728000,2018-01-28 00:08:01 Eastern Standard Time,2018-01-28,00:08:01,-0500,808574239959871489,cloudbasedjames,JM☁🚀💰,,#Coinbase vs. #Robinhood. Here we Go!  https://t.co/Yf5ad50ime #cryptocurrency #CryptoNews #robinhoodapp #cryptoexchange #cryptocurrencies #bitcoin #Ethereum #xrp #ripple  https://t.co/fN9be5AiOa,en,[],['https://medium.com/@jamesmigliore/coinbase-vs-robinhood-4eda923d44a7'],['https://pbs.twimg.com/media/DUmmscVW4AEZdvT.jpg'],32,152,359,"['coinbase', 'robinhood', 'cryptocurrency', 'cryptonews', 'robinhoodapp', 'cryptoexchange', 'cryptocurrencies', 'bitcoin', 'ethereum', 'xrp', 'ripple']",[],https://twitter.com/cloudbasedjames/status/957480357833728000,False,,1,https://pbs.twimg.com/media/DUmmscVW4AEZdvT.jpg,,,,,,,[],,,,
957440592728018946,957440592728018946,2018-01-27 21:30:00 Eastern Standard Time,2018-01-27,21:30:00,-0500,941466099928809472,bitcoinprivate,Bitcoin Private [BTCP],,We're pleased to release the Zlassic Electrum Wallet Beta to our community! Available to download here:  https://t.co/FbCHu7CeYg Stay tuned for one more update before our major announcement taking place tomorrow at our first ever Bitcoin Private conference (will be live-streamed).  https://t.co/HT9rEeyxfF,en,[],['https://github.com/BTCP-community/electrum-zcl/releases/tag/Z!1.0.0'],['https://pbs.twimg.com/media/DUmCXI7UQAEnACP.jpg'],142,421,976,[],[],https://twitter.com/bitcoinprivate/status/957440592728018946,False,,1,https://pbs.twimg.com/media/DUmCXI7UQAEnACP.jpg,,,,,,,[],,,,
957377697759612933,957377697759612933,2018-01-27 17:20:05 Eastern Standard Time,2018-01-27,17:20:05,-0500,40742821,tuurdemeester,Tuur Demeester,,"Bitcoin is the revenge of the nerds: no politics, just code.",en,[],[],[],92,547,2029,[],[],https://twitter.com/TuurDemeester/status/957377697759612933,False,,0,,,,,,,,[],,,,
957368014235688965,957368014235688965,2018-01-27 16:41:36 Eastern Standard Time,2018-01-27,16:41:36,-0500,23618940,lopp,Jameson Lopp,,Some predictions state that there will be 50+ forks of Bitcoin's blockchain this year. If only they knew...  https://t.co/sYF0jH17mt,en,[],[],['https://pbs.twimg.com/tweet_video_thumb/DUlA_ZEX0AMiuz7.jpg'],32,142,546,[],[],https://twitter.com/lopp/status/957368014235688965,False,,1,https://pbs.twimg.com/tweet_video_thumb/DUlA_ZEX0AMiuz7.jpg,,,,,,,[],,,,
957344967093030912,957344967093030912,2018-01-27 15:10:01 Eastern Standard Time,2018-01-27,15:10:01,-0500,18856867,zerohedge,zerohedge,,Tokyo Office Building Sells For 547 Bitcoin  https://t.co/8X56aeYOeB,en,[],['https://www.zerohedge.com/news/2018-01-27/tokyo-office-building-sells-547-bitcoin'],[],11,138,198,[],[],https://twitter.com/zerohedge/status/957344967093030912,False,,0,,,,,,,,[],,,,
957311641946902528,957311641946902528,2018-01-27 12:57:36 Eastern Standard Time,2018-01-27,12:57:36,-0500,859484337850523648,crypto_rand,Crypto Rand,,Hedge funds go bullish on #Bitcoin futures   https://t.co/z0AjSr1WIu,en,[],['https://www.wsj.com/articles/hedge-funds-go-bullish-on-bitcoin-futures-1517006939'],[],25,210,451,['bitcoin'],[],https://twitter.com/crypto_rand/status/957311641946902528,False,,0,,,,,,,,[],,,,
957307894973784066,957307894973784066,2018-01-27 12:42:42 Eastern Standard Time,2018-01-27,12:42:42,-0500,25053299,fortunemagazine,FORTUNE,,Starbucks chairman says cryptocurrency will be big — just not bitcoin  https://t.co/NRl7YYkT89,en,[],['http://for.tn/2Go37wa'],[],46,217,409,[],[],https://twitter.com/FortuneMagazine/status/957307894973784066,False,,0,,,,,,,,[],,,,
957302189168386048,957302189168386048,2018-01-27 12:20:02 Eastern Standard Time,2018-01-27,12:20:02,-0500,20402945,cnbc,CNBC,,"If you own bitcoin, here’s how much you owe in taxes  https://t.co/oFxXAGfAeu",en,[],[],[],62,240,271,[],[],https://twitter.com/CNBC/status/957302189168386048,False,,1,https://pbs.twimg.com/media/DUfxKCsVQAAVtAM.jpg,,,,,,,[],,,,
957295285344133120,957295285344133120,2018-01-27 11:52:36 Eastern Standard Time,2018-01-27,11:52:36,-0500,40742821,tuurdemeester,Tuur Demeester,,"Underground Bitcoin mining farms in Venezuela ""easily in the thousands and possibly over one hundred thousand"".  https://t.co/dyn8w7ItOF",en,[],['https://hackernoon.com/extortion-police-raids-and-secrecy-inside-the-venezuelan-bitcoin-mining-world-6e97a25e7402'],[],19,155,249,[],[],https://twitter.com/TuurDemeester/status/957295285344133120,False,,0,,,,,,,,[],,,,
957257121623691264,957257121623691264,2018-01-27 09:20:57 Eastern Standard Time,2018-01-27,09:20:57,-0500,22682896,charlieshrem,Charlie Shrem,,My wife can attest to this #bitcoin #hodl  https://t.co/JgCvgHpfz0,en,[],[],['https://pbs.twimg.com/media/DUjcGxpW4AAhSxU.jpg'],54,331,1269,"['bitcoin', 'hodl']",[],https://twitter.com/CharlieShrem/status/957257121623691264,False,,1,https://pbs.twimg.com/media/DUjcGxpW4AAhSxU.jpg,,,,,,,[],,,,
957230478989312000,957230478989312000,2018-01-27 07:35:05 Eastern Standard Time,2018-01-27,07:35:05,-0500,19224439,nouriel,Nouriel Roubini,,"Agreed: the whole cryptocurrencies/bitcoin/ICO bubble is driven by the FOMO, Fear Of Missing Out, by small clueless investors/suckers being conned by an army of conflicted insiders, scammers, swindlers, criminals, carnival barkers &amp; pump-and-dump conmen   https://t.co/2EkEuUSUo8",en,[],['https://www.marketwatch.com/story/most-icos-are-unjustified-but-soaring-due-to-fomo-2018-01-23'],[],37,208,307,[],[],https://twitter.com/Nouriel/status/957230478989312000,False,,0,,,,,,,,[],,,,
957210428140027905,957210428140027905,2018-01-27 06:15:24 Eastern Standard Time,2018-01-27,06:15:24,-0500,5988062,theeconomist,The Economist,,People are buying Bitcoin because they expect other people to buy it from them at a higher price. This is foolish  https://t.co/hvx0c0lWYZ,en,[],['http://econ.st/2BvcKFJ'],[],121,493,738,[],[],https://twitter.com/TheEconomist/status/957210428140027905,False,,0,,,,,,,,[],,,,
957204243068329984,957204243068329984,2018-01-27 05:50:50 Eastern Standard Time,2018-01-27,05:50:50,-0500,900521261842825216,andy_hoffman_cg,Andy Hoffman,,"The whole world is on to you, @rogerkver and @dollarvigilante.  The entire, global #Bitcoin community KNOWS you are planning a new BCH pump/#BTC dump at, or just before Anarchapulco 2/15 - and will be READY.  Try it, we dare you!",en,"[{'screen_name': 'rogerkver', 'name': 'roger ver', 'id': '176758255'}, {'screen_name': 'dollarvigilante', 'name': 'the dollar vigilante', 'id': '199152706'}]",[],[],52,233,554,"['bitcoin', 'btc']",[],https://twitter.com/Andy_Hoffman_CG/status/957204243068329984,False,,0,,,,,,,,[],,,,
957195180247015424,957195180247015424,2018-01-27 05:14:49 Eastern Standard Time,2018-01-27,05:14:49,-0500,2799211554,whalepanda,WhalePanda,,"$1 fee to move 40k #Bitcoin ($440M), the fees are too damn high but Segwit is unfairly cheap.  https://t.co/J8CWH3Or9v",en,[],['https://twitter.com/khannib/status/957186970672947200'],[],20,150,636,['bitcoin'],[],https://twitter.com/WhalePanda/status/957195180247015424,False,https://twitter.com/khannib/status/957186970672947200,0,,,,,,,,[],,,,
957186881271320578,957186881271320578,2018-01-27 04:41:50 Eastern Standard Time,2018-01-27,04:41:50,-0500,121881179,canyilmaz1,Can Yılmaz,,"Aynı adamların birbirinden apayrı binlerce konu hakkında bilgi sahibi ! olup, bir otorite gibi tv lerde yorum yapmalarından sıkılmadınız mı? Tsunami,Afrin, beyaz ekmek, eğitim, Paris iklim anlaşması, kar lastiği, futbol, kanaviçe, Merkel, bitcoin, hayvancılık... Herşeyi biliyor",tr,[],[],[],154,894,5337,[],[],https://twitter.com/canyilmaz1/status/957186881271320578,False,,0,,,,,,,,[],,,,
957150757890879488,957150757890879488,2018-01-27 02:18:18 Eastern Standard Time,2018-01-27,02:18:18,-0500,2207129125,cointelegraph,Cointelegraph,,Chinese Buyers are Still Investing in #Bitcoin and #Cryptocurrency Through Hong Kong OTC Exchanges  https://t.co/iXPRr2d5hU,en,[],['https://cointelegraph.com/news/how-chinese-bitcoin-buyers-are-getting-around-government-ban'],[],32,235,464,"['bitcoin', 'cryptocurrency']",[],https://twitter.com/Cointelegraph/status/957150757890879488,False,,0,,,,,,,,[],,,,
957073358234951680,957073358234951680,2018-01-26 21:10:44 Eastern Standard Time,2018-01-26,21:10:44,-0500,4919234126,cnledger,cnLedger,,"Former director at Institute of Financial Sciences, China's Ministry of Finance: It's impossible to truly ban bitcoin. We must pay close attention to the blockchain technology.  https://t.co/iUxbWe1sNE",en,[],['http://finance.ifeng.com/a/20180127/15951366_0.shtml'],[],8,231,411,[],[],https://twitter.com/cnLedger/status/957073358234951680,False,,0,,,,,,,,[],,,,
957072173809664001,957072173809664001,2018-01-26 21:06:02 Eastern Standard Time,2018-01-26,21:06:02,-0500,11250462,aloria,aloria,,Dinner with my aunt; she asked me what bitcoin is. I told her it was once pronounced actually pronounced “beet-KWAAN” and started as a bartering system for French peasants. Now she’s mad at me.,en,[],[],[],22,147,861,[],[],https://twitter.com/aloria/status/957072173809664001,False,,0,,,,,,,,[],,,,
957001728406245391,957001728406245391,2018-01-26 16:26:06 Eastern Standard Time,2018-01-26,16:26:06,-0500,475094271,maxekaplan,Max Kaplan,,Asking a CEO of a bank what they think of #Bitcoin is like asking the CEO of a taxi company what they think of Uber.,en,[],[],[],146,2310,6132,['bitcoin'],[],https://twitter.com/maxekaplan/status/957001728406245391,False,,0,,,,,,,,[],,,,
956998119866150912,956998119866150912,2018-01-26 16:11:46 Eastern Standard Time,2018-01-26,16:11:46,-0500,19026149,hackerfantastic,Hacker Fantastic,,"2,982 bitcoin miners exposed to the Internet, have factory default credentials of ""root/root"" and an insecure unsigned firmware update process... this is going to end in tears.  https://t.co/iuWHIDipjp",en,[],[],['https://pbs.twimg.com/media/DUfv_TTWsAAPUCx.jpg'],110,1739,2277,[],[],https://twitter.com/hackerfantastic/status/956998119866150912,False,,1,https://pbs.twimg.com/media/DUfv_TTWsAAPUCx.jpg,,,,,,,[],,,,
956983694304202752,956983694304202752,2018-01-26 15:14:27 Eastern Standard Time,2018-01-26,15:14:27,-0500,23618940,lopp,Jameson Lopp,,Some folks get really upset when their mental model of Bitcoin is proven to be flawed. Especially if they had convinced themselves that they were important / wielded power over the system. Seek the Tao of Bitcoin; realize it is outside of your control.,en,[],[],[],38,173,829,[],[],https://twitter.com/lopp/status/956983694304202752,False,,0,,,,,,,,[],,,,
956965317955276803,956965317955276803,2018-01-26 14:01:26 Eastern Standard Time,2018-01-26,14:01:26,-0500,65698096,splcenter,Southern Poverty Law Center,,"We are monitoring more than 200 so-called “alt-right” bitcoin wallets. “Some folks are getting straight off rich from their bitcoin accounts, which will fuel their ugly activities.”  https://t.co/J43ZY0H0Qt",en,[],['https://www.theguardian.com/commentisfree/2018/jan/24/bitcoin-currency-far-right-neo-nazis-cryptocurrencies'],[],31,164,178,[],[],https://twitter.com/splcenter/status/956965317955276803,False,,0,,,,,,,,[],,,,
956951309256622080,956951309256622080,2018-01-26 13:05:46 Eastern Standard Time,2018-01-26,13:05:46,-0500,238782335,mattbellassai,Matt Bellassai,,"a cab driver tried to talk to me about bitcoin and i had to be like ""please sir, can we talk about something i understand like clouds or soups""",en,[],[],[],24,415,4403,[],[],https://twitter.com/MattBellassai/status/956951309256622080,False,,0,,,,,,,,[],,,,
956937168680865792,956937168680865792,2018-01-26 12:09:34 Eastern Standard Time,2018-01-26,12:09:34,-0500,2287224893,th3acist,Ian,,"Coinbase spent so much time acting like Bitcoin was MySpace, THEY became MySpace...",en,[],[],[],59,232,1321,[],[],https://twitter.com/Th3Acist/status/956937168680865792,False,,0,,,,,,,,[],,,,
956881847119765511,956881847119765511,2018-01-26 08:29:45 Eastern Standard Time,2018-01-26,08:29:45,-0500,73886724,sylvqin,𝙨𝙮𝙡𝙫𝙖𝙞𝙣,,nutella is the new bitcoin,en,[],[],[],8,197,932,[],[],https://twitter.com/Sylvqin/status/956881847119765511,False,,0,,,,,,,,[],,,,
956844943565316096,956844943565316096,2018-01-26 06:03:06 Eastern Standard Time,2018-01-26,06:03:06,-0500,34713362,business,Bloomberg,,Cryptocurrencies slump after one of Japan's biggest Bitcoin exchanges halts withdrawals  https://t.co/ygbKYvvfL6  https://t.co/gD9aH6VmyJ,en,[],['https://bloom.bg/2nekuYb'],['https://pbs.twimg.com/media/DUdlZ2iW4AAGLwS.jpg'],57,199,188,[],[],https://twitter.com/business/status/956844943565316096,False,,1,https://pbs.twimg.com/media/DUdlZ2iW4AAGLwS.jpg,,,,,,,[],,,,
956829257929576448,956829257929576448,2018-01-26 05:00:46 Eastern Standard Time,2018-01-26,05:00:46,-0500,20902138,alistairmilne,Alistair Milne,,Someone has opened nearly 4000 BTC of shorts vs USD since around 8am. We are either being front-run or they want to cause panic #bitcoin #bitfinex,en,[],[],[],108,298,673,"['bitcoin', 'bitfinex']",[],https://twitter.com/alistairmilne/status/956829257929576448,False,,0,,,,,,,,[],,,,
956819505107341312,956819505107341312,2018-01-26 04:22:01 Eastern Standard Time,2018-01-26,04:22:01,-0500,859484337850523648,crypto_rand,Crypto Rand,,Really interesting breakdown about #Bitcoin  futures &amp; contract expiration in some hours. Source:  https://t.co/yrIWSevklc  https://t.co/MM9eafs65K,en,[],['https://www.reddit.com/r/Bitcoin/comments/7syd2c/expiring_futures_tomorrow_not_so_fast/'],['https://pbs.twimg.com/media/DUdOJvoW0AAAaie.jpg'],38,222,481,['bitcoin'],[],https://twitter.com/crypto_rand/status/956819505107341312,False,,1,https://pbs.twimg.com/media/DUdOJvoW0AAAaie.jpg,,,,,,,[],,,,
956796777025347589,956796777025347589,2018-01-26 02:51:42 Eastern Standard Time,2018-01-26,02:51:42,-0500,169312819,jillrgunter,Jill Gunter,,"If you work on blockchain tech, read this. If you have made money off of crypto, read this. If you don’t know what bitcoin is good for, read this. If you think we are in a bubble, read this.  This is what it’s all about.  🇻🇪♥️   https://t.co/SRzGxNClya",en,[],['https://hackernoon.com/extortion-police-raids-and-secrecy-inside-the-venezuelan-bitcoin-mining-world-6e97a25e7402'],[],18,179,492,[],[],https://twitter.com/jillrgunter/status/956796777025347589,False,,0,,,,,,,,[],,,,
956795092454510592,956795092454510592,2018-01-26 02:45:01 Eastern Standard Time,2018-01-26,02:45:01,-0500,18856867,zerohedge,zerohedge,,"Theresa May: We're ""Very Seriously"" Considering Action On Bitcoin  https://t.co/FbVQjPewUR",en,[],['https://www.zerohedge.com/news/2018-01-25/theresa-may-were-very-seriously-considering-action-bitcoin'],[],67,123,138,[],[],https://twitter.com/zerohedge/status/956795092454510592,False,,0,,,,,,,,[],,,,
956704561162522624,956704561162522624,2018-01-25 20:45:16 Eastern Standard Time,2018-01-25,20:45:16,-0500,14293310,time,TIME,,50 Cent forgot about those Bitcoin he got in 2014 and now they're worth $8 million  https://t.co/RUgugtVMnZ,en,[],['http://ti.me/2Fc1NLy'],[],31,126,395,[],[],https://twitter.com/TIME/status/956704561162522624,False,,0,,,,,,,,[],,,,
956694351463067653,956694351463067653,2018-01-25 20:04:42 Eastern Standard Time,2018-01-25,20:04:42,-0500,2163374389,existentialcoms,Existential Comics,,Making money off Bitcoin speculation is the ultimate libertarian wet dream because you can get fantastically rich without producing anything useful for society.,en,[],[],[],86,1029,3692,[],[],https://twitter.com/existentialcoms/status/956694351463067653,False,,0,,,,,,,,[],,,,
956657903951335425,956657903951335425,2018-01-25 17:39:52 Eastern Standard Time,2018-01-25,17:39:52,-0500,16732770,cnbcfastmoney,CNBC's Fast Money,,"So-called Bitcoin Oracle @VinnyLingham gives his predictions for #bitcoin and #bitcoincash, and plays a game of buy, sell, hodl with the traders  https://t.co/a8X0P097Wb",en,"[{'screen_name': 'vinnylingham', 'name': 'vinny lingham', 'id': '1854401'}]",[],[],377,451,1176,"['bitcoin', 'bitcoincash']",[],https://twitter.com/CNBCFastMoney/status/956657903951335425,False,,1,https://pbs.twimg.com/amplify_video_thumb/956657223018561536/img/PBpF_MO5hfZjjn25.jpg,,,,,,,[],,,,
956647900892741632,956647900892741632,2018-01-25 17:00:07 Eastern Standard Time,2018-01-25,17:00:07,-0500,54882396,shuumai,しゅうまい君,,Bitcoinの通貨はクズ,ja,[],[],[],17,492,1150,[],[],https://twitter.com/shuumai/status/956647900892741632,False,,0,,,,,,,,[],,,,
956629337058500608,956629337058500608,2018-01-25 15:46:21 Eastern Standard Time,2018-01-25,15:46:21,-0500,18946913,jameswester,James Wester,,"Do people at Davos think world leaders dissing bitcoin is going to hurt it? I mean, isn't it like dad telling his teenage daughter not to date a drummer?",en,[],[],[],68,273,1070,[],[],https://twitter.com/jameswester/status/956629337058500608,False,,0,,,,,,,,[],,,,
956617807306854400,956617807306854400,2018-01-25 15:00:33 Eastern Standard Time,2018-01-25,15:00:33,-0500,820282353436200960,bitstein,Bitstein,,Imagine being bearish on Bitcoin on a day like this.  * BitGo acquiring Kingdom Trust Co. * GDAX partnering with Trading Technologies * Acinq releasing Strike for Lightning payments * Robinhood adding cryptocurrency trading  What a day! And it's only 2PM here in Texas!,en,[],[],[],16,159,579,[],[],https://twitter.com/bitstein/status/956617807306854400,False,,0,,,,,,,,[],,,,
956609701655011329,956609701655011329,2018-01-25 14:28:20 Eastern Standard Time,2018-01-25,14:28:20,-0500,47539748,bill_gross,Bill Gross,,"""Bitcoin is one of the most audacious, generous, and profound inventions that I’ve witnessed in my career, and it has the ability to help many, many people. We’re only 9 yrs into this experiment, but it’s remarklable how many things it has accomplished.."" Neil Rimer #WEF18 #Davos  https://t.co/X8CPx6SkL1",en,[],[],['https://pbs.twimg.com/media/DUaPa8PW4AQNY5g.jpg'],27,613,1379,"['wef18', 'davos']",[],https://twitter.com/Bill_Gross/status/956609701655011329,False,,1,https://pbs.twimg.com/media/DUaPa8PW4AQNY5g.jpg,,,,,,,[],,,,
956594364805013504,956594364805013504,2018-01-25 13:27:23 Eastern Standard Time,2018-01-25,13:27:23,-0500,770190164043898880,acinq_co,ACINQ,,Introducing strike: a stripe-like API for ⚡️Lightning    https://t.co/ZSFAaAVwJ9  #bitcoin #lightning  https://t.co/CWkBl44XO1,en,[],['https://medium.com/@ACINQ/introducing-strike-a-stripe-like-api-for-lightning-c84762f4f634'],[],31,294,726,"['bitcoin', 'lightning']",[],https://twitter.com/acinq_co/status/956594364805013504,False,,1,https://pbs.twimg.com/ext_tw_video_thumb/956594308236398593/pu/img/exmiuArO5bMjaEJ1.jpg,,,,,,,[],,,,
956593866479755264,956593866479755264,2018-01-25 13:25:25 Eastern Standard Time,2018-01-25,13:25:25,-0500,940216253318393856,bitcoinote,BitcoiNote (BTCN),,"💥 Announcing the first BitcoiNote AIRDROP! 💥   Up to 1,000 participants can claim free BTCN NOW:  https://t.co/bxHB5kHEfG  #BitcoiNote #airdrop #airdropalert #airdrops #crypto #cryptocurrencies #blockchain #Bitcoin #BTC  https://t.co/xl4wZPYNeN",en,[],['http://bit.ly/BTCN-Airdrop-1'],['https://pbs.twimg.com/media/DUZ_Xg6WsAEtKvQ.jpg'],192,641,394,"['bitcoinote', 'airdrop', 'airdropalert', 'airdrops', 'crypto', 'cryptocurrencies', 'blockchain', 'bitcoin', 'btc']",[],https://twitter.com/BitcoiNote/status/956593866479755264,False,,1,https://pbs.twimg.com/media/DUZ_Xg6WsAEtKvQ.jpg,,,,,,,[],,,,
956576262717366273,956576262717366273,2018-01-25 12:15:28 Eastern Standard Time,2018-01-25,12:15:28,-0500,40742821,tuurdemeester,Tuur Demeester,,"Stock trading app Robin Hood is going after Coinbase: ""will let you buy and sell Bitcoin and Ethereum without any added transaction fees starting in February, compared to Coinbase’s 1.5 to 4 percent fees in the US""  https://t.co/Z7LnVVn48x",en,[],['https://techcrunch.com/2018/01/25/free-cryptocurrency-trading-app/'],[],126,846,2279,[],[],https://twitter.com/TuurDemeester/status/956576262717366273,False,,0,,,,,,,,[],,,,
956576181415038976,956576181415038976,2018-01-25 12:15:08 Eastern Standard Time,2018-01-25,12:15:08,-0500,20402945,cnbc,CNBC,,Robinhood will launch bitcoin and ethereum trading in 5 states in February  https://t.co/qGLgVnGHBQ via @cnbctech  https://t.co/lOBPNIEfbf,en,"[{'screen_name': 'cnbctech', 'name': 'cnbc tech', 'id': '19962813'}]",['http://cnb.cx/2Ea0o8S'],['https://pbs.twimg.com/media/DUZw94pU8AEwxhi.jpg'],44,226,504,[],[],https://twitter.com/CNBC/status/956576181415038976,False,,1,https://pbs.twimg.com/media/DUZw94pU8AEwxhi.jpg,,,,,,,[],,,,
