id,conversation_id,created_at,date,time,timezone,user_id,username,name,place,tweet,language,mentions,urls,photos,replies_count,retweets_count,likes_count,hashtags,cashtags,link,retweet,quote_url,video,thumbnail,near,geo,source,user_rt_id,user_rt,retweet_id,reply_to,retweet_date,translate,trans_src,trans_dest
1051645172834951170,1051645172834951170,2018-10-14 21:25:22 Eastern Daylight Time,2018-10-14,21:25:22,-0500,191718288,sam_feldman_,Sam Feldman 🎈,,Bitcoin all-time price graph (August 2010 – October 2018).  $BTC @APompliano @TheCryptoDog  https://t.co/0VMxhbNgWS,en,"[{'screen_name': 'apompliano', 'name': 'pomp 🌪', 'id': '339061487'}, {'screen_name': 'thecryptodog', 'name': 'the crypto dog☽', 'id': '887748030304329728'}]",[],[],23,383,898,[],['btc'],https://twitter.com/sam_feldman_/status/1051645172834951170,False,,1,https://pbs.twimg.com/ext_tw_video_thumb/1051645030052454400/pu/img/1ttbI4IRoBWeKihG.jpg,,,,,,,[],,,,
1051545313951997953,1051221081149857792,2018-10-14 14:48:34 Eastern Daylight Time,2018-10-14,14:48:34,-0500,61417559,erikvoorhees,Erik Voorhees,,"@Nouriel Interesting. I presented on Bitcoin at NYU, where you profess, in early 2013. Any student there who bought any would be up 200x and could simultaneously pay off his NYU student debt and afford a ticket to one of your hot tub parties. Keep cherry picking data, Professor.",en,[],[],[],50,248,2062,[],[],https://twitter.com/ErikVoorhees/status/1051545313951997953,False,,0,,,,,,,,"[{'screen_name': 'Nouriel', 'name': 'Nouriel Roubini', 'id': '19224439'}]",,,,
1051541861163298818,1051541861163298818,2018-10-14 14:34:51 Eastern Daylight Time,2018-10-14,14:34:51,-0500,147997340,jonlehtinen,Jon Lehtinen,,Shutting down bitcoin would get us 1 full year’s worth of progress toward limiting the impact of climate change to 2c this century. Overnight.,en,[],[],[],21,157,308,[],[],https://twitter.com/jonlehtinen/status/1051541861163298818,False,https://twitter.com/davidgerard/status/1051539087394566145,0,,,,,,,,[],,,,
1051539087394566145,1051539087394566145,2018-10-14 14:23:49 Eastern Daylight Time,2018-10-14,14:23:49,-0500,14723614,davidgerard,your #1 source for absurdist true crime 🐍👑 🌷,,"“Bitcoin is made from ashes, and if ashes were legal tender, humanity would burn everything in sight and call it progress.”  https://t.co/YTFVMiRkDe",en,[],['https://sluggerotoole.com/2018/10/12/bitcoin-must-die/'],[],7,136,241,[],[],https://twitter.com/davidgerard/status/1051539087394566145,False,,0,,,,,,,,[],,,,
1051533544596656128,1051533544596656128,2018-10-14 14:01:48 Eastern Daylight Time,2018-10-14,14:01:48,-0500,30866801,matiastrader,Matias ☣,,Attacking Bitcoin since it was below $100.  https://t.co/wcBX8ik7ar,en,[],[],['https://pbs.twimg.com/media/DpfMJ0OXgAUVjeC.jpg'],31,175,809,[],[],https://twitter.com/MatiasTrader/status/1051533544596656128,False,,1,https://pbs.twimg.com/media/DpfMJ0OXgAUVjeC.jpg,,,,,,,[],,,,
1051497055200468994,1051497055200468994,2018-10-14 11:36:48 Eastern Daylight Time,2018-10-14,11:36:48,-0500,2307692107,blockstream,Blockstream,,"To transfer $BTC onto the #LiquidNetwork #sidechain via the 2-way peg, the BTC is deposited into a multisig peg address. After 102 confirmations, $LBTC is transferred for the user. To peg out onto the #Bitcoin #blockchain, only 2 Liquid confirmations are required. ⛓️  https://t.co/MPIegqeOuV",en,[],[],['https://pbs.twimg.com/tweet_video_thumb/DpeluCGXcAA3bbP.jpg'],30,178,559,"['liquidnetwork', 'sidechain', 'bitcoin', 'blockchain']","['btc', 'lbtc']",https://twitter.com/Blockstream/status/1051497055200468994,False,,1,https://pbs.twimg.com/tweet_video_thumb/DpeluCGXcAA3bbP.jpg,,,,,,,[],,,,
1051460386489331713,1051460386489331713,2018-10-14 09:11:05 Eastern Daylight Time,2018-10-14,09:11:05,-0500,19224439,nouriel,Nouriel Roubini,,"So the cost per transaction of bitcoin is literally $60. So if I were to buy a $3 latte at Starbucks I would have to pay $63 to get it!  So the myth of a ""Brilliant new technology that reduces the vast fees of legacy financial systems""! turns out to be a Big Fat Lie!",en,[],[],[],436,207,507,[],[],https://twitter.com/Nouriel/status/1051460386489331713,False,https://twitter.com/Tr0llyTr0llFace/status/1051458999760146432,0,,,,,,,,[],,,,
1051415163503603712,1051415163503603712,2018-10-14 06:11:23 Eastern Daylight Time,2018-10-14,06:11:23,-0500,992741542094819334,kubitx,KuBitX,,KuBitX is changing the narrative for emerging markets.  Join the train. #soulfulsunday   https://t.co/A8Vou22M5A  #cryptocurrency #bitcoin #ethereum #kbx #cryptoexchange #ico #pre_ico  https://t.co/K3Eu0a9Tk5,en,[],['http://t.me/kubitx_official'],['https://pbs.twimg.com/media/Dpdggk-WsAAzu_y.jpg'],7,316,378,"['soulfulsunday', 'cryptocurrency', 'bitcoin', 'ethereum', 'kbx', 'cryptoexchange', 'ico', 'pre_ico']",[],https://twitter.com/kubitx/status/1051415163503603712,False,,1,https://pbs.twimg.com/media/Dpdggk-WsAAzu_y.jpg,,,,,,,[],,,,
1051222570282807296,1051222570282807296,2018-10-13 17:26:06 Eastern Daylight Time,2018-10-13,17:26:06,-0500,72515407,bitfurygeorge,George Kikvadze ⛏⚡,,"Hey ⁦@Nouriel⁩ before going out and making complete fool of yourself (again) &amp; calling Bitcoin money for criminals, how about you read up on the UK Treasury Report placing Bitcoin as Lowest Risk for Money Laundering while Banks as Highest 😭 Pls RT so Dr Doom gets educated  https://t.co/7nELdefQb9",en,"[{'screen_name': 'nouriel', 'name': 'nouriel roubini', 'id': '19224439'}]",[],['https://pbs.twimg.com/media/DpaxW1HUUAA4ekA.jpg'],23,324,650,[],[],https://twitter.com/BitfuryGeorge/status/1051222570282807296,False,,1,https://pbs.twimg.com/media/DpaxW1HUUAA4ekA.jpg,,,,,,,[],,,,
1051161288167120896,1051059968298889216,2018-10-13 13:22:35 Eastern Daylight Time,2018-10-13,13:22:35,-0500,386728215,fluffypony,"phluffypony.lmdb (🖖,🖖)",,"@andrewgdotcom What if we stopped printing plastic credit cards that expire every couple of years, if we stopped producing machines to swipe those cards, if we stopped producing paper for printed credit card receipts, and just used Bitcoin instead? I think you’re backing the wrong pony, Andrew.",en,[],[],[],57,140,1197,[],[],https://twitter.com/fluffypony/status/1051161288167120896,False,,0,,,,,,,,"[{'screen_name': 'andrewgdotcom', 'name': 'Andrew Gallagher', 'id': '15263795'}]",,,,
1051155319328526337,1051155319328526337,2018-10-13 12:58:52 Eastern Daylight Time,2018-10-13,12:58:52,-0500,23618940,lopp,Jameson Lopp,,Bitcoin is not going to succeed due to its proponents engaging in successful debates with skeptics and antagonists. It will succeed by offering a superior product to the global market that outcompetes banks and nation states.,en,[],[],[],117,609,2647,[],[],https://twitter.com/lopp/status/1051155319328526337,False,,0,,,,,,,,[],,,,
1051137217719140352,1051137217719140352,2018-10-13 11:46:56 Eastern Daylight Time,2018-10-13,11:46:56,-0500,901371,rmondello,Ricky Mondello,,"“Ricky, why do you dislike bitcoin so much?”  https://t.co/Nka1dpaAOe",en,[],['https://twitter.com/andrewgdotcom/status/1051059968298889216'],[],4,124,246,[],[],https://twitter.com/rmondello/status/1051137217719140352,False,https://twitter.com/andrewgdotcom/status/1051059968298889216,0,,,,,,,,[],,,,
1051136904811417601,1051136904811417601,2018-10-13 11:45:41 Eastern Daylight Time,2018-10-13,11:45:41,-0500,933380144248639488,cryptoinvest18,Crypto Investments Guide,,Your favourite coin? Vote and Retweet! Give a shoutout to your coin!!!   #crypto #cryptocurrency #xrp #ripple #bitcoin #btc #nem #xem #verge #xvg #tron #trx #digibyte #dgb #ethereum #eth #stellar #xlm #monero #xmr #cardano #ada #litecoin #ltc #miota #iota #money #investing #ico,en,[],[],[],153,163,179,"['crypto', 'cryptocurrency', 'xrp', 'ripple', 'bitcoin', 'btc', 'nem', 'xem', 'verge', 'xvg', 'tron', 'trx', 'digibyte', 'dgb', 'ethereum', 'eth', 'stellar', 'xlm', 'monero', 'xmr', 'cardano', 'ada', 'litecoin', 'ltc', 'miota', 'iota', 'money', 'investing', 'ico']",[],https://twitter.com/CryptoInvest18/status/1051136904811417601,False,,0,,,,,,,,[],,,,
1051059968298889216,1051059968298889216,2018-10-13 06:39:58 Eastern Daylight Time,2018-10-13,06:39:58,-0500,15263795,andrewgdotcom,Andrew Gallagher,,"If #Bitcoin were to cease trading tomorrow, 0.5% of the world’s electricity demand would simply disappear – which would cover one year’s worth of the carbon emission cuts required to limit temperature rises this century to 2C.  https://t.co/eiF9FIz2fh",en,[],['https://sluggerotoole.com/2018/10/12/bitcoin-must-die/'],[],369,5692,8934,['bitcoin'],[],https://twitter.com/andrewgdotcom/status/1051059968298889216,False,,0,,,,,,,,[],,,,
1050829790012481538,1050829790012481538,2018-10-12 15:25:20 Eastern Daylight Time,2018-10-12,15:25:20,-0500,96583499,oly245,Oly245,,"It's Friday and I've had a good week so...  Giving away $200 worth of Bitcoin. Retweet and follow to enter. (1x 200USD) Winner picked at random on the 21st of October 8pm UK time. (Must be following)   Make sure you are following, good luck.  $ZIL $BTC $NEO $ETH $QKC $ICX $BAT",en,[],[],[],178,1026,633,[],"['zil', 'btc', 'neo', 'eth', 'qkc', 'icx', 'bat']",https://twitter.com/Oly245/status/1050829790012481538,False,,0,,,,,,,,[],,,,
1050775932229836800,1050775932229836800,2018-10-12 11:51:19 Eastern Daylight Time,2018-10-12,11:51:19,-0500,728643489756516352,fillbeforeshill,Roy Blackstone (The Don),,Bitcoin.  https://t.co/NqUqafYYRN,en,[],[],['https://pbs.twimg.com/media/DpUbHy_WwAAb-20.jpg'],47,366,1508,[],[],https://twitter.com/fillbeforeshill/status/1050775932229836800,False,,1,https://pbs.twimg.com/media/DpUbHy_WwAAb-20.jpg,,,,,,,[],,,,
1050678413181087745,1050678413181087745,2018-10-12 05:23:49 Eastern Daylight Time,2018-10-12,05:23:49,-0500,2799211554,whalepanda,WhalePanda,,Imagine criticizing Bitcoin at $58 and then see it go to $20 000. Your credibility is lost so the only thing you can do is double down and shout louder. I've yet to hear a single valid argument from Nouriel about Bitcoin.,en,[],[],[],63,277,1674,[],[],https://twitter.com/WhalePanda/status/1050678413181087745,False,,0,,,,,,,,[],,,,
1050519665842122752,1050519665842122752,2018-10-11 18:53:00 Eastern Daylight Time,2018-10-11,18:53:00,-0500,20884310,timdraper,Tim Draper,,Reason # 541 that we like Bitcoin better than fiat. The Fed never gets it quite right.,en,[],[],[],27,220,1045,[],[],https://twitter.com/TimDraper/status/1050519665842122752,False,,0,,,,,,,,[],,,,
1050502021080539136,1050502021080539136,2018-10-11 17:42:53 Eastern Daylight Time,2018-10-11,17:42:53,-0500,15540222,rauchg,Guillermo Rauch,,base58 by satoshi is brilliant – a gem found inside bitcoin's original codebase  Also check out base58check   https://t.co/nOuXsoyEdB  https://t.co/cR4y3huzLh,en,[],['https://en.bitcoin.it/wiki/Base58Check_encoding'],['https://pbs.twimg.com/media/DpQhqeBUwAAk6Dq.jpg'],16,195,888,[],[],https://twitter.com/rauchg/status/1050502021080539136,False,,1,https://pbs.twimg.com/media/DpQhqeBUwAAk6Dq.jpg,,,,,,,[],,,,
1050494653953323008,1050494653953323008,2018-10-11 17:13:37 Eastern Daylight Time,2018-10-11,17:13:37,-0500,632528146,kerooke,Kevin Rooke,,"Bitcoin: 1.65M people going to 5,583 meetups globally  Bitcoin Cash: 12K people going to 106 meetups globally  Ethereum: 1.13M people going to 3,967 meetups globally  EOS: 60K people going to 178 meetups globally  Gives you a good feel for organic interest/curiousity 👇  https://t.co/RChr1KOmyL",en,[],[],"['https://pbs.twimg.com/media/DpQa0srX4AEmkKM.jpg', 'https://pbs.twimg.com/media/DpQa0smXoAAuN_t.jpg', 'https://pbs.twimg.com/media/DpQa0sjXUAEtuis.jpg', 'https://pbs.twimg.com/media/DpQa0spXUAAsl9K.jpg']",58,397,1080,[],[],https://twitter.com/kerooke/status/1050494653953323008,False,,1,https://pbs.twimg.com/media/DpQa0srX4AEmkKM.jpg,,,,,,,[],,,,
1050485032941318144,1050485032941318144,2018-10-11 16:35:23 Eastern Daylight Time,2018-10-11,16:35:23,-0500,1398479138,clairlemon,Claire Lehmann,,"Roya Mahboob paid her female contributors in bitcoin as they were not allowed to have bank accounts. She's now teaching girls about blockchain, crypto, how to code and financial literacy. My new hero  https://t.co/8i2fv1denf",en,[],['https://www.forbes.com/sites/laurashin/2017/08/08/how-bitcoin-solved-this-serial-entrepreneurs-problems/#2d42e215309c'],[],26,255,1021,[],[],https://twitter.com/clairlemon/status/1050485032941318144,False,,0,,,,,,,,[],,,,
1050393957862133760,1050393957862133760,2018-10-11 10:33:29 Eastern Daylight Time,2018-10-11,10:33:29,-0500,14710235,neerajka,Neeraj K. Agrawal,,"Here is more info on Roya Mahboob, the Afghan entrepreneur who needed to use Bitcoin to pay her female employees because they couldn’t get bank accounts   https://t.co/dc8okNifPt",en,[],['https://www.forbes.com/sites/laurashin/2017/08/08/how-bitcoin-solved-this-serial-entrepreneurs-problems/#1e1b05a6309c'],[],20,297,867,[],[],https://twitter.com/NeerajKA/status/1050393957862133760,False,,0,,,,,,,,[],,,,
1050378024288473088,1050378024288473088,2018-10-11 09:30:10 Eastern Daylight Time,2018-10-11,09:30:10,-0500,339061487,apompliano,Pomp 🌪,,"Things are about to get interesting:  - US in longest bull run in history - Debt piling up fast - Developing world currencies failing - US Fed raised rates 3X this year - US likely to raise rates to defend currency in future  Long Bitcoin, Short the Bankers.",en,[],[],[],98,722,2755,[],[],https://twitter.com/APompliano/status/1050378024288473088,False,,0,,,,,,,,[],,,,
1050363791114944512,1050363791114944512,2018-10-11 08:33:37 Eastern Daylight Time,2018-10-11,08:33:37,-0500,992741542094819334,kubitx,KuBitX,,Check out some key milestones and info from the team.  https://t.co/inO8gFXCpH #cryptocurrency #bitcoin #ethereum #kbx #cryptoexchange #ico #pre_ico #bitcoins #cryptocurrencies #cryptotraders #money #southafrica #Blockchain #revolution #technology #followers #altcoins #Africa  https://t.co/CWDHMVeP81,en,[],['https://t.me/KuBitX_ANN'],['https://pbs.twimg.com/media/DpOjM84WkAE6pQr.jpg'],9,366,436,"['cryptocurrency', 'bitcoin', 'ethereum', 'kbx', 'cryptoexchange', 'ico', 'pre_ico', 'bitcoins', 'cryptocurrencies', 'cryptotraders', 'money', 'southafrica', 'blockchain', 'revolution', 'technology', 'followers', 'altcoins', 'africa']",[],https://twitter.com/kubitx/status/1050363791114944512,False,,1,https://pbs.twimg.com/media/DpOjM84WkAE6pQr.jpg,,,,,,,[],,,,
1050073234719293440,1050073234719293440,2018-10-10 13:19:03 Eastern Daylight Time,2018-10-10,13:19:03,-0500,25552514,arjunblj,Arjun Balaji,,Bitcoin is a game disguised to teach you about:  - Ethics of money production - History of central banking &amp; gold - Adversarial system design  - Commodities markets - Distributed systems engineering &amp; the software lifecycle - Securities law   What have you learned from Bitcoin?,en,[],[],[],107,372,1273,[],[],https://twitter.com/arjunblj/status/1050073234719293440,False,,0,,,,,,,,[],,,,
1050070845530533888,1050070845530533888,2018-10-10 13:09:33 Eastern Daylight Time,2018-10-10,13:09:33,-0500,2307692107,blockstream,Blockstream,,"The @Blockstream team is excited to announce the #LiquidNetwork is now live with 23 members! Liquid enables fast, secure, and confidential transactions, along with digital asset issuance on the world's first production #Bitcoin #sidechain. 🔒⛓️🌊  https://t.co/hWkU2bd1ku  https://t.co/IBvDIoHCsS",en,"[{'screen_name': 'blockstream', 'name': 'blockstream', 'id': '2307692107'}]",['https://blockstream.com/2018/10/10/liquid-launch.html'],['https://pbs.twimg.com/media/DpKIxUNWsAAd7yu.jpg'],87,318,905,"['liquidnetwork', 'bitcoin', 'sidechain']",[],https://twitter.com/Blockstream/status/1050070845530533888,False,,1,https://pbs.twimg.com/media/DpKIxUNWsAAd7yu.jpg,,,,,,,[],,,,
1050053405010522112,1050053405010522112,2018-10-10 12:00:15 Eastern Daylight Time,2018-10-10,12:00:15,-0500,1333467482,coindesk,CoinDesk,,"JUST IN: Three years in the making, bitcoin's first sidechain ""Liquid"" is now live.  https://t.co/Q5ZPdvJU3J",en,[],['http://ow.ly/iKYL30mb5Gd'],[],24,256,573,[],[],https://twitter.com/CoinDesk/status/1050053405010522112,False,,0,,,,,,,,[],,,,
1049970631997964288,1049970631997964288,2018-10-10 06:31:20 Eastern Daylight Time,2018-10-10,06:31:20,-0500,961490237623975942,icovoco,ICOVO,,"We will hold meetup ""A Cypherpunk Dream and Privacy on Blockchain"" on 30th Oct in Tokyo. We'll talk about the genesis of bitcoin, why privacy matters on blockchain and some of the cryptographic methods to protect our privacy on blockchain. Check it out at  https://t.co/o5yjnzP0T3  https://t.co/rtkV2bD03L",en,[],['https://www.meetup.com/ja-JP/ethereum_hack_tokyo/events/254870678/'],['https://pbs.twimg.com/media/DpI-qHCUUAAZC8m.jpg'],5,761,849,[],[],https://twitter.com/ICOVOCO/status/1049970631997964288,False,,1,https://pbs.twimg.com/media/DpI-qHCUUAAZC8m.jpg,,,,,,,[],,,,
1049970617133518849,1049970617133518849,2018-10-10 06:31:17 Eastern Daylight Time,2018-10-10,06:31:17,-0500,555380059,sabrireyiziniz,Sabri Reyiz,,2018 yılının en çok değer kaybedenleri; - Arda Turan - Türk Lirası - Bitcoin,tr,[],[],[],41,957,10781,[],[],https://twitter.com/SabriReyiziniz/status/1049970617133518849,False,,0,,,,,,,,[],,,,
1049832672925646848,1049832672925646848,2018-10-09 21:23:08 Eastern Daylight Time,2018-10-09,21:23:08,-0500,175091719,karlthefog,Karl the Fog ☁️,,It tastes like Everlane tops and bros talking about Bitcoin,en,[],[],[],18,176,1692,[],[],https://twitter.com/KarlTheFog/status/1049832672925646848,False,https://twitter.com/itsmejessssssss/status/1049827042470985728,0,,,,,,,,[],,,,
1049786746269888513,1049786746269888513,2018-10-09 18:20:39 Eastern Daylight Time,2018-10-09,18:20:39,-0500,35749949,joelkatz,𝙳𝚊𝚟𝚒𝚍 𝚂𝚌𝚑𝚠𝚊𝚛𝚝𝚣,,A new study shows China controls 74% of bitcoin. Does that sound decentralized to you?  https://t.co/4Oa68QlHLu,en,[],['https://thenextweb.com/hardfork/2018/10/08/china-means-intent-destroy-bitcoin/'],[],134,564,1487,[],[],https://twitter.com/JoelKatz/status/1049786746269888513,False,,0,,,,,,,,[],,,,
1049666755629654016,1049666755629654016,2018-10-09 10:23:51 Eastern Daylight Time,2018-10-09,10:23:51,-0500,14539108,df_porto,Elinhas,,"Amiga, o PT apoiou SETE ditaduras  República de Wadiya Terra de Ooo Ancapistão (pré Bitcoin, recentemente livre) Cubazuela (Universo V-184) Grupo Rodoviário Alimentício Augusto Liberato, o Graal Colégio Marista Dom Silvério A Banda Foo Fighters",pt,[],[],[],15,280,1039,[],[],https://twitter.com/df_porto/status/1049666755629654016,False,,0,,,,,,,,[],,,,
1049653411292037122,1049653411292037122,2018-10-09 09:30:49 Eastern Daylight Time,2018-10-09,09:30:49,-0500,992741542094819334,kubitx,KuBitX,,Participate in KuBitX public beta testing and receive some free KBX tokens reward. Follow the link to register. Beta Testing commences on the 11th.  https://t.co/Vdv7S2AA3Q #cryptocurrency #bitcoin #ethereum #kbx #cryptoexchange #ico #pre_ico,en,[],['https://goo.gl/forms/tNeHPLmcR2X2ZXkp1'],[],8,358,412,"['cryptocurrency', 'bitcoin', 'ethereum', 'kbx', 'cryptoexchange', 'ico', 'pre_ico']",[],https://twitter.com/kubitx/status/1049653411292037122,False,,0,,,,,,,,[],,,,
1049647617444065281,1049647617444065281,2018-10-09 09:07:48 Eastern Daylight Time,2018-10-09,09:07:48,-0500,1856523530,capitalandceleb,CCN - Capital & Celeb News,,Jack Ma: I Pay Special Attention to Blockchain &amp; Bitcoin to Create Cashless Society  https://t.co/eG7t1T5CbL,en,[],['https://www.ccn.com/jack-ma-i-pay-special-attention-to-blockchain-bitcoin-to-create-cashless-society/'],[],33,530,1306,[],[],https://twitter.com/CapitalAndCeleb/status/1049647617444065281,False,,0,,,,,,,,[],,,,
1049406035256053760,1049406035256053760,2018-10-08 17:07:50 Eastern Daylight Time,2018-10-08,17:07:50,-0500,2207129125,cointelegraph,Cointelegraph,,SEC will soon announce its decision on 9 new Bitcoin ETFs – how are the market’s expectations affecting the prices?  https://t.co/eHCyKHaMn8,en,[],['https://cointelegraph.com/news/bitcoin-ethereum-ripple-bitcoin-cash-eos-stellar-litecoin-cardano-monero-tron-price-analysis-october-8'],[],19,191,424,[],[],https://twitter.com/Cointelegraph/status/1049406035256053760,False,,0,,,,,,,,[],,,,
1049380245911064576,1049380245911064576,2018-10-08 15:25:21 Eastern Daylight Time,2018-10-08,15:25:21,-0500,2207129125,cointelegraph,Cointelegraph,,Crypto analyst Ran Neuner says Bitcoin’s price is “about to explode”  https://t.co/rNJypQD73F,en,[],['https://cointelegraph.com/news/cnbcs-ran-neuner-says-bitcoin-is-about-to-explode-points-to-pending-etf-decision'],[],46,211,447,[],[],https://twitter.com/Cointelegraph/status/1049380245911064576,False,,0,,,,,,,,[],,,,
1049272658314055681,1049272658314055681,2018-10-08 08:17:50 Eastern Daylight Time,2018-10-08,08:17:50,-0500,859484337850523648,crypto_rand,Crypto Rand,,"#Bitcoin knocking the door and looking for the breakout.  If breaks that resistance I will be looking at $7,500 as first target.  Expecting a huge breakout on volume too during the next 2-3 days.  $BTC $BTCUSD $XBTUSD  https://t.co/A9clK1Wz5u",en,[],[],['https://pbs.twimg.com/media/Do_DqboXoAEn1mw.jpg'],39,235,876,['bitcoin'],"['btc', 'btcusd', 'xbtusd']",https://twitter.com/crypto_rand/status/1049272658314055681,False,,1,https://pbs.twimg.com/media/Do_DqboXoAEn1mw.jpg,,,,,,,[],,,,
1049183322360832000,1049183322360832000,2018-10-08 02:22:51 Eastern Daylight Time,2018-10-08,02:22:51,-0500,3325602822,tradingroomapp,Trading Room,,"#Bitcoin had the best tech setup to breakdown in last 4 weeks, instead its stubbornly holding so far. Give &amp; take one more week for any #BTC breakdown. If not, we will focus on 5400-5750 as an interim bottom for an attempt to 8900-9100 &amp; beyond  Mid Term (Not for Margin Traders)  https://t.co/nBNFDGovWh",en,[],[],['https://pbs.twimg.com/media/Do9yfHzU0AIqRq6.jpg'],37,318,930,"['bitcoin', 'btc']",[],https://twitter.com/tradingroomapp/status/1049183322360832000,False,,1,https://pbs.twimg.com/media/Do9yfHzU0AIqRq6.jpg,,,,,,,[],,,,
1049167695243960320,1049167695243960320,2018-10-08 01:20:45 Eastern Daylight Time,2018-10-08,01:20:45,-0500,16827333,souljaboy,Soulja Boy (Big Draco),,Bitcoin,en,[],[],[],451,2755,10027,[],[],https://twitter.com/souljaboy/status/1049167695243960320,False,,0,,,,,,,,[],,,,
1049139732548993025,1049139732548993025,2018-10-07 23:29:38 Eastern Daylight Time,2018-10-07,23:29:38,-0500,925112851894865920,kashthefuturist,Dr. Kash Sirinanda,,Google's robot dog meets real dog for the first time  #AI #IoT #Robotics #Robot #future #technology #TechTrends #automation #ArtificialIntelligence #EmergingTechnologies #4IR #ML #DataScience #DT #IIoT #MachineLearning #DeepLearning #bitcoin #blockchain #DigitalTransformation  https://t.co/as9x3gujHs,en,[],[],[],20,191,316,"['ai', 'iot', 'robotics', 'robot', 'future', 'technology', 'techtrends', 'automation', 'artificialintelligence', 'emergingtechnologies', '4ir', 'ml', 'datascience', 'dt', 'iiot', 'machinelearning', 'deeplearning', 'bitcoin', 'blockchain', 'digitaltransformation']",[],https://twitter.com/kashthefuturist/status/1049139732548993025,False,,1,https://pbs.twimg.com/ext_tw_video_thumb/1049139647882784768/pu/img/hj1OhO3vvtmvYIBA.jpg,,,,,,,[],,,,
1049091017960562689,1049091017960562689,2018-10-07 20:16:04 Eastern Daylight Time,2018-10-07,20:16:04,-0500,19224439,nouriel,Nouriel Roubini,,"Decentralization in crypto is a myth. It is a system more centralized than North Korea: miners are centralized, exchanges are centralized, developers are centralized dictators (Buterin is ""dictator for life"" ) &amp; the Gini inequality coefficient of bitcoin is worse than North Korea",en,[],[],[],123,149,340,[],[],https://twitter.com/Nouriel/status/1049091017960562689,False,,0,,,,,,,,[],,,,
1049067965025607683,1049067965025607683,2018-10-07 18:44:28 Eastern Daylight Time,2018-10-07,18:44:28,-0500,23618940,lopp,Jameson Lopp,,"Asking ""who controls Bitcoin?"" is like asking ""who controls English?""",en,[],[],[],122,357,1461,[],[],https://twitter.com/lopp/status/1049067965025607683,False,,0,,,,,,,,[],,,,
1049055155285573632,1049055155285573632,2018-10-07 17:53:34 Eastern Daylight Time,2018-10-07,17:53:34,-0500,339061487,apompliano,Pomp 🌪,,History will be unkind to those who knew about Bitcoin early and did nothing.,en,[],[],[],77,404,1835,[],[],https://twitter.com/APompliano/status/1049055155285573632,False,,0,,,,,,,,[],,,,
1048978354563469312,1048978354563469312,2018-10-07 12:48:23 Eastern Daylight Time,2018-10-07,12:48:23,-0500,58487473,cryptomanran,Ran NeuNer,,I just bought Bitcoin for my parents. It’s too obvious that it’s about to explode...,en,[],[],[],183,273,1613,[],[],https://twitter.com/cryptomanran/status/1048978354563469312,False,,0,,,,,,,,[],,,,
1048902921067352064,1048902921067352064,2018-10-07 07:48:38 Eastern Daylight Time,2018-10-07,07:48:38,-0500,992741542094819334,kubitx,KuBitX,,"We at KuBitX want to educate, empower and involve you in the digital financial revolution so that you, in turn, can give back to your economy. Together we're stronger. Choose KuBitX #cryptocurrency #bitcoin #ethereum #kbx #cryptoexchange #ico #pre_ico #bitcoins #oprahwinfrey  https://t.co/NirFHGgSgU",en,[],[],['https://pbs.twimg.com/media/Do5zhqTXgAIkeNb.jpg'],7,346,398,"['cryptocurrency', 'bitcoin', 'ethereum', 'kbx', 'cryptoexchange', 'ico', 'pre_ico', 'bitcoins', 'oprahwinfrey']",[],https://twitter.com/kubitx/status/1048902921067352064,False,,1,https://pbs.twimg.com/media/Do5zhqTXgAIkeNb.jpg,,,,,,,[],,,,
1048883763684544514,1048883763684544514,2018-10-07 06:32:31 Eastern Daylight Time,2018-10-07,06:32:31,-0500,1333467482,coindesk,CoinDesk,,"By the end of the year, an initial coin offering will be launched on bitcoin. thanks to sidechains tech.  https://t.co/60GKbnRSYN",en,[],['http://ow.ly/iEvw30m8bjD'],[],36,301,582,[],[],https://twitter.com/CoinDesk/status/1048883763684544514,False,,0,,,,,,,,[],,,,
