id,conversation_id,created_at,date,time,timezone,user_id,username,name,place,tweet,language,mentions,urls,photos,replies_count,retweets_count,likes_count,hashtags,cashtags,link,retweet,quote_url,video,thumbnail,near,geo,source,user_rt_id,user_rt,retweet_id,reply_to,retweet_date,translate,trans_src,trans_dest
1064929887423733765,1064929887423733765,2018-11-20 12:14:05 Eastern Standard Time,2018-11-20,12:14:05,-0500,1333467482,coindesk,CoinDesk,,JUST IN: The launch of Bakkt's physically-settled bitcoin futures product has been pushed back to January of next year.  https://t.co/qn1kDI8gVV,en,[],['http://ow.ly/S2va30mGMTF'],[],79,342,566,[],[],https://twitter.com/CoinDesk/status/1064929887423733765,False,,0,,,,,,,,[],,,,
1064928505136336902,1064928505136336902,2018-11-20 12:08:35 Eastern Standard Time,2018-11-20,12:08:35,-0500,1333467482,coindesk,CoinDesk,,"BREAKING: In a new notice, ICE Futures U.S., Inc. says it will list the Bakkt Bitcoin (USD) Daily Futures Contract on January 24 of next year.  https://t.co/YqNvZ3oCPq",en,[],['http://ow.ly/u9Vy30mGMqP'],[],98,688,1509,[],[],https://twitter.com/CoinDesk/status/1064928505136336902,False,,0,,,,,,,,[],,,,
1064899270409621504,1064899270409621504,2018-11-20 10:12:25 Eastern Standard Time,2018-11-20,10:12:25,-0500,1333467482,coindesk,CoinDesk,,The U.S. Department of Justice is reportedly investigating Tether and Bitfinex over whether they artificially boosted bitcoin's price using the USDT stablecoin.  https://t.co/H0XDbvL5qT,en,[],['http://ow.ly/udX830mGCLi'],[],36,164,357,[],[],https://twitter.com/CoinDesk/status/1064899270409621504,False,,0,,,,,,,,[],,,,
1064887391658418181,1064887391658418181,2018-11-20 09:25:13 Eastern Standard Time,2018-11-20,09:25:13,-0500,928759224599040001,crypto,Bloomberg Crypto,,"The U.S. Justice Department is investigating whether last year’s epic Bitcoin rally was fueled in part by manipulation, with traders driving it up with Tether  https://t.co/QLXJU60Pfd",en,[],['https://bloom.bg/2QXBBdP'],[],64,284,467,[],[],https://twitter.com/crypto/status/1064887391658418181,False,,0,,,,,,,,[],,,,
1064886041012854784,1064886041012854784,2018-11-20 09:19:51 Eastern Standard Time,2018-11-20,09:19:51,-0500,146008010,cryptomichnl,Michaël van de Poppe,,"This is a very nice picture, just watched Bloomberg.  Apple, Facebook, Amazon, Google &amp; Netflix (#FAANG) combined now down $985 billion dollars since all time high.  'Just a correction'.   But yes, crypto is dead and stuff.   #bitcoin #crypto  https://t.co/yXXalJXBBP",en,[],[],['https://pbs.twimg.com/media/Dsc8GD1XgAAt1C0.jpg'],22,180,480,"['faang', 'bitcoin', 'crypto']",[],https://twitter.com/CryptoMichNL/status/1064886041012854784,False,,1,https://pbs.twimg.com/media/Dsc8GD1XgAAt1C0.jpg,,,,,,,[],,,,
1064844208870088704,1064844208870088704,2018-11-20 06:33:37 Eastern Standard Time,2018-11-20,06:33:37,-0500,249564158,faizwahab,Faiz Wahab,,Bitcoin drop further below $5000.  Apa khabar jutawan bitcoin? Hahahahahahhhhhhhhah  https://t.co/tgy80qo63I,in,[],[],['https://pbs.twimg.com/media/DscWKIGUcAAFemF.jpg'],27,287,193,[],[],https://twitter.com/faizwahab/status/1064844208870088704,False,,1,https://pbs.twimg.com/media/DscWKIGUcAAFemF.jpg,,,,,,,[],,,,
1064718491159326723,1064718491159326723,2018-11-19 22:14:04 Eastern Standard Time,2018-11-19,22:14:04,-0500,1413027896,charliebilello,Charlie Bilello,,"Largest Bitcoin Drawdowns... 1) Sep 2010 to Oct 2010: -94.1% ($0.17 to $.01) 2) Jun 2011 to Nov 2011: -93.8% ($32 to $1.99) 3) Nov 2013 to Jan 2015: -85.4% ($1,166 to $170) 4) Apr 2013 to Jul 2013: -76.4% ($266 to $63) 5) Dec 2017 to Today: -76.2% ($19,783 to $4,709) $BTC.X",en,[],[],[],31,356,801,[],['btc.x'],https://twitter.com/charliebilello/status/1064718491159326723,False,,0,,,,,,,,[],,,,
1064654534021136387,1064654534021136387,2018-11-19 17:59:55 Eastern Standard Time,2018-11-19,17:59:55,-0500,16732770,cnbcfastmoney,CNBC's Fast Money,,It's a horror show for #bitcoin. Take a look at these moves... if you dare. $BTC  https://t.co/9kkd9ytVDd,en,[],[],['https://pbs.twimg.com/media/DsZpfpPWsAAKgTS.jpg'],170,217,840,['bitcoin'],['btc'],https://twitter.com/CNBCFastMoney/status/1064654534021136387,False,,1,https://pbs.twimg.com/media/DsZpfpPWsAAKgTS.jpg,,,,,,,[],,,,
1064627122189291523,1064627122189291523,2018-11-19 16:11:00 Eastern Standard Time,2018-11-19,16:11:00,-0500,863527548,steve_hanke,Steve Hanke,,"#Bitcoin, going, going, gone?  https://t.co/kgeEBduSqH",en,[],[],['https://pbs.twimg.com/media/DsYVapzWsAEaHis.jpg'],41,149,272,['bitcoin'],[],https://twitter.com/steve_hanke/status/1064627122189291523,False,,1,https://pbs.twimg.com/media/DsYVapzWsAEaHis.jpg,,,,,,,[],,,,
1064619394226167810,1064619394226167810,2018-11-19 15:40:17 Eastern Standard Time,2018-11-19,15:40:17,-0500,47003920,jchervinsky,Jake Chervinsky,,"I didn't know anything about crypto until last year when I saw a random article about price and decided to finally learn what bitcoin was about.  Price brought me in, but there's *nothing* price can do to drive me out.  I guarantee I'm not alone. The virus will keep spreading. 👊",en,[],[],[],78,423,2513,[],[],https://twitter.com/jchervinsky/status/1064619394226167810,False,,0,,,,,,,,[],,,,
1064592831564652556,1064592831564652556,2018-11-19 13:54:44 Eastern Standard Time,2018-11-19,13:54:44,-0500,813554157097459714,steinkobbe,Wild Geerters,,With bitcoin down another 10% today I was reminded a year ago Cheong tweeted that bitcoin is not going down less than 24 hours before it peaked and started crashing. His timing is absolutely incredible. You couldn't be this good at being wrong if you tried.  https://t.co/28bs83rKY4,en,[],[],"['https://pbs.twimg.com/media/DsYvWR4XQAAVksl.jpg', 'https://pbs.twimg.com/media/DsYvwhaXgAAvNHj.jpg']",32,181,1401,[],[],https://twitter.com/steinkobbe/status/1064592831564652556,False,,1,https://pbs.twimg.com/media/DsYvWR4XQAAVksl.jpg,,,,,,,[],,,,
1064585834286919680,1064585834286919680,2018-11-19 13:26:56 Eastern Standard Time,2018-11-19,13:26:56,-0500,47191293,rmac18,Ryan Mac 🙃,,"A few months ago @jack suggested reporters should help Twitter vet the platform for problems.   .@JaneLytv and I did that and found Twitter's ad platform allowed hackers to run promoted bitcoin giveaway scams. In turn, Jane got her account locked.  https://t.co/ia7G0W9hCc",en,"[{'screen_name': 'jack', 'name': 'jack⚡️', 'id': '12'}, {'screen_name': 'janelytv', 'name': 'jane lytvynenko', 'id': '65284273'}]",['https://www.buzzfeednews.com/article/janelytvynenko/twitter-cryptocurrency-scams-verified-accounts-russia-target'],[],19,675,1000,[],[],https://twitter.com/RMac18/status/1064585834286919680,False,,0,,,,,,,,[],,,,
1064582484237697025,1064582484237697025,2018-11-19 13:13:37 Eastern Standard Time,2018-11-19,13:13:37,-0500,23618940,lopp,Jameson Lopp,,"No, Bitcoin isn't dying - it's just preparing for this year's Black Friday sale.  https://t.co/FeJe5S2V2z",en,[],[],['https://pbs.twimg.com/media/DsYoGAaVsAAmfzH.jpg'],56,427,1749,[],[],https://twitter.com/lopp/status/1064582484237697025,False,,1,https://pbs.twimg.com/media/DsYoGAaVsAAmfzH.jpg,,,,,,,[],,,,
1064558458605903872,1064558458605903872,2018-11-19 11:38:09 Eastern Standard Time,2018-11-19,11:38:09,-0500,2214652482,rampcapitalllc,Ramp Capital,,"Bitcoin support levels: 1̶9̶,̶0̶0̶0̶ ̶ 1̶8̶,̶0̶0̶0̶ ̶ 1̶7̶,̶0̶0̶0̶ ̶ 1̶6̶,̶0̶0̶0̶ ̶ 1̶5̶,̶0̶0̶0̶ ̶ 1̶4̶,̶0̶0̶0̶ ̶ 1̶3̶,̶0̶0̶0̶ ̶ 1̶2̶,̶0̶0̶0̶ ̶ 1̶1̶,̶0̶0̶0̶ ̶ 1̶0̶,̶0̶0̶0̶ ̶ 9̶,̶0̶0̶0̶ ̶ 8̶,̶0̶0̶0̶ ̶ 7̶,̶0̶0̶0̶  6̶,̶0̶0̶0̶  5̶,̶0̶0̶0̶ 4,000  3,000  2,000  1,000  666  420  69  0",und,[],[],[],169,852,3679,[],[],https://twitter.com/RampCapitalLLC/status/1064558458605903872,False,,0,,,,,,,,[],,,,
1064557509082517504,1064557509082517504,2018-11-19 11:34:23 Eastern Standard Time,2018-11-19,11:34:23,-0500,928759224599040001,crypto,Bloomberg Crypto,,"BREAKING: Bitcoin drops below $5,000 for first time since October 2017  https://t.co/wnzqof0hTi  https://t.co/ROHE7i4YQB",en,[],['https://bloom.bg/2DMf9Bq'],['https://pbs.twimg.com/media/DsYRaVdXQAEcMvZ.jpg'],47,220,317,[],[],https://twitter.com/crypto/status/1064557509082517504,False,,1,https://pbs.twimg.com/media/DsYRaVdXQAEcMvZ.jpg,,,,,,,[],,,,
1064557336579239936,1064557336579239936,2018-11-19 11:33:42 Eastern Standard Time,2018-11-19,11:33:42,-0500,34713362,business,Bloomberg,,"BREAKING: Bitcoin drops below $5,000 for first time since October 2017  https://t.co/Cf8ZWQrEbr  https://t.co/QFo7AIOsxj",en,[],['https://bloom.bg/2QVPclU'],['https://pbs.twimg.com/media/DsYRQVWW0AM4aSc.jpg'],17,177,217,[],[],https://twitter.com/business/status/1064557336579239936,False,,1,https://pbs.twimg.com/media/DsYRQVWW0AM4aSc.jpg,,,,,,,[],,,,
1064513942536503297,1064513942536503297,2018-11-19 08:41:16 Eastern Standard Time,2018-11-19,08:41:16,-0500,999364221904326657,needashruberry,Knight_who_says_Ni!,,"Fuck your hodl, fuck TA fuck the next bitcoin, fuck a bear. Fuck the rumors, fuck the news, fuck your paid group leader and fuck the bulls. Fuck resistance, fuck support, fuck my positions for not being short. Fuck your highs and fuck your lows I've capitulated all my portfolios.",en,[],[],[],201,233,1443,[],[],https://twitter.com/NeedaShruberry/status/1064513942536503297,False,,0,,,,,,,,[],,,,
1064513343602532354,1064513343602532354,2018-11-19 08:38:53 Eastern Standard Time,2018-11-19,08:38:53,-0500,928759224599040001,crypto,Bloomberg Crypto,,Bitcoin is 📉  https://t.co/CV3evJXfkq  https://t.co/rqRKd8EERd,en,[],['https://bloom.bg/2QWL9Wf'],['https://pbs.twimg.com/media/DsXpPoEXoAEcv8x.jpg'],41,184,321,[],[],https://twitter.com/crypto/status/1064513343602532354,False,,1,https://pbs.twimg.com/media/DsXpPoEXoAEcv8x.jpg,,,,,,,[],,,,
1064462023654850562,1064462023654850562,2018-11-19 05:14:57 Eastern Standard Time,2018-11-19,05:14:57,-0500,1333467482,coindesk,CoinDesk,,"Kraken has warned that the new bitcoin cash token, BCH SV, doesn't meet its standard listing requirements and should be seen as a “high risk” investment.  https://t.co/cVvLGa8vnR",en,[],['http://ow.ly/jQYm30mFnnH'],[],50,270,583,[],[],https://twitter.com/CoinDesk/status/1064462023654850562,False,,0,,,,,,,,[],,,,
1064412206626947072,1064412206626947072,2018-11-19 01:57:00 Eastern Standard Time,2018-11-19,01:57:00,-0500,1022733890052648961,_chocolatebella,Feni Roberts 🍫,,"Zabuiru (ZazaMoney) didn't steal any money from his Brother in-law as claimed by people who hated him, he made his money through Bitcoin and is known to be a very rich guy in his area.  Funny how social media can spread fake news so fast 🤦🏾  https://t.co/kOT2rjhcrl",en,[],[],['https://pbs.twimg.com/media/DsWNQDsWsAA2lBC.jpg'],21,256,284,[],[],https://twitter.com/_chocolatebella/status/1064412206626947072,False,,1,https://pbs.twimg.com/media/DsWNQDsWsAA2lBC.jpg,,,,,,,[],,,,
1064410014226382848,1064410014226382848,2018-11-19 01:48:17 Eastern Standard Time,2018-11-19,01:48:17,-0500,20656604,magicaltux,Mark Karpelès,,Craig Wright is a liar - claiming 2011 MtGox bitcoin transactions as his own - and yet is continuously gaining popularity. I'm looking at all of this unfold as an outsider and I do not think this will end well. Read more on Craig Wright claims:  https://t.co/Qti8BEYSl9,en,[],['https://blog.wizsec.jp/2018/02/kleiman-v-craig-wright-bitcoins.html'],[],67,192,693,[],[],https://twitter.com/MagicalTux/status/1064410014226382848,False,,0,,,,,,,,[],,,,
1064393044282228736,1064393044282228736,2018-11-19 00:40:51 Eastern Standard Time,2018-11-19,00:40:51,-0500,896368772537364481,newaccwhodis72,👾,,"Have you guys heard that Zubairu wasn't beaten after all, that it was all a rumor from people who hated him?  The source said he's into bitcoin and he  started investing for a while now. So guys, what's your excuse of being broke? 🤷‍♀️",en,[],[],[],144,536,1486,[],[],https://twitter.com/NewAccwhodis72/status/1064393044282228736,False,,0,,,,,,,,[],,,,
1064341791581732864,1064341791581732864,2018-11-18 21:17:12 Eastern Standard Time,2018-11-18,21:17:12,-0500,968396771096281088,gmbplatform,GMB,,I just published Seong Kee Kim Giving Lecture on Birth of Bitcoin  https://t.co/mTYFIUHzyn,en,[],['https://link.medium.com/CHR09k8AXR'],[],5,481,468,[],[],https://twitter.com/GMBplatform/status/1064341791581732864,False,,0,,,,,,,,[],,,,
1064311187377217536,1064311187377217536,2018-11-18 19:15:35 Eastern Standard Time,2018-11-18,19:15:35,-0500,1856523530,capitalandceleb,CCN - Capital & Celeb News,,Could Switzerland’s Crypto ETP Increase the Chance of a Bitcoin ETF Approval?  https://t.co/CLK2FssZHC,en,[],['https://www.ccn.com/could-switzerlands-crypto-etp-increase-the-chance-of-a-bitcoin-etf-approval/'],[],13,173,478,[],[],https://twitter.com/CapitalAndCeleb/status/1064311187377217536,False,,0,,,,,,,,[],,,,
1064256202559889409,1064256202559889409,2018-11-18 15:37:06 Eastern Standard Time,2018-11-18,15:37:06,-0500,1037725348144852992,conanobitcoin,Conan O'Bitcoin,,"The #LightningNetwork is exploding. Transfer #bitcoin instantly and anonymously for 1 satoshi per tx.  🤔   Pay less attention to the price and more  attention to development. 👍🚀⚡  Channels: 15,300+ Capacity: 338 BTC ( $1.9M USD )  PS: Buy Bitcoin!  https://t.co/lEfzYQHjnG",en,[],[],['https://pbs.twimg.com/media/DsT_X1LUwAAWfhE.jpg'],30,347,1057,"['lightningnetwork', 'bitcoin']",[],https://twitter.com/ConanOBitcoin/status/1064256202559889409,False,,1,https://pbs.twimg.com/media/DsT_X1LUwAAWfhE.jpg,,,,,,,[],,,,
1064203677303492613,1064203677303492613,2018-11-18 12:08:23 Eastern Standard Time,2018-11-18,12:08:23,-0500,892915205826646017,nondualrandy,Randy @3,,"Bitcoin halves in 551 days, which can mean 1 of 2 things for you.  1. You can spend your time being salty on twtr for the next 2 years.  2. You can shut up and accumulate as much bitcoin as possible.  Your choice.",en,[],[],[],62,250,1313,[],[],https://twitter.com/nondualrandy/status/1064203677303492613,False,,0,,,,,,,,[],,,,
1064186224284442624,1064186224284442624,2018-11-18 10:59:02 Eastern Standard Time,2018-11-18,10:59:02,-0500,47866057,investorxrp,Investor XRP,,Retweet if you think $XRP will overtake Bitcoin in 2019! 😎 $btc,en,[],[],[],50,366,688,[],"['xrp', 'btc']",https://twitter.com/InvestorXrp/status/1064186224284442624,False,,0,,,,,,,,[],,,,
1064143480744755200,1064143480744755200,2018-11-18 08:09:11 Eastern Standard Time,2018-11-18,08:09:11,-0500,1469101279,aantonop,Andreas,,"If we are going to say ""Be your own bank,"" we must also be prepared to teach people about risk calculation and management. #Bitcoin #security  https://t.co/V4aos93K1F",en,[],['https://youtu.be/M82t5wZG3fc?t=667'],[],60,337,1067,"['bitcoin', 'security']",[],https://twitter.com/aantonop/status/1064143480744755200,False,,0,,,,,,,,[],,,,
1064141922183335936,1064141922183335936,2018-11-18 08:02:59 Eastern Standard Time,2018-11-18,08:02:59,-0500,339061487,apompliano,Pomp 🌪,,"About time someone spoke truth to power.  Long Bitcoin, Short the Bankers!  https://t.co/f5N3u4BR9r",en,[],[],[],300,2553,5694,[],[],https://twitter.com/APompliano/status/1064141922183335936,False,,1,https://pbs.twimg.com/ext_tw_video_thumb/1064141584520769543/pu/img/QCDiNiHeuMNdJtFS.jpg,,,,,,,[],,,,
1064015560856371200,1064015560856371200,2018-11-17 23:40:52 Eastern Standard Time,2018-11-17,23:40:52,-0500,3325602822,tradingroomapp,Trading Room,,Long Term Investors  If you buy #Bitcoin at 5200 your downside is 50% even if it drops to 2700 (you can add more on dips to 4400-3400)  Your potential upside is  100% @ 10400 1:2 200% @ 15600 1:4  Very good Risk:Reward in Number 1 #crypto for Mid Term #BTC  Just saying.....,en,[],[],[],31,190,968,"['bitcoin', 'crypto', 'btc']",[],https://twitter.com/tradingroomapp/status/1064015560856371200,False,,0,,,,,,,,[],,,,
1064009289793187840,1064009289793187840,2018-11-17 23:15:57 Eastern Standard Time,2018-11-17,23:15:57,-0500,938119622276014080,desicryptohodlr,Shalini⚡,,"So #Binance just moved $600 Million in Bitcoin for Just $7  This would've cost $18 million in fees under traditional banking methods with 3% fees for transfers  This alone is reason for #bitcoin to exist, reason for banks to hate it &amp; the reason for us to invest in its future",en,[],[],[],92,772,2492,"['binance', 'bitcoin']",[],https://twitter.com/DesiCryptoHodlr/status/1064009289793187840,False,,0,,,,,,,,[],,,,
1063950003461189632,1063950003461189632,2018-11-17 19:20:22 Eastern Standard Time,2018-11-17,19:20:22,-0500,75149736,mustachetommy,Tommy Mustache #❤️❤️❤️,,Crypto’s Too Expensive? Binance Sent $600 Million in Bitcoin for Just $7   Binance would had paid $18 million in fees under the traditional banking method of 3% fees for transfers.   @cz_binance    https://t.co/4a97F1H3ok via @cryptocoinsnews,en,"[{'screen_name': 'cz_binance', 'name': 'cz 🔶 binance', 'id': '902926941413453824'}, {'screen_name': 'cryptocoinsnews', 'name': 'cryptocoinsnews', 'id': '1102512140630544384'}]",['https://www.ccn.com/cryptos-too-expensive-binance-sent-600-million-in-bitcoin-for-just-7/'],[],28,332,961,[],[],https://twitter.com/MustacheTommy/status/1063950003461189632,False,,0,,,,,,,,[],,,,
1063934905279803392,1063934905279803392,2018-11-17 18:20:23 Eastern Standard Time,2018-11-17,18:20:23,-0500,1856523530,capitalandceleb,CCN - Capital & Celeb News,,Crypto’s Too Expensive? Binance Sent $600 Million in Bitcoin for Just $7  https://t.co/hUkE4HBNsA,en,[],['https://www.ccn.com/cryptos-too-expensive-binance-sent-600-million-in-bitcoin-for-just-7/'],[],28,266,650,[],[],https://twitter.com/CapitalAndCeleb/status/1063934905279803392,False,,0,,,,,,,,[],,,,
1063876188798664704,1063876188798664704,2018-11-17 14:27:03 Eastern Standard Time,2018-11-17,14:27:03,-0500,249324297,amirabtahi,Amir Abtahi,,برادر ارجمند جناب آقای حسن خمینی. با سلام متخصصین زحمت کشی که سایت حضرتعالی را تهیه و تولید کرده اند، کد coinhive را در آن جانمایی کرده اند که از لود CPU سیستم مخاطب برای تولید Bitcoin استفاده میکند. من الله توفیق.  @HassanKhomeini  https://t.co/MnTI2TB9vr,fa,"[{'screen_name': 'hassankhomeini', 'name': 'سید حسن خمینی', 'id': '1039186974'}]",[],['https://pbs.twimg.com/media/DsOlv8uXcAAbpO6.jpg'],29,161,881,[],[],https://twitter.com/amirabtahi/status/1063876188798664704,False,,1,https://pbs.twimg.com/media/DsOlv8uXcAAbpO6.jpg,,,,,,,[],,,,
1063806505017896960,1063806505017896960,2018-11-17 09:50:10 Eastern Standard Time,2018-11-17,09:50:10,-0500,339061487,apompliano,Pomp 🌪,,History lesson:  - People feared electricity - People feared first train - People feared first plane - People feared the internet - People feared hedge funds - People feared Bitcoin  People fear what they don't understand. Don't get caught on the wrong side of history.,en,[],[],[],357,2456,6740,[],[],https://twitter.com/APompliano/status/1063806505017896960,False,,0,,,,,,,,[],,,,
1063660504315559937,1063660504315559937,2018-11-17 00:10:00 Eastern Standard Time,2018-11-17,00:10:00,-0500,755504,alexandraerin,Alexandra Erin,,"My favorite thing about Bitcoin is when they call it ""sound money"" as they hasten the climate change apocalypse by wasting cheap, dirty electricity to get fractions of a virtual commodity that will be useless if the global information infrastructure fails.",en,[],[],[],7,128,386,[],[],https://twitter.com/AlexandraErin/status/1063660504315559937,False,,0,,,,,,,,[],,,,
1063658842511298560,1063658842511298560,2018-11-17 00:03:24 Eastern Standard Time,2018-11-17,00:03:24,-0500,497665754,501awani,🇲🇾Astro AWANI🇲🇾,,#AWANInews #AWANI745 Penggunaan bitcoin dilarang dalam Islam   https://t.co/zaSVgb1Mca  https://t.co/B4MQhQIlMD,in,[],['http://www.astroawani.com/berita-malaysia/penggunaan-bitcoin-dilarang-dalam-islam-191377'],['https://pbs.twimg.com/media/DsLgEn0WoAAUQdg.jpg'],30,336,339,"['awaninews', 'awani745']",[],https://twitter.com/501Awani/status/1063658842511298560,False,,1,https://pbs.twimg.com/media/DsLgEn0WoAAUQdg.jpg,,,,,,,[],,,,
1063600706337161216,1063600706337161216,2018-11-16 20:12:23 Eastern Standard Time,2018-11-16,20:12:23,-0500,2415748447,devilscompiler,Noah Ruderman,,#Bitcoin  Deficit: 0 Bailouts: 0 Central banks: 0 Committees: 0 Employees: 0 CEOs: 0 Marketing budget: 0 Trademarks / patents: 0 Dev / founder reward / premine: none Seed investors: 0 VC funding: 0 Uptime: 99.98%,en,[],[],[],21,235,690,['bitcoin'],[],https://twitter.com/devilscompiler/status/1063600706337161216,False,,0,,,,,,,,[],,,,
1063559240156106752,1063559240156106752,2018-11-16 17:27:37 Eastern Standard Time,2018-11-16,17:27:37,-0500,35045612,lnstats,Lightning Network statistics ⚡,,#LightningNetwork  mainnet has reached 200 BTC capacity!  (over $1 million USD)   https://t.co/sJohipLfV2            #Lightning #LN #bitcoin $BTC  https://t.co/fhD9kf7EqC,en,[],['https://1ml.com/statistics'],['https://pbs.twimg.com/media/DsKFVcxUUAAL8W2.jpg'],10,118,362,"['lightningnetwork', 'lightning', 'ln', 'bitcoin']",['btc'],https://twitter.com/LNstats/status/1063559240156106752,False,,1,https://pbs.twimg.com/media/DsKFVcxUUAAL8W2.jpg,,,,,,,[],,,,
1063557546433220608,1063557546433220608,2018-11-16 17:20:53 Eastern Standard Time,2018-11-16,17:20:53,-0500,361289499,bitcoinmagazine,Bitcoin Magazine,,"The #LightningNetwork's bitcoin capacity recently surpassed $1,000,000 for the first time in its short history.  #Bitcoin #bitcoinnews #Crypto   https://t.co/jbPCCgHbBi",en,[],['https://bitcoinmagazine.com/articles/progress-report-lightning-network-surpasses-1m-btc-capacity-4000-nodes/'],[],31,287,726,"['lightningnetwork', 'bitcoin', 'bitcoinnews', 'crypto']",[],https://twitter.com/BitcoinMagazine/status/1063557546433220608,False,,0,,,,,,,,[],,,,
1063549465204649984,1063549465204649984,2018-11-16 16:48:46 Eastern Standard Time,2018-11-16,16:48:46,-0500,61417559,erikvoorhees,Erik Voorhees,,The euro is 16 years old.  Bitcoin is 10 years old. Both digital currencies. One governed by politicians and debased as a matter of policy. One governed by open-source code and impossible to debase. Which more likely lives to see 30 years of age?,en,[],[],[],198,1103,3911,[],[],https://twitter.com/ErikVoorhees/status/1063549465204649984,False,,0,,,,,,,,[],,,,
1063542245230546944,1063542245230546944,2018-11-16 16:20:05 Eastern Standard Time,2018-11-16,16:20:05,-0500,14717442,xentagz,Dennis Parker,,#Bitcoin is the Apex Predator (@TraceMayer on @TechBalt show)  https://t.co/6mx2CZ7W1F,en,"[{'screen_name': 'tracemayer', 'name': 'trace mayer', 'id': '57689645'}, {'screen_name': 'techbalt', 'name': 'adam meister', 'id': '49585687'}]",[],[],22,214,579,['bitcoin'],[],https://twitter.com/Xentagz/status/1063542245230546944,False,,1,https://pbs.twimg.com/ext_tw_video_thumb/1063541425776836608/pu/img/ZjdcJ_5oTef9QskY.jpg,,,,,,,[],,,,
1063513301353517056,1063513301353517056,2018-11-16 14:25:04 Eastern Standard Time,2018-11-16,14:25:04,-0500,632528146,kerooke,Kevin Rooke,,"Bitcoin is averaging over 680,000 active users per day in November.  The last time Bitcoin broke that benchmark? February 2018.  If you're following prices, you're looking at the wrong charts.  https://t.co/Y7aOwrmsxR",en,[],[],['https://pbs.twimg.com/media/DsJbbKnUUAAwcNl.jpg'],32,218,591,[],[],https://twitter.com/kerooke/status/1063513301353517056,False,,1,https://pbs.twimg.com/media/DsJbbKnUUAAwcNl.jpg,,,,,,,[],,,,
1063510089426968577,1063510089426968577,2018-11-16 14:12:19 Eastern Standard Time,2018-11-16,14:12:19,-0500,928759224599040001,crypto,Bloomberg Crypto,,"Analysts suggest Bitcoin could gravitate toward $1,500 level  https://t.co/aTZYm90OPr  https://t.co/yJEU1Ma7jI",en,[],['https://bloom.bg/2QObQN1'],['https://pbs.twimg.com/media/DsJYyjVWsAEqDoA.jpg'],139,157,293,[],[],https://twitter.com/crypto/status/1063510089426968577,False,,1,https://pbs.twimg.com/media/DsJYyjVWsAEqDoA.jpg,,,,,,,[],,,,
1063510083106193409,1063510083106193409,2018-11-16 14:12:17 Eastern Standard Time,2018-11-16,14:12:17,-0500,755070940309032961,jimmyzhong_iost,Jimmy Zhong,,"#Bitcoin has been declared dead 316 times. Think about that. The truth is, we've never had as much talent and interest in the space. #Crypto has been evolving in leaps and bounds. If you believe in the technology, don't let short-term volatility scare you!  https://t.co/E2gaWQinV6",en,[],['http://bit.ly/2zYl4yR'],[],59,886,1090,"['bitcoin', 'crypto']",[],https://twitter.com/jimmyzhong_iost/status/1063510083106193409,False,,0,,,,,,,,[],,,,
1063481584605630465,1063481584605630465,2018-11-16 12:19:02 Eastern Standard Time,2018-11-16,12:19:02,-0500,1856523530,capitalandceleb,CCN - Capital & Celeb News,,Pantera Capital CEO: ‘In a Decade Billions of People Will be Using Bitcoin  https://t.co/KDELd4DTiy,en,[],['https://www.ccn.com/pantera-capital-ceo-in-a-decade-billions-of-people-will-be-using-bitcoin/'],[],32,462,1016,[],[],https://twitter.com/CapitalAndCeleb/status/1063481584605630465,False,,0,,,,,,,,[],,,,
1063459210049085444,1063459210049085444,2018-11-16 10:50:08 Eastern Standard Time,2018-11-16,10:50:08,-0500,561274620,weisscrypto,Weiss Crypto,,"What's it gonna take for #XRP to decouple from #BTC? Simple: XRP-based trading pairs. The sooner we add more diversity to the crypto space, the safer we'll all be. #Bitcoin shouldn't dictate the outcome of every single project in this industry. #Binance, are you listening?",en,[],[],[],51,306,1021,"['xrp', 'btc', 'bitcoin', 'binance']",[],https://twitter.com/WeissCrypto/status/1063459210049085444,False,,0,,,,,,,,[],,,,
