id,conversation_id,created_at,date,time,timezone,user_id,username,name,place,tweet,language,mentions,urls,photos,replies_count,retweets_count,likes_count,hashtags,cashtags,link,retweet,quote_url,video,thumbnail,near,geo,source,user_rt_id,user_rt,retweet_id,reply_to,retweet_date,translate,trans_src,trans_dest
1048775297162731520,1048775297162731520,2018-10-06 23:21:30 Eastern Daylight Time,2018-10-06,23:21:30,-0500,1037725348144852992,conanobitcoin,Conan O'Bitcoin,,Bitcoin is going to be worth 100X+ within the next 10 years and you're contemplating on whether you should buy it now at $6500 or wait for it to dip to $6000? .... 🤦‍♂️ #bitcoin,en,[],[],[],44,174,854,['bitcoin'],[],https://twitter.com/ConanOBitcoin/status/1048775297162731520,False,,0,,,,,,,,[],,,,
1048596022396686336,1048596022396686336,2018-10-06 11:29:08 Eastern Daylight Time,2018-10-06,11:29:08,-0500,202590356,haroldsinnott,Harold Sinnott #CES2022 📲,,What is #Blockchain? Why it stands to revolutionize the way we interact with each other.  #CyberSecurity #Crypto #Bitcoin #FutureOfWork  @CIGIonline cc @MikeQuindazzi @dinisguarda @jblefevre60 @andi_staub @sallyeaves @Paula_Piccard @JacBurns_Comext    https://t.co/WHX64R8kkU,en,"[{'screen_name': 'cigionline', 'name': 'cigi', 'id': '38498866'}, {'screen_name': 'mikequindazzi', 'name': 'mike quindazzi ✨', 'id': '2344530218'}, {'screen_name': 'dinisguarda', 'name': 'dinis guarda', 'id': '20222744'}, {'screen_name': 'jblefevre60', 'name': 'jean-baptiste lefevre', 'id': '4374719908'}, {'screen_name': 'andi_staub', 'name': 'andreas staub', 'id': '298704683'}, {'screen_name': 'sallyeaves', 'name': 'dr. sally eaves #mwc22', 'id': '3131243261'}, {'screen_name': 'paula_piccard', 'name': 'paula piccard #mwc22', 'id': '291831562'}]",[],[],11,209,272,"['blockchain', 'cybersecurity', 'crypto', 'bitcoin', 'futureofwork']",[],https://twitter.com/HaroldSinnott/status/1048596022396686336,False,,1,https://pbs.twimg.com/media/DSt-8NiXUAAkEh7.jpg,,,,,,,[],,,,
1048578080682459136,1048578080682459136,2018-10-06 10:17:50 Eastern Daylight Time,2018-10-06,10:17:50,-0500,952552351025520640,1thousandx,1thousandx,,Stop the bullying! @rogerkver @SatoshiLite #bitcoin #BitcoinCash #litecoin #LightningNetwork #crypto #cryptocurrency #altcoins #ethereum #stopthebullyingincrypto  https://t.co/0FyoM7R1Ia,en,"[{'screen_name': 'rogerkver', 'name': 'roger ver', 'id': '176758255'}, {'screen_name': 'satoshilite', 'name': 'charlie lee', 'id': '14338147'}]",[],[],125,301,1306,"['bitcoin', 'bitcoincash', 'litecoin', 'lightningnetwork', 'crypto', 'cryptocurrency', 'altcoins', 'ethereum', 'stopthebullyingincrypto']",[],https://twitter.com/1thousandx/status/1048578080682459136,False,,1,https://pbs.twimg.com/ext_tw_video_thumb/1048577696438124545/pu/img/YGEJv9kmzJObvB92.jpg,,,,,,,[],,,,
1048543872870223874,1048543872870223874,2018-10-06 08:01:54 Eastern Daylight Time,2018-10-06,08:01:54,-0500,16732770,cnbcfastmoney,CNBC's Fast Money,,Bitcoin in the past month...  https://t.co/0miuVpXOZL,en,[],[],['https://pbs.twimg.com/media/Do0tGH8XgAE5jpW.jpg'],154,181,659,[],[],https://twitter.com/CNBCFastMoney/status/1048543872870223874,False,,1,https://pbs.twimg.com/media/Do0tGH8XgAE5jpW.jpg,,,,,,,[],,,,
1048468916505174016,1048468911929274368,2018-10-06 03:04:03 Eastern Daylight Time,2018-10-06,03:04:03,-0500,14338147,satoshilite,Charlie Lee,,"6/6 Bitcoin with Lightning Network more closely fits the Bitcoin whitepaper's title: ""A Peer-to-Peer Electronic Cash System."" This is Satoshi's Vision.",en,[],[],[],63,208,1050,[],[],https://twitter.com/SatoshiLite/status/1048468916505174016,False,,0,,,,,,,,[],,,,
1048468911929274368,1048468911929274368,2018-10-06 03:04:02 Eastern Daylight Time,2018-10-06,03:04:02,-0500,14338147,satoshilite,Charlie Lee,,"1/ On-chain Bitcoin and Litecoin payments are not peer-to-peer. Payments are sent from sender to miners, who record it on a distributed ledger. The recipient receives the payment when it's recorded. BUT, this is facilitated by a p2p network where transactions are broadcasted.",en,[],[],[],67,388,1328,[],[],https://twitter.com/SatoshiLite/status/1048468911929274368,False,,0,,,,,,,,[],,,,
1048337303842766849,1048337303842766849,2018-10-05 18:21:05 Eastern Daylight Time,2018-10-05,18:21:05,-0500,339061487,apompliano,Pomp 🌪,,"JP Morgan just agreed to another settlement after it allegedly violated US sanctions.  Long Bitcoin, Short the Bankers!",en,[],[],[],25,223,929,[],[],https://twitter.com/APompliano/status/1048337303842766849,False,,0,,,,,,,,[],,,,
1048324665087856648,1048324665087856648,2018-10-05 17:30:51 Eastern Daylight Time,2018-10-05,17:30:51,-0500,1856523530,capitalandceleb,CCN - Capital & Celeb News,,Resurrection? SEC to Begin Reviewing 9 Rejected Bitcoin ETFs  https://t.co/1fi3Yv2Up8,en,[],['https://www.ccn.com/resurrection-sec-to-begin-reviewing-9-rejected-bitcoin-etfs/'],[],14,207,452,[],[],https://twitter.com/CapitalAndCeleb/status/1048324665087856648,False,,0,,,,,,,,[],,,,
1048322175655014400,1048322175655014400,2018-10-05 17:20:58 Eastern Daylight Time,2018-10-05,17:20:58,-0500,14338147,satoshilite,Charlie Lee,,Soulja Boy's Bitcoin song also mentions he has Litecoin. 😲   https://t.co/dAN7jnAaNt  It's happening!!! @souljaboy 👊,en,"[{'screen_name': 'souljaboy', 'name': 'soulja boy (big draco)', 'id': '16827333'}]",['https://www.youtube.com/watch?time_continue=4&v=549MoXf3-zA'],[],104,250,966,[],[],https://twitter.com/SatoshiLite/status/1048322175655014400,False,https://twitter.com/CoinDesk/status/1048317267811979265,0,,,,,,,,[],,,,
1048317267811979265,1048317267811979265,2018-10-05 17:01:28 Eastern Daylight Time,2018-10-05,17:01:28,-0500,1333467482,coindesk,CoinDesk,,"Soulja Boy is diving head-first into the crypto world with a song titled ""Bitcoin"" off his latest track.  https://t.co/NUKUEBRG5e",en,[],['http://ow.ly/9nLe30m7zi1'],[],112,445,1163,[],[],https://twitter.com/CoinDesk/status/1048317267811979265,False,,0,,,,,,,,[],,,,
1048263767010828289,1048263767010828289,2018-10-05 13:28:52 Eastern Daylight Time,2018-10-05,13:28:52,-0500,1333467482,coindesk,CoinDesk,,The SEC is asking for further comment on nine different bitcoin exchange-traded fund rule change proposals currently under review.  https://t.co/sOiiazvspY,en,[],['http://ow.ly/41AR30m7ooO'],[],17,201,446,[],[],https://twitter.com/CoinDesk/status/1048263767010828289,False,,0,,,,,,,,[],,,,
1048243397272784896,1048243397272784896,2018-10-05 12:07:55 Eastern Daylight Time,2018-10-05,12:07:55,-0500,2207129125,cointelegraph,Cointelegraph,,SEC will review 9 Bitcoin ETF proposals until Oct. 26  https://t.co/xjHdBJgtKk,en,[],['https://cointelegraph.com/news/us-sec-sets-october-26-deadline-for-reviewing-nine-bitcoin-etf-applications'],[],52,501,1005,[],[],https://twitter.com/Cointelegraph/status/1048243397272784896,False,,0,,,,,,,,[],,,,
1048213014904799233,1048213014904799233,2018-10-05 10:07:12 Eastern Daylight Time,2018-10-05,10:07:12,-0500,47003920,jchervinsky,Jake Chervinsky,,"Dear @elonmusk,  We know you care deeply about advancing the world's transition to sustainable energy.  An untold amount of energy is wasted on metal &amp; paper currency. Please help us transition to bitcoin, which incentivizes innovation &amp; use of cheap renewables.  Thanks, Humanity",en,"[{'screen_name': 'elonmusk', 'name': 'elon musk', 'id': '44196397'}]",[],[],71,246,1391,[],[],https://twitter.com/jchervinsky/status/1048213014904799233,False,,0,,,,,,,,[],,,,
1048191104456253442,1048191104456253442,2018-10-05 08:40:08 Eastern Daylight Time,2018-10-05,08:40:08,-0500,918804624303382528,100trillionusd,PlanB,,#bitcoin halving: only 19 months to go ... we are in the green zone!  https://t.co/5rxVEVhNjU,en,[],[],['https://pbs.twimg.com/media/Dovr_BaX0AA2GTQ.png'],41,363,883,['bitcoin'],[],https://twitter.com/100trillionUSD/status/1048191104456253442,False,,1,https://pbs.twimg.com/media/Dovr_BaX0AA2GTQ.png,,,,,,,[],,,,
1048165571701948416,1048165571701948416,2018-10-05 06:58:40 Eastern Daylight Time,2018-10-05,06:58:40,-0500,19847181,novogratz,Mike Novogratz,,This is really big news.  David Swenson the most influential investor in the world.  By making this investment he just said the bitcoin is a store of value.  He’s the alpha bull of the herd.  Congrats ⁦@_charlienoyes⁩ ⁦⁦@FEhrsam⁩   https://t.co/uUsz4MOvwI,en,"[{'screen_name': '_charlienoyes', 'name': 'charlie noyes', 'id': '895723521153703936'}, {'screen_name': 'fehrsam', 'name': 'fred ehrsam', 'id': '315991624'}]",['https://www.bloomberg.com/news/articles/2018-10-05/yale-is-said-to-invest-in-crypto-fund-that-raised-400-million'],[],62,917,2249,[],[],https://twitter.com/novogratz/status/1048165571701948416,False,,0,,,,,,,,[],,,,
1047960822125875201,1047960822125875201,2018-10-04 17:25:04 Eastern Daylight Time,2018-10-04,17:25:04,-0500,16732770,cnbcfastmoney,CNBC's Fast Money,,TD Ameritrade just went full #crypto. @SteveQuirk_TDA lays out what that means for #bitcoin investors.  https://t.co/qSMdrz24fv,en,[],[],[],78,565,1294,"['crypto', 'bitcoin']",[],https://twitter.com/CNBCFastMoney/status/1047960822125875201,False,,1,https://pbs.twimg.com/media/Dosazv3XgAIuwPg.jpg,,,,,,,[],,,,
1047948026843734016,1047948026843734016,2018-10-04 16:34:14 Eastern Daylight Time,2018-10-04,16:34:14,-0500,9300262,politico,POLITICO,,The Russian hackers were charged with identity theft and wire fraud for sending emails to U.S. employees to trick them into sharing their login credentials.   They also used the cryptocurrency Bitcoin to purchase servers and domains to pay vendors without leaving a paper trail  https://t.co/PQbicpTTQe,en,[],[],[],23,167,189,[],[],https://twitter.com/politico/status/1047948026843734016,False,,1,https://pbs.twimg.com/ext_tw_video_thumb/1047947971772465152/pu/img/-yrOkSze-CqAFNzj.jpg,,,,,,,[],,,,
1047902572714110976,1047902572714110976,2018-10-04 13:33:37 Eastern Daylight Time,2018-10-04,13:33:37,-0500,574032254,coinbase,Coinbase,,"Blockchain technology is enabling a new financial future, but that doesn’t mean it’s obvious how you get started today. In this edition of #cryptocurious, Coinbase CEO @brian_armstrong tackles one of the most common questions: “How do you buy bitcoin?""  https://t.co/C1NIKeSInv  https://t.co/MVpOlhY4lL",en,"[{'screen_name': 'brian_armstrong', 'name': 'brian armstrong', 'id': '14379660'}]",['https://bit.ly/2PbnkcC'],[],157,257,762,['cryptocurious'],[],https://twitter.com/coinbase/status/1047902572714110976,False,,1,https://pbs.twimg.com/media/DorlA61XkAAH-dB.jpg,,,,,,,[],,,,
1047884852454862849,1047884852454862849,2018-10-04 12:23:12 Eastern Daylight Time,2018-10-04,12:23:12,-0500,1598709350,danheld,Dan Held,,"1/ Many people think Bitcoin’s distribution wasn’t fair, or that Satoshi “stealth mined.” Below I dive into early mining, inequality, distribution, and ethics.  For a deeper dive, my Medium post:  https://t.co/fWOT8UQ9Xl  TL;DR - check out this thread 👇",en,[],['https://medium.com/@danhedl/bitcoins-distribution-was-fair-e2ef7bbbc892'],[],40,356,821,[],[],https://twitter.com/danheld/status/1047884852454862849,False,,0,,,,,,,,[],,,,
1047846068107599874,1047846068107599874,2018-10-04 09:49:05 Eastern Daylight Time,2018-10-04,09:49:05,-0500,2382106993,mollymckew,Molly McKew,,"And yet another reminder: our guys can trace cryptocurrency transactions, which is really bad news for a lot of goons who were hiding behind bitcoin and other cryptocurrencies.",en,[],[],[],9,183,471,[],[],https://twitter.com/MollyMcKew/status/1047846068107599874,False,https://twitter.com/MollyMcKew/status/1047843227963940864,0,,,,,,,,[],,,,
1047712943197044736,1047712943197044736,2018-10-04 01:00:05 Eastern Daylight Time,2018-10-04,01:00:05,-0500,1333467482,coindesk,CoinDesk,,JUST IN: Bitcoin startup Acinq has closed new funding – and it's all going to build out the #lightning network:  https://t.co/RHxISVUEuZ,en,[],['http://ow.ly/zMpf30m5IEx'],[],12,190,534,['lightning'],[],https://twitter.com/CoinDesk/status/1047712943197044736,False,,0,,,,,,,,[],,,,
1047607462583525376,1047607462583525376,2018-10-03 18:00:57 Eastern Daylight Time,2018-10-03,18:00:57,-0500,16732770,cnbcfastmoney,CNBC's Fast Money,,Top Wall Street advisor @ricedelman just entered the world of #bitcoin in a big way. Here's why he's embracing #crypto.  https://t.co/c0lRh0AxoI,en,"[{'screen_name': 'ricedelman', 'name': 'ric edelman', 'id': '16134476'}]",[],[],92,525,1203,"['bitcoin', 'crypto']",[],https://twitter.com/CNBCFastMoney/status/1047607462583525376,False,,1,https://pbs.twimg.com/media/DonZbn9X4AAxbMY.jpg,,,,,,,[],,,,
1047497546741047301,1047497546741047301,2018-10-03 10:44:11 Eastern Daylight Time,2018-10-03,10:44:11,-0500,1944727015,aaronvanw,Aaron van Wirdum,,Bitcoin Core 0.17.0 Is Released: Here’s What’s New  https://t.co/SSF2qW0Ep3,en,[],['https://bitcoinmagazine.com/articles/bitcoin-core-0170-released-heres-whats-new/'],[],12,230,478,[],[],https://twitter.com/AaronvanW/status/1047497546741047301,False,,0,,,,,,,,[],,,,
1047492323880460288,1047492323880460288,2018-10-03 10:23:26 Eastern Daylight Time,2018-10-03,10:23:26,-0500,992741542094819334,kubitx,KuBitX,,Check out our article on Medium  https://t.co/msm6YcLXjM  #cryptocurrency #bitcoin #ethereum #kbx #cryptoexchange #ico #pre_ico #bitcoins #cryptocurrencies #cryptotraders #money #southafrica #Blockchain #revolution #technology #followers #altcoins #africa #Malta #entrepreneur,en,[],['https://medium.com/@kubitx/kubitx-the-story-so-far-e6bae5c5f304'],[],3,388,455,"['cryptocurrency', 'bitcoin', 'ethereum', 'kbx', 'cryptoexchange', 'ico', 'pre_ico', 'bitcoins', 'cryptocurrencies', 'cryptotraders', 'money', 'southafrica', 'blockchain', 'revolution', 'technology', 'followers', 'altcoins', 'africa', 'malta', 'entrepreneur']",[],https://twitter.com/kubitx/status/1047492323880460288,False,,0,,,,,,,,[],,,,
1047485772583067649,1047485772583067649,2018-10-03 09:57:24 Eastern Daylight Time,2018-10-03,09:57:24,-0500,339061487,apompliano,Pomp 🌪,,"If banks are too big to fail, Bitcoin is too secure to fail.",en,[],[],[],52,290,1407,[],[],https://twitter.com/APompliano/status/1047485772583067649,False,,0,,,,,,,,[],,,,
1047482917268729856,1047482917268729856,2018-10-03 09:46:03 Eastern Daylight Time,2018-10-03,09:46:03,-0500,1856523530,capitalandceleb,CCN - Capital & Celeb News,,"Bitcoin is Still at an Early Stage: If You Hold 0.28 BTC, You’re Part of the 1%  https://t.co/pLI6MPsNVE",en,[],['https://www.ccn.com/bitcoin-is-still-at-an-early-stage-if-you-hold-0-28-btc-youre-part-of-the-1/'],[],35,380,901,[],[],https://twitter.com/CapitalAndCeleb/status/1047482917268729856,False,,0,,,,,,,,[],,,,
1047471815751172096,1047471815751172096,2018-10-03 09:01:56 Eastern Daylight Time,2018-10-03,09:01:56,-0500,61417559,erikvoorhees,Erik Voorhees,,Big Institutional Investors are Buying Large Amounts of Bitcoin in OTC Market  https://t.co/bDY3PfAEMe,en,[],['https://www.newsbtc.com/2018/10/03/big-institutional-investors-are-buying-large-amounts-of-bitcoin-in-otc-market/'],[],33,352,804,[],[],https://twitter.com/ErikVoorhees/status/1047471815751172096,False,,0,,,,,,,,[],,,,
1047468832057692161,1047468832057692161,2018-10-03 08:50:05 Eastern Daylight Time,2018-10-03,08:50:05,-0500,23618940,lopp,Jameson Lopp,,Looks like 138 people contributed to the Bitcoin Core 0.17 release. An all-time high!,en,[],[],[],20,138,896,[],[],https://twitter.com/lopp/status/1047468832057692161,False,,0,,,,,,,,[],,,,
1047464253828096000,1047464253828096000,2018-10-03 08:31:53 Eastern Daylight Time,2018-10-03,08:31:53,-0500,2933805082,fintechfrank,Frank Chaparro,,"BREAKING! Big institutional crypto news.   TDAmeritrade, Virtu, DRW, SIG, Cboe, Digital Currency Group, Pantera Capital, and more are getting behind a brand new market for crypto called ErisX.   Aiming to get approval for futures on bitcoin, bitcoin cash, ethereum and lite coin.",en,[],[],[],62,517,1412,[],[],https://twitter.com/fintechfrank/status/1047464253828096000,False,,0,,,,,,,,[],,,,
1047453288227131392,1047453288227131392,2018-10-03 07:48:19 Eastern Daylight Time,2018-10-03,07:48:19,-0500,4839528448,bitcoincoreorg,Bitcoin Core Project,,Bitcoin Core 0.17.0 Released  https://t.co/ciwCREngon,en,[],['https://lists.linuxfoundation.org/pipermail/bitcoin-core-dev/2018-October/000068.html'],[],79,267,666,[],[],https://twitter.com/bitcoincoreorg/status/1047453288227131392,False,,0,,,,,,,,[],,,,
1047360262431490048,1047360262431490048,2018-10-03 01:38:40 Eastern Daylight Time,2018-10-03,01:38:40,-0500,20902138,alistairmilne,Alistair Milne,,"Coinbase Growth Update: - added ~5million users in the last 6 months, now have 25mil - average of ~25,000 users/day is comparable to mid-2017 Data here:  https://t.co/R9B63J2d6Q #bitcoin  https://t.co/MITLacwC5L",en,[],['https://docs.google.com/spreadsheets/d/1NgvD2kFT69mSXuJPzPDu-Qv9SS1ck2iPt6Kw9a55z0k/edit?usp=sharing'],['https://pbs.twimg.com/media/Doj3vf0X0AAW97M.jpg'],53,263,646,['bitcoin'],[],https://twitter.com/alistairmilne/status/1047360262431490048,False,,1,https://pbs.twimg.com/media/Doj3vf0X0AAW97M.jpg,,,,,,,[],,,,
1047285916937719808,1047285916937719808,2018-10-02 20:43:14 Eastern Daylight Time,2018-10-02,20:43:14,-0500,339061487,apompliano,Pomp 🌪,,"Today the Federal Reserve Chairman said he would “act with authority” if inflation started to rise in the US.  What does that even mean??  It’s about time we start trusting math and software over humans.  Long Bitcoin, Short the Bankers.",en,[],[],[],100,375,1574,[],[],https://twitter.com/APompliano/status/1047285916937719808,False,,0,,,,,,,,[],,,,
1047188058519433216,1047188058519433216,2018-10-02 14:14:23 Eastern Daylight Time,2018-10-02,14:14:23,-0500,20374262,maxkeiser,🇸🇻 BITCOIN AMBASSADOR 🌋,,"The move to $28,000 will be crisis-driven and then no #Bitcoin will be available under $100,000 as price gaps - and even at that price, not much BTC available.",en,[],[],[],66,158,640,['bitcoin'],[],https://twitter.com/maxkeiser/status/1047188058519433216,False,,0,,,,,,,,[],,,,
1047097581610909697,1047097581610909697,2018-10-02 08:14:52 Eastern Daylight Time,2018-10-02,08:14:52,-0500,339061487,apompliano,Pomp 🌪,,There will only be 21 million Bitcoin.  At some point scarcity takes over.,en,[],[],[],194,359,2003,[],[],https://twitter.com/APompliano/status/1047097581610909697,False,,0,,,,,,,,[],,,,
1046874045126467585,1046874045126467585,2018-10-01 17:26:36 Eastern Daylight Time,2018-10-01,17:26:36,-0500,16732770,cnbcfastmoney,CNBC's Fast Money,,"#Bitcoin is a commodity, but how do you characterize the rest? @giancarloCFTC, the man in charge of #crypto regulation, goes on the record.  https://t.co/hn2B1UOnGH",en,[],[],[],77,339,788,"['bitcoin', 'crypto']",[],https://twitter.com/CNBCFastMoney/status/1046874045126467585,False,,1,https://pbs.twimg.com/media/Doc-ZIJXsAAsZss.jpg,,,,,,,[],,,,
1046832503619825664,1046832503619825664,2018-10-01 14:41:32 Eastern Daylight Time,2018-10-01,14:41:32,-0500,3259423777,bitcoinguruhq,BitcoinGuru,,"The U.S. Commodity Futures Trading Commission (CFTC) officially labelled  Bitcoin a commodity, [...] essentially claiming it under its Umbrella  #Bitcoin #CFTC #Crypto #Cryptocurrency #SEC $BTCUSD   https://t.co/ckU3LYXtH2",en,[],['https://www.nasdaq.com/article/bitcoin-ruled-commodity-palladium-etf-shines-cm1030552'],[],5,152,288,"['bitcoin', 'cftc', 'crypto', 'cryptocurrency', 'sec']",['btcusd'],https://twitter.com/BitcoinGuruHQ/status/1046832503619825664,False,,0,,,,,,,,[],,,,
1046815482546929664,1046815482546929664,2018-10-01 13:33:54 Eastern Daylight Time,2018-10-01,13:33:54,-0500,339061487,apompliano,Pomp 🌪,,"Venezuela’s Bolivar has been in hyperinflation since Nov 2016.  Last week, Bitcoin trading volumes set a record high. CCN is reporting that this week’s Venezuelan volumes will be even higher.  Bitcoin isn’t a Silicon Valley dream. It is the best option for many around the world.",en,[],[],[],30,221,894,[],[],https://twitter.com/APompliano/status/1046815482546929664,False,,0,,,,,,,,[],,,,
1046761454819594241,1046761454819594241,2018-10-01 09:59:13 Eastern Daylight Time,2018-10-01,09:59:13,-0500,943428844920475648,soundmoneyz,Sound Money Central ⚡️,,We just witnessed an altcoiners meeting to takeover Bitcoin 😆  Please reward our effort with a retweet if you enjoy these vids and  want to see more of them in the future. 👍💪  https://t.co/LtoncH1iQb,en,[],[],[],43,325,804,[],[],https://twitter.com/SoundMoneyz/status/1046761454819594241,False,,1,https://pbs.twimg.com/ext_tw_video_thumb/1046760307023106048/pu/img/Yz9g8KZNyPgx_Ys6.jpg,,,,,,,[],,,,
1046650961135951872,1046650961135951872,2018-10-01 02:40:09 Eastern Daylight Time,2018-10-01,02:40:09,-0500,1153045459,incindia,Congress,,"PM Modi hails 'Digital India' as the new technological revolution, all the while his govt.'s websites are being hacked almost every day for illegal bitcoin mining.   https://t.co/AyZ0CNZGpg",en,[],['https://www.indiatoday.in/mail-today/story/every-day-1-government-website-hacked-bitcoins-crypto-currency-1353097-2018-10-01'],[],39,462,1102,[],[],https://twitter.com/INCIndia/status/1046650961135951872,False,,0,,,,,,,,[],,,,
