id,conversation_id,created_at,date,time,timezone,user_id,username,name,place,tweet,language,mentions,urls,photos,replies_count,retweets_count,likes_count,hashtags,cashtags,link,retweet,quote_url,video,thumbnail,near,geo,source,user_rt_id,user_rt,retweet_id,reply_to,retweet_date,translate,trans_src,trans_dest
1063407625805664256,1063400765119758336,2018-11-16 07:25:09 Eastern Standard Time,2018-11-16,07:25:09,-0500,906870773066772480,bitmexresearch,BitMEX Research,,"@hernzzzzzz Bitcoin Cash ABC miners are also making considerable daily losses, even larger losses than SV miners, according to our estimates.  https://t.co/uMS9LiYUXS",en,[],[],['https://pbs.twimg.com/media/DsH7To-XoAAotOe.jpg'],20,136,306,[],[],https://twitter.com/BitMEXResearch/status/1063407625805664256,False,,1,https://pbs.twimg.com/media/DsH7To-XoAAotOe.jpg,,,,,,,"[{'screen_name': 'hernzzzzzz', 'name': 'Hernz', 'id': '2907397519'}]",,,,
1063305690935164928,1063305690935164928,2018-11-16 00:40:06 Eastern Standard Time,2018-11-16,00:40:06,-0500,14717442,xentagz,Dennis Parker,,"“​If you’re not a Bitcoin Maximalist, you have not done enough research” - @TraceMayer",en,"[{'screen_name': 'tracemayer', 'name': 'trace mayer', 'id': '57689645'}]",[],[],24,205,808,[],[],https://twitter.com/Xentagz/status/1063305690935164928,False,,0,,,,,,,,[],,,,
1063304102048866304,1063304102048866304,2018-11-16 00:33:47 Eastern Standard Time,2018-11-16,00:33:47,-0500,16589206,wikileaks,WikiLeaks,,"Protect Julian Assange and WikiLeaks staff from extradition. Contribute to the @WikiLeaks Defense Fund (independently audited by the Courage Foundation): Bitcoin, Zcash, Paypal, Visa, Amex and more:   https://t.co/E1QbYJL4bB  https://t.co/l87YwFk53n",en,"[{'screen_name': 'wikileaks', 'name': 'wikileaks', 'id': '16589206'}]",['https://www.iamwikileaks.org/donate/'],['https://pbs.twimg.com/media/DsGcsg6WwAAaON0.jpg'],305,694,974,[],[],https://twitter.com/wikileaks/status/1063304102048866304,False,,1,https://pbs.twimg.com/media/DsGcsg6WwAAaON0.jpg,,,,,,,[],,,,
1063282344117723136,1063282344117723136,2018-11-15 23:07:20 Eastern Standard Time,2018-11-15,23:07:20,-0500,877807935493033984,binance,Binance,,"#Binance Has Distributed Bitcoin Cash ABC (BCHABC), Bitcoin Cash SV (BCHSV) and Will Open Trading  https://t.co/Ex5YmLkspH  https://t.co/UAv1VYVzVd",en,[],['https://support.binance.com/hc/en-us/articles/360019875411'],['https://pbs.twimg.com/media/DsGJduIU0AAMMMV.jpg'],163,202,602,['binance'],[],https://twitter.com/binance/status/1063282344117723136,False,,1,https://pbs.twimg.com/media/DsGJduIU0AAMMMV.jpg,,,,,,,[],,,,
1063273432605954048,1063273432605954048,2018-11-15 22:31:55 Eastern Standard Time,2018-11-15,22:31:55,-0500,339061487,apompliano,Pomp 🌪,,"The European Central Bank has called Bitcoin “the evil spawn of the financial crisis.”  The only evil thing central banks should be talking about is their history of using inflation to increase the inequality gap.  Long Bitcoin, Short the Bankers!",en,[],[],[],98,495,2130,[],[],https://twitter.com/APompliano/status/1063273432605954048,False,,0,,,,,,,,[],,,,
1063261832477990912,1063261742380154880,2018-11-15 21:45:49 Eastern Standard Time,2018-11-15,21:45:49,-0500,902926941413453824,cz_binance,CZ 🔶 Binance,,Less possibility of confusion with bitcoin now.,en,[],[],[],75,122,1354,[],[],https://twitter.com/cz_binance/status/1063261832477990912,False,,0,,,,,,,,[],,,,
1063174824057552897,1063174824057552897,2018-11-15 16:00:05 Eastern Standard Time,2018-11-15,16:00:05,-0500,4898091,financialtimes,Financial Times,,The European Central Bank has just dubbed bitcoin 'the evil spawn of the financial crisis'  https://t.co/69nvpuMqsW,en,[],['https://on.ft.com/2DEWDLf'],[],165,207,402,[],[],https://twitter.com/FinancialTimes/status/1063174824057552897,False,,0,,,,,,,,[],,,,
1063129769150042112,1063129769150042112,2018-11-15 13:01:03 Eastern Standard Time,2018-11-15,13:01:03,-0500,339061487,apompliano,Pomp 🌪,,Who cares what a bunch of random guys are doing with fake Bitcoin networks.  Don’t get distracted.   The work ahead is too important to waste mental energy on the sideshows.,en,[],[],[],107,389,2279,[],[],https://twitter.com/APompliano/status/1063129769150042112,False,,0,,,,,,,,[],,,,
1063123138081370112,1063123138081370112,2018-11-15 12:34:42 Eastern Standard Time,2018-11-15,12:34:42,-0500,176758255,rogerkver,Roger Ver,,The  https://t.co/6EeRmpfaH7 pool now has more hash rate on it than the entire BCH network had earlier today.   Bitcoin is cash for the world!   #BitcoinCash #bitcoincashfork  https://t.co/n2MqQ5mlfK,en,[],['http://Bitcoin.com'],['https://pbs.twimg.com/media/DsD4ndPW4AUvO8P.jpg'],335,268,1077,"['bitcoincash', 'bitcoincashfork']",[],https://twitter.com/rogerkver/status/1063123138081370112,False,,1,https://pbs.twimg.com/media/DsD4ndPW4AUvO8P.jpg,,,,,,,[],,,,
1063121248488587264,1063121248488587264,2018-11-15 12:27:12 Eastern Standard Time,2018-11-15,12:27:12,-0500,536904693,lincolnsbible,LB,,"Well, well, well... what have we here? A thread on Zuck &amp; Lean In’s treason, perhaps? Eleven months ago, is it? Right when some savvy journos chose to start investigating? (you’re f*ckng welcome, America. We’ll keep exposing this shit. Now get those bitcoin Nazis off our jocks.)",en,[],[],[],13,273,593,[],[],https://twitter.com/LincolnsBible/status/1063121248488587264,False,https://twitter.com/LincolnsBible/status/963209749889077249,0,,,,,,,,[],,,,
1063045037813051392,1063043393494937600,2018-11-15 07:24:22 Eastern Standard Time,2018-11-15,07:24:22,-0500,83466368,ecb,European Central Bank,,"Cœuré: Bitcoin was an extremely clever idea. Sadly, not every clever idea is a good idea.",en,[],[],[],297,156,329,[],[],https://twitter.com/ecb/status/1063045037813051392,False,,0,,,,,,,,[],,,,
1063018187166408704,1063018187166408704,2018-11-15 05:37:40 Eastern Standard Time,2018-11-15,05:37:40,-0500,357312062,bitcoin,Bitcoin,,"Just over 6 hours remain until Bitcoin's first ever Hash War begins. As tiresome as the drama may be, it will be fascinating to see a community dispute actually resolved through pure hashrate in real time.   https://t.co/nhf00FNJsH  https://t.co/dNV152z9it",en,[],['https://cash.coin.dance/'],['https://pbs.twimg.com/media/DsCZXs2V4AAxrb1.jpg'],61,174,440,[],[],https://twitter.com/Bitcoin/status/1063018187166408704,False,,1,https://pbs.twimg.com/media/DsCZXs2V4AAxrb1.jpg,,,,,,,[],,,,
1062990890505924608,1062990890505924608,2018-11-15 03:49:12 Eastern Standard Time,2018-11-15,03:49:12,-0500,970560317074878464,securypto,Securypto,,A new way to monetize content distribution with the safety of your privacy ensured by blockchain and encryption   https://t.co/DXi7QQd2P3  #security #blockchain #blockchaintechnology #bitcoin…  https://t.co/4949kUSrFo,en,[],"['https://goo.gl/4bycZC', 'https://www.instagram.com/p/BqMeJVcAhjo/?utm_source=ig_twitter_share&igshid=imm2y12u2sf']",[],9,521,555,"['security', 'blockchain', 'blockchaintechnology', 'bitcoin']",[],https://twitter.com/Securypto/status/1062990890505924608,False,,0,,,,,,,,[],,,,
1062954439474958339,1062954439474958339,2018-11-15 01:24:21 Eastern Standard Time,2018-11-15,01:24:21,-0500,2395318063,_kevin_pham,Kevin Pham,,Milton Friedman predicted the invention of Bitcoin in the 90's.  Paul Krugman predicted the internet would be no more important than the fax machine in the 90's.  https://t.co/8JQzrgo4ug,en,[],[],"['https://pbs.twimg.com/media/DsBfaeMVAAAwu1L.jpg', 'https://pbs.twimg.com/media/DsBfbGcUwAMdHLW.jpg']",39,140,465,[],[],https://twitter.com/_Kevin_Pham/status/1062954439474958339,False,,1,https://pbs.twimg.com/media/DsBfaeMVAAAwu1L.jpg,,,,,,,[],,,,
1062831969246027776,1062831969246027776,2018-11-14 17:17:42 Eastern Standard Time,2018-11-14,17:17:42,-0500,2199605117,rnr_0,Romano,,Pepe buys bitcoin  https://t.co/DzTWXlFlFl,en,[],[],[],77,364,1330,[],[],https://twitter.com/RNR_0/status/1062831969246027776,False,,1,https://pbs.twimg.com/ext_tw_video_thumb/1062831751188439040/pu/img/6ptTpIeYsc1sato6.jpg,,,,,,,[],,,,
1062778792819736577,1062778792819736577,2018-11-14 13:46:24 Eastern Standard Time,2018-11-14,13:46:24,-0500,2373682811,zackvoell,Zack Voell,,"""Ramen"" just became more popular than ""Bitcoin"".  https://t.co/T16VHJj20Q",en,[],[],['https://pbs.twimg.com/media/Dr-_pe7WsAAzzhe.jpg'],80,319,1393,[],[],https://twitter.com/zackvoell/status/1062778792819736577,False,,1,https://pbs.twimg.com/media/Dr-_pe7WsAAzzhe.jpg,,,,,,,[],,,,
1062768239074271232,1062768239074271232,2018-11-14 13:04:28 Eastern Standard Time,2018-11-14,13:04:28,-0500,19224439,nouriel,Nouriel Roubini,,I could gloat about Bitcoin collapsing 10% in a day to $5700. But that is still some way to ZERO where Bitcoin belongs.  Actually since Bitcoin is The Mother of All Toxic Pollutions &amp; Environmental Disasters its true fair value is highly NEGATIVE with the right externality tax,en,[],[],[],568,325,1025,[],[],https://twitter.com/Nouriel/status/1062768239074271232,False,,0,,,,,,,,[],,,,
1062756686014898177,1062756686014898177,2018-11-14 12:18:33 Eastern Standard Time,2018-11-14,12:18:33,-0500,928759224599040001,crypto,Bloomberg Crypto,,"Bitcoin falls below $6,000 to lowest level in over a year  https://t.co/CbJw7XC90W  https://t.co/4ohUM5Hli2",en,[],['https://bloom.bg/2DBpmRf'],['https://pbs.twimg.com/media/Dr-rkqoX0AAViDy.jpg'],54,292,474,[],[],https://twitter.com/crypto/status/1062756686014898177,False,,1,https://pbs.twimg.com/media/Dr-rkqoX0AAViDy.jpg,,,,,,,[],,,,
1062748076094509056,1062748076094509056,2018-11-14 11:44:20 Eastern Standard Time,2018-11-14,11:44:20,-0500,20902138,alistairmilne,Alistair Milne,,Current status: #bitcoin  https://t.co/WE5FlgaAr3,en,[],[],[],19,132,606,['bitcoin'],[],https://twitter.com/alistairmilne/status/1062748076094509056,False,,1,https://pbs.twimg.com/ext_tw_video_thumb/1062748009405038592/pu/img/h5Vg0SpZG71zh_3K.jpg,,,,,,,[],,,,
1062743385570607104,1062743385570607104,2018-11-14 11:25:42 Eastern Standard Time,2018-11-14,11:25:42,-0500,18856867,zerohedge,zerohedge,,Bitcoin  https://t.co/9i8ZvLJMM8,en,[],[],['https://pbs.twimg.com/media/Dr-feTIVYAA0tbD.jpg'],43,209,327,[],[],https://twitter.com/zerohedge/status/1062743385570607104,False,,1,https://pbs.twimg.com/media/Dr-feTIVYAA0tbD.jpg,,,,,,,[],,,,
1062739776242106368,1062739776242106368,2018-11-14 11:11:22 Eastern Standard Time,2018-11-14,11:11:22,-0500,2799211554,whalepanda,WhalePanda,,#Bitcoin  https://t.co/IPvcAPQho2,und,[],[],[],41,162,804,['bitcoin'],[],https://twitter.com/WhalePanda/status/1062739776242106368,False,,1,https://pbs.twimg.com/ext_tw_video_thumb/1062739743685988355/pu/img/IvyIeXa6L7NVE2W2.jpg,,,,,,,[],,,,
1062733188672483330,1062733188672483330,2018-11-14 10:45:11 Eastern Standard Time,2018-11-14,10:45:11,-0500,14710235,neerajka,Neeraj K. Agrawal,,I have been sent a copy of the Bitcoin children’s book  https://t.co/QHkIeoQLso,en,[],[],"['https://pbs.twimg.com/media/Dr-WL8oXgAAuQRR.jpg', 'https://pbs.twimg.com/media/Dr-WL8rWoAUvqyH.jpg', 'https://pbs.twimg.com/media/Dr-WL8vWkAESShh.jpg', 'https://pbs.twimg.com/media/Dr-WL8qWoAA2rrO.jpg']",67,205,1155,[],[],https://twitter.com/NeerajKA/status/1062733188672483330,False,,1,https://pbs.twimg.com/media/Dr-WL8oXgAAuQRR.jpg,,,,,,,[],,,,
1062728015841542144,1062728015841542144,2018-11-14 10:24:38 Eastern Standard Time,2018-11-14,10:24:38,-0500,561274620,weisscrypto,Weiss Crypto,,"With BTC 10th anniversary behind us, which of these coins do you think will rise in 2019 as the best investment? #BTC #ETH #XRP #ADA #Cardano #Ether #Ethereum #bitcoin #altcoins",en,[],[],[],49,131,224,"['btc', 'eth', 'xrp', 'ada', 'cardano', 'ether', 'ethereum', 'bitcoin', 'altcoins']",[],https://twitter.com/WeissCrypto/status/1062728015841542144,False,,0,,,,,,,,[],,,,
1062695905768263680,1062695905768263680,2018-11-14 08:17:02 Eastern Standard Time,2018-11-14,08:17:02,-0500,1008162403,noodleofbinance,๑ Panda ๑,,"#bitcoin $btc   Jihan:  I have no intention to start a hash war with CSW, because if I do (by relocating hash power from btc mining to bch mining), btc price will dump below yearly support; it may even breach $5000. But since CSW is relentless, I am all in to fight till death!  https://t.co/d95axXEwFS",en,[],[],['https://pbs.twimg.com/media/Dr90STZX4AEEqWd.jpg'],64,153,364,['bitcoin'],['btc'],https://twitter.com/NoodleofBinance/status/1062695905768263680,False,,1,https://pbs.twimg.com/media/Dr90STZX4AEEqWd.jpg,,,,,,,[],,,,
1062445038322569217,1062445038322569217,2018-11-13 15:40:11 Eastern Standard Time,2018-11-13,15:40:11,-0500,820252180796100608,bitcoinissaving,Bitcoin is Saving,,I just published Understanding the Technical Side of Bitcoin  https://t.co/fazxsPZ44d,en,[],['https://link.medium.com/x8d43ZwUOR'],[],19,202,617,[],[],https://twitter.com/BitcoinIsSaving/status/1062445038322569217,False,,0,,,,,,,,[],,,,
1062444300204732419,1062444300204732419,2018-11-13 15:37:15 Eastern Standard Time,2018-11-13,15:37:15,-0500,299865877,knightofdelta,"0xManasseh (🎩, 🎩)",,"Oil price is less than 10% above the oil price benchmark for Nigerian 2019 budget. Oil, whose volatility is worse than Bitcoin, accounts for 90% of Government revenue.   Guess who’s living on a Ponzi scheme.",en,[],[],[],10,125,142,[],[],https://twitter.com/knightofdelta/status/1062444300204732419,False,,0,,,,,,,,[],,,,
1062388561868177408,1062388561868177408,2018-11-13 11:55:46 Eastern Standard Time,2018-11-13,11:55:46,-0500,87193720,ameero1,Ameero,,HUGE Bitcoin news: One the biggest European exchanges  https://t.co/8IGDQWk2Wd has bought bank and gained banking license. They plan a massive expansion with 4000 Bitcoin ATMs across Germany.    https://t.co/6Gx4tFm0Lq,en,[],"['http://Bitcoin.de', 'http://mobile.dgap.de/dgap/News/corporate/bitcoin-group-erwirbt-die-tremmel-wertpapierhandelsbank-gmbh-und-erweitert-das-eigene-serviceportfolio-signifikant/?newsID=1108253']",[],53,578,1522,[],[],https://twitter.com/ameero1/status/1062388561868177408,False,,0,,,,,,,,[],,,,
1062359512110297088,1062359512110297088,2018-11-13 10:00:20 Eastern Standard Time,2018-11-13,10:00:20,-0500,65698096,splcenter,Southern Poverty Law Center,,"According to white nationalist Richard Spencer, Bitcoin is the “currency of the alt-right.” The decentralized, peer-to-peer, crypto-currency has obvious appeal: no company and no government can intervene to stop the donations from flowing.  https://t.co/g04aAJMN04",en,[],['https://www.ccn.com/hate-pays-neo-nazi-site-daily-stormer-has-raised-surprising-amount-of-bitcoin/'],[],22,242,220,[],[],https://twitter.com/splcenter/status/1062359512110297088,False,,0,,,,,,,,[],,,,
1061975499868721152,1061975499868721152,2018-11-12 08:34:24 Eastern Standard Time,2018-11-12,08:34:24,-0500,768122323,mekhoko,Matt Khoury,,"Marc Andreessen on Bitcoin, Money, and God  https://t.co/jtLuCDfIY5",en,[],[],['https://pbs.twimg.com/media/DrzlAo8U8AAg_kB.jpg'],9,142,393,[],[],https://twitter.com/MEKhoko/status/1061975499868721152,False,,1,https://pbs.twimg.com/media/DrzlAo8U8AAg_kB.jpg,,,,,,,[],,,,
1061955338126155776,1061955338126155776,2018-11-12 07:14:17 Eastern Standard Time,2018-11-12,07:14:17,-0500,19570960,realdonaldtrfan,Donald J. Trump ........................... ᵖᵃʳᵒᵈʸ,,A guy e-mailed me &amp; said he hacked my iPhone camera &amp; recorded me watching Goldin Shower porn! LIES! I never did that! NEVER! Now I'm being BLACKMAILED! I must send $5 million in BitCoin or videos of what I did will be released! But I don't know HOW to use BitCoin! #MondayMorning,en,[],[],[],236,627,3369,['mondaymorning'],[],https://twitter.com/realDonaldTrFan/status/1061955338126155776,False,,0,,,,,,,,[],,,,
1061942562834001920,1061942562834001920,2018-11-12 06:23:31 Eastern Standard Time,2018-11-12,06:23:31,-0500,1333467482,coindesk,CoinDesk,,"Bitcoin could be in for a recovery rally, having defended a key support level over the weekend.  https://t.co/FXqWYxefPU",en,[],['http://ow.ly/mF0q30mAdNo'],[],20,181,432,[],[],https://twitter.com/CoinDesk/status/1061942562834001920,False,,0,,,,,,,,[],,,,
1061830948050927619,1061830948050927619,2018-11-11 23:00:00 Eastern Standard Time,2018-11-11,23:00:00,-0500,22151193,qikipedia,Quite Interesting,,"In 2017, 69 million metric tons of carbon dioxide was generated by bitcoin production.",en,[],[],[],41,278,719,[],[],https://twitter.com/qikipedia/status/1061830948050927619,False,,0,,,,,,,,[],,,,
1061778124915044355,1061778124915044355,2018-11-11 19:30:06 Eastern Standard Time,2018-11-11,19:30:06,-0500,1856523530,capitalandceleb,CCN - Capital & Celeb News,,Bitcoin Accepted Here: Major US Museum Now Takes Crypto Payments  https://t.co/l4zsEej4QP,en,[],['https://www.ccn.com/major-museum-in-the-us-to-accept-bitcoin-big-win-for-crypto-awareness/'],[],14,347,864,[],[],https://twitter.com/CapitalAndCeleb/status/1061778124915044355,False,,0,,,,,,,,[],,,,
1061720972372336641,1061720972372336641,2018-11-11 15:43:00 Eastern Standard Time,2018-11-11,15:43:00,-0500,863527548,steve_hanke,Steve Hanke,,I found the #bitcoin machine.  https://t.co/SXdXnhtOO2,en,[],[],['https://pbs.twimg.com/media/DrvCJt1W4AIxP7H.jpg'],93,236,579,['bitcoin'],[],https://twitter.com/steve_hanke/status/1061720972372336641,False,,1,https://pbs.twimg.com/media/DrvCJt1W4AIxP7H.jpg,,,,,,,[],,,,
1061698728782786561,1061698728782786561,2018-11-11 14:14:37 Eastern Standard Time,2018-11-11,14:14:37,-0500,2338070737,bitcoinist,Bitcoinist.com,,"Bitcoin ATMs Have Spread To 4,000 Locations Globally  https://t.co/bmEgHEjQir",en,[],['https://bitcoinist.com/bitcoin-atms-4000-globally/'],[],18,261,654,[],[],https://twitter.com/bitcoinist/status/1061698728782786561,False,,0,,,,,,,,[],,,,
1061634908064497665,1061634908064497665,2018-11-11 10:01:00 Eastern Standard Time,2018-11-11,10:01:00,-0500,339061487,apompliano,Pomp 🌪,,"In Greece for a few days.   Every person I talk to eventually mentions their financial crisis from a few years ago if we talk for long enough.  People don’t forget when banks and governments mismanage their money.  Long Bitcoin, Short the Bankers!",en,[],[],[],67,270,1523,[],[],https://twitter.com/APompliano/status/1061634908064497665,False,,0,,,,,,,,[],,,,
1061569725275213825,1061569725275213825,2018-11-11 05:42:00 Eastern Standard Time,2018-11-11,05:42:00,-0500,1856523530,capitalandceleb,CCN - Capital & Celeb News,,20% of the British Population See Bitcoin as an Inevitability  https://t.co/yQlQTctz1v,en,[],['https://www.ccn.com/20-of-the-british-population-see-bitcoin-as-an-inevitability/'],[],14,222,599,[],[],https://twitter.com/CapitalAndCeleb/status/1061569725275213825,False,,0,,,,,,,,[],,,,
1061415918616698881,1061415918616698881,2018-11-10 19:30:49 Eastern Standard Time,2018-11-10,19:30:49,-0500,23618940,lopp,Jameson Lopp,,No one has found the bottom of the Bitcoin rabbit hole.  https://t.co/c6kpxVaUbw,en,[],[],['https://pbs.twimg.com/tweet_video_thumb/DrrnTWsXgAAlaaH.jpg'],47,328,1302,[],[],https://twitter.com/lopp/status/1061415918616698881,False,,1,https://pbs.twimg.com/tweet_video_thumb/DrrnTWsXgAAlaaH.jpg,,,,,,,[],,,,
1061306645878398977,1061306645878398977,2018-11-10 12:16:37 Eastern Standard Time,2018-11-10,12:16:37,-0500,2214652482,rampcapitalllc,Ramp Capital,,When you bring up Bitcoin this year at Thanksgiving  https://t.co/5VZimGYXz1,en,[],[],[],98,443,1887,[],[],https://twitter.com/RampCapitalLLC/status/1061306645878398977,False,,1,https://pbs.twimg.com/ext_tw_video_thumb/1060644942886903809/pu/img/-UwI2AhwdPEpLCZJ.jpg,,,,,,,[],,,,
1061255409908932614,1061255409908932614,2018-11-10 08:53:01 Eastern Standard Time,2018-11-10,08:53:01,-0500,61989169,drei4u,Altcoin Pump Hunter,,"When Bitcoin was around $186, @TimDraper's $10k prediction seemed like a pipe dream, a lot of people laughed at him, I was gunning for $5k realistically. And now, he thinks its going to $250,000.",en,"[{'screen_name': 'timdraper', 'name': 'tim draper', 'id': '20884310'}]",[],[],42,243,1151,[],[],https://twitter.com/drei4u/status/1061255409908932614,False,,0,,,,,,,,[],,,,
1061118301105864704,1061118301105864704,2018-11-09 23:48:12 Eastern Standard Time,2018-11-09,23:48:12,-0500,86829277,leoaw,Leo Weese 獅草地,,"Bitcoin is just a massive conspiracy to teach you about economics, finance, politics and computers.",en,[],[],[],93,1039,4245,[],[],https://twitter.com/LeoAW/status/1061118301105864704,False,,0,,,,,,,,[],,,,
1061107871272685568,1061107871272685568,2018-11-09 23:06:45 Eastern Standard Time,2018-11-09,23:06:45,-0500,75149736,mustachetommy,Tommy Mustache #❤️❤️❤️,,"Hublot's Newest Watch is $25,000, and You Can Only Pay With Bitcoin |   Only 210 watches will be made.  $25k each and has Bitcoin designs inside the watch.  Digital Trends  https://t.co/jKjc0neLTj",en,[],['https://www.digitaltrends.com/wearables/hublot-big-bang-meca-10-p2p-bitcoin-news/amp/'],[],35,255,680,[],[],https://twitter.com/MustacheTommy/status/1061107871272685568,False,,0,,,,,,,,[],,,,
1061082579795877888,1061082579795877888,2018-11-09 21:26:15 Eastern Standard Time,2018-11-09,21:26:15,-0500,2207129125,cointelegraph,Cointelegraph,,Tim Draper stands by his prediction that Bitcoin will reach $250k in four years  https://t.co/EO3TyJuFzS,en,[],['https://cointelegraph.com/news/tim-draper-stands-by-his-bitcoin-price-prediction-of-250k-in-2022'],[],38,350,961,[],[],https://twitter.com/Cointelegraph/status/1061082579795877888,False,,0,,,,,,,,[],,,,
1061078602903666688,1061078602903666688,2018-11-09 21:10:27 Eastern Standard Time,2018-11-09,21:10:27,-0500,1856523530,capitalandceleb,CCN - Capital & Celeb News,,Bitcoin ETF Could Attract Billions in New Investment: VanEck  https://t.co/pue2WKfxvP,en,[],['https://www.ccn.com/bitcoin-etf-could-attract-billions-in-new-investment-vaneck/'],[],20,337,838,[],[],https://twitter.com/CapitalAndCeleb/status/1061078602903666688,False,,0,,,,,,,,[],,,,
1060944893546098688,1060944893546098688,2018-11-09 12:19:08 Eastern Standard Time,2018-11-09,12:19:08,-0500,339061487,apompliano,Pomp 🌪,,Bitcoin believer starter kit:  1. Read Bitcoin whitepaper 2. Set up digital wallet 3. Send transaction 4. Realize the magic 5. Tell friends  Educate yourself. Spread the virus.,en,[],[],[],154,967,3240,[],[],https://twitter.com/APompliano/status/1060944893546098688,False,,0,,,,,,,,[],,,,
1060889383673516032,1060889383673516032,2018-11-09 08:38:34 Eastern Standard Time,2018-11-09,08:38:34,-0500,2523137198,mikenerduk,Mike McCarthy 🏴󠁧󠁢󠁥󠁮󠁧󠁿 Tpunk #9623,,"Was TRON a good decision for you??  TRON: 963,846 txns. Operating at 0.56% capacity. No pending.  Ethereum: 554,198 txns. At 100% capacity. Will take 3hours 18 mins to clear 77,538 pending txns.  Bitcoin: 668,556 txns. At 96.72% capacity. Nothing pending for now.  #TRON #TRX",en,[],[],[],67,195,871,"['tron', 'trx']",[],https://twitter.com/MikeNerdUK/status/1060889383673516032,False,,0,,,,,,,,[],,,,
1060761617091170305,1060761617091170305,2018-11-09 00:10:52 Eastern Standard Time,2018-11-09,00:10:52,-0500,1011068228603441152,willywonkaxrp,🔥Bull Run Wonka🔥XRP NFTs,,"Cryptocurrency market on brink of ‘price explosion’ but #Bitcoin won’t trigger it, experts predict  Retweet if you think #XRP will be the catalyst for the next Bull Run!! 🏃🏼🏃🏼🏃🏼🏃🏼🏃🏼🏃🏼  #XRP #XRPCommunity #Crypto #Fintech  https://t.co/vvN8BueUyB",en,[],['https://www.independent.co.uk/life-style/gadgets-and-tech/news/bitcoin-cryptocurrency-market-price-prediction-2018-latest-ethereum-stellar-a8624266.html'],[],13,205,387,"['bitcoin', 'xrp', 'xrp', 'xrpcommunity', 'crypto', 'fintech']",[],https://twitter.com/WillyWonkaXRP/status/1060761617091170305,False,,0,,,,,,,,[],,,,
1060738069903495168,1060738069903495168,2018-11-08 22:37:18 Eastern Standard Time,2018-11-08,22:37:18,-0500,960091531448217600,bvbtc,Brekkie ⚒ 🦢,,"Fiat will become obsolete.  Bitcoin will hit $1,000,000.  Dollar stores will become Satoshi stores.  https://t.co/iGSPj0hMfd",en,[],[],['https://pbs.twimg.com/media/Drh_mWjU8AAwyvc.jpg'],37,186,840,[],[],https://twitter.com/BVBTC/status/1060738069903495168,False,,1,https://pbs.twimg.com/media/Drh_mWjU8AAwyvc.jpg,,,,,,,[],,,,
1060674329363472385,1060674329363472385,2018-11-08 18:24:01 Eastern Standard Time,2018-11-08,18:24:01,-0500,339061487,apompliano,Pomp 🌪,,"Goldman Sachs raised $6.5 billion from a Malaysian sovereign wealth fund in 2009.  Those proceeds are now tied to corruption cases across the world.   Both the Malaysian PM &amp; Goldman CEO Lloyd Blankfein personally attended the initial meeting.  Long Bitcoin, Short the Bankers.",en,[],[],[],54,325,1551,[],[],https://twitter.com/APompliano/status/1060674329363472385,False,,0,,,,,,,,[],,,,
1060668705980534785,1060668705980534785,2018-11-08 18:01:40 Eastern Standard Time,2018-11-08,18:01:40,-0500,859484337850523648,crypto_rand,Crypto Rand,,"BREAKING:   #China lifts #Bitcoin ban:  ""Individuals and businesses can now own #Cryptocurrencies legally""  https://t.co/MJYuQDyxWf",en,[],['https://www.btcnn.com/china-lifts-bitcoin-ban-individuals-and-businesses-can-now-own-cryptocurrencies-legally/'],[],192,1511,3641,"['china', 'bitcoin', 'cryptocurrencies']",[],https://twitter.com/crypto_rand/status/1060668705980534785,False,,0,,,,,,,,[],,,,
1060607981664972800,1060607981664972800,2018-11-08 14:00:22 Eastern Standard Time,2018-11-08,14:00:22,-0500,14338147,satoshilite,Charlie Lee,,Bitcoin Satoshi Vision is the real Bitcoin Cash.  Karma's a BCH. 😂,en,[],[],[],206,493,3139,[],[],https://twitter.com/SatoshiLite/status/1060607981664972800,False,,0,,,,,,,,[],,,,
1060596274133716994,1060596274133716994,2018-11-08 13:13:51 Eastern Standard Time,2018-11-08,13:13:51,-0500,18469669,saifedean,Saifedean.com,,My answer to the question: what is the problem Bitcoin solves?  https://t.co/GfynNkjfmg,en,[],['https://www.spectator.co.uk/2018/11/the-problem-bitcoin-solves/'],[],58,437,1042,[],[],https://twitter.com/saifedean/status/1060596274133716994,False,,0,,,,,,,,[],,,,
