id,conversation_id,created_at,date,time,timezone,user_id,username,name,place,tweet,language,mentions,urls,photos,replies_count,retweets_count,likes_count,hashtags,cashtags,link,retweet,quote_url,video,thumbnail,near,geo,source,user_rt_id,user_rt,retweet_id,reply_to,retweet_date,translate,trans_src,trans_dest
1053917233083285506,1053917233083285506,2018-10-21 03:53:43 Eastern Daylight Time,2018-10-21,03:53:43,-0500,1856523530,capitalandceleb,CCN - Capital & Celeb News,,"Partnership Could See up to 100,000 Regular ATMs in U.S. Turned into Bitcoin-Vending Machines  https://t.co/XgcjG0iORf",en,[],['https://www.ccn.com/partnership-could-see-up-to-100000-regular-atms-in-u-s-turned-into-bitcoin-vending-machines/'],[],23,406,929,[],[],https://twitter.com/CapitalAndCeleb/status/1053917233083285506,False,,0,,,,,,,,[],,,,
1053795710062100480,1053795710062100480,2018-10-20 19:50:50 Eastern Daylight Time,2018-10-20,19:50:50,-0500,87494620,gigabitcoin,GigaɃitcoin,,"Bitcoin [BTC], Ethereum, Litecoin and more accepted as payment by Marks Jewelers  https://t.co/7d3lT5tu4C",en,[],['https://ambcrypto.com/bitcoin-btc-ethereum-litecoin-and-more-accepted-as-payment-by-marks-jewelers/'],[],19,207,583,[],[],https://twitter.com/GigaBitcoin/status/1053795710062100480,False,,0,,,,,,,,[],,,,
1053781757600980992,1053781757600980992,2018-10-20 18:55:23 Eastern Daylight Time,2018-10-20,18:55:23,-0500,732026896683286528,vikinguistas,Viky,,"A todo esto, hace 1441 días que no perdemos un clásico oficial en la cancha. La última vez que pasó esto, un tal Obama era presidente, pocos conocían lo que era Charlie Hebdo, no existía el Brexit, Fidel Castro vivía y el Bitcoin cotizaba por debajo de los USD 500, por ejemplo.",es,[],[],[],14,211,695,[],[],https://twitter.com/vikinguistas/status/1053781757600980992,False,,0,,,,,,,,[],,,,
1053746803663872000,1053746803663872000,2018-10-20 16:36:30 Eastern Daylight Time,2018-10-20,16:36:30,-0500,21263333,jimmysong,Jimmy Song (송재준),,Stage 1: Bitcoin makes you wealthy Stage 2: Bitcoin takes away power from the money printers Stage 3: Bitcoin gives power back to the people Stage 4: Bitcoin makes you self-sovereign Stage 5: Bitcoin builds civilization,en,[],[],[],128,448,1733,[],[],https://twitter.com/jimmysong/status/1053746803663872000,False,,0,,,,,,,,[],,,,
1053694447534436352,1053694447534436352,2018-10-20 13:08:27 Eastern Daylight Time,2018-10-20,13:08:27,-0500,1856523530,capitalandceleb,CCN - Capital & Celeb News,,"Novogratz Says Cryptos Are Safe, Expects Bitcoin to Rally In Q1 2019  https://t.co/31LNVoDtaf",en,[],['https://www.ccn.com/novogratz-says-cryptos-are-safe-expects-bitcoin-to-rally-in-q1-2019/'],[],48,297,785,[],[],https://twitter.com/CapitalAndCeleb/status/1053694447534436352,False,,0,,,,,,,,[],,,,
1053675591302557696,1053675591302557696,2018-10-20 11:53:31 Eastern Daylight Time,2018-10-20,11:53:31,-0500,828368204779118592,jokehow,Joke How,,DOCTOR: are you sexually act-  *stops mid sentence after noticing my bitcoin shirt and hat*  DOCTOR: do you smoke,en,[],[],[],30,240,2166,[],[],https://twitter.com/jokehow/status/1053675591302557696,False,,0,,,,,,,,[],,,,
1053613755333033985,1053613755333033985,2018-10-20 07:47:49 Eastern Daylight Time,2018-10-20,07:47:49,-0500,339061487,apompliano,Pomp 🌪,,This week in crypto:  1. Crypto miners caught in trade war 2. SEC start FinHub to help startups 3. US Marshals will auction $4.3M BTC 4. Bitcoin Futures grew 41% in Q3 5. Qtum partnered w/ AWS in China 6. @coinbase listed 0x token 7. ETH Foundation awarded $3M in grants  Onwards!,en,"[{'screen_name': 'coinbase', 'name': 'coinbase', 'id': '574032254'}]",[],[],46,283,1101,[],[],https://twitter.com/APompliano/status/1053613755333033985,False,,0,,,,,,,,[],,,,
1053587318320312322,1053587318320312322,2018-10-20 06:02:46 Eastern Daylight Time,2018-10-20,06:02:46,-0500,1333467482,coindesk,CoinDesk,,"Charlie Shrem, one of bitcoin's earliest entrepreneurs, believes Satoshi's white paper is about more than just technology.  https://t.co/gm2UKYJLSj",en,[],['http://ow.ly/6MNC30mj6ww'],[],12,177,480,[],[],https://twitter.com/CoinDesk/status/1053587318320312322,False,,0,,,,,,,,[],,,,
1053483896749228032,1053483896749228032,2018-10-19 23:11:48 Eastern Daylight Time,2018-10-19,23:11:48,-0500,13418472,woonomic,Willy Woo,,"Meanwhile... during the bear market no less... Bitcoin's blocks peak above 95% full without anyone noticing, the fees and confirm times remain nominal. Bitcoin of 2018 is not Bitcoin of 2017. The protocol is quietly improving.  https://t.co/ZgtpBnQFbJ",en,[],[],['https://pbs.twimg.com/media/Dp65c4lU8AIKUmM.jpg'],59,469,1480,[],[],https://twitter.com/woonomic/status/1053483896749228032,False,,1,https://pbs.twimg.com/media/Dp65c4lU8AIKUmM.jpg,,,,,,,[],,,,
1053441138454077440,1053441138454077440,2018-10-19 20:21:54 Eastern Daylight Time,2018-10-19,20:21:54,-0500,381289719,nntaleb,Nassim Nicholas Taleb,,"Mr Krugman @paulkrugman has been effectively wrong on everything (markets, bitcoin, technology, trade, GDP, FX, elections, history...): the real world is not something he has ever managed to grasp.   So, predictably, he now supports the neocons (Iraq, Lybia, Syria, etc.)",en,"[{'screen_name': 'paulkrugman', 'name': 'paul krugman', 'id': '17006157'}]",[],[],97,618,2180,[],[],https://twitter.com/nntaleb/status/1053441138454077440,False,https://twitter.com/paulkrugman/status/1053274998742441985,0,,,,,,,,[],,,,
1053295372775370752,1053295372775370752,2018-10-19 10:42:40 Eastern Daylight Time,2018-10-19,10:42:40,-0500,561274620,weisscrypto,Weiss Crypto,,"If you were only going to buy one coin in the current down market, what coin would it be? #BTC #Bitcoin #XRP #ADA #EOS #Cardano",en,[],[],[],85,147,241,"['btc', 'bitcoin', 'xrp', 'ada', 'eos', 'cardano']",[],https://twitter.com/WeissCrypto/status/1053295372775370752,False,,0,,,,,,,,[],,,,
1053170901540392960,1053170901540392960,2018-10-19 02:28:04 Eastern Daylight Time,2018-10-19,02:28:04,-0500,928759224599040001,crypto,Bloomberg Crypto,,"“I’m a big believer in Bitcoin. I really am so bullish on it, and I want to own more of it.”  https://t.co/VMfo0lmlG4",en,[],['https://bloom.bg/2yNviBz'],[],33,224,651,[],[],https://twitter.com/crypto/status/1053170901540392960,False,,0,,,,,,,,[],,,,
1052998812049072130,1052998812049072130,2018-10-18 15:04:15 Eastern Daylight Time,2018-10-18,15:04:15,-0500,14717442,xentagz,Dennis Parker,,"""#Bitcoin will replace gold and soar in price to $700,000"" The entire #bitcoin network could one day be worth more than $6 trillion, according to a partner at pfeffer capital – but other cryptocurrencies are doomed  https://t.co/PEncC8J3pr",en,[],['https://www.independent.co.uk/life-style/gadgets-and-tech/news/bitcoin-price-live-gold-value-cryptocurrency-sohn-soros-invest-pfeffer-a8323441.html'],[],40,266,760,"['bitcoin', 'bitcoin']",[],https://twitter.com/Xentagz/status/1052998812049072130,False,,0,,,,,,,,[],,,,
1052913464547700736,1052913464547700736,2018-10-18 09:25:06 Eastern Daylight Time,2018-10-18,09:25:06,-0500,1856523530,capitalandceleb,CCN - Capital & Celeb News,,Bitcoin Breakout ‘Only a Matter of Time’: Analyst  https://t.co/IHoD00R0uq,en,[],['https://www.ccn.com/bitcoin-breakout-only-a-matter-of-time-analyst/'],[],20,186,479,[],[],https://twitter.com/CapitalAndCeleb/status/1052913464547700736,False,,0,,,,,,,,[],,,,
1052840748452728832,1052840748452728832,2018-10-18 04:36:09 Eastern Daylight Time,2018-10-18,04:36:09,-0500,3267440208,diepsanh,Bull Diep,,We moved $50 million dollar worth of XRP into our company in 2 seconds and it costed 30 cents. There is no way to do that with fiat or Bitcoin.    Michael Arrington - Arrington XRP Capital #XRPcommunity #XRP #XRPthestandard #XRPinseconds  https://t.co/opHJ2Fwu0B,en,[],[],[],111,1209,2965,"['xrpcommunity', 'xrp', 'xrpthestandard', 'xrpinseconds']",[],https://twitter.com/DiepSanh/status/1052840748452728832,False,,1,https://pbs.twimg.com/ext_tw_video_thumb/1052839685133819904/pu/img/jxOuN_eP7nQjfLH6.jpg,,,,,,,[],,,,
1052750437294563328,1052750437294563328,2018-10-17 22:37:18 Eastern Daylight Time,2018-10-17,22:37:18,-0500,61417559,erikvoorhees,Erik Voorhees,,This is the Bitcoineta van. It travels around South America teaching about Bitcoin at schools and on local TV stations. This is how the world changes.,en,[],[],[],32,326,1214,[],[],https://twitter.com/ErikVoorhees/status/1052750437294563328,False,https://twitter.com/labitcoineta/status/1040241147828944898,0,,,,,,,,[],,,,
1052665877705814016,1052665877705814016,2018-10-17 17:01:17 Eastern Daylight Time,2018-10-17,17:01:17,-0500,730518593004134400,lightning,Lightning Labs⚡️🌋,,Neutrino is a new bitcoin light client that enables Lightning to run on mobile phones. ⚡️📱  We wrote a post on the tech behind Neutrino and how it helps users hold their own keys with better privacy:  https://t.co/r4DQrhAXWz @bvu @roasbeef @stile65 @jimpo_potamus,en,"[{'screen_name': 'bvu', 'name': 'bryan vu', 'id': '7765862'}, {'screen_name': 'roasbeef', 'name': 'olaoluwa osuntokun', 'id': '568914153'}, {'screen_name': 'stile65', 'name': 'alex ⚡ @blueadept:matrix.org', 'id': '36806342'}, {'screen_name': 'jimpo_potamus', 'name': 'jim posen', 'id': '1122886706'}]",['https://blog.lightning.engineering/posts/2018/10/17/neutrino.html'],[],18,229,619,[],[],https://twitter.com/lightning/status/1052665877705814016,False,,0,,,,,,,,[],,,,
1052606764737277955,1052606764737277955,2018-10-17 13:06:23 Eastern Daylight Time,2018-10-17,13:06:23,-0500,992741542094819334,kubitx,KuBitX,,"We are close to a Beta Test Release. KuBitX Exchange is designed for you to love the elegance, simplicity and enhanced user experience. Join the Hybrid Exchange -  https://t.co/JUaL2O43gp  #cryptocurrency #bitcoin #ethereum #kbx #cryptoexchange #ico #pre_ico #bitcoins  https://t.co/3q990ByynL",en,[],['https://www.kubitx.io/wp.pdf'],['https://pbs.twimg.com/media/Dpub-BnXcAAJwy_.jpg'],4,267,324,"['cryptocurrency', 'bitcoin', 'ethereum', 'kbx', 'cryptoexchange', 'ico', 'pre_ico', 'bitcoins']",[],https://twitter.com/kubitx/status/1052606764737277955,False,,1,https://pbs.twimg.com/media/Dpub-BnXcAAJwy_.jpg,,,,,,,[],,,,
1052550528046002177,1052550528046002177,2018-10-17 09:22:55 Eastern Daylight Time,2018-10-17,09:22:55,-0500,967873687864004608,monarchwallet,Monarch Wallet,,How To Create Your Own Monarch Wallet - Watch This Wallet Tutorial Video  https://t.co/G58fXvGomy  #monarchtoken #cryptocurrency #blockchain #bitcoin #ethereum #tokensale #crowdsale #TGE,en,[],['http://bit.ly/2yIJYSI'],[],2,403,402,"['monarchtoken', 'cryptocurrency', 'blockchain', 'bitcoin', 'ethereum', 'tokensale', 'crowdsale', 'tge']",[],https://twitter.com/MonarchWallet/status/1052550528046002177,False,,0,,,,,,,,[],,,,
1052505807701585920,1052505807701585920,2018-10-17 06:25:13 Eastern Daylight Time,2018-10-17,06:25:13,-0500,2207129125,cointelegraph,Cointelegraph,,"Bitcoin volatility achieves all-time low, crypto market could initiate a major rally  https://t.co/6Gk17nVKFp",en,[],['https://cointelegraph.com/news/bitcoin-volatility-hits-record-low-calm-before-a-major-short-term-rally-experts-weigh-in'],[],13,244,492,[],[],https://twitter.com/Cointelegraph/status/1052505807701585920,False,,0,,,,,,,,[],,,,
1052452820354588672,1052452820354588672,2018-10-17 02:54:40 Eastern Daylight Time,2018-10-17,02:54:40,-0500,23420231,etoro,eToro,,We helped @KristianNairn to rebrand himself.  What do you think?  #ItsTimeTo #moon #Bitcoin #Crypto #btc #hodl #xrp #eth,en,"[{'screen_name': 'kristiannairn', 'name': 'kristian nairn', 'id': '19950500'}]",[],[],68,309,1223,"['itstimeto', 'moon', 'bitcoin', 'crypto', 'btc', 'hodl', 'xrp', 'eth']",[],https://twitter.com/eToro/status/1052452820354588672,False,,0,,,,,,,,[],,,,
1052419129536380928,1052419129536380928,2018-10-17 00:40:48 Eastern Daylight Time,2018-10-17,00:40:48,-0500,632528146,kerooke,Kevin Rooke,,"Yesterday someone transferred $195,000,000 worth of Bitcoin.  They paid less than 10 cents in transfer fees.  Find me a better way to transfer millions of dollars, I'll wait...  👀  https://t.co/Hvm9VDUV1Q",en,[],[],['https://pbs.twimg.com/media/DprxdEuWsAAogFS.jpg'],53,240,728,[],[],https://twitter.com/kerooke/status/1052419129536380928,False,,1,https://pbs.twimg.com/media/DprxdEuWsAAogFS.jpg,,,,,,,[],,,,
1052327274756919296,1052327274756919296,2018-10-16 18:35:48 Eastern Daylight Time,2018-10-16,18:35:48,-0500,1856523530,capitalandceleb,CCN - Capital & Celeb News,,"$194 Million was Moved Using Bitcoin With $0.1 Fee, True Potential of Crypto   https://t.co/40jOOHhmKK",en,[],['https://www.ccn.com/194-million-was-moved-using-bitcoin-with-0-1-fee-true-potential-of-crypto/'],[],41,527,1314,[],[],https://twitter.com/CapitalAndCeleb/status/1052327274756919296,False,,0,,,,,,,,[],,,,
1052244177906364416,1052244177906364416,2018-10-16 13:05:36 Eastern Daylight Time,2018-10-16,13:05:36,-0500,1469101279,aantonop,Andreas,,"Most bitcoin and open blockchain events cost $300 or more to attend.  Thanks to my supporters on Patreon, you can attend one of my talks for $30. We even share profits back with the local community!  Next event: Seattle, Nov 10th  https://t.co/cLbKiTPOra   https://t.co/5XUA51xk7j  https://t.co/Xdft8WzsP3",en,[],"['https://andreas.events/seattle', 'https://patreon.com/aantonop']",['https://pbs.twimg.com/media/DppSc1sV4AAddNT.jpg'],99,267,1372,[],[],https://twitter.com/aantonop/status/1052244177906364416,False,,1,https://pbs.twimg.com/media/DppSc1sV4AAddNT.jpg,,,,,,,[],,,,
1052206505976426496,1052206505976426496,2018-10-16 10:35:54 Eastern Daylight Time,2018-10-16,10:35:54,-0500,14338147,satoshilite,Charlie Lee,,"Ever since MtGox announced Litecoin support in 2013 and failed to deliver, I've been on a mission to get LTC added to exchanges to help increase liquidity.  With the launch of LTC on Gemini today, every single major Bitcoin exchange supports Litecoin. Mission accomplished! 🚀🌕  https://t.co/6jvSyvsKdm",en,[],[],['https://pbs.twimg.com/tweet_video_thumb/DpowMCfUwAALbK7.jpg'],419,1013,4987,[],[],https://twitter.com/SatoshiLite/status/1052206505976426496,False,,1,https://pbs.twimg.com/tweet_video_thumb/DpowMCfUwAALbK7.jpg,,,,,,,[],,,,
1052117574044053504,1052117574044053504,2018-10-16 04:42:31 Eastern Daylight Time,2018-10-16,04:42:31,-0500,2207129125,cointelegraph,Cointelegraph,,"Next six months should see institutional Bitcoin hook-up, says Novogratz  https://t.co/pU7DmCnGzp",en,[],['https://cointelegraph.com/news/mike-novogratz-institutions-will-get-into-bitcoin-in-q1-q2-2019-bringing-new-highs'],[],24,326,725,[],[],https://twitter.com/Cointelegraph/status/1052117574044053504,False,,0,,,,,,,,[],,,,
1052077504461250563,1052077504461250563,2018-10-16 02:03:18 Eastern Daylight Time,2018-10-16,02:03:18,-0500,61417559,erikvoorhees,Erik Voorhees,,"It would be impossible for every Fidelity brokerage customer to own even one Bitcoin. This is why Bitcoins are worth thousands of dollars, while a dollar is only worth one dollar (and only until next year when when it's worth 97 cents). Save wisely.  https://t.co/NdEEgYNH9a",en,[],['https://www.fidelity.com/about-fidelity/fidelity-by-numbers/corporate-statistics'],[],37,307,979,[],[],https://twitter.com/ErikVoorhees/status/1052077504461250563,False,,0,,,,,,,,[],,,,
1052022462790033408,1052022462790033408,2018-10-15 22:24:35 Eastern Daylight Time,2018-10-15,22:24:35,-0500,938690231863197696,coinsurenz,ℭoinsure(F9 BE B4 D9),,Over the weekend I sent a bitcoin transaction to a relay 12.6km away with no cell network or internet connection. Here's a tweetstorm about how I used @gotenna and @SamouraiWallet to do it,en,"[{'screen_name': 'gotenna', 'name': 'gotenna', 'id': '1180392589'}, {'screen_name': 'samouraiwallet', 'name': 'samourai wallet', 'id': '3009858875'}]",[],[],56,388,1131,[],[],https://twitter.com/CoinsureNZ/status/1052022462790033408,False,,0,,,,,,,,[],,,,
1051924618762698752,1051924618762698752,2018-10-15 15:55:47 Eastern Daylight Time,2018-10-15,15:55:47,-0500,339061487,apompliano,Pomp 🌪,,"According to @saifedean, every fiat currency in the world has lost more than 95% of its value since 1971.  That means if you had $100 in 1971 and left it in your bank account, it would be the equivalent of $5 or less today.  Long Bitcoin, Short the Bankers.",en,"[{'screen_name': 'saifedean', 'name': 'saifedean.com', 'id': '18469669'}]",[],[],110,617,2044,[],[],https://twitter.com/APompliano/status/1051924618762698752,False,,0,,,,,,,,[],,,,
1051911582739922944,1051911582739922944,2018-10-15 15:03:59 Eastern Daylight Time,2018-10-15,15:03:59,-0500,1919231,cabel,Cabel,,"Many years ago I converted $5 into Bitcoin at a ""Bitcoin ATM"" here in town. It printed out a receipt with my credentials. I recently pulled the receipt out of my wallet and it was printed on thermal paper… so it's completely, totally blank. A metaphor",en,[],[],[],19,119,735,[],[],https://twitter.com/cabel/status/1051911582739922944,False,,0,,,,,,,,[],,,,
1051909971888222208,1051909971888222208,2018-10-15 14:57:35 Eastern Daylight Time,2018-10-15,14:57:35,-0500,1856523530,capitalandceleb,CCN - Capital & Celeb News,,Mainstream: $7.2 Trillion Asset Manager Fidelity Will Help Customers Invest in Bitcoin   https://t.co/Z2fGeUpLhG,en,[],['https://www.ccn.com/mainstream-7-2-trillion-asset-manager-fidelity-will-help-customers-invest-in-bitcoin/'],[],5,189,462,[],[],https://twitter.com/CapitalAndCeleb/status/1051909971888222208,False,,0,,,,,,,,[],,,,
1051906396969562112,1051906396969562112,2018-10-15 14:43:23 Eastern Daylight Time,2018-10-15,14:43:23,-0500,61417559,erikvoorhees,Erik Voorhees,,Fidelity Launches Institutional Platform For Bitcoin And Ethereum via @forbes  https://t.co/AgitesBXq6,en,"[{'screen_name': 'forbes', 'name': 'forbes', 'id': '91478624'}]",['https://www.forbes.com/sites/michaeldelcastillo/2018/10/15/fidelity-launches-institutional-platform-for-bitcoin-and-ethereum/#5eca0ee593c4'],[],16,176,635,[],[],https://twitter.com/ErikVoorhees/status/1051906396969562112,False,,0,,,,,,,,[],,,,
1051902076920520704,1051902076920520704,2018-10-15 14:26:13 Eastern Daylight Time,2018-10-15,14:26:13,-0500,40742821,tuurdemeester,Tuur Demeester,,"Impressed to see @Fidelity, a financial institution of worldwide renown, appropriately pay homage to the foundational work by David Chaum, Adam Back, Wei Dai, Nick Szabo, and Hal Finney. Shows maturity and serious commitment to the Bitcoin project.   https://t.co/mBvMt82kYW  https://t.co/YnnxTTs6bk",en,"[{'screen_name': 'fidelity', 'name': 'fidelity investments', 'id': '65174274'}]",['https://medium.com/@FidelityDigitalAssets/the-evolution-of-digital-cash-da19b06aa58e'],"['https://pbs.twimg.com/media/DpkbJbtUYAEuner.jpg', 'https://pbs.twimg.com/media/DpkbKP3UYAYWO5-.jpg', 'https://pbs.twimg.com/media/DpkbK0wUYAMslR-.jpg']",19,354,1106,[],[],https://twitter.com/TuurDemeester/status/1051902076920520704,False,,1,https://pbs.twimg.com/media/DpkbJbtUYAEuner.jpg,,,,,,,[],,,,
1051876864652922881,1051876864652922881,2018-10-15 12:46:02 Eastern Daylight Time,2018-10-15,12:46:02,-0500,949384296271368192,honestlycrypto,The Crypto Profit,,"BREAKING NEWS   Remember when I broke the fidelity story guys and I called fidelity and asked questions about #crypto?  Yeah, I told you it was coming!  MAJOR NEWS fidelity just announced support for #bitcoin and #Eth   The virus is spreading @APompliano    https://t.co/wqZuCWfg3B",en,"[{'screen_name': 'apompliano', 'name': 'pomp 🌪', 'id': '339061487'}]",['https://www.forbes.com/sites/michaeldelcastillo/2018/10/15/fidelity-launches-institutional-platform-for-bitcoin-and-ethereum/amp/?__twitter_impression=true'],[],19,184,570,"['crypto', 'bitcoin', 'eth']",[],https://twitter.com/HonestlyCrypto/status/1051876864652922881,False,,0,,,,,,,,[],,,,
1051874420904607745,1051874420904607745,2018-10-15 12:36:19 Eastern Daylight Time,2018-10-15,12:36:19,-0500,1333467482,coindesk,CoinDesk,,"Fidelity has revealed its plan to launch Fidelity Digital Asset Services, LLC, a trading platform focused on institutional clients. ""Our goal is to make digitally-native assets, such as bitcoin, more accessible to investors,"" Fidelity CEO Abigail Johnson said in a statement.",en,[],[],[],9,190,486,[],[],https://twitter.com/CoinDesk/status/1051874420904607745,False,,0,,,,,,,,[],,,,
1051873831688781824,1051873831688781824,2018-10-15 12:33:59 Eastern Daylight Time,2018-10-15,12:33:59,-0500,902282851499917312,forbescrypto,Forbes Crypto,,Fidelity Investments launches first institutional trading platform for bitcoin and ethereum:  https://t.co/N0zqyZIq7Y by @DelRayMan  https://t.co/VghEqZgHxs,en,"[{'screen_name': 'delrayman', 'name': 'michael del castillo', 'id': '126915737'}]",['http://on.forbes.com/6015DATGZ'],['https://pbs.twimg.com/media/DpkBrOcXcAACDia.jpg'],9,177,342,[],[],https://twitter.com/ForbesCrypto/status/1051873831688781824,False,,1,https://pbs.twimg.com/media/DpkBrOcXcAACDia.jpg,,,,,,,[],,,,
1051873387914637312,1051873387914637312,2018-10-15 12:32:13 Eastern Daylight Time,2018-10-15,12:32:13,-0500,976884195632001027,digitalassets,Fidelity Digital Assets,,"We’re a new company creating a full-service enterprise-grade platform for #digitalassets, such as #bitcoin and #ethereum.  https://t.co/9Qah4I7y2V  https://t.co/CRVeUKO55B",en,[],['https://www.fidelitydigitalassets.com?ccsource=twitter_fdasannouncement'],['https://pbs.twimg.com/media/DpkBQZPX4AASNDk.jpg'],32,153,420,"['digitalassets', 'bitcoin', 'ethereum']",[],https://twitter.com/DigitalAssets/status/1051873387914637312,False,,1,https://pbs.twimg.com/media/DpkBQZPX4AASNDk.jpg,,,,,,,[],,,,
1051835125959352327,1051835125959352327,2018-10-15 10:00:10 Eastern Daylight Time,2018-10-15,10:00:10,-0500,61417559,erikvoorhees,Erik Voorhees,,"Yay I got blocked by @Nouriel!  The last thing I said to him was ""In 2011 Bitcoin fell 95% from $31 to under $2.""  Historical context was not pleasing to him I guess?  @CaitlinLong_ we can be Nouriel block buddies now!",en,"[{'screen_name': 'nouriel', 'name': 'nouriel roubini', 'id': '19224439'}, {'screen_name': 'caitlinlong_', 'name': 'caitlin long 🔑⚡️🟠', 'id': '717926102614716417'}]",[],[],108,170,1514,[],[],https://twitter.com/ErikVoorhees/status/1051835125959352327,False,,0,,,,,,,,[],,,,
1051813291004227584,1051813291004227584,2018-10-15 08:33:24 Eastern Daylight Time,2018-10-15,08:33:24,-0500,989484049524838401,c3_nik,C3|Nik (not investment advice),,We see Ethereum is not able to scale.  Bitcoin is not able to scale. And now Tether is in a weird state.  It's time for #XRP as a new base pair on  @binance @cz_binance @Bitstamp @BittrexExchange @krakenfx @BithumbOfficial   Let's make this thing a movement again by retweeting 🙂,en,"[{'screen_name': 'binance', 'name': 'binance', 'id': '877807935493033984'}, {'screen_name': 'cz_binance', 'name': 'cz 🔶 binance', 'id': '902926941413453824'}, {'screen_name': 'bitstamp', 'name': 'bitstamp', 'id': '352518189'}, {'screen_name': 'bittrexexchange', 'name': 'bittrex', 'id': '2309637680'}, {'screen_name': 'krakenfx', 'name': 'kraken exchange', 'id': '1399148563'}, {'screen_name': 'bithumbofficial', 'name': 'bithumb', 'id': '908496633196814337'}]",[],[],43,990,1471,['xrp'],[],https://twitter.com/C3_Nik/status/1051813291004227584,False,,0,,,,,,,,[],,,,
1051746378295185409,1051746378295185409,2018-10-15 04:07:31 Eastern Daylight Time,2018-10-15,04:07:31,-0500,4137926120,cryptanzee,CryptoChimp,,Bitcoin vs Bottom Shorters  https://t.co/h9JGAhU1u0,en,[],[],[],53,176,962,[],[],https://twitter.com/Cryptanzee/status/1051746378295185409,False,,1,https://pbs.twimg.com/ext_tw_video_thumb/1051745851842932736/pu/img/2-u_RW1Q6QMxM8_E.jpg,,,,,,,[],,,,
1051731458837106688,1051731458837106688,2018-10-15 03:08:14 Eastern Daylight Time,2018-10-15,03:08:14,-0500,756725677827776512,dannyfreshii,Chukwuebuka Okoroafor,,Fashion designer na tailor wey good school  Instagram na fb wey travel abroad  DJ Cuppy na speed darlington wey get money 😂😂😂  Olosho na Ashawo wey dey do home service  Bitcoin na money wey dey for phone  Custard na Akamo wey go aboard 🙏🙏🙏🙏  Add yours. Don't spoil the fun,en,[],[],[],45,149,317,[],[],https://twitter.com/DannyFreshii/status/1051731458837106688,False,,0,,,,,,,,[],,,,
1051731197909450752,1051731197909450752,2018-10-15 03:07:12 Eastern Daylight Time,2018-10-15,03:07:12,-0500,1333467482,coindesk,CoinDesk,,"Bitcoin's price just jumped by 11 percent within two hours on Monday to reach a month-high above $6,900.   https://t.co/JYPYz8GzeZ",en,[],['http://ow.ly/mPLp30memhS'],[],29,188,430,[],[],https://twitter.com/CoinDesk/status/1051731197909450752,False,,0,,,,,,,,[],,,,
1051712602655453185,1051712602655453185,2018-10-15 01:53:19 Eastern Daylight Time,2018-10-15,01:53:19,-0500,3473608753,bokujyuumai,墨汁うまい(Bokujyuumai),,BTC速報：テザーのペッグ崩壊が止まらず、1USDT=0.94ドルまで下落。結果ビットコインやイーサリアムを買い資金を退避させている模様　#ビットコイン #Bitcoin #仮想通貨 #Bitfinex #Tether #テザー #ビットフィネックス  https://t.co/6ZoMfYMqPt,ja,[],[],['https://pbs.twimg.com/media/Dphu4vxUUAASxOk.jpg'],2,167,263,"['ビットコイン', 'bitcoin', '仮想通貨', 'bitfinex', 'tether', 'テザー', 'ビットフィネックス']",[],https://twitter.com/bokujyuumai/status/1051712602655453185,False,,1,https://pbs.twimg.com/media/Dphu4vxUUAASxOk.jpg,,,,,,,[],,,,
