id,conversation_id,created_at,date,time,timezone,user_id,username,name,place,tweet,language,mentions,urls,photos,replies_count,retweets_count,likes_count,hashtags,cashtags,link,retweet,quote_url,video,thumbnail,near,geo,source,user_rt_id,user_rt,retweet_id,reply_to,retweet_date,translate,trans_src,trans_dest
1056658230569426944,1056658230569426944,2018-10-28 17:25:28 Eastern Daylight Time,2018-10-28,17:25:28,-0500,984635318954586113,megatronic13,Sassparilla,,Guy at party: and that’s how Bitcoin works  Me: *nudging my service parrot*  Parrot: squawk that’s so interesting that’s so interesting,en,[],[],[],57,2259,17703,[],[],https://twitter.com/Megatronic13/status/1056658230569426944,False,,0,,,,,,,,[],,,,
1056596861727981569,1056596861727981569,2018-10-28 13:21:37 Eastern Daylight Time,2018-10-28,13:21:37,-0500,892429154121068544,nicholas_merten,Nicholas Merten,,"One thing that people are ignoring in this quiet market is the fact that, as of tomorrow, Bitcoin will have held $6,000 for over a year. That’s huge. It’s proving that bitcoin is functioning as a store of value.",en,[],[],[],59,378,1808,[],[],https://twitter.com/Nicholas_Merten/status/1056596861727981569,False,,0,,,,,,,,[],,,,
1056573003901878277,1056573003901878277,2018-10-28 11:46:48 Eastern Daylight Time,2018-10-28,11:46:48,-0500,1469101279,aantonop,Andreas,,"Open blockchain systems like #Bitcoin have a very steep learning curve. We're so used to looking for some authority to tell us what will happen or what is true, but it is you who will get to choose how these systems evolve.  https://t.co/v936HOFfkI",en,[],['https://youtu.be/XCVaabu3J04?t=555'],[],23,232,626,['bitcoin'],[],https://twitter.com/aantonop/status/1056573003901878277,False,,0,,,,,,,,[],,,,
1056548141313404929,1056548141313404929,2018-10-28 10:08:01 Eastern Daylight Time,2018-10-28,10:08:01,-0500,61417559,erikvoorhees,Erik Voorhees,,"Bitcoin’s inflation schedule is set for the next 100 years: transparent, unwavering, and known to all parties. US Dollar’s inflation schedule is unknown even 1 year out: opaque and manipulated quarterly. One model mathematical &amp; civilized; the other political &amp; antiquated.",en,[],[],[],83,1156,3374,[],[],https://twitter.com/ErikVoorhees/status/1056548141313404929,False,,0,,,,,,,,[],,,,
1056515427914919936,1056515427914919936,2018-10-28 07:58:01 Eastern Daylight Time,2018-10-28,07:58:01,-0500,107637333,cryptochihiro,Chihiro ♀,,#Bitcoin #BTC 😇  https://t.co/Bnn8f76UlJ,und,[],[],['https://pbs.twimg.com/media/Dql_LfoXQAE2xqX.jpg'],55,474,1705,"['bitcoin', 'btc']",[],https://twitter.com/CryptoChihiro/status/1056515427914919936,False,,1,https://pbs.twimg.com/media/Dql_LfoXQAE2xqX.jpg,,,,,,,[],,,,
1056377170338099200,1056377170338099200,2018-10-27 22:48:38 Eastern Daylight Time,2018-10-27,22:48:38,-0500,13418472,woonomic,Willy Woo,,"Bitcoin is not just money. It’s the invention of an Internet-native digital scarcity. And with that breakthrough, software will eat the financial world.",en,[],[],[],16,150,543,[],[],https://twitter.com/woonomic/status/1056377170338099200,False,https://twitter.com/TuurDemeester/status/1055948722574708736,0,,,,,,,,[],,,,
1056184316127047680,1056184316127047680,2018-10-27 10:02:18 Eastern Daylight Time,2018-10-27,10:02:18,-0500,1856523530,capitalandceleb,CCN - Capital & Celeb News,,China’s Merchants are Legally Allowed to Accept Bitcoin and Crypto  https://t.co/bNb8tl8yWw,en,[],['https://www.ccn.com/chinas-merchants-are-legally-allowed-to-accept-bitcoin-and-crypto/'],[],61,944,2009,[],[],https://twitter.com/CapitalAndCeleb/status/1056184316127047680,False,,0,,,,,,,,[],,,,
1056012836084871168,1056012836084871168,2018-10-26 22:40:54 Eastern Daylight Time,2018-10-26,22:40:54,-0500,2436389418,swiftonsecurity,SwiftOnSecurity,,You: “Can we vote by phone?” Telephony engineer: “That’s unworkable for reasons.”  You: “Should we use entirely electronic voting?” Electronic security expert: “That’s a bad idea for reasons.”  You: “We could vote with the blockchain” Bitcoin enthusiast: “DID SOMEONE SAY COCAINE”,en,[],[],[],29,530,2185,[],[],https://twitter.com/SwiftOnSecurity/status/1056012836084871168,False,,0,,,,,,,,[],,,,
1055954441403277313,1055954441403277313,2018-10-26 18:48:52 Eastern Daylight Time,2018-10-26,18:48:52,-0500,339061487,apompliano,Pomp 🌪,,"Equity market 10 year outlook: 📉  Crypto market 10 year outlook: 📈  Long Bitcoin, Short the Bankers.",en,[],[],[],49,242,1183,[],[],https://twitter.com/APompliano/status/1055954441403277313,False,,0,,,,,,,,[],,,,
1055836804782452739,1055836804782452739,2018-10-26 11:01:25 Eastern Daylight Time,2018-10-26,11:01:25,-0500,1333467482,coindesk,CoinDesk,,JUST IN: A new ethereum token called Wrapped Bitcoin is aimed to hold a 1:1 peg with bitcoin.  https://t.co/cgNhrKmXrU,en,[],['http://ow.ly/DPtK30mo2NR'],[],141,297,622,[],[],https://twitter.com/CoinDesk/status/1055836804782452739,False,,0,,,,,,,,[],,,,
1055804674933178368,1055804674933178368,2018-10-26 08:53:45 Eastern Daylight Time,2018-10-26,08:53:45,-0500,1469101279,aantonop,Andreas,,"""Mastering Bitcoin 2nd Edition"" has now been re-released under a  completely open license - CC-BY-SA.   Under the new license, you can create derivatives (translations, workshops, courses, etc) and publish commercially or non-commercially.    https://t.co/qOUtx2ADEf",en,[],['https://github.com/bitcoinbook/bitcoinbook'],[],57,609,1775,[],[],https://twitter.com/aantonop/status/1055804674933178368,False,,0,,,,,,,,[],,,,
1055782101059100672,1055782101059100672,2018-10-26 07:24:03 Eastern Daylight Time,2018-10-26,07:24:03,-0500,1333467482,coindesk,CoinDesk,,Bitcoin has been trading in the very narrow range of $100 for seven days – that's the longest run at such low volatility since April 2017.  https://t.co/LTQmiBzcTW,en,[],['http://ow.ly/eZs930mnPFh'],[],31,151,414,[],[],https://twitter.com/CoinDesk/status/1055782101059100672,False,,0,,,,,,,,[],,,,
1055721663604625408,1055721663604625408,2018-10-26 03:23:53 Eastern Daylight Time,2018-10-26,03:23:53,-0500,1333467482,coindesk,CoinDesk,,"An arbitration body in China has said bitcoin should be legally protected as a property, despite the central banks's ban on crypto trading.  https://t.co/YYTpXzvUaF",en,[],['http://ow.ly/Q8k330mnEwp'],[],14,190,466,[],[],https://twitter.com/CoinDesk/status/1055721663604625408,False,,0,,,,,,,,[],,,,
1055623228335378432,1055623228335378432,2018-10-25 20:52:44 Eastern Daylight Time,2018-10-25,20:52:44,-0500,4919234126,cnledger,cnLedger,,"1/ Chinese court confirms Bitcoin protected by law. Shenzhen Court of International Arbitration ruled a case involving cryptos. Inside the verdict: CN law does not forbid owning &amp; transferring bitcoin, which should be protected by law bc its property nature and economic value.",en,[],[],[],51,859,1785,[],[],https://twitter.com/cnLedger/status/1055623228335378432,False,,0,,,,,,,,[],,,,
1055622075006812161,1055622075006812161,2018-10-25 20:48:09 Eastern Daylight Time,2018-10-25,20:48:09,-0500,1413027896,charliebilello,Charlie Bilello,,Volatility over last 10 days... Bitcoin: 8% S&amp;P 500: 25% This is the biggest negative differential (-17%) on record.  https://t.co/jOEwQRdTvi,en,[],[],['https://pbs.twimg.com/media/DqZRnDQWsAA2bO7.jpg'],22,235,553,[],[],https://twitter.com/charliebilello/status/1055622075006812161,False,,1,https://pbs.twimg.com/media/DqZRnDQWsAA2bO7.jpg,,,,,,,[],,,,
1055570142497665024,1055570142497665024,2018-10-25 17:21:48 Eastern Daylight Time,2018-10-25,17:21:48,-0500,14338147,satoshilite,Charlie Lee,,"Bitcoin, Ethereum, and Litecoin are the BELlweather cryptos. They are the only coins that are traded on every major crypto exchanges and can be stored on every hardware wallet.  Easily buying and securely storing other coins is really a PITA. 😂",en,[],[],[],141,310,1335,[],[],https://twitter.com/SatoshiLite/status/1055570142497665024,False,,0,,,,,,,,[],,,,
1055455461162577921,1055455461162577921,2018-10-25 09:46:06 Eastern Daylight Time,2018-10-25,09:46:06,-0500,1469101279,aantonop,Andreas,,"How cool is this: ""Mastering Bitcoin 1Ed"", on Chinese national TV. Even with a slightly sanitized title (no mention of Bitcoin), the content is the same.   Hoping to visiting China next year. Maybe this brings more opportunities and conference invitations.",en,[],[],[],49,133,644,[],[],https://twitter.com/aantonop/status/1055455461162577921,False,https://twitter.com/cnLedger/status/1055448196246192129,0,,,,,,,,[],,,,
1055449529653198848,1055449529653198848,2018-10-25 09:22:31 Eastern Daylight Time,2018-10-25,09:22:31,-0500,339061487,apompliano,Pomp 🌪,,"Bitcoin has been less volatile than NASDAQ, DOW and S&amp;P 500 over the past month. (H/t @taiberg)  Long Bitcoin, Short the Bankers.",en,"[{'screen_name': 'taiberg', 'name': 'michael', 'id': '398194929'}]",[],[],69,381,1634,[],[],https://twitter.com/APompliano/status/1055449529653198848,False,,0,,,,,,,,[],,,,
1055429622337359872,1055429622337359872,2018-10-25 08:03:25 Eastern Daylight Time,2018-10-25,08:03:25,-0500,23618940,lopp,Jameson Lopp,,Do you have friends who you want to learn about Bitcoin but you can't get them to read walls of text? Send them to the infographics library at  https://t.co/RY5zft54Sd by @patestevao &amp; @marcoagner,en,"[{'screen_name': 'patestevao', 'name': 'patrícia estevão', 'id': '2761272032'}, {'screen_name': 'marcoagner', 'name': 'agner', 'id': '1290250926910054407'}]",['https://www.bitcoindesigned.com/'],[],21,223,530,[],[],https://twitter.com/lopp/status/1055429622337359872,False,,0,,,,,,,,[],,,,
1055349676780724224,1055349676780724224,2018-10-25 02:45:45 Eastern Daylight Time,2018-10-25,02:45:45,-0500,2799211554,whalepanda,WhalePanda,,Reminder that Hal Finney was already talking about Hodling Bitcoin vs spending it directly (and talking about layer 2) in 2010 while some people are trying to push the narrative now that it only started during the block size debate.  https://t.co/VRhIq0Vig3,en,[],[],['https://pbs.twimg.com/media/DqVakJLXcAAn5K2.jpg'],37,171,669,[],[],https://twitter.com/WhalePanda/status/1055349676780724224,False,,1,https://pbs.twimg.com/media/DqVakJLXcAAn5K2.jpg,,,,,,,[],,,,
1055311801066442753,1055311801066442753,2018-10-25 00:15:14 Eastern Daylight Time,2018-10-25,00:15:14,-0500,40742821,tuurdemeester,Tuur Demeester,,"Google searches for ""Bitcoin"" lowest since May 2017 - down 93% since Dec ATH.  https://t.co/6wUqp2VHrm",en,[],[],['https://pbs.twimg.com/media/DqU4GbmUwAAoX2u.jpg'],81,219,648,[],[],https://twitter.com/TuurDemeester/status/1055311801066442753,False,,1,https://pbs.twimg.com/media/DqU4GbmUwAAoX2u.jpg,,,,,,,[],,,,
1055158386650726400,1055158386650726400,2018-10-24 14:05:37 Eastern Daylight Time,2018-10-24,14:05:37,-0500,23618940,lopp,Jameson Lopp,,Multi-year Bitcoin scaling debate in &lt; a tweet: * Some folks prioritize low cost of transacting. * Some folks prioritize low cost of validating the system. * You can have both via a layered architecture similar to the Internet itself.,en,[],[],[],29,158,656,[],[],https://twitter.com/lopp/status/1055158386650726400,False,,0,,,,,,,,[],,,,
1055087525436383232,1055087525436383232,2018-10-24 09:24:03 Eastern Daylight Time,2018-10-24,09:24:03,-0500,61417559,erikvoorhees,Erik Voorhees,,"Last week, Uber driver scoffed at Bitcoin. “At least the dollar is backed by gold!” he says. Touché sir!",en,[],[],[],109,132,1292,[],[],https://twitter.com/ErikVoorhees/status/1055087525436383232,False,,0,,,,,,,,[],,,,
1055016904321126400,1055016904321126400,2018-10-24 04:43:25 Eastern Daylight Time,2018-10-24,04:43:25,-0500,859484337850523648,crypto_rand,Crypto Rand,,"To celebrate the latest moves on #Altcoins and #Bitcoin I'm giving away:  - 500$ worth of BTC - 3 bundles of 5 #Trading books. - 3 free memberships to my private community, where I provide educational content and exclusive charts. Link:  https://t.co/WV7FKTZRa0  RT to participate!",en,[],['https://discordapp.com/invite/zfvynx8'],[],125,1718,907,"['altcoins', 'bitcoin', 'trading']",[],https://twitter.com/crypto_rand/status/1055016904321126400,False,,0,,,,,,,,[],,,,
1054984950192181248,1054835948595433474,2018-10-24 02:36:27 Eastern Daylight Time,2018-10-24,02:36:27,-0500,745273,naval,Naval,,"@JamesClear Asymmetric opportunities:  Invest in startups Start a company Create a book, podcast, video Create a (software) product Go on many first dates Go to a cocktail party Read a Lindy book Move to a big city Buy Bitcoin Tweet",en,[],[],[],97,1115,4544,[],[],https://twitter.com/naval/status/1054984950192181248,False,,0,,,,,,,,"[{'screen_name': 'JamesClear', 'name': 'James Clear', 'id': '226428094'}]",,,,
1054932194421030912,1054932194421030912,2018-10-23 23:06:49 Eastern Daylight Time,2018-10-23,23:06:49,-0500,339061487,apompliano,Pomp 🌪,,"|￣￣￣￣￣￣￣￣￣￣￣￣| |           Dear haters,               | |               You can’t                | |               kill Bitcoin               | |           Love, Pomp                | |＿＿＿＿＿＿＿＿＿＿＿＿|  (\__/) ||  (•ㅅ•) ||  / 　 づv",en,[],[],[],65,147,1213,[],[],https://twitter.com/APompliano/status/1054932194421030912,False,,0,,,,,,,,[],,,,
1054851626769543168,1054851626769543168,2018-10-23 17:46:40 Eastern Daylight Time,2018-10-23,17:46:40,-0500,14717442,xentagz,Dennis Parker,,"In 8 days, it will be the 10th birthday of the Bitcoin White Paper released by Satoshi Nakamoto on October 31, 2008  https://t.co/7Z4LoDoov1",en,[],[],['https://pbs.twimg.com/media/DqOV9NdXQAAfXR8.jpg'],25,290,958,[],[],https://twitter.com/Xentagz/status/1054851626769543168,False,,1,https://pbs.twimg.com/media/DqOV9NdXQAAfXR8.jpg,,,,,,,[],,,,
1054823492011638784,1054823492011638784,2018-10-23 15:54:52 Eastern Daylight Time,2018-10-23,15:54:52,-0500,989484049524838401,c3_nik,C3|Nik (not investment advice),,"** Breaking **  Coinbase Trust is allowed to custody XRP now!  ""DFS has also approved Coinbase Trust to offer secure custody services for six of the largest virtual currencies: Bitcoin, Bitcoin Cash, Ethereum, Ether Classic, XRP and Litecoin.""  Thx @BankXRP  https://t.co/f6nIWzEyvq",en,"[{'screen_name': 'bankxrp', 'name': '𝗕𝗮𝗻𝗸xrp', 'id': '937342499093471232'}]",[],['https://pbs.twimg.com/media/DqN8UH1X4AAbjQM.jpg'],27,166,411,[],[],https://twitter.com/C3_Nik/status/1054823492011638784,False,,1,https://pbs.twimg.com/media/DqN8UH1X4AAbjQM.jpg,,,,,,,[],,,,
1054822570032193536,1054822570032193536,2018-10-23 15:51:13 Eastern Daylight Time,2018-10-23,15:51:13,-0500,339061487,apompliano,Pomp 🌪,,The first central bank to fully embrace Bitcoin will have a significant advantage in the next 100 years.  Fighting a technology evolution is never a wise decision.,en,[],[],[],85,334,1492,[],[],https://twitter.com/APompliano/status/1054822570032193536,False,,0,,,,,,,,[],,,,
1054769355500806144,1054769355500806144,2018-10-23 12:19:45 Eastern Daylight Time,2018-10-23,12:19:45,-0500,23618940,lopp,Jameson Lopp,,Bitcoin Bubble Altcoin Bubble ICO Bubble Forkcoin Bubble Stablecoin Bubble Life's a bubble and then you die.,en,[],[],[],61,122,961,[],[],https://twitter.com/lopp/status/1054769355500806144,False,,0,,,,,,,,[],,,,
1054762238832271360,1054762238832271360,2018-10-23 11:51:28 Eastern Daylight Time,2018-10-23,11:51:28,-0500,1333467482,coindesk,CoinDesk,,"Representatives from VanEck, SolidX and the Cboe have met with the SEC's newest Commissioner, Elad Roisman, to discuss a bitcoin ETF proposal.  https://t.co/NbNspIHiPV",en,[],['http://ow.ly/oEM130mlnad'],[],11,180,356,[],[],https://twitter.com/CoinDesk/status/1054762238832271360,False,,0,,,,,,,,[],,,,
1054742629567451138,1054742629567451138,2018-10-23 10:33:33 Eastern Daylight Time,2018-10-23,10:33:33,-0500,14338147,satoshilite,Charlie Lee,,"The backwards &amp; forwards compatibility of Bitcoin/Litecoin updates is highly underappreciated in this space IMO. Think of the amount of resources a company needs to put in to review, implement &amp; test every forced upgrade for each supported coin. Any mistake could be money losing!",en,[],[],[],26,142,597,[],[],https://twitter.com/SatoshiLite/status/1054742629567451138,False,https://twitter.com/LamassuSupport/status/1054437564084641792,0,,,,,,,,[],,,,
1054730140993966082,1054730140993966082,2018-10-23 09:43:56 Eastern Daylight Time,2018-10-23,09:43:56,-0500,47966112,odell,ODELL,,"So much bullish news over the last 24 hours,  insane.  -Singapore sovereign wealth fund invests in binance -Bakkt launch imminent -VanEck/SolidX ETF approval inches closer -Square cold storage framework released -Elon tweeted about bitcoin (finally) -Betty is a badass  https://t.co/ThtlKXS0tl",en,[],[],['https://pbs.twimg.com/tweet_video_thumb/DqMnd-YU8AEzlzl.jpg'],24,204,743,[],[],https://twitter.com/ODELL/status/1054730140993966082,False,,1,https://pbs.twimg.com/tweet_video_thumb/DqMnd-YU8AEzlzl.jpg,,,,,,,[],,,,
1054728717484748800,1054728717484748800,2018-10-23 09:38:16 Eastern Daylight Time,2018-10-23,09:38:16,-0500,339061487,apompliano,Pomp 🌪,,"Long Bitcoin, Short the Bankers",en,[],[],[],56,266,1491,[],[],https://twitter.com/APompliano/status/1054728717484748800,False,,0,,,,,,,,[],,,,
1054714693401632768,1054714693401632768,2018-10-23 08:42:33 Eastern Daylight Time,2018-10-23,08:42:33,-0500,14717442,xentagz,Dennis Parker,,"BREAKING: BITCOIN SEC ETF MEETING: CBOE, VanEck, SolidX All Meet With SEC Commissioner Elad Roisman; Approval Confidence ‘High’  https://t.co/ewBA9KtbeJ",en,[],['https://abacusjournal.com/breaking-bitcoin-sec-etf-meeting-cboe-vaneck-solidx-all-meet-with-sec-commissioner-elad-roisman-approval-confidence-high/'],[],8,153,317,[],[],https://twitter.com/Xentagz/status/1054714693401632768,False,,0,,,,,,,,[],,,,
1054694264809099264,1054694264809099264,2018-10-23 07:21:22 Eastern Daylight Time,2018-10-23,07:21:22,-0500,939131942775218176,ap_abacus,Andrew Abacus 🔑,,"BREAKING: BITCOIN SEC ETF MEETING: CBOE, VanEck, SolidX All Meet With SEC Commissioner Elad Roisman; Approval Confidence ‘High’  https://t.co/O0s0nntyCw",en,[],['https://abacusjournal.com/?p=5861'],[],42,628,1295,[],[],https://twitter.com/AP_Abacus/status/1054694264809099264,False,,0,,,,,,,,[],,,,
1054659103652569089,1054659103652569089,2018-10-23 05:01:39 Eastern Daylight Time,2018-10-23,05:01:39,-0500,1333467482,coindesk,CoinDesk,,"Elon Musk mentioned bitcoin in a mysterious tweet, and it's whipping up plenty of speculation across the crypto community.  https://t.co/utMm6svHJV",en,[],['http://ow.ly/VKrd30ml04Q'],[],24,283,920,[],[],https://twitter.com/CoinDesk/status/1054659103652569089,False,,0,,,,,,,,[],,,,
1054552786568912898,1054552786568912898,2018-10-22 21:59:11 Eastern Daylight Time,2018-10-22,21:59:11,-0500,892479848,ayoedebiri,Ayo Edebiri,,i entered an Uber pool (my fault) while a migraine was starting (I’m obsessed with suffering) and the two men (toxic) who separately entered my pool knew each other (kill me) from working in robotics (oppressive) and now they’re talking bitcoin with the driver (just bury me here),en,[],[],[],13,170,3709,[],[],https://twitter.com/ayoedebiri/status/1054552786568912898,False,,0,,,,,,,,[],,,,
1054541460635213824,1054541460635213824,2018-10-22 21:14:11 Eastern Daylight Time,2018-10-22,21:14:11,-0500,18567517,alokmenghrajani,alokmenghrajani,,Square’s Bitcoin Cold Storage Solution is now opensource!  https://t.co/IpyneBAP4d,en,[],['https://medium.com/square-corner-blog/open-sourcing-subzero-ee9e3e071827'],[],5,154,482,[],[],https://twitter.com/alokmenghrajani/status/1054541460635213824,False,,0,,,,,,,,[],,,,
1054523763780403205,1054523763780403205,2018-10-22 20:03:52 Eastern Daylight Time,2018-10-22,20:03:52,-0500,1856523530,capitalandceleb,CCN - Capital & Celeb News,,NYSE Owner’s Bitcoin Futures Market Will Open in Mid-December  https://t.co/TX6R0vyTU9,en,[],['https://www.ccn.com/nyse-owners-bitcoin-futures-market-will-open-in-mid-december/'],[],9,182,393,[],[],https://twitter.com/CapitalAndCeleb/status/1054523763780403205,False,,0,,,,,,,,[],,,,
1054520588734058496,1054501056229588992,2018-10-22 19:51:15 Eastern Daylight Time,2018-10-22,19:51:15,-0500,44196397,elonmusk,Elon Musk,,@vicentes @Grimezsz Wanna buy some Bitcoin? 😉😉  https://t.co/9ZbBJ5fuVq,en,[],[],['https://pbs.twimg.com/media/DqJo4XUU8AAVUcl.jpg'],1079,7268,23720,[],[],https://twitter.com/elonmusk/status/1054520588734058496,False,,1,https://pbs.twimg.com/media/DqJo4XUU8AAVUcl.jpg,,,,,,,"[{'screen_name': 'vicentes', 'name': 'Cybergrade', 'id': '14290802'}, {'screen_name': 'Grimezsz', 'name': '𝔊𝔯𝔦𝔪𝔢𝔰 (⌛️,⏳) ᚷᚱᛁᛗᛖᛋ', 'id': '276540738'}]",,,,
1054468559320084481,1054468559320084481,2018-10-22 16:24:30 Eastern Daylight Time,2018-10-22,16:24:30,-0500,2799211554,whalepanda,WhalePanda,,BAKKT to begin trading Bitcoin daily futures on 12th of December.   https://t.co/UgJxZ5LHXm,en,[],['https://abacusjournal.com/bakkt-begins-december-12-bakkt-will-begin-trading-bitcoin-daily-futures-contracts-dec-12/'],[],54,673,1741,[],[],https://twitter.com/WhalePanda/status/1054468559320084481,False,,0,,,,,,,,[],,,,
1054457776448159744,1054457776448159744,2018-10-22 15:41:39 Eastern Daylight Time,2018-10-22,15:41:39,-0500,956457592007680000,mounia_nl,Mounia,,"""Bakkt has announced the date it will turn on the lights and begin utilizing the ICE exchange family of networks to trade Bitcoin futures contracts. The date is set as December 12, 2018.""  By @RogueAbacus    https://t.co/iCRYWmCSbf",en,[],['https://abacusjournal.com/bakkt-begins-december-12-bakkt-will-begin-trading-bitcoin-daily-futures-contracts-dec-12/'],[],33,193,473,[],[],https://twitter.com/Mounia_NL/status/1054457776448159744,False,,0,,,,,,,,[],,,,
1054455361657360384,1054455361657360384,2018-10-22 15:32:03 Eastern Daylight Time,2018-10-22,15:32:03,-0500,939131942775218176,ap_abacus,Andrew Abacus 🔑,,BAKKT BEGINS: DECEMBER 12: Bakkt Will Begin Trading Bitcoin Daily Futures Contracts Dec. 12  https://t.co/C6iewEdwGo,en,[],['https://abacusjournal.com/?p=5855'],[],47,815,1578,[],[],https://twitter.com/AP_Abacus/status/1054455361657360384,False,,0,,,,,,,,[],,,,
1054440959470067716,1054440959470067716,2018-10-22 14:34:49 Eastern Daylight Time,2018-10-22,14:34:49,-0500,176758255,rogerkver,Roger Ver,,"Inflation, 2018.  Venezuela: 200,000% Argentina: 34% Turkey: 24% Iran: 24% Ethiopia: 12% Nigeria: 11% Philippines: 6.7% Pakistan: 5.1% Mexico: 4.9% Brazil: 4.5% Bitcoin Cash 4.2%",es,[],[],[],104,299,892,[],[],https://twitter.com/rogerkver/status/1054440959470067716,False,,0,,,,,,,,[],,,,
1054375626268925953,1054375626268925953,2018-10-22 10:15:13 Eastern Daylight Time,2018-10-22,10:15:13,-0500,21263333,jimmysong,Jimmy Song (송재준),,So many people think they can influence Bitcoin by criticizing it. That works in politics and centralized organizations but doesn't work with Bitcoin. Bitcoin doesn't care and every criticism Bitcoin survives makes it stronger.  Bitcoin is anti-fragile to your criticisms.,en,[],[],[],48,147,667,[],[],https://twitter.com/jimmysong/status/1054375626268925953,False,,0,,,,,,,,[],,,,
1054319315942600705,1054319315942600705,2018-10-22 06:31:27 Eastern Daylight Time,2018-10-22,06:31:27,-0500,859484337850523648,crypto_rand,Crypto Rand,,Easy chart to know if #Bitcoin is dead or not.  https://t.co/KGm5LwfnOC,en,[],[],['https://pbs.twimg.com/media/DqGxYyzXcAAo6aE.jpg'],82,407,1397,['bitcoin'],[],https://twitter.com/crypto_rand/status/1054319315942600705,False,,1,https://pbs.twimg.com/media/DqGxYyzXcAAo6aE.jpg,,,,,,,[],,,,
1054278809329922050,1054278809329922050,2018-10-22 03:50:30 Eastern Daylight Time,2018-10-22,03:50:30,-0500,755070940309032961,jimmyzhong_iost,Jimmy Zhong,,Bank account got closed a month ago because of #bitcoin OTC transactions...had to pay a ridiculous fine &amp; withdraw all the CASH today since personal check is not supported in China. Just realized how heavy paper money is... please let #crypto take over the world soon.,en,[],[],[],36,932,1087,"['bitcoin', 'crypto']",[],https://twitter.com/jimmyzhong_iost/status/1054278809329922050,False,,0,,,,,,,,[],,,,
1054070675567128576,1054070675567128576,2018-10-21 14:03:27 Eastern Daylight Time,2018-10-21,14:03:27,-0500,820252180796100608,bitcoinissaving,Bitcoin is Saving,,"Bitcoin (BTC) now has the most influential, hard working, high caliber set of adopters that it has ever had in its history. BTC’s volume and liquidity are at historic highs, on and off chain scaling are both happening. Bitcoin has never been more competitive versus fiat. ⚡️👏 🚀",en,[],[],[],27,233,947,[],[],https://twitter.com/BitcoinIsSaving/status/1054070675567128576,False,,0,,,,,,,,[],,,,
1054013702960230401,1054013702960230401,2018-10-21 10:17:04 Eastern Daylight Time,2018-10-21,10:17:04,-0500,203652149,sjosephburns,Steve Burns,,Amazon has almost no stores 🏪 Uber owns almost no cars 🚗 Facebook creates no content ✏️ Alibaba has no inventory 📚 AirBnB owns no real estate🏡 Netflix is not a television channel📺  Tinder requires no marriage💑 Central Banks have no gold💸 Bitcoin has no physical coins💰,en,[],[],[],20,187,533,[],[],https://twitter.com/SJosephBurns/status/1054013702960230401,False,,0,,,,,,,,[],,,,
1054005657672843264,1054005657672843264,2018-10-21 09:45:05 Eastern Daylight Time,2018-10-21,09:45:05,-0500,23618940,lopp,Jameson Lopp,,"This man is wanted for questioning regarding the murder of a 24 year old bitcoin holder in Oslo, Norway last week.  https://t.co/HWhoIaiu3m  https://t.co/8IZtAn2eJk",en,[],['https://www.newsinenglish.no/2018/10/19/wanted-after-murder-and-robbery/'],['https://pbs.twimg.com/media/DqCUhGDWwAAzD5w.jpg'],43,258,438,[],[],https://twitter.com/lopp/status/1054005657672843264,False,,1,https://pbs.twimg.com/media/DqCUhGDWwAAzD5w.jpg,,,,,,,[],,,,
