id,conversation_id,created_at,date,time,timezone,user_id,username,name,place,tweet,language,mentions,urls,photos,replies_count,retweets_count,likes_count,hashtags,cashtags,link,retweet,quote_url,video,thumbnail,near,geo,source,user_rt_id,user_rt,retweet_id,reply_to,retweet_date,translate,trans_src,trans_dest
1066314090996514816,1066314090996514816,2018-11-24 07:54:25 Eastern Standard Time,2018-11-24,07:54:25,-0500,390627208,ivanontech,"Ivan on Tech (🖥, 📲, 🎮) - Building Moralis Web3",,"Noob: Bitcoin should be stopped, it’s wasting more energy than entire nations!  Well, your Christmas lights waste more energy than entire countries too.  The difference is that Bitcoin brings economic freedom to the world and is literally saving lives.   https://t.co/IYhiLk4kiU",en,[],['https://toshitimes.com/crypto-christmas/'],[],33,139,509,[],[],https://twitter.com/IvanOnTech/status/1066314090996514816,False,,0,,,,,,,,[],,,,
1066302216921907200,1066302216921907200,2018-11-24 07:07:14 Eastern Standard Time,2018-11-24,07:07:14,-0500,92376011,garciabanchs,Ángel García Banchs,,Bitcoin es la burbuja más loca de la que haya registro en toda la historia de la humanidad. Es una locura pensar que tenía sentido que las personas abandonasen la producción de bienes y servicios útiles a la sociedad para ponernos todos a producir dizque dinero.   De manicomonio.  https://t.co/djHFotlv5s,es,[],[],['https://pbs.twimg.com/media/DsxENltWwAIeony.jpg'],69,206,179,[],[],https://twitter.com/garciabanchs/status/1066302216921907200,False,,1,https://pbs.twimg.com/media/DsxENltWwAIeony.jpg,,,,,,,[],,,,
1066298871096184832,1066298871096184832,2018-11-24 06:53:56 Eastern Standard Time,2018-11-24,06:53:56,-0500,19224439,nouriel,Nouriel Roubini,,"Bitcoin is the biggest bubble &amp; bust in history. Biggest as up 60X from 3 years before peak. Nasdaq was only 4X, so tiny bubble vs BTC. Even bankrupt South Sea was 8X. More similar to Mississippi (35X) that went bankrupt or Tulip-mania. BTC bust biggest/fastest too. Case rested!  https://t.co/OYLtIJ6dPq",en,[],[],['https://pbs.twimg.com/media/DsxBKt8VYAA7QQF.jpg'],115,346,491,[],[],https://twitter.com/Nouriel/status/1066298871096184832,False,,1,https://pbs.twimg.com/media/DsxBKt8VYAA7QQF.jpg,,,,,,,[],,,,
1066230744538845184,1066230744538845184,2018-11-24 02:23:13 Eastern Standard Time,2018-11-24,02:23:13,-0500,970560317074878464,securypto,Securypto,, https://t.co/GpZKlBxvkv Testnet has been launched! Already ahead of the roadmap!  https://t.co/EDPXYYTND2 JOIN the ICO &amp; Airdrop of the year! JOIN NOW! #bitcoin #ethereum #xrp #rippel #blockchain #Crypto #Anonymous #megaupload #piratebay #ipfs #siacoin #storj  https://t.co/MZKBTYtRiv,en,[],"['http://Securypto.io', 'https://bit.ly/2Al2bq0']",['https://pbs.twimg.com/media/DswDNHuXgAEoGbX.jpg'],44,645,656,"['bitcoin', 'ethereum', 'xrp', 'rippel', 'blockchain', 'crypto', 'anonymous', 'megaupload', 'piratebay', 'ipfs', 'siacoin', 'storj']",[],https://twitter.com/Securypto/status/1066230744538845184,False,,1,https://pbs.twimg.com/media/DswDNHuXgAEoGbX.jpg,,,,,,,[],,,,
1066150527195668480,1066150527195668480,2018-11-23 21:04:28 Eastern Standard Time,2018-11-23,21:04:28,-0500,896545146023620609,cryptowhalebot,Whalebot Web3,,"When Bitcoin was at $20,000 everyone wished they could have bought it at today’s prices.   There’s a lesson there.",en,[],[],[],23,138,715,[],[],https://twitter.com/CryptoWhalebot/status/1066150527195668480,False,,0,,,,,,,,[],,,,
1066148795400957952,1066148795400957952,2018-11-23 20:57:35 Eastern Standard Time,2018-11-23,20:57:35,-0500,339061487,apompliano,Pomp 🌪,,Bitcoin drastically outperformed the S&amp;P 500 over the last 10 years.  Even Buffett didn’t do that 😉,en,[],[],[],48,218,1189,[],[],https://twitter.com/APompliano/status/1066148795400957952,False,,0,,,,,,,,[],,,,
1066076434748268544,1066076434748268544,2018-11-23 16:10:03 Eastern Standard Time,2018-11-23,16:10:03,-0500,95066790,real_vijay,Vijay Boyapati,,There are two #Bitcoin investor mindsets:  1. How much are my BTC worth in $USD terms?  2. What % of the 21m total supply do I own?  The first despairs during bear markets.   The second rejoices.,en,[],[],[],44,245,1158,['bitcoin'],['usd'],https://twitter.com/real_vijay/status/1066076434748268544,False,,0,,,,,,,,[],,,,
1066072167194996737,1066072167194996737,2018-11-23 15:53:05 Eastern Standard Time,2018-11-23,15:53:05,-0500,961445378,officialmcafee,John McAfee,,My friend Tommy Mustache put together a chart of previous Bitcoin crashes. Seems we are right on track. The percentage drop is spot on. Must be close to turning around. Thank you Tommy.,en,[],[],[],108,275,856,[],[],https://twitter.com/officialmcafee/status/1066072167194996737,False,https://twitter.com/MustacheTommy/status/1066002458625732608,0,,,,,,,,[],,,,
1066058486851739648,1066058486851739648,2018-11-23 14:58:44 Eastern Standard Time,2018-11-23,14:58:44,-0500,339061487,apompliano,Pomp 🌪,,Went on @cnni to talk about why Bitcoin isn't dead.  Don't listen to the noise. Focus on the fundamentals.  https://t.co/hgwR7eyhND,en,"[{'screen_name': 'cnni', 'name': 'cnn international', 'id': '2097571'}]",[],[],375,1008,3883,[],[],https://twitter.com/APompliano/status/1066058486851739648,False,,1,https://pbs.twimg.com/ext_tw_video_thumb/1066057146486411266/pu/img/PzU-zyI0cRUYRwLT.jpg,,,,,,,[],,,,
1066051891686182912,1066051891686182912,2018-11-23 14:32:31 Eastern Standard Time,2018-11-23,14:32:31,-0500,928759224599040001,crypto,Bloomberg Crypto,,The Bitcoin Cash wars are over  https://t.co/Lhs6Y6TwOO,en,[],['https://bloom.bg/2DULdDo'],[],47,149,339,[],[],https://twitter.com/crypto/status/1066051891686182912,False,,0,,,,,,,,[],,,,
1066027233435893761,1066027233435893761,2018-11-23 12:54:32 Eastern Standard Time,2018-11-23,12:54:32,-0500,787709936,fred_delicious,Fred Delicious,,Feel really bad for the dudes losing money on Bitcoin. Who would've thought spending cash on literally nothing was a bad business model,en,[],[],[],13,278,1842,[],[],https://twitter.com/Fred_Delicious/status/1066027233435893761,False,,0,,,,,,,,[],,,,
1066024668572770304,1066024668572770304,2018-11-23 12:44:21 Eastern Standard Time,2018-11-23,12:44:21,-0500,16790565,cnnjason,Jason K. Morrell,,"Bitpay says Bitcoin will reach up to $15-20,000 in 2019 … But @APompliano tells @CNNI it’s gonna get MUCH lower in the short term   #cryptocurrency @paulanewtonCNN  https://t.co/SN3Thf6wIQ",en,"[{'screen_name': 'apompliano', 'name': 'pomp 🌪', 'id': '339061487'}, {'screen_name': 'cnni', 'name': 'cnn international', 'id': '2097571'}, {'screen_name': 'paulanewtoncnn', 'name': 'paula newton', 'id': '16435865'}]",[],[],45,170,537,['cryptocurrency'],[],https://twitter.com/CNNJason/status/1066024668572770304,False,,1,https://pbs.twimg.com/media/DstHx91V4AA39mO.jpg,,,,,,,[],,,,
1066019266858749952,1066019266858749952,2018-11-23 12:22:53 Eastern Standard Time,2018-11-23,12:22:53,-0500,991345218678116353,digitalassetbuy,Digital Asset Investor Researcher/Wild Speculator,,Hi @Bakkt .  You may not have known that #xrp is also the most Eco-Friendly Digital Asset and consumes far less energy than #bitcoin .  https://t.co/PzwsDi8jpC,en,"[{'screen_name': 'bakkt', 'name': 'bakkt', 'id': '1025229076339060736'}]",[],['https://pbs.twimg.com/media/Dss_TbzUwAAxLXp.jpg'],39,348,868,"['xrp', 'bitcoin']",[],https://twitter.com/digitalassetbuy/status/1066019266858749952,False,,1,https://pbs.twimg.com/media/Dss_TbzUwAAxLXp.jpg,,,,,,,[],,,,
1066011192207032320,1066011192207032320,2018-11-23 11:50:48 Eastern Standard Time,2018-11-23,11:50:48,-0500,339061487,apompliano,Pomp 🌪,,I’ll be on CNN International talking about Bitcoin and dropping BIG FACTS at 12:20p EST today.  Get your popcorn ready!  https://t.co/n4l1M7gRSp,en,[],[],['https://pbs.twimg.com/tweet_video_thumb/Dss7hg3U8AACl0x.jpg'],102,154,1117,[],[],https://twitter.com/APompliano/status/1066011192207032320,False,,1,https://pbs.twimg.com/tweet_video_thumb/Dss7hg3U8AACl0x.jpg,,,,,,,[],,,,
1065980699545608193,1065980699545608193,2018-11-23 09:49:38 Eastern Standard Time,2018-11-23,09:49:38,-0500,1856523530,capitalandceleb,CCN - Capital & Celeb News,,"Crypto ETF Could Launch Bitcoin Price to $20,000 in 2019: BitPay’s Sonny Singh  https://t.co/E5TE8THZQL",en,[],['https://www.ccn.com/crypto-etf-could-launch-bitcoin-price-to-20000-in-2019-bitpays-sonny-singh/'],[],16,187,512,[],[],https://twitter.com/CapitalAndCeleb/status/1065980699545608193,False,,0,,,,,,,,[],,,,
1065966861718740993,1065966861718740993,2018-11-23 08:54:39 Eastern Standard Time,2018-11-23,08:54:39,-0500,608512987,stanleycohenlaw,Stanley Cohen,,"Congratulations to the Zionist asshole that has claimed to have hacked my email address and is demanding a bitcoin payment lest they release what they claim is the body of my communications, research and work including much that is not. Fuck you. Go for it. Zionism is a disease.",en,[],[],[],41,216,457,[],[],https://twitter.com/StanleyCohenLaw/status/1065966861718740993,False,,0,,,,,,,,[],,,,
1065957520194367491,1065957520194367491,2018-11-23 08:17:32 Eastern Standard Time,2018-11-23,08:17:32,-0500,339061487,apompliano,Pomp 🌪,,Daily transaction volumes:  - Visa does ~$30 billion - MasterCard does ~$11 billion - Bitcoin does ~$8 billion  Bitcoin is closing the gap.  This will be the real flippening 🔥,en,[],[],[],173,1118,3771,[],[],https://twitter.com/APompliano/status/1065957520194367491,False,,0,,,,,,,,[],,,,
1065949264143093760,1065949264143093760,2018-11-23 07:44:43 Eastern Standard Time,2018-11-23,07:44:43,-0500,390627208,ivanontech,"Ivan on Tech (🖥, 📲, 🎮) - Building Moralis Web3",,Bitcoin is already overtaking MasterCard.  And we are in a bear market...  And we are just getting started...   https://t.co/hjLNizqVLR,en,[],['https://toshitimes.com/bitcoins-daily-transfer-volume-close-to-overtaking-mastercards/'],[],89,552,1640,[],[],https://twitter.com/IvanOnTech/status/1065949264143093760,False,,0,,,,,,,,[],,,,
1065912291504390145,1065912291504390145,2018-11-23 05:17:48 Eastern Standard Time,2018-11-23,05:17:48,-0500,2207129125,cointelegraph,Cointelegraph,,"Institutional entry could see Bitcoin hit $15-20K by the end of next year, says BitPay COO  https://t.co/p06zNZJMem",en,[],['https://cointelegraph.com/news/bitpay-coo-sonny-singh-bitcoin-could-hit-15-20k-by-end-of-2019'],[],52,191,479,[],[],https://twitter.com/Cointelegraph/status/1065912291504390145,False,,0,,,,,,,,[],,,,
1065895557284036608,1065895557284036608,2018-11-23 04:11:18 Eastern Standard Time,2018-11-23,04:11:18,-0500,3267440208,diepsanh,Bull Diep,,"-Bitcoin has some real technological limitations -The digital asset that show fundamental use cases will develop a fundamental value -XRP is being used more than Bitcoin being used as of today  Cory Johnson, Ripple Nov18  #XRP #XRPthestandard  https://t.co/hmpqXNFTtT",en,[],[],[],30,223,606,"['xrp', 'xrpthestandard']",[],https://twitter.com/DiepSanh/status/1065895557284036608,False,,1,https://pbs.twimg.com/ext_tw_video_thumb/1065894628644204544/pu/img/KEckn0xI4-l4iZ_L.jpg,,,,,,,[],,,,
1065886460786688000,1065886460786688000,2018-11-23 03:35:10 Eastern Standard Time,2018-11-23,03:35:10,-0500,1333467482,coindesk,CoinDesk,,The Lightning Network is already powering a real blogging platform with bitcoin micropayments.  https://t.co/JN8Yu9aFzG,en,[],['http://ow.ly/76ZW30mIQVQ'],[],28,273,724,[],[],https://twitter.com/CoinDesk/status/1065886460786688000,False,,0,,,,,,,,[],,,,
1065792424985866242,1065792424985866242,2018-11-22 21:21:30 Eastern Standard Time,2018-11-22,21:21:30,-0500,20169416,tracyalloway,Tracy Alloway,,"Look, it's a Black Friday sale in Bitcoin:  https://t.co/vgnJCzECb3",en,[],[],['https://pbs.twimg.com/media/Dsp0gmdUwAEcGlc.jpg'],51,342,1225,[],[],https://twitter.com/tracyalloway/status/1065792424985866242,False,,1,https://pbs.twimg.com/media/Dsp0gmdUwAEcGlc.jpg,,,,,,,[],,,,
1065754249668235264,1065754249668235264,2018-11-22 18:49:48 Eastern Standard Time,2018-11-22,18:49:48,-0500,10446482,nvk,DETERMINISTIC OPTIMISM,,Bitcoin is dead 😂  “Bitcoin Close to Overtaking @MasterCard in Daily Transfers”  https://t.co/jGvLcEznKN,en,"[{'screen_name': 'mastercard', 'name': 'mastercard', 'id': '75014376'}]",['https://www.trustnodes.com/2018/11/21/bitcoin-close-to-overtaking-mastercard-in-daily-transfers'],[],42,349,1031,[],[],https://twitter.com/nvk/status/1065754249668235264,False,,0,,,,,,,,[],,,,
1065751785770500096,1065751785770500096,2018-11-22 18:40:01 Eastern Standard Time,2018-11-22,18:40:01,-0500,898155965899526145,iamcryptowolf,Wolf 🐺,,Meanwhile bitcoin on Google trends... 🤔  https://t.co/BFUfzCS2Zd,en,[],[],['https://pbs.twimg.com/media/DspPmFsX4AEnaM4.jpg'],104,444,1741,[],[],https://twitter.com/IamCryptoWolf/status/1065751785770500096,False,,1,https://pbs.twimg.com/media/DspPmFsX4AEnaM4.jpg,,,,,,,[],,,,
1065669799773114384,1065669799773114384,2018-11-22 13:14:14 Eastern Standard Time,2018-11-22,13:14:14,-0500,339061487,apompliano,Pomp 🌪,,"More than 60% of Belgian banks think banks could become irrelevant in the future because of innovations like blockchain tech.  More than 40% think virtual currencies are a threat to their business.  Long Bitcoin, Short the Bankers!",en,[],[],[],53,310,1348,[],[],https://twitter.com/APompliano/status/1065669799773114384,False,,0,,,,,,,,[],,,,
1065625123477221377,1065625123477221377,2018-11-22 10:16:42 Eastern Standard Time,2018-11-22,10:16:42,-0500,339061487,apompliano,Pomp 🌪,,Thanksgiving is for family and explaining Bitcoin.,en,[],[],[],65,160,1317,[],[],https://twitter.com/APompliano/status/1065625123477221377,False,,0,,,,,,,,[],,,,
1065616753139564544,1065616753139564544,2018-11-22 09:43:26 Eastern Standard Time,2018-11-22,09:43:26,-0500,1000054781866475520,geebahq,Geeba,,PR reminder!: Geeba Token Sale Lists on Latoken Exchange  https://t.co/9RVPlyvSva… via @BTCTN  #bitcoin #geeba #pressrelease #ico #investment #ThrowbackThursday,et,"[{'screen_name': 'btctn', 'name': 'bitcoin news', 'id': '3367334171'}]",['http://news.bitcoin.com/pr-geeba-token'],[],1,427,405,"['bitcoin', 'geeba', 'pressrelease', 'ico', 'investment', 'throwbackthursday']",[],https://twitter.com/GeebaHQ/status/1065616753139564544,False,,0,,,,,,,,[],,,,
1065545889614372864,1065545889614372864,2018-11-22 05:01:51 Eastern Standard Time,2018-11-22,05:01:51,-0500,1333467482,coindesk,CoinDesk,,Tobacconists in France will reportedly be selling bitcoin vouchers to the public from New Year.  https://t.co/IxAfJtVfE1,en,[],['http://ow.ly/lQHQ30mIdCb'],[],16,139,358,[],[],https://twitter.com/CoinDesk/status/1065545889614372864,False,,0,,,,,,,,[],,,,
1065527517153390592,1065527517153390592,2018-11-22 03:48:51 Eastern Standard Time,2018-11-22,03:48:51,-0500,867617849208037377,okex,OKEx,,"What Are You Thankful for This Year?  Either it be Bitcoin or anything in your daily life, share with us what you are most thankful for this year.  Also, follow us and RT for a chance to win 50 USDT. We'll pick 3 winners on Nov 26.  #Thanksgiving #giveaway #free  https://t.co/g3pOBC6L2F",en,[],[],['https://pbs.twimg.com/media/Dsl8IlHVsAA6T1q.jpg'],644,419,458,"['thanksgiving', 'giveaway', 'free']",[],https://twitter.com/OKEx/status/1065527517153390592,False,,1,https://pbs.twimg.com/media/Dsl8IlHVsAA6T1q.jpg,,,,,,,[],,,,
1065517157688066048,1065517157688066048,2018-11-22 03:07:41 Eastern Standard Time,2018-11-22,03:07:41,-0500,3267440208,diepsanh,Bull Diep,,"-Demand for cash is decreasing -Crypto such as Bitcoin, Ethereum and Ripple are vying for spots in a cashless world, with more stable value, quicker and cheaper settlement -Posibility for CBDC Christine Lagarde, IMF Nov18 #IOV #Ripple #XRP #CBDC #Bitcoin  https://t.co/2CP3aXgrKx",en,[],[],[],61,394,934,"['iov', 'ripple', 'xrp', 'cbdc', 'bitcoin']",[],https://twitter.com/DiepSanh/status/1065517157688066048,False,,1,https://pbs.twimg.com/ext_tw_video_thumb/1065516446506135552/pu/img/eLeUM73qHOW9mZ2Y.jpg,,,,,,,[],,,,
1065507204059602944,1065507204059602944,2018-11-22 02:28:08 Eastern Standard Time,2018-11-22,02:28:08,-0500,541502762,biyitheplug,- Biyi 🔥,,When they tell you to come invest your money in bitcoin 😂  https://t.co/c3s1zxdFEz,en,[],[],[],220,1661,2675,[],[],https://twitter.com/BiyiThePlug/status/1065507204059602944,False,,1,https://pbs.twimg.com/ext_tw_video_thumb/1065506997225906176/pu/img/mhrBNnpez0Ah7wnZ.jpg,,,,,,,[],,,,
1065505973203169280,1065505973203169280,2018-11-22 02:23:14 Eastern Standard Time,2018-11-22,02:23:14,-0500,56000672,wiz,wiz,,"I’ll keep mining and supporting Bitcoin as long as I can, despite the current market conditions. I’m in this for the long run and don’t care about short term price fluctuations. Who’s with me??  https://t.co/Q2lg2fRlmt",en,[],[],['https://pbs.twimg.com/media/DslwByqU8AAV8O5.jpg'],237,380,3534,[],[],https://twitter.com/wiz/status/1065505973203169280,False,,1,https://pbs.twimg.com/media/DslwByqU8AAV8O5.jpg,,,,,,,[],,,,
1065487313549983745,1065487313549983745,2018-11-22 01:09:06 Eastern Standard Time,2018-11-22,01:09:06,-0500,311430228,bobbyclee,Bobby Lee - Ballet: World's EASIEST wallet!,,"#Money has always been either #Physical in nature (coins, bills, gold), or #Account-based, and thus tied to real-name identity (bank accounts).  With #Bitcoin, for the first time in human history, money is now just #Information: nothing physical, and not tied to any identity.",en,[],[],[],33,186,691,"['money', 'physical', 'account', 'bitcoin', 'information']",[],https://twitter.com/bobbyclee/status/1065487313549983745,False,,0,,,,,,,,[],,,,
1065462749281435648,1065462749281435648,2018-11-21 23:31:29 Eastern Standard Time,2018-11-21,23:31:29,-0500,2178012643,balajis,Balaji Srinivasan,,"Blockchains are the next step after open source, as they provide open data &amp; open execution. You don’t just see the source code with something like Bitcoin or Ethereum. With a full node you see all historical data, all pending writes, and can retrace every step of code execution.",en,[],[],[],37,277,1058,[],[],https://twitter.com/balajis/status/1065462749281435648,False,,0,,,,,,,,[],,,,
1065359195673907203,1065359195673907203,2018-11-21 16:40:00 Eastern Standard Time,2018-11-21,16:40:00,-0500,13393052,aclu,ACLU,,"An illuminating conversation with Edward Snowden about blockchains, bitcoin, and how they can go wrong:  https://t.co/r6MspK3T6n",en,[],['https://www.aclu.org/blog/privacy-technology/internet-privacy/edward-snowden-explains-blockchain-his-lawyer-and-rest-us'],[],25,382,750,[],[],https://twitter.com/ACLU/status/1065359195673907203,False,,0,,,,,,,,[],,,,
1065329007657398272,1065328176744812547,2018-11-21 14:40:02 Eastern Standard Time,2018-11-21,14:40:02,-0500,16076032,ggreenwald,Glenn Greenwald,,2/ Literally that whole tweet - about ACLU &amp; Snowden - was a lie. ACLU didn't promote bitcoin. Snowden explained - not promoted or sold - crypto-currency. Just compare this GCHQ agent's lie to the actual article to see how false it is:  https://t.co/zG4ZhyI0PX,en,[],['https://www.aclu.org/blog/privacy-technology/internet-privacy/edward-snowden-explains-blockchain-his-lawyer-and-rest-us'],[],18,147,374,[],[],https://twitter.com/ggreenwald/status/1065329007657398272,False,,0,,,,,,,,[],,,,
1065277883784998912,1065277883784998912,2018-11-21 11:16:54 Eastern Standard Time,2018-11-21,11:16:54,-0500,47966112,odell,ODELL,,"Every bitcoin sell off consolidates bitcoin ownership into stronger hands, reduces liquidity, and preps the next bull cycle.",en,[],[],[],49,265,1511,[],[],https://twitter.com/ODELL/status/1065277883784998912,False,,0,,,,,,,,[],,,,
1065263645997838338,1065263645997838338,2018-11-21 10:20:19 Eastern Standard Time,2018-11-21,10:20:19,-0500,1413027896,charliebilello,Charlie Bilello,,2018 Crypto Returns... Qtum: -96% ICON: -95% Cardano: -94% Lisk: -93% IOTA: -92% NEM: -92% Bitcoin Gold: -91% Dash: -90% OmiseGO: -90% Bitcoin Cash: -89% NEO: -88% Litecoin: -86% zCash: -84% Ethereum: -83% Ethereum Classic: -81% Monero: -81% XRP: -79% TRON: -76% Bitcoin: -67%,en,[],[],[],310,1682,3736,[],[],https://twitter.com/charliebilello/status/1065263645997838338,False,,0,,,,,,,,[],,,,
1065241273903259648,1065241273009938432,2018-11-21 08:51:25 Eastern Standard Time,2018-11-21,08:51:25,-0500,1025229076339060736,bakkt,Bakkt,,"As the world’s most liquid and widely distributed cryptocurrency, and where we’ve seen the most customer demand, bitcoin’s profile creates a liquid product on which to build a futures contract (2/2)",en,[],[],[],88,271,1245,[],[],https://twitter.com/Bakkt/status/1065241273903259648,False,,0,,,,,,,,[],,,,
1065241273009938432,1065241273009938432,2018-11-21 08:51:25 Eastern Standard Time,2018-11-21,08:51:25,-0500,1025229076339060736,bakkt,Bakkt,,"We've been asked why we're starting with bitcoin. Here's why:  Bitcoin today accounts for over half of total crypto market capitalization and has been deemed to be a commodity, and its derivatives are regulated in the US by the CFTC... (1/2)",en,[],[],[],283,968,3007,[],[],https://twitter.com/Bakkt/status/1065241273009938432,False,,0,,,,,,,,[],,,,
1065238435256926209,1065238435256926209,2018-11-21 08:40:08 Eastern Standard Time,2018-11-21,08:40:08,-0500,1471313300,peterktodd,Peter Todd,,"Knowing that GPU's aren't used to mine Bitcoin is basic blockchain tech knowledge.  If a idiotic mistake like this can get past @Bloomberg's editors/fact checkers it's either too incompetent to be reporting on Bitcoin, or dishonestly making up #FakeNews  https://t.co/aTlrp9kJB7",en,"[{'screen_name': 'bloomberg', 'name': 'bloomberg lp', 'id': '104237736'}]",[],['https://pbs.twimg.com/media/Dsh8s0-WsAAE7Vq.jpg'],52,238,951,['fakenews'],[],https://twitter.com/peterktodd/status/1065238435256926209,False,,1,https://pbs.twimg.com/media/Dsh8s0-WsAAE7Vq.jpg,,,,,,,[],,,,
1065228728568041472,1065228728568041472,2018-11-21 08:01:34 Eastern Standard Time,2018-11-21,08:01:34,-0500,1333467482,coindesk,CoinDesk,,U.S.-based bitcoin mining firm Giga Watt has declared bankruptcy with millions still owed to creditors.  https://t.co/MsIJvigNjX,en,[],['http://ow.ly/Fwz830mHvdI'],[],106,571,989,[],[],https://twitter.com/CoinDesk/status/1065228728568041472,False,,0,,,,,,,,[],,,,
1065214707492102145,1065214707492102145,2018-11-21 07:05:51 Eastern Standard Time,2018-11-21,07:05:51,-0500,164628863,mvidallopez,Miguel Vidal,,Fun fact: Nvidia GPUs are NOT used to mine Bitcoin! #fakenews,en,[],[],[],25,136,641,['fakenews'],[],https://twitter.com/mvidallopez/status/1065214707492102145,False,https://twitter.com/bopinion/status/1064896830058700800,0,,,,,,,,[],,,,
1065052950823911424,1065052950823911424,2018-11-20 20:23:05 Eastern Standard Time,2018-11-20,20:23:05,-0500,339061487,apompliano,Pomp 🌪,,"Bitcoin is down over 75% from its all-time high.  It is still the best performing asset class in the last 5 years.  It has dwarfed stocks, bonds, currencies and commodities since inception too.  Ignore the noise, trust the code.",en,[],[],[],160,1011,3855,[],[],https://twitter.com/APompliano/status/1065052950823911424,False,,0,,,,,,,,[],,,,
1065017151986327552,1065017151986327552,2018-11-20 18:00:50 Eastern Standard Time,2018-11-20,18:00:50,-0500,16732770,cnbcfastmoney,CNBC's Fast Money,,"As #bitcoin plunges and nears $4,000, Wall Street's Crypto King Bart Smith of Susquehanna says he's still a long-term believer in the cryptocurrency.  https://t.co/SzsL9tZAhB",en,[],[],[],52,191,545,['bitcoin'],[],https://twitter.com/CNBCFastMoney/status/1065017151986327552,False,,1,https://pbs.twimg.com/media/Dsezc1PXgAA9BR2.jpg,,,,,,,[],,,,
1064993022725799937,1064993022725799937,2018-11-20 16:24:57 Eastern Standard Time,2018-11-20,16:24:57,-0500,2799211554,whalepanda,WhalePanda,,"If you bought a lambo with Bitcoin at $20k, would sell it now and buy Bitcoin with that money you made a nice profit (in Bitcoin) and you had fun while being a douche.",en,[],[],[],58,144,1283,[],[],https://twitter.com/WhalePanda/status/1064993022725799937,False,,0,,,,,,,,[],,,,
1064971283903983619,1064971283903983619,2018-11-20 14:58:34 Eastern Standard Time,2018-11-20,14:58:34,-0500,2916305152,snowden,Edward Snowden,,"Ever want to hear me explain blockchains and bitcoin? Of course you didn't. But now you can, in hardcover and freely online, thanks to @McSweeneys 54, ""The End of Trust"". Read some of society's finest minds on the future of technology. Available here:  https://t.co/d0NJUepyIt  https://t.co/tdRwzK1CtE",en,"[{'screen_name': 'mcsweeneys', 'name': 'timothy mcsweeney', 'id': '30109507'}]",['https://www.eff.org/the-end-of-trust'],['https://pbs.twimg.com/tweet_video_thumb/DseJakYWoAA_87S.jpg'],72,817,1946,[],[],https://twitter.com/Snowden/status/1064971283903983619,False,,1,https://pbs.twimg.com/tweet_video_thumb/DseJakYWoAA_87S.jpg,,,,,,,[],,,,
1064969408743755777,1064969408743755777,2018-11-20 14:51:07 Eastern Standard Time,2018-11-20,14:51:07,-0500,1376161898,iohk_charles,Charles Hoskinson,,The headlines and carnival barking from the media about the current state of Bitcoin and recent losses show they have never gotten our movement. $150 billion in value has been liberated from the banking system and now exists in a parallel economy. Our growth remains unchallenged,en,[],[],[],39,242,1064,[],[],https://twitter.com/IOHK_Charles/status/1064969408743755777,False,,0,,,,,,,,[],,,,
1064942364710576128,1064942364710576128,2018-11-20 13:03:40 Eastern Standard Time,2018-11-20,13:03:40,-0500,339061487,apompliano,Pomp 🌪,,"STOP THE MADNESS.  Global debt is at an all-time high of $247 trillion.  $247,000,000,000,000  Long Bitcoin, Short the Bankers!",en,[],[],[],155,735,3070,[],[],https://twitter.com/APompliano/status/1064942364710576128,False,,0,,,,,,,,[],,,,
