id,conversation_id,created_at,date,time,timezone,user_id,username,name,place,tweet,language,mentions,urls,photos,replies_count,retweets_count,likes_count,hashtags,cashtags,link,retweet,quote_url,video,thumbnail,near,geo,source,user_rt_id,user_rt,retweet_id,reply_to,retweet_date,translate,trans_src,trans_dest
935641808700293120,935641808700293120,2017-11-28 17:49:25 Eastern Standard Time,2017-11-28,17:49:25,-0500,339061487,apompliano,Pomp 🌪,,"Crypto Market Caps:  Bitcoin: $168 billion  Ethereum: $45 billion Bitcoin Cash: $26 billion Ripple: $10 billion Bitcoin Gold: $5 billion Litecoin: $5 billion  Whether you believe or not, this is real money.",en,[],[],[],27,217,665,[],[],https://twitter.com/APompliano/status/935641808700293120,False,,0,,,,,,,,[],,,,
935637356459069441,935637356459069441,2017-11-28 17:31:43 Eastern Standard Time,2017-11-28,17:31:43,-0500,2178012643,balajis,Balaji Srinivasan,,"Bitcoin, pronounced dead more than one hundred times, now $10,000 per coin. Ethereum now closing in on $500. And crypto as a whole? $300B.  The point of a high price isn't just to make money, though that's always nice.  The point is to prove them wrong.",en,[],[],[],40,452,1428,[],[],https://twitter.com/balajis/status/935637356459069441,False,,0,,,,,,,,[],,,,
935631033390678016,935631033390678016,2017-11-28 17:06:36 Eastern Standard Time,2017-11-28,17:06:36,-0500,538399586,prestonpysh,Preston Pysh,,"For people looking to enter the #Bitcoin space for the first time, be mindful that you might have your temperament tested in the coming weeks/months.  Historically, the price only trades &gt;2.45X above the 200 DMA about 6% of the time (it's current location).  https://t.co/m967rbHyyl",en,[],[],['https://pbs.twimg.com/media/DPwGA0cX4AYZ5A-.jpg'],34,170,436,['bitcoin'],[],https://twitter.com/PrestonPysh/status/935631033390678016,False,,1,https://pbs.twimg.com/media/DPwGA0cX4AYZ5A-.jpg,,,,,,,[],,,,
935599674051850240,935599674051850240,2017-11-28 15:01:59 Eastern Standard Time,2017-11-28,15:01:59,-0500,10429092,drboycewatkins1,Dr Boyce Watkins,,"Buy your kids some bitcoin for Christmas. In 2 years, that PlayStation will be worthless",en,[],[],[],25,143,284,[],[],https://twitter.com/drboycewatkins1/status/935599674051850240,False,,0,,,,,,,,[],,,,
935599091849023488,935599091849023488,2017-11-28 14:59:40 Eastern Standard Time,2017-11-28,14:59:40,-0500,903617387643199488,stktoken,STK token,,"Thanks for this in-depth review, @TheGobOneCrypto! #GoCanada :) #cryptocurrency #blockchain #ethereum #bitcoin #btc #bitcoins #ICO #token #crowdsale #tokensale  https://t.co/jL1iPwDBfs",en,[],['https://www.youtube.com/watch?v=7P0OeaLGfXA'],[],2,320,302,"['gocanada', 'cryptocurrency', 'blockchain', 'ethereum', 'bitcoin', 'btc', 'bitcoins', 'ico', 'token', 'crowdsale', 'tokensale']",[],https://twitter.com/STKtoken/status/935599091849023488,False,,0,,,,,,,,[],,,,
935597400709664768,935597400709664768,2017-11-28 14:52:57 Eastern Standard Time,2017-11-28,14:52:57,-0500,347640382,sadieisonfire,1994 Subaru Outback,,2018 people gon be buying weed with bitcoin,en,[],[],[],19,184,953,[],[],https://twitter.com/Sadieisonfire/status/935597400709664768,False,,0,,,,,,,,[],,,,
935596104632107009,935596104632107009,2017-11-28 14:47:48 Eastern Standard Time,2017-11-28,14:47:48,-0500,287816744,suitpossum,Brett Scott,,"For all of ya gloating about the #Bitcoin price, it's only got to this point because some of us actually used it to buy things in the real world in the past. Here's my $850 pizza, $160 bondage tape &amp; $1688 Fastmail subscription from a while ago. Show me your receipts, speculators  https://t.co/q0ntU5hR0I",en,[],[],"['https://pbs.twimg.com/media/DPvlX9xWAAAJufO.jpg', 'https://pbs.twimg.com/media/DPvlb6jWkAIB6Lb.jpg', 'https://pbs.twimg.com/media/DPvl0QjX4AIGwz5.jpg']",73,165,590,['bitcoin'],[],https://twitter.com/Suitpossum/status/935596104632107009,False,,1,https://pbs.twimg.com/media/DPvlX9xWAAAJufO.jpg,,,,,,,[],,,,
935580100396974081,935580100396974081,2017-11-28 13:44:12 Eastern Standard Time,2017-11-28,13:44:12,-0500,164425558,jonerlichman,Jon Erlichman,,"Bitcoin price milestones in 2017:  November: $10,000 November:  $9,000 November:  $8,000 November:  $7,000 October:      $6,000 October:      $5,000 August:        $4,000 June:            $3,000 May:             $2,000 January:      $1,000",en,[],[],[],24,361,601,[],[],https://twitter.com/JonErlichman/status/935580100396974081,False,,0,,,,,,,,[],,,,
935579986446168069,935579986446168069,2017-11-28 13:43:45 Eastern Standard Time,2017-11-28,13:43:45,-0500,20902138,alistairmilne,Alistair Milne,,"Year 2030: Me - ""I remember watching as Bitcoin broke above $10k"" Son - ""You're so OLD dad, now lend me 0.1BTC so I can buy a house""",en,[],[],[],31,257,938,[],[],https://twitter.com/alistairmilne/status/935579986446168069,False,,0,,,,,,,,[],,,,
935565977177219072,935565977177219072,2017-11-28 12:48:05 Eastern Standard Time,2017-11-28,12:48:05,-0500,18856867,zerohedge,zerohedge,,"Bitcoin is up 11,000,000% in five years",en,[],[],[],62,607,1183,[],[],https://twitter.com/zerohedge/status/935565977177219072,False,,0,,,,,,,,[],,,,
935564279150989312,935564279150989312,2017-11-28 12:41:20 Eastern Standard Time,2017-11-28,12:41:20,-0500,15998669,udovetter,Udo Vetter,,"Gespräch mit einem Vater. Dessen damals 16-jähriger Sohn hat vor 3,5 Jahren 125 Bitcoin gekauft, wofür ihm der Vater die Ohren langzog und die Bitcoin verscherbelte. Heute spricht sein Sohn nicht mehr mit ihm, aus welchen Gründen auch immer.",de,[],[],[],19,282,822,[],[],https://twitter.com/udovetter/status/935564279150989312,False,,0,,,,,,,,[],,,,
935556665939656704,935556665939656704,2017-11-28 12:11:05 Eastern Standard Time,2017-11-28,12:11:05,-0500,25160944,kashhill,Kashmir Hill,,"When I lived on Bitcoin in 2013, I treated a bunch of strangers to a sushi dinner that cost 10 bitcoin. At current valuation, that was a $99,000 sushi dinner!",en,[],[],[],40,192,1072,[],[],https://twitter.com/kashhill/status/935556665939656704,False,,0,,,,,,,,[],,,,
935551025737601028,935551025737601028,2017-11-28 11:48:40 Eastern Standard Time,2017-11-28,11:48:40,-0500,3179873194,cryptohustle,฿TF%$Brrrrrr!,,"Every #bitcoin holder was also given $BCH. This technically qualifies us all as ""community members"". If we decide to call it #BCASH then you need to just deal with it. Welcome to the free market.",en,[],[],[],44,130,763,"['bitcoin', 'bcash']",['bch'],https://twitter.com/CryptoHustle/status/935551025737601028,False,,0,,,,,,,,[],,,,
935543612577910788,935543612577910788,2017-11-28 11:19:13 Eastern Standard Time,2017-11-28,11:19:13,-0500,2260491445,coinmarketcap,CoinMarketCap,,"The price of Bitcoin has reached $10,000!  https://t.co/fi55d4aaQr    #CoinMarketCap #bitcoin #cryptocurrency #blockchain  https://t.co/2F3FOu8PqI",en,[],['http://www.coinmarketcap.com/bitcoin'],['https://pbs.twimg.com/media/DPu3dFBX0AEHCFh.jpg'],60,431,819,"['coinmarketcap', 'bitcoin', 'cryptocurrency', 'blockchain']",[],https://twitter.com/CoinMarketCap/status/935543612577910788,False,,1,https://pbs.twimg.com/media/DPu3dFBX0AEHCFh.jpg,,,,,,,[],,,,
935534213587243008,935534213587243008,2017-11-28 10:41:52 Eastern Standard Time,2017-11-28,10:41:52,-0500,903617387643199488,stktoken,STK token,,"STK featured on #ICOHotel, gets a Triple A rating! #cryptocurrency #blockchain #ethereum #bitcoin #btc #bitcoins #ICO #token #crowdsale #tokensale  https://t.co/uTL41cHcGj",en,[],['https://icohotel.com/news/Cryptocurrencies/introducing-stk:-a-new-cryptocurrency-for-instant'],[],3,307,288,"['icohotel', 'cryptocurrency', 'blockchain', 'ethereum', 'bitcoin', 'btc', 'bitcoins', 'ico', 'token', 'crowdsale', 'tokensale']",[],https://twitter.com/STKtoken/status/935534213587243008,False,,0,,,,,,,,[],,,,
935530079098212353,935530079098212353,2017-11-28 10:25:26 Eastern Standard Time,2017-11-28,10:25:26,-0500,1413027896,charliebilello,Charlie Bilello,,"Bitcoin's market cap just passed Mastercard's, a company that processes 56 billion transactions per year.  $BTC.X $MA  https://t.co/rGVuKYm95S",en,[],[],['https://pbs.twimg.com/media/DPurUwdU8AELrPq.jpg'],17,142,188,[],"['btc.x', 'ma']",https://twitter.com/charliebilello/status/935530079098212353,False,,1,https://pbs.twimg.com/media/DPurUwdU8AELrPq.jpg,,,,,,,[],,,,
935529083022196736,935529083022196736,2017-11-28 10:21:29 Eastern Standard Time,2017-11-28,10:21:29,-0500,390266895,legendofcrypto,Crypto Boss,,"Bitcoin at: $1,000 ""It's too expensive"" Bitcoin at: $3,000 ""It's still too expensive"" Bitcoin at: $5,000 ""I'm waiting for the dip"" Bitcoin at: $7,000 ""It's way too expensive now"" Bitcoin at: $10,000 ""Buying some Bitcoin! We're going to the moon!""  https://t.co/vGIxfbGCc2",en,[],[],['https://pbs.twimg.com/tweet_video_thumb/DPuqJbRU8Agbb6t.jpg'],31,338,850,[],[],https://twitter.com/LegendOfCrypto/status/935529083022196736,False,,1,https://pbs.twimg.com/tweet_video_thumb/DPuqJbRU8Agbb6t.jpg,,,,,,,[],,,,
935524656886566912,935524656886566912,2017-11-28 10:03:54 Eastern Standard Time,2017-11-28,10:03:54,-0500,61417559,erikvoorhees,Erik Voorhees,,Why does Bitcoin keep growing?  Because it's time to separate money and state.,en,[],[],[],104,1082,2840,[],[],https://twitter.com/ErikVoorhees/status/935524656886566912,False,,0,,,,,,,,[],,,,
935523391930601472,935523391930601472,2017-11-28 09:58:52 Eastern Standard Time,2017-11-28,09:58:52,-0500,61417559,erikvoorhees,Erik Voorhees,,"The current Bitcoin price bubble is only a surprise to those who are new to the industry. One does not create a world-changing technology without a bubbly ascent. This is the 4th or 5th large bubble, and there will be more.",en,[],[],[],29,239,795,[],[],https://twitter.com/ErikVoorhees/status/935523391930601472,False,,0,,,,,,,,[],,,,
935515965500067841,935515965500067841,2017-11-28 09:29:21 Eastern Standard Time,2017-11-28,09:29:21,-0500,1413027896,charliebilello,Charlie Bilello,,"At $165 billion, Bitcoin's market cap just passed PepsiCo.  Yes, that Pepsi: Founded in 1898 Gatorade, 7 Up, Mountain Dew, Lay's, Tropicana, Doritos, Cheetos, Tostitos 264,000 employees $63 billion in revenue  $BTC.X $PEP  https://t.co/HaOdD6dZPx",en,[],[],['https://pbs.twimg.com/media/DPueidXX0AMo0Ao.jpg'],46,260,389,[],"['btc.x', 'pep']",https://twitter.com/charliebilello/status/935515965500067841,False,,1,https://pbs.twimg.com/media/DPueidXX0AMo0Ao.jpg,,,,,,,[],,,,
935503131542216704,935503131542216704,2017-11-28 08:38:22 Eastern Standard Time,2017-11-28,08:38:22,-0500,747366374452887553,yourcashaa,Cashaa,,Today #Bitcoin has finally reached the long awaited 10000 USD!  https://t.co/dwLbLs5zBP #CAS #BTC #Level39 @TeamBlockchain @auxesisgroup @BlockchainLabIN @auxledger,en,"[{'screen_name': 'teamblockchain', 'name': 'team blockchain', 'id': '811868073456238593'}, {'screen_name': 'auxesisgroup', 'name': 'auxesis group', 'id': '740076425101889536'}, {'screen_name': 'blockchainlabin', 'name': 'blockchain lab india', 'id': '914605899704094722'}, {'screen_name': 'auxledger', 'name': 'auxledger', 'id': '932944587861176320'}]",['https://goo.gl/FrMPhV'],[],0,298,299,"['bitcoin', 'cas', 'btc', 'level39']",[],https://twitter.com/yourCashaa/status/935503131542216704,False,,0,,,,,,,,[],,,,
935499795233468416,935499795233468416,2017-11-28 08:25:06 Eastern Standard Time,2017-11-28,08:25:06,-0500,961445378,officialmcafee,John McAfee,,"Article: Bitcoin investors will be the richest people on earth. Anyone who understands Bitcoin cannot deny this. But what does that say about Bitcoin miners?  We occupy the top rung of profitability. Soon, mining will be immorally profitable.   https://t.co/WRsX35pxwD",en,[],['http://www.mntrends.com/2017/10/see-why-bitcoin-investors-might-make.html?m=1'],[],67,250,589,[],[],https://twitter.com/officialmcafee/status/935499795233468416,False,,0,,,,,,,,[],,,,
935491958646149120,935491958646149120,2017-11-28 07:53:58 Eastern Standard Time,2017-11-28,07:53:58,-0500,705277074983002112,nebeusworld,Nebeus,,"P2P cryptocurrency loans.    Get P2P loans in Bitcoins, Ether (ETH), Ether Classic (ETC) and Ripple (XRP) as well as other 11 popular cryptocurrencies.  With Nebeus, it's easy.  Learn more at  https://t.co/HBzz2LMWVK    #ICO #Nebeus #bitcoin #cryptocurrency #NebeusICO #p2plending  https://t.co/jrEkmK5lgd",en,[],['http://token.nebeus.com'],['https://pbs.twimg.com/media/DPuI-USXUAEPqFi.jpg'],2,354,314,"['ico', 'nebeus', 'bitcoin', 'cryptocurrency', 'nebeusico', 'p2plending']",[],https://twitter.com/NebeusWorld/status/935491958646149120,False,,1,https://pbs.twimg.com/media/DPuI-USXUAEPqFi.jpg,,,,,,,[],,,,
935491229189574662,935491229189574662,2017-11-28 07:51:04 Eastern Standard Time,2017-11-28,07:51:04,-0500,972651,mashable,Mashable,,"It's happened: Bitcoin $10,000  https://t.co/uAd5IR9sRF",en,[],['http://on.mash.to/2zLyXU3'],[],16,131,139,[],[],https://twitter.com/mashable/status/935491229189574662,False,,0,,,,,,,,[],,,,
935476034526433280,896549808818843650,2017-11-28 06:50:41 Eastern Standard Time,2017-11-28,06:50:41,-0500,2421317989,jackfru1t,Jack🏴‍☠️⚡,,"#bitcoin $0      -   $1000: 1789 days $1000-   $2000: 1271 days $2000-   $3000: 23 days $3000-   $4000: 62 days $4000-   $5000: 61 days $5000-   $6000: 8 days $6000-   $7000: 13 days $7000-   $8000: 14 days $8000-   $9000: 9 days $9000- $10,000: 2 days",en,[],[],[],36,256,468,['bitcoin'],[],https://twitter.com/jackfru1t/status/935476034526433280,False,,0,,,,,,,,[],,,,
935474858191855618,935474858191855618,2017-11-28 06:46:01 Eastern Standard Time,2017-11-28,06:46:01,-0500,14654494,excellion,Samson Mow,,10k is nothing. Just wait. #Bitcoin  https://t.co/zZ0ypOT5AF,en,[],[],['https://pbs.twimg.com/tweet_video_thumb/DPt5ZVqUQAAvbZo.jpg'],30,211,627,['bitcoin'],[],https://twitter.com/Excellion/status/935474858191855618,False,,1,https://pbs.twimg.com/tweet_video_thumb/DPt5ZVqUQAAvbZo.jpg,,,,,,,[],,,,
935468001876471808,935468001876471808,2017-11-28 06:18:46 Eastern Standard Time,2017-11-28,06:18:46,-0500,2207129125,cointelegraph,Cointelegraph,,#Bitcoin crosses $10K as result of exponential adoption increases.  https://t.co/NLZcAP94kQ,en,[],['https://cointelegraph.com/news/bitcoin-price-hits-10000'],[],25,340,519,['bitcoin'],[],https://twitter.com/Cointelegraph/status/935468001876471808,False,,0,,,,,,,,[],,,,
935465815708721152,935465815708721152,2017-11-28 06:10:05 Eastern Standard Time,2017-11-28,06:10:05,-0500,57689645,tracemayer,Trace Mayer,,Wall Street meetings all day. A palpable visceral fear of deflation (Great Credit Contraction already started). I find it invigorating. Probably how a 🦁 feels seeing a 🦓. With #Bitcoin there is nothing to fear about deflation. 1st network effect is a feature &amp; not a bug. 🚂 🐂  https://t.co/zTMZDwlfiK,en,[],[],['https://pbs.twimg.com/media/DPtwVNbU8AA6V0G.jpg'],18,209,483,['bitcoin'],[],https://twitter.com/TraceMayer/status/935465815708721152,False,,1,https://pbs.twimg.com/media/DPtwVNbU8AA6V0G.jpg,,,,,,,[],,,,
935435733791379456,935435733791379456,2017-11-28 04:10:33 Eastern Standard Time,2017-11-28,04:10:33,-0500,804699627404619776,mediumsqueeze,Bitcoin 1984 🌃,,Front page of the Financial Times #bitcoin  https://t.co/6GHg694kHq,en,[],[],['https://pbs.twimg.com/media/DPtVTC8WAAAMCXa.jpg'],32,578,1049,['bitcoin'],[],https://twitter.com/MediumSqueeze/status/935435733791379456,False,,1,https://pbs.twimg.com/media/DPtVTC8WAAAMCXa.jpg,,,,,,,[],,,,
935400885244518400,935314793803628544,2017-11-28 01:52:04 Eastern Standard Time,2017-11-28,01:52:04,-0500,14338147,satoshilite,Charlie Lee,,"@elonmusk @ThisIsSandeepG Elon, consider accepting Bitcoin for your cars. It's very easy to sign up for a @coinbase merchant account and integrate it. And there's 0 risk. Good PR too.  Future of cars bought with the future of money. Think about that!",en,"[{'screen_name': 'coinbase', 'name': 'coinbase', 'id': '574032254'}]",[],[],145,555,2629,[],[],https://twitter.com/SatoshiLite/status/935400885244518400,False,,0,,,,,,,,"[{'screen_name': 'elonmusk', 'name': 'Elon Musk', 'id': '44196397'}, {'screen_name': 'ThisIsSandeepG', 'name': 'Ѕαи∂єєρ Gυттιкσи∂α', 'id': '2737103354'}]",,,,
935395687612678144,935395687612678144,2017-11-28 01:31:25 Eastern Standard Time,2017-11-28,01:31:25,-0500,51053243,nanutria,Víctor Medina,,Avísenme cuando el Bitcoin sirva para comprar ron.,es,[],[],[],17,140,259,[],[],https://twitter.com/nanutria/status/935395687612678144,False,,0,,,,,,,,[],,,,
935377468764114949,935377468764114949,2017-11-28 00:19:01 Eastern Standard Time,2017-11-28,00:19:01,-0500,18469669,saifedean,Saifedean.com,,"The rise in Bitcoin's value is not a bubble, but a natural feature of its design &amp; economic incentives.  Bitcoin's supply is strictly scarce; there'll never be more than 21 million. Adoption must lead to a rise in value. In turn, rising value leads to more adoption.",en,[],[],[],30,226,500,[],[],https://twitter.com/saifedean/status/935377468764114949,False,,0,,,,,,,,[],,,,
935375453677932544,935375453677932544,2017-11-28 00:11:01 Eastern Standard Time,2017-11-28,00:11:01,-0500,705277074983002112,nebeusworld,Nebeus,,"Buy and sell cryptocurrencies at the best prices. We have increased purchasing limits to 50K EUR per week.  Pre-sale ending in 2 days, get your tokens at a special price!  Learn more at  https://t.co/HBzz2LMWVK    #ICO #Nebeus #bitcoin #cryptocurrency #NebeusICO #trade  https://t.co/uRnTZMiX7M",en,[],['http://token.nebeus.com'],['https://pbs.twimg.com/media/DPsfAzZXkAEjsPp.jpg'],0,328,306,"['ico', 'nebeus', 'bitcoin', 'cryptocurrency', 'nebeusico', 'trade']",[],https://twitter.com/NebeusWorld/status/935375453677932544,False,,1,https://pbs.twimg.com/media/DPsfAzZXkAEjsPp.jpg,,,,,,,[],,,,
935311222534111232,935311222534111232,2017-11-27 19:55:47 Eastern Standard Time,2017-11-27,19:55:47,-0500,347640382,sadieisonfire,1994 Subaru Outback,,cyber monday is the only day of the year that it’s legal to fuck a bitcoin,en,[],[],[],7,229,1261,[],[],https://twitter.com/Sadieisonfire/status/935311222534111232,False,,0,,,,,,,,[],,,,
935305263292338177,935305263292338177,2017-11-27 19:32:06 Eastern Standard Time,2017-11-27,19:32:06,-0500,807095,nytimes,The New York Times,,"Bitcoin hits $10,000 on some exchanges — defying skeptics and encouraging believers who see it as a new asset class  https://t.co/t9Q0p1mUg3",en,[],['http://nyti.ms/2zJTvMu'],[],32,158,219,[],[],https://twitter.com/nytimes/status/935305263292338177,False,,0,,,,,,,,[],,,,
935303991008944129,935303991008944129,2017-11-27 19:27:03 Eastern Standard Time,2017-11-27,19:27:03,-0500,16912124,ericgarland,Eric Garland,,"The panic tweets of agents, assets, and sillypants are my hors d'oeuvres in the twilight.  Rage, rage, at the dying of the Bitcoin-fueled #provokatsiya 😎",en,[],[],[],30,193,826,['provokatsiya'],[],https://twitter.com/ericgarland/status/935303991008944129,False,,0,,,,,,,,[],,,,
935296330880122881,935296330880122881,2017-11-27 18:56:36 Eastern Standard Time,2017-11-27,18:56:36,-0500,961445378,officialmcafee,John McAfee,,"It amazes me that human beings can deceive themselves. Bitcoin has been doubling every month for the past three months, yet an analyst suggests that it might grow, in the next 8 months, by 12%. They opened the door to the new world, but  brought the rules from the old world.",en,[],[],[],107,458,1774,[],[],https://twitter.com/officialmcafee/status/935296330880122881,False,,0,,,,,,,,[],,,,
935285735250452481,935285735250452481,2017-11-27 18:14:30 Eastern Standard Time,2017-11-27,18:14:30,-0500,20402945,cnbc,CNBC,,"Bitcoin could 'easily' reach $40,000 by the end of 2018, hedge fund legend Novogratz says  https://t.co/D49YEVV2C9",en,[],['http://cnb.cx/2ibB4bQ'],[],36,256,357,[],[],https://twitter.com/CNBC/status/935285735250452481,False,,0,,,,,,,,[],,,,
935282957950087168,935282957950087168,2017-11-27 18:03:28 Eastern Standard Time,2017-11-27,18:03:28,-0500,16732770,cnbcfastmoney,CNBC's Fast Money,,The man who called #bitcoin $10K back in October now sees this @novogratz  https://t.co/ZeO1ztoRUx,en,"[{'screen_name': 'novogratz', 'name': 'mike novogratz', 'id': '19847181'}]",[],[],41,341,567,['bitcoin'],[],https://twitter.com/CNBCFastMoney/status/935282957950087168,False,,1,https://pbs.twimg.com/amplify_video_thumb/935281442161954817/img/XrFOHGC4gzKaGNQJ.jpg,,,,,,,[],,,,
935278372283920384,935278372283920384,2017-11-27 17:45:15 Eastern Standard Time,2017-11-27,17:45:15,-0500,13049362,complex,Complex,,Bitcoin is somehow more valuable than McDonald's or Disney  https://t.co/QOLJuq1zzK  https://t.co/sEhCeFi6RZ,en,[],['https://trib.al/O1exCuQ'],['https://pbs.twimg.com/tweet_video_thumb/DPrGsRKXUAAhlzc.jpg'],13,114,457,[],[],https://twitter.com/Complex/status/935278372283920384,False,,1,https://pbs.twimg.com/tweet_video_thumb/DPrGsRKXUAAhlzc.jpg,,,,,,,[],,,,
935276242621947911,935276242621947911,2017-11-27 17:36:47 Eastern Standard Time,2017-11-27,17:36:47,-0500,16732770,cnbcfastmoney,CNBC's Fast Money,,.@novogratz: #Bitcoin could be at $40K by the end of 2018,en,"[{'screen_name': 'novogratz', 'name': 'mike novogratz', 'id': '19847181'}]",[],[],40,196,423,['bitcoin'],[],https://twitter.com/CNBCFastMoney/status/935276242621947911,False,,0,,,,,,,,[],,,,
935265662905266176,935265662905266176,2017-11-27 16:54:45 Eastern Standard Time,2017-11-27,16:54:45,-0500,233318165,kyletorpey,Kyle Torpey,,Tesla owner using the free power from a charging station to mine bitcoin  https://t.co/fO0F4hhtFA,en,[],['https://ecomotoringnews.com/2017/11/24/bitcoin-mining-in-electric-vehicles-raises-other-questions/'],[],51,471,884,[],[],https://twitter.com/kyletorpey/status/935265662905266176,False,,0,,,,,,,,[],,,,
935258999817060352,935258999817060352,2017-11-27 16:28:16 Eastern Standard Time,2017-11-27,16:28:16,-0500,352515718,visualcap,Visual Capitalist,,"[Infographic] The Journey to $10,000 #Bitcoin in a Timeline:  https://t.co/lioCfFff8B  https://t.co/XLmrL1vMLG",en,[],['http://www.visualcapitalist.com/visualizing-journey-10000-bitcoin/'],['https://pbs.twimg.com/media/DPq1FAgVwAAN3ym.jpg'],18,302,362,['bitcoin'],[],https://twitter.com/VisualCap/status/935258999817060352,False,,1,https://pbs.twimg.com/media/DPq1FAgVwAAN3ym.jpg,,,,,,,[],,,,
935256828593573889,935246706160967680,2017-11-27 16:19:38 Eastern Standard Time,2017-11-27,16:19:38,-0500,14338147,satoshilite,Charlie Lee,,"Roger keeps calling Bitcoin, Bitcoin Core and Bitcoin SegWit, and yet flips out when John kept saying Bcash.  I don't get upset when people call Litecoin, shitcoin or testnet or copy-paste-coin. If enough people use a different name to refer to Litecoin, then that's its name.",en,[],[],[],147,185,1518,[],[],https://twitter.com/SatoshiLite/status/935256828593573889,False,,0,,,,,,,,[],,,,
935254129101991937,935254129101991937,2017-11-27 16:08:55 Eastern Standard Time,2017-11-27,16:08:55,-0500,548531623,datavetaren,Datavetaren,,"Why is gold valuable? • It’s durable • It’s portable • It’s divisible (weight, length of wire) • It’s fungible • Limited supply So, why is #bitcoin valuable? 🤔 All of above AND: • Transferable over the Internet • Programmable • Easy to verify",en,[],[],[],34,258,597,['bitcoin'],[],https://twitter.com/Datavetaren/status/935254129101991937,False,,0,,,,,,,,[],,,,
935231166835298304,935231166835298304,2017-11-27 14:37:40 Eastern Standard Time,2017-11-27,14:37:40,-0500,903617387643199488,stktoken,STK token,,Great overview of STK on #tokensaletoday. #cryptocurrency #blockchain #ethereum #bitcoin #btc #bitcoins #ICO #token #crowdsale #tokensale  https://t.co/XZU70lfXmO,en,[],['http://tokensaletoday.com/2017/11/12/stk-wants-to-make-it-easy-to-pay-with-cryptocurrencies/'],[],1,370,301,"['tokensaletoday', 'cryptocurrency', 'blockchain', 'ethereum', 'bitcoin', 'btc', 'bitcoins', 'ico', 'token', 'crowdsale', 'tokensale']",[],https://twitter.com/STKtoken/status/935231166835298304,False,,0,,,,,,,,[],,,,
935230558480879616,935230558480879616,2017-11-27 14:35:15 Eastern Standard Time,2017-11-27,14:35:15,-0500,1537459717,mistressblunt,Mistress Blunt - NYC Femdom Dominatrix,,"If you’re looking to put a smile on a special lady’s face this holiday season here are some simple gift ideas to help spread holiday cheer:   -max out her Roth IRA -a bitcoin -pay her rent -if she has debt, pay it -$5000 for redecorating -pay for her vacation (without you)",en,[],[],[],29,433,990,[],[],https://twitter.com/MistressBlunt/status/935230558480879616,False,,0,,,,,,,,[],,,,
935224177572884481,935224177572884481,2017-11-27 14:09:54 Eastern Standard Time,2017-11-27,14:09:54,-0500,20402945,cnbc,CNBC,,Bitcoin exchange Coinbase has more users than stock brokerage Schwab  https://t.co/SkxufPGfS7,en,[],['http://cnb.cx/2hVZv9H'],[],18,151,274,[],[],https://twitter.com/CNBC/status/935224177572884481,False,,0,,,,,,,,[],,,,
935216776396378112,935216776396378112,2017-11-27 13:40:29 Eastern Standard Time,2017-11-27,13:40:29,-0500,23618940,lopp,Jameson Lopp,,Don't underestimate the power of exponential trends. Bitcoin could crash 50% right now and it would be a 2 month setback.  https://t.co/aRyZlhM32Y,en,[],[],['https://pbs.twimg.com/media/DPqOmoHU8AAAMyo.jpg'],46,327,731,[],[],https://twitter.com/lopp/status/935216776396378112,False,,1,https://pbs.twimg.com/media/DPqOmoHU8AAAMyo.jpg,,,,,,,[],,,,
935216521953136641,935216521953136641,2017-11-27 13:39:28 Eastern Standard Time,2017-11-27,13:39:28,-0500,903617387643199488,stktoken,STK token,,Two weeks left in our presale! Instant cryptocurrency payments ... anywhere.  https://t.co/LAcjQJnH5O #cryptocurrency #blockchain #ethereum #bitcoin #bitcoins #ICO #token  https://t.co/KqbsWKST00,en,[],['http://www.stktoken.com'],[],3,307,284,"['cryptocurrency', 'blockchain', 'ethereum', 'bitcoin', 'bitcoins', 'ico', 'token']",[],https://twitter.com/STKtoken/status/935216521953136641,False,,1,https://pbs.twimg.com/ext_tw_video_thumb/935215570580004864/pu/img/lRZE2TwUXjblCRHw.jpg,,,,,,,[],,,,
