id,conversation_id,created_at,date,time,timezone,user_id,username,name,place,tweet,language,mentions,urls,photos,replies_count,retweets_count,likes_count,hashtags,cashtags,link,retweet,quote_url,video,thumbnail,near,geo,source,user_rt_id,user_rt,retweet_id,reply_to,retweet_date,translate,trans_src,trans_dest
932221016826265600,932221016826265600,2017-11-19 07:16:24 Eastern Standard Time,2017-11-19,07:16:24,-0500,72515407,bitfurygeorge,George Kikvadze ⛏⚡,,"""I Love Blockchain, Just Not Bitcoin""  ""I Love Internet, Just Not TCP/IP""",en,[],[],[],52,237,682,[],[],https://twitter.com/BitfuryGeorge/status/932221016826265600,False,,0,,,,,,,,[],,,,
932103357837144065,932103357837144065,2017-11-18 23:28:52 Eastern Standard Time,2017-11-18,23:28:52,-0500,3307881361,tihobrkan,Tiho Brkan,,"Bitcoin is rising faster than any asset class we have seen over the last 400 years. $BTC  The sharp bull markets including Tech Bubble of the last 90s, US stocks of 1920s, Oil in early 2000s and even the famous South Sea Bubble... do not even come close to the rise in Bitcoin.  https://t.co/s0foHDXmtG",en,[],[],['https://pbs.twimg.com/media/DO9-kpTUMAE6jdW.jpg'],53,345,448,[],['btc'],https://twitter.com/TihoBrkan/status/932103357837144065,False,,1,https://pbs.twimg.com/media/DO9-kpTUMAE6jdW.jpg,,,,,,,[],,,,
932013933342359553,932013933342359553,2017-11-18 17:33:32 Eastern Standard Time,2017-11-18,17:33:32,-0500,203652149,sjosephburns,Steve Burns,,Amazon has almost no stores 🏪 Uber owns almost no cars 🚗 Facebook creates no content ✏️ Alibaba has no inventory 📚 AirBnB owns no real estate🏡 Netflix is not a television channel📺  Tinder requires no marriage💑 Central Banks have no gold💸 Bitcoin has no physical coins💰,en,[],[],[],86,1470,2943,[],[],https://twitter.com/SJosephBurns/status/932013933342359553,False,,0,,,,,,,,[],,,,
932006130653585408,932006130653585408,2017-11-18 17:02:32 Eastern Standard Time,2017-11-18,17:02:32,-0500,1333467482,coindesk,CoinDesk,,"First Long Term LedgerX Bitcoin Option Pegs Price at $10,000 in One Year  https://t.co/MLR4ldSVuK  https://t.co/N2pc7XmALv",en,[],['http://bit.ly/2zfwZea'],['https://pbs.twimg.com/media/DO8mop4WkAcJM6q.jpg'],25,173,254,[],[],https://twitter.com/CoinDesk/status/932006130653585408,False,,1,https://pbs.twimg.com/media/DO8mop4WkAcJM6q.jpg,,,,,,,[],,,,
931983337731657729,931983337731657729,2017-11-18 15:31:57 Eastern Standard Time,2017-11-18,15:31:57,-0500,2187082280,bit_novosti,BitNovosti.com⚡️,,"Like a clockwork. Bitcoin mempool fills with spam -&gt; BCH pumps. Bcash pump is finished -&gt; Bitcoin mempool clears. We are supposed to think it's all just a coincidence, right?  https://t.co/YpY7NvhFbb",en,[],[],['https://pbs.twimg.com/media/DO8RWaOUEAUUcVb.jpg'],31,211,509,[],[],https://twitter.com/bit_novosti/status/931983337731657729,False,,1,https://pbs.twimg.com/media/DO8RWaOUEAUUcVb.jpg,,,,,,,[],,,,
931960744698089472,931960744698089472,2017-11-18 14:02:11 Eastern Standard Time,2017-11-18,14:02:11,-0500,880470278408724481,utrust,Utrust,,UTRUST ICO - Only 9% of tokens left 🔥🔥🔥! Join the revolution now!  https://t.co/LSsu9SXJMH #CRYPTOREVOLUTION #ICO #UTRUST #crypto #cryptocurrencies #fintech #blockchain #bitcoin #ethereum $UTK  https://t.co/ppjcqNCOPU,en,[],['https://utrust.io/'],['https://pbs.twimg.com/media/DO78-hkW0AAvOrD.jpg'],7,477,427,"['cryptorevolution', 'ico', 'utrust', 'crypto', 'cryptocurrencies', 'fintech', 'blockchain', 'bitcoin', 'ethereum']",['utk'],https://twitter.com/UTRUST/status/931960744698089472,False,,1,https://pbs.twimg.com/media/DO78-hkW0AAvOrD.jpg,,,,,,,[],,,,
931900951115587584,931900951115587584,2017-11-18 10:04:35 Eastern Standard Time,2017-11-18,10:04:35,-0500,2207129125,cointelegraph,Cointelegraph,,"Major ATM Manufacturer Integrates #Bitcoin, Exposure to Millions of Users  https://t.co/lbGDFFlxbH",en,[],['https://cointelegraph.com/news/major-atm-manufacturer-integrates-bitcoin-exposure-to-millions-of-users'],[],6,168,264,['bitcoin'],[],https://twitter.com/Cointelegraph/status/931900951115587584,False,,0,,,,,,,,[],,,,
931896039698812929,931896039698812929,2017-11-18 09:45:04 Eastern Standard Time,2017-11-18,09:45:04,-0500,3179873194,cryptohustle,฿TF%$Brrrrrr!,,"There's a reason why #Bitcoin has checks and balances. Give miners unchecked power and they'll push for code that makes them more money. #BCASH currently has 122,600 more coins than $BTC due to mining hyperinflation.  https://t.co/zkct7Xgiza",en,[],[],['https://pbs.twimg.com/media/DO7CUgJXcAUpuOO.jpg'],27,152,431,"['bitcoin', 'bcash']",['btc'],https://twitter.com/CryptoHustle/status/931896039698812929,False,,1,https://pbs.twimg.com/media/DO7CUgJXcAUpuOO.jpg,,,,,,,[],,,,
931858123400282112,931858123400282112,2017-11-18 07:14:24 Eastern Standard Time,2017-11-18,07:14:24,-0500,23618940,lopp,Jameson Lopp,,Bitcoin Core == anyone who contributes. Those fixated on complaining about Core tend to be non-contributors or contributors who can't handle rejection. Complainers are welcome to contribute or compete; thus far the competition leaves much to be desired.,en,[],[],[],27,182,764,[],[],https://twitter.com/lopp/status/931858123400282112,False,,0,,,,,,,,[],,,,
931747393124659200,931747393124659200,2017-11-17 23:54:24 Eastern Standard Time,2017-11-17,23:54:24,-0500,2374745089,redactedtonight,redacted tonight,,JPMorgan Busted Laundering Money After Calling Bitcoin a Money Laundering Tool  https://t.co/yN3lkTLovc,en,[],['http://theantimedia.org/jpmorgan-money-laundering-bitcoin/'],[],18,197,190,[],[],https://twitter.com/RedactedTonight/status/931747393124659200,False,,0,,,,,,,,[],,,,
931735907589226497,931735907589226497,2017-11-17 23:08:45 Eastern Standard Time,2017-11-17,23:08:45,-0500,66106683,simondixontwitt,Simon Dixon (Beware Impersonators),,Every fund manager in the world will have to have #Bitcoin in their portfolio over the coming years whether they believe in it or not as it’s an uncorrelated asset. The questions is who will buy it cheapest before all the others?  https://t.co/H72x2ZO14x,en,[],[],['https://pbs.twimg.com/media/DO4w3PSVAAEL4Ly.jpg'],24,180,386,['bitcoin'],[],https://twitter.com/SimonDixonTwitt/status/931735907589226497,False,,1,https://pbs.twimg.com/media/DO4w3PSVAAEL4Ly.jpg,,,,,,,[],,,,
931728074705686528,931728074705686528,2017-11-17 22:37:38 Eastern Standard Time,2017-11-17,22:37:38,-0500,816255358066946050,jfnewbery,John Newbery,,"This is so important. Bitcoin Core is a process. We're lucky to have brilliant people involved in the process, but those people are all eventually replaceable. The important thing is the culture of openness and fierce technical review and test.  https://t.co/er9h1vpRiT",en,[],['https://twitter.com/suhasdaftuar/status/931706750226583552'],[],11,134,426,[],[],https://twitter.com/jfnewbery/status/931728074705686528,False,https://twitter.com/suhasdaftuar/status/931706750226583552,0,,,,,,,,[],,,,
931635567061848069,931635567061848069,2017-11-17 16:30:02 Eastern Standard Time,2017-11-17,16:30:02,-0500,768122323,mekhoko,Matt Khoury,,"""I like blockchain but not bitcoin"" (or variation)  Google Translate:  I like to sound smart, open minded, and ""with it"" while also playing it safe, without taking the time to really understand either of those things very well at all.",en,[],[],[],18,168,524,[],[],https://twitter.com/MEKhoko/status/931635567061848069,False,,0,,,,,,,,[],,,,
931601871231385602,931601871231385602,2017-11-17 14:16:09 Eastern Standard Time,2017-11-17,14:16:09,-0500,39879120,saraeisen,Sara Eisen,,Bitcoin price up 95% or so since Jaime Dimon called it a fraud,en,[],[],[],140,537,1771,[],[],https://twitter.com/SaraEisen/status/931601871231385602,False,,0,,,,,,,,[],,,,
931583859283693569,931583859283693569,2017-11-17 13:04:34 Eastern Standard Time,2017-11-17,13:04:34,-0500,467535591,ercwl,Eric Wall,,"""This week in Bitcoin"" summary: SegWit2x was buggy and did not happen, Bitcoin Cash got rid of their EDA and stopped draining hashpower, Bitcoin mempool cleared up and 25¢ SegWit-transactions were processed. And the price hit $8,000.  https://t.co/D3uX4WvQYy",en,[],[],['https://pbs.twimg.com/media/DO2k5-RXUAIKAlh.jpg'],17,230,449,[],[],https://twitter.com/ercwl/status/931583859283693569,False,,1,https://pbs.twimg.com/media/DO2k5-RXUAIKAlh.jpg,,,,,,,[],,,,
931578966875525120,931578966875525120,2017-11-17 12:45:08 Eastern Standard Time,2017-11-17,12:45:08,-0500,19847181,novogratz,Mike Novogratz,,"Crypto market cap will go to 1 trillion by end of 2018.  Bitcoin to hit $20,000 by December 2018 – investor  https://t.co/17Xh4fCozD via @Reuters",en,"[{'screen_name': 'reuters', 'name': 'reuters', 'id': '1652541'}]",['https://reut.rs/2jsTOUv'],[],79,487,916,[],[],https://twitter.com/novogratz/status/931578966875525120,False,,0,,,,,,,,[],,,,
931577788749946882,931577788749946882,2017-11-17 12:40:27 Eastern Standard Time,2017-11-17,12:40:27,-0500,900521261842825216,andy_hoffman_cg,Andy Hoffman,,"In 30 years in the financial markets, Bitcoin is the most uncorrelated asset class I have ever come across.  The reason being, it is a BRAND NEW asset class, enroute to becoming as large as stocks, bonds, and ALL legacy asset classes.",en,[],[],[],17,207,508,[],[],https://twitter.com/Andy_Hoffman_CG/status/931577788749946882,False,,0,,,,,,,,[],,,,
931568181566517248,931568181566517248,2017-11-17 12:02:16 Eastern Standard Time,2017-11-17,12:02:16,-0500,14338147,satoshilite,Charlie Lee,,Thank God people came to their senses and abandoned SegWit2x last week.  Cheers to all the Bitcoin developers for keeping the network safe and secure throughout the years!  https://t.co/4YgPev073W,en,[],['https://twitter.com/lopp/status/931521661450547206'],[],33,271,1060,[],[],https://twitter.com/SatoshiLite/status/931568181566517248,False,https://twitter.com/lopp/status/931521661450547206,0,,,,,,,,[],,,,
931558543446114306,931558543446114306,2017-11-17 11:23:58 Eastern Standard Time,2017-11-17,11:23:58,-0500,2905249409,eosgold_io,EOSGOLD.io,,Sign up for EOS GOLD Airdrop #1:   https://t.co/pXOTw9nUSS …  #EOS #EOSGOLD #ETHEREUM #BITCOIN,en,[],['https://goo.gl/forms/MEMhQwz26gMmkq453'],[],280,1373,674,"['eos', 'eosgold', 'ethereum', 'bitcoin']",[],https://twitter.com/EOSGOLD_io/status/931558543446114306,False,,0,,,,,,,,[],,,,
931553531471032320,931553531471032320,2017-11-17 11:04:03 Eastern Standard Time,2017-11-17,11:04:03,-0500,816255358066946050,jfnewbery,John Newbery,,"I try to assume good intentions in people. Unfortunately, I can no longer do so for @jgarzik. My judgement is that he is acting to disrupt the bitcoin network to advance his own interests.",en,"[{'screen_name': 'jgarzik', 'name': 'ser jeff garzik', 'id': '94274445'}]",[],[],20,142,476,[],[],https://twitter.com/jfnewbery/status/931553531471032320,False,,0,,,,,,,,[],,,,
931541829379555328,931541829379555328,2017-11-17 10:17:33 Eastern Standard Time,2017-11-17,10:17:33,-0500,2799211554,whalepanda,WhalePanda,,"This is the kind of incompetence Bitcoin devs have to deal with. People think they know better, their input gets reviewed and rejected. They cry about censorship/toxicity. Attempt to do it by themselves, fail &amp; find a way to blame Core. Thanks Core devs for keeping my coins safe.",en,[],[],[],26,332,1476,[],[],https://twitter.com/WhalePanda/status/931541829379555328,False,,0,,,,,,,,[],,,,
931525881792729088,931525881792729088,2017-11-17 09:14:11 Eastern Standard Time,2017-11-17,09:14:11,-0500,1643500784,francispouliot_,NAKED FACE (offline),,Hey @BitPay you remember when you sent an email to millions of users urging them to download BTC1 to replace Bitcoin?  Did you send an email back to instruct them to change back to Core?   Or did nobody actually listen anyway?  Or do you just don't have a f***?,en,"[{'screen_name': 'bitpay', 'name': 'bitpay', 'id': '915465450'}]",[],[],17,131,545,[],[],https://twitter.com/francispouliot_/status/931525881792729088,False,,0,,,,,,,,[],,,,
931511594063888384,931511594063888384,2017-11-17 08:17:25 Eastern Standard Time,2017-11-17,08:17:25,-0500,705277074983002112,nebeusworld,Nebeus,,Indisputable advantages.  Without many words.   Become a part of the most transparent system now  https://t.co/ENAIEkkKvS  #ico #cryptobank #bitcoin #cryptocurrencies  https://t.co/1ZN4dMYXoM,en,[],['http://nebeus.com/ico'],['https://pbs.twimg.com/media/DO1k2FMW0AAYJ_4.jpg'],0,376,357,"['ico', 'cryptobank', 'bitcoin', 'cryptocurrencies']",[],https://twitter.com/NebeusWorld/status/931511594063888384,False,,1,https://pbs.twimg.com/media/DO1k2FMW0AAYJ_4.jpg,,,,,,,[],,,,
931508652674084865,931508652674084865,2017-11-17 08:05:44 Eastern Standard Time,2017-11-17,08:05:44,-0500,154221292,casey,Casey Neistat,,"dear @elonmusk how do i preorder one of those roadsters?  should i send you cash or bitcoin?  just LMK, i could put a check in the mail or fax you my credit card number if thats easier.  thanks.",en,"[{'screen_name': 'elonmusk', 'name': 'elon musk', 'id': '44196397'}]",[],[],197,1040,16585,[],[],https://twitter.com/Casey/status/931508652674084865,False,,0,,,,,,,,[],,,,
931493617423798272,931493617423798272,2017-11-17 07:05:59 Eastern Standard Time,2017-11-17,07:05:59,-0500,876116436820905984,kingcrypto2,KING $SHIB,,WOW For my one year anniversary as a #1 Bitcoin contributor by the @HuffPost - we are giving away 100 #litecoins randomly to whoever likes and retweets this post. Winners revealed on Sunday! GO! #bitcoin $ltc $etc,en,"[{'screen_name': 'huffpost', 'name': 'huffpost', 'id': '14511951'}]",[],[],53,553,671,"['litecoins', 'bitcoin']","['ltc', 'etc']",https://twitter.com/KingCrypto2/status/931493617423798272,False,,0,,,,,,,,[],,,,
931491157737197568,931491157737197568,2017-11-17 06:56:12 Eastern Standard Time,2017-11-17,06:56:12,-0500,19898168,cnbci,CNBC International,,"The brains behind two of the world's biggest cryptocurrencies face off on bitcoin, cash and ICOs.  https://t.co/F588yo0Tpj",en,[],[],[],46,375,716,[],[],https://twitter.com/CNBCi/status/931491157737197568,False,,1,https://pbs.twimg.com/media/DO1SDKcXkAEatrV.jpg,,,,,,,[],,,,
931477049973329920,931477049973329920,2017-11-17 06:00:09 Eastern Standard Time,2017-11-17,06:00:09,-0500,18856867,zerohedge,zerohedge,,"ICYMI: After Slamming Bitcoin As A Money Laundering Tool, JPMorgan Busted For Money Laundering  https://t.co/t1knQTHtc3",en,[],['http://www.zerohedge.com/news/2017-11-16/after-slamming-bitcoin-money-laundering-tool-jpmorgan-busted-money-laundering'],[],7,143,254,[],[],https://twitter.com/zerohedge/status/931477049973329920,False,,0,,,,,,,,[],,,,
931375366832304128,896549808818843650,2017-11-16 23:16:06 Eastern Standard Time,2017-11-16,23:16:06,-0500,2421317989,jackfru1t,Jack🏴‍☠️⚡,,#bitcoin $0      - $1000: 1789 days $1000- $2000: 1271 days $2000- $3000: 23 days $3000- $4000: 62 days $4000- $5000: 61 days $5000- $6000: 8 days $6000- $7000: 13 days $7000- $8000: 14 days,en,[],[],[],33,375,655,['bitcoin'],[],https://twitter.com/jackfru1t/status/931375366832304128,False,,0,,,,,,,,[],,,,
931370360896937984,931370360896937984,2017-11-16 22:56:12 Eastern Standard Time,2017-11-16,22:56:12,-0500,907661256332636160,jury2beonline,Jury.Online,,"Great to be gathered in one place along with major Russian and foreign experts At BLOCKCHAIN AND BITCOIN CONFERENCE in Moscow, Russia!   https://t.co/uy0Tyc7bFt",en,[],['https://jury.online/news/27'],[],0,522,344,[],[],https://twitter.com/jury2beonline/status/931370360896937984,False,,0,,,,,,,,[],,,,
931334375836454913,931334375836454913,2017-11-16 20:33:13 Eastern Standard Time,2017-11-16,20:33:13,-0500,203334350,iampinkk1,🌻,,Hackers: All we need is 5k bitcoin &amp; you can have the monitors back   Webber: Cool I’ll write a check now   Hackers: Alright so that’ll be 20 million dollars   Webber: #GreysAnatomy  https://t.co/KTX0ARwRWW,en,[],[],['https://pbs.twimg.com/tweet_video_thumb/DOzDrJuW0AED0-P.jpg'],5,227,530,['greysanatomy'],[],https://twitter.com/IAmPinkk1/status/931334375836454913,False,,1,https://pbs.twimg.com/tweet_video_thumb/DOzDrJuW0AED0-P.jpg,,,,,,,[],,,,
931320806424027137,931320806424027137,2017-11-16 19:39:18 Eastern Standard Time,2017-11-16,19:39:18,-0500,18856867,zerohedge,zerohedge,,"After Slamming Bitcoin As A Money Laundering Tool, JPMorgan Busted For Money Laundering  https://t.co/t1knQTZ43B",en,[],['http://www.zerohedge.com/news/2017-11-16/after-slamming-bitcoin-money-laundering-tool-jpmorgan-busted-money-laundering'],[],153,2113,3521,[],[],https://twitter.com/zerohedge/status/931320806424027137,False,,0,,,,,,,,[],,,,
931314489395355648,931314489395355648,2017-11-16 19:14:11 Eastern Standard Time,2017-11-16,19:14:11,-0500,5988062,theeconomist,The Economist,,People are buying Bitcoin because they expect other people to buy it from them at a higher price. This is foolish  https://t.co/HTi6GvYoEk,en,[],['http://econ.st/2hE4HCF'],[],48,306,381,[],[],https://twitter.com/TheEconomist/status/931314489395355648,False,,0,,,,,,,,[],,,,
931298020204924928,931298020204924928,2017-11-16 18:08:45 Eastern Standard Time,2017-11-16,18:08:45,-0500,361289499,bitcoinmagazine,Bitcoin Magazine,,The Lightning Network Now Supports Transactions Across Blockchains  https://t.co/PMM2g660Mu #bitcoin #blockchain #lightning,en,[],['https://bitcoinmagazine.com/articles/lightning-network-now-supports-transactions-across-blockchains/'],[],17,259,431,"['bitcoin', 'blockchain', 'lightning']",[],https://twitter.com/BitcoinMagazine/status/931298020204924928,False,,0,,,,,,,,[],,,,
931291149691736065,931291149691736065,2017-11-16 17:41:27 Eastern Standard Time,2017-11-16,17:41:27,-0500,2207129125,cointelegraph,Cointelegraph,,"#Bitcoin breaks $8,000 following massive price drop last week.  https://t.co/5A1D5B9FfA",en,[],['https://cointelegraph.com/news/bitcoin-breaks-through-8000-following-massive-head-fake'],[],16,226,323,['bitcoin'],[],https://twitter.com/Cointelegraph/status/931291149691736065,False,,0,,,,,,,,[],,,,
931288530466242560,931288530466242560,2017-11-16 17:31:02 Eastern Standard Time,2017-11-16,17:31:02,-0500,91478624,forbes,Forbes,,"Bitcoin reached an all-time high today, surpassing $7,800 for the first time  https://t.co/W4hhYSWCum  https://t.co/RGgvK6bU5A",en,[],['http://on.forbes.com/6017D8Dgl'],['https://pbs.twimg.com/media/DOyZ-3oUIAEd9bY.jpg'],15,156,213,[],[],https://twitter.com/Forbes/status/931288530466242560,False,,1,https://pbs.twimg.com/media/DOyZ-3oUIAEd9bY.jpg,,,,,,,[],,,,
931278407945551873,931278407945551873,2017-11-16 16:50:49 Eastern Standard Time,2017-11-16,16:50:49,-0500,1333467482,coindesk,CoinDesk,,"BREAKING: Bitcoin Nears $7,900 to Hit New All-Time High  https://t.co/BE0YUxzddG  https://t.co/joKyjmcUNS",en,[],['http://bit.ly/2imqyM4'],['https://pbs.twimg.com/media/DOyQxoAW4AAr9QH.jpg'],22,246,422,[],[],https://twitter.com/CoinDesk/status/931278407945551873,False,,1,https://pbs.twimg.com/media/DOyQxoAW4AAr9QH.jpg,,,,,,,[],,,,
931278384864288768,931278384864288768,2017-11-16 16:50:43 Eastern Standard Time,2017-11-16,16:50:43,-0500,14338147,satoshilite,Charlie Lee,,"I believe you guys have been waiting for this!  Now that Segwit2x is canceled and SegWit haters have their own coin to play with, it's full steam ahead with scaling Bitcoin/Litecoin with LN and other 2nd layer scaling solutions!  https://t.co/rOTC1ukprl",en,[],['https://twitter.com/lightning/status/931277111490265088'],[],139,825,2716,[],[],https://twitter.com/SatoshiLite/status/931278384864288768,False,https://twitter.com/lightning/status/931277111490265088,0,,,,,,,,[],,,,
931277111490265088,931277111490265088,2017-11-16 16:45:40 Eastern Standard Time,2017-11-16,16:45:40,-0500,730518593004134400,lightning,Lightning Labs⚡️🌋,,Today we're excited to announce the first ever Lightning cross-chain swap from Bitcoin to Litecoin!⚡️⛓️💱   Check out the code and demo here:  https://t.co/92CMslUrV4  https://t.co/hnaAUWktuN,en,[],"['https://blog.lightning.engineering/announcement/2017/11/16/ln-swap.html', 'https://www.youtube.com/watch?v=cBVcgzEuJ7Q']",[],140,1382,2939,[],[],https://twitter.com/lightning/status/931277111490265088,False,,0,,,,,,,,[],,,,
931275344232947712,931275344232947712,2017-11-16 16:38:38 Eastern Standard Time,2017-11-16,16:38:38,-0500,1854401,vinnylingham,Vinny Lingham,,"Bitcoin becoming “Digital Gold” has closed the opportunity for it to be used a global currency. We should prepare ourselves for a world where governments may issue their own crypto, possibly backed by BTC, but Bitcoin itself will likely never be practically usable as a currency.  https://t.co/4iQKMVoHIz",en,[],['https://twitter.com/vinnylingham/status/931274337352482818'],[],109,158,381,[],[],https://twitter.com/VinnyLingham/status/931275344232947712,False,https://twitter.com/vinnylingham/status/931274337352482818,0,,,,,,,,[],,,,
931234937939857409,931234937939857409,2017-11-16 13:58:05 Eastern Standard Time,2017-11-16,13:58:05,-0500,903617387643199488,stktoken,STK token,,"We're at @sgfintechfest this week. Find us &amp; say hello, we'll show you what we're all about! #sff2017 #sgfintechfest #cryptocurrency #blockchain #ethereum #bitcoin #bitcoins #ICO #token  https://t.co/l1zLyFWmXu",en,"[{'screen_name': 'sgfintechfest', 'name': 'sg fintech festival', 'id': '4750983733'}]",[],['https://pbs.twimg.com/media/DOxpJ17UEAAhQ_D.jpg'],4,413,351,"['sff2017', 'sgfintechfest', 'cryptocurrency', 'blockchain', 'ethereum', 'bitcoin', 'bitcoins', 'ico', 'token']",[],https://twitter.com/STKtoken/status/931234937939857409,False,,1,https://pbs.twimg.com/media/DOxpJ17UEAAhQ_D.jpg,,,,,,,[],,,,
931213550953132033,931213550953132033,2017-11-16 12:33:06 Eastern Standard Time,2017-11-16,12:33:06,-0500,1469101279,aantonop,Andreas,,Bitcoin Q&amp;A: My response to Jamie Dimon  https://t.co/7LCnLLtUK4,en,[],['https://youtu.be/1dEcdGc0tIo'],[],26,153,371,[],[],https://twitter.com/aantonop/status/931213550953132033,False,,0,,,,,,,,[],,,,
931187122954031104,931187122954031104,2017-11-16 10:48:05 Eastern Standard Time,2017-11-16,10:48:05,-0500,5988062,theeconomist,The Economist,,People are buying Bitcoin because they expect other people to buy it from them at a higher price. This is foolish  https://t.co/72r79wDcvx,en,[],['http://econ.st/2hwbvOX'],[],122,338,480,[],[],https://twitter.com/TheEconomist/status/931187122954031104,False,,0,,,,,,,,[],,,,
931159366450814976,931159366450814976,2017-11-16 08:57:47 Eastern Standard Time,2017-11-16,08:57:47,-0500,2207129125,cointelegraph,Cointelegraph,,"💥BREAKING: American Express adopts #Ripple in its business payments solution, the coin is up 25%:  https://t.co/zM5JoMPkHb  https://t.co/zT0NTXPnjD #cryptocurrencies #Bitcoin  https://t.co/S2rAehwsXM",en,[],"['https://www.reuters.com/article/us-blockchain-amex-ripple/amex-launches-blockchain-based-business-payments-using-ripple-idUSKBN1DG1SX', 'https://coinmarketcap.com/currencies/ripple/#charts']",['https://pbs.twimg.com/media/DOwkf_UWsAATN1q.jpg'],14,188,303,"['ripple', 'cryptocurrencies', 'bitcoin']",[],https://twitter.com/Cointelegraph/status/931159366450814976,False,,1,https://pbs.twimg.com/media/DOwkf_UWsAATN1q.jpg,,,,,,,[],,,,
931114823290707969,931114823290707969,2017-11-16 06:00:47 Eastern Standard Time,2017-11-16,06:00:47,-0500,2520888308,cryptobull,Crypto฿ull,,"No matter how bad your day is remember that only a few days ago some dude panic sold his bitcoin at $5,500 and bought bcash at $2,800. 😂",en,[],[],[],146,1073,3660,[],[],https://twitter.com/CryptoBull/status/931114823290707969,False,,0,,,,,,,,[],,,,
931078738724425730,931078738724425730,2017-11-16 03:37:24 Eastern Standard Time,2017-11-16,03:37:24,-0500,888369106419953664,hatchworksvc,Team Hatchworks,,"SVK Crypto ### OUR NEXT BITCOIN AND CRYPTO CURRENCY EVENT IN LONDON ### Thursday 16th Nov at wework Moorgate, London, UK. Spectre.ai there!  https://t.co/QhAsKV6Sql",en,[],['https://www.eventbrite.co.uk/e/when-bitcoin-rules-the-world-tickets-39076359443?aff=eac2'],[],5,838,671,[],[],https://twitter.com/HatchworksVC/status/931078738724425730,False,,0,,,,,,,,[],,,,
931055769268523008,931055769268523008,2017-11-16 02:06:08 Eastern Standard Time,2017-11-16,02:06:08,-0500,3323903998,worldcoresocial,Worldcore,,New London cryptocurrency exchange starts operating with a bitcoin debit card  https://t.co/QkAisu7yIP #Blockchaintechs #Cryptocurrency #blog  https://t.co/dGwHk7KOD7,en,[],['http://bit.ly/2hDdl42'],['https://pbs.twimg.com/media/DOvGSScUEAEs3Jm.jpg'],2,427,362,"['blockchaintechs', 'cryptocurrency', 'blog']",[],https://twitter.com/worldcoresocial/status/931055769268523008,False,,1,https://pbs.twimg.com/media/DOvGSScUEAEs3Jm.jpg,,,,,,,[],,,,
931002599112880133,931002599112880133,2017-11-15 22:34:51 Eastern Standard Time,2017-11-15,22:34:51,-0500,820252180796100608,bitcoinissaving,Bitcoin is Saving,,Thank you @SatoshiLite for not calling Litecoin “Bitcoin Lite” and not insisting “Bitcoin Lite is Bitcoin”. You don’t get enough credit for that.,en,"[{'screen_name': 'satoshilite', 'name': 'charlie lee', 'id': '14338147'}]",[],[],53,289,1847,[],[],https://twitter.com/BitcoinIsSaving/status/931002599112880133,False,,0,,,,,,,,[],,,,
930987755462713344,930987755462713344,2017-11-15 21:35:52 Eastern Standard Time,2017-11-15,21:35:52,-0500,22682896,charlieshrem,Charlie Shrem,,"Because you are positioning yourself to control the ASIC market, which you told me yourself directly. #Bitcoin was originally mined on CPU/GPU. Many of us in 2011 used to do it, but you wouldnt know that because you showed up like 2 years ago.  https://t.co/s2BhR76HeP",en,[],['https://twitter.com/ProfFaustus/status/930846822624612357'],[],39,153,624,['bitcoin'],[],https://twitter.com/CharlieShrem/status/930987755462713344,False,0,0,,,,,,,,[],,,,
