id,conversation_id,created_at,date,time,timezone,user_id,username,name,place,tweet,language,mentions,urls,photos,replies_count,retweets_count,likes_count,hashtags,cashtags,link,retweet,quote_url,video,thumbnail,near,geo,source,user_rt_id,user_rt,retweet_id,reply_to,retweet_date,translate,trans_src,trans_dest
929153776262320128,929153776262320128,2017-11-10 20:08:17 Eastern Standard Time,2017-11-10,20:08:17,-0500,41118154,kamiya344,ろ。まのふ,,「自我を持ったAIが一つの軍団を作って人類に牙を向く」という展開で，AIが軍団を作る際の一番最初の軍資金の供給元が気になってたんだけど，最近はBitcoinみたいに計算力が直接現金化できる場所が出てきたから問題なさそう,ja,[],[],[],1,330,379,[],[],https://twitter.com/kamiya344/status/929153776262320128,False,,0,,,,,,,,[],,,,
929042931826200576,929042931826200576,2017-11-10 12:47:50 Eastern Standard Time,2017-11-10,12:47:50,-0500,5988062,theeconomist,The Economist,,People are buying Bitcoin because they expect other people to buy it from them at a higher price. This is foolish  https://t.co/RBdG9Ib4lJ,en,[],['http://econ.st/2jevPs5'],[],31,239,301,[],[],https://twitter.com/TheEconomist/status/929042931826200576,False,,0,,,,,,,,[],,,,
929001762928803843,929001762928803843,2017-11-10 10:04:14 Eastern Standard Time,2017-11-10,10:04:14,-0500,906781700914536448,sisa_fund,SISA,,We are excited and happy to announce SISA tokens are going to be available for trading in the exchange @HitBtc starting Nov 13th 2017 #SISA #SISAfund #blockchain #ethereum #bitcoin #exchange #Trade  https://t.co/ThdCDLpZn7,en,"[{'screen_name': 'hitbtc', 'name': 'hitbtc', 'id': '1364642054'}]",[],['https://pbs.twimg.com/media/DOR5s-8UQAAD_ZC.jpg'],12,529,429,"['sisa', 'sisafund', 'blockchain', 'ethereum', 'bitcoin', 'exchange', 'trade']",[],https://twitter.com/Sisa_fund/status/929001762928803843,False,,1,https://pbs.twimg.com/media/DOR5s-8UQAAD_ZC.jpg,,,,,,,[],,,,
928969135966400512,928969135966400512,2017-11-10 07:54:36 Eastern Standard Time,2017-11-10,07:54:36,-0500,3473608753,bokujyuumai,墨汁うまい(Bokujyuumai),,超速報：bitFlyerスプレッド5%を記録し5万円下落。約5000BTC約40億円分のポジションのロスカット。ロールバック不可避か？　#ビットコイン #Bitcoin #仮想通貨 #ブロックチェーン #フィンテック $BTC #bitFlyer #ビットフライヤー  https://t.co/DO0hFUji9m,ja,[],[],['https://pbs.twimg.com/media/DORby8SVoAA72QL.jpg'],5,142,167,"['ビットコイン', 'bitcoin', '仮想通貨', 'ブロックチェーン', 'フィンテック', 'bitflyer', 'ビットフライヤー']",['btc'],https://twitter.com/bokujyuumai/status/928969135966400512,False,,1,https://pbs.twimg.com/media/DORby8SVoAA72QL.jpg,,,,,,,[],,,,
928965054912905216,928965054912905216,2017-11-10 07:38:23 Eastern Standard Time,2017-11-10,07:38:23,-0500,906781700914536448,sisa_fund,SISA,,#SISAfund #sisa #bitcoin #ethereum #Blockchain  https://t.co/99TJ1efGkG,und,[],[],['https://pbs.twimg.com/media/DORYpq2VQAArXlI.jpg'],1,502,397,"['sisafund', 'sisa', 'bitcoin', 'ethereum', 'blockchain']",[],https://twitter.com/Sisa_fund/status/928965054912905216,False,,1,https://pbs.twimg.com/media/DORYpq2VQAArXlI.jpg,,,,,,,[],,,,
928944787121758210,928944787121758210,2017-11-10 06:17:50 Eastern Standard Time,2017-11-10,06:17:50,-0500,2947115859,faatehim,faateh mohammad,,"👋 Hi! My name is Faateh Mohammad and I am currently a 9th grader. I just launched Explain Me Please. It attempts to explain complex topics such as Bitcoin, etc. to a readers taste, rather than a writer's level.  Check It Out On @ProductHunt!  https://t.co/wRtG2ZKurt  https://t.co/yv0S6Ypx6w",en,"[{'screen_name': 'producthunt', 'name': 'product hunt 😸', 'id': '2208027565'}]",['https://www.producthunt.com/posts/explain-me-please'],['https://pbs.twimg.com/media/DORGQenU8AEjfeI.jpg'],16,127,439,[],[],https://twitter.com/faatehim/status/928944787121758210,False,,1,https://pbs.twimg.com/media/DORGQenU8AEjfeI.jpg,,,,,,,[],,,,
928828551314501632,928828551314501632,2017-11-09 22:35:58 Eastern Standard Time,2017-11-09,22:35:58,-0500,203652149,sjosephburns,Steve Burns,,$AMZN has almost no stores 🏪 $Uber owns almost no cars 🚗 $FB creates no content ✏️ $BABA has no inventory 📚 $AirBnB owns no real estate 🏡 Bitcoin has no physical coins 💰,en,[],[],[],59,763,1369,[],"['amzn', 'uber', 'fb', 'baba', 'airbnb']",https://twitter.com/SJosephBurns/status/928828551314501632,False,,0,,,,,,,,[],,,,
928819869801332736,928819869801332736,2017-11-09 22:01:28 Eastern Standard Time,2017-11-09,22:01:28,-0500,2799211554,whalepanda,WhalePanda,,"BCash pump as expected. I am fine with BCash, just another altcoin with very limited dev support. My only issue with it is the attempt to confuse new people into buying it who want to buy #Bitcoin.  https://t.co/CFSk1fmUQk is guilty of this. I expect legal action at some point.",en,[],['http://Bitcoin.com'],[],77,152,602,['bitcoin'],[],https://twitter.com/WhalePanda/status/928819869801332736,False,,0,,,,,,,,[],,,,
928791388879278082,928791388879278082,2017-11-09 20:08:17 Eastern Standard Time,2017-11-09,20:08:17,-0500,5988062,theeconomist,The Economist,,People are buying Bitcoin because they expect other people to buy it from them at a higher price. This is foolish  https://t.co/th4T8HrtlE,en,[],['http://econ.st/2hfEGFV'],[],44,315,463,[],[],https://twitter.com/TheEconomist/status/928791388879278082,False,,0,,,,,,,,[],,,,
928787086290964480,928787086290964480,2017-11-09 19:51:12 Eastern Standard Time,2017-11-09,19:51:12,-0500,2728472118,r_cucalon,Ricardo Cucalón,,"No quieren Uber, No quieren Bitcoin, NO quieren a los EEUU, NO quieren avanzar en desarrollo, NO quieren TPS, qué mas no quieren?",es,[],[],[],36,142,241,[],[],https://twitter.com/R_Cucalon/status/928787086290964480,False,,0,,,,,,,,[],,,,
928752211131355136,928752211131355136,2017-11-09 17:32:37 Eastern Standard Time,2017-11-09,17:32:37,-0500,91478624,forbes,Forbes,,"The Failure of SegWit2x Shows Bitcoin is Digital Gold, Not a Better PayPal  https://t.co/Sx5D65IcQz",en,[],['http://www.forbes.com/sites/ktorpey/2017/11/09/failure-segwit2x-shows-bitcoin-digital-gold-not-paypal/?utm_source=TWITTER&utm_medium=social&utm_term=ViEWS%20Alerts#76616c657269'],[],31,175,303,[],[],https://twitter.com/Forbes/status/928752211131355136,False,,0,,,,,,,,[],,,,
928714542040961030,928714542040961030,2017-11-09 15:02:56 Eastern Standard Time,2017-11-09,15:02:56,-0500,23618940,lopp,Jameson Lopp,,Proposal for a new Bitcoin layer that addresses the scalability problem with opening &amp; closing payment channels by enabling trustless off-blockchain channel funding.  https://t.co/KQKbt6gv1D  https://t.co/DrL5I11IQc,en,[],['https://www.tik.ee.ethz.ch/file/a20a865ce40d40c8f942cf206a7cba96/Scalable_Funding_Of_Blockchain_Micropayment_Networks%20(1).pdf'],['https://pbs.twimg.com/media/DONz1XBUIAA6Lz0.jpg'],39,329,780,[],[],https://twitter.com/lopp/status/928714542040961030,False,,1,https://pbs.twimg.com/media/DONz1XBUIAA6Lz0.jpg,,,,,,,[],,,,
928709281905491968,928709281905491968,2017-11-09 14:42:02 Eastern Standard Time,2017-11-09,14:42:02,-0500,14444941,justmoon,Stefan Thomas,,Dear #Bitcoin. Don't cry for #Segwit2x - the future is already here. $XRP  https://t.co/hrLk0LgRfG,en,[],[],['https://pbs.twimg.com/media/DONmbmdVwAA1cYK.jpg'],114,458,1043,"['bitcoin', 'segwit2x']",['xrp'],https://twitter.com/justmoon/status/928709281905491968,False,,1,https://pbs.twimg.com/media/DONmbmdVwAA1cYK.jpg,,,,,,,[],,,,
928705663060074496,928681468024500224,2017-11-09 14:27:39 Eastern Standard Time,2017-11-09,14:27:39,-0500,216735143,felipehoffa,Felipe Hoffa,,@dougsillars @rick_viscomi @paulcalvano @HTTPArchive So this Brazilian government website eats all my CPU to mine cryptocurrency when I land on their homepage... ouch (thx @rick_viscomi @HTTPArchive #BigQuery #bitcoin)  https://t.co/5UDbNlzxIw,en,"[{'screen_name': 'rick_viscomi', 'name': 'rick viscomi', 'id': '89405591'}, {'screen_name': 'httparchive', 'name': 'http archive 💾', 'id': '281524304'}]",[],"['https://pbs.twimg.com/media/DONr-xBW4AYlLYC.jpg', 'https://pbs.twimg.com/media/DONsgBcXcAAQhqR.jpg']",29,436,407,"['bigquery', 'bitcoin']",[],https://twitter.com/felipehoffa/status/928705663060074496,False,,1,https://pbs.twimg.com/media/DONr-xBW4AYlLYC.jpg,,,,,,,"[{'screen_name': 'dougsillars', 'name': 'Doug Sillars', 'id': '17539957'}, {'screen_name': 'rick_viscomi', 'name': 'Rick Viscomi', 'id': '89405591'}, {'screen_name': 'paulcalvano', 'name': 'Paul Calvano', 'id': '1521995292'}, {'screen_name': 'HTTPArchive', 'name': 'HTTP Archive 💾', 'id': '281524304'}]",,,,
928693219445166086,928693219445166086,2017-11-09 13:38:12 Eastern Standard Time,2017-11-09,13:38:12,-0500,908863693248593920,bitcoingold,Bitcoin Gold [BTG],,The wait is over we are proud to announce the launch date for Bitcoin Gold  https://t.co/VCCLuEipr6  #1cpu1vote #BTG,en,[],['https://bitcoingold.org/bitcoin-gold-launch/'],[],67,204,357,"['1cpu1vote', 'btg']",[],https://twitter.com/bitcoingold/status/928693219445166086,False,,0,,,,,,,,[],,,,
928686097613381632,928686097613381632,2017-11-09 13:09:54 Eastern Standard Time,2017-11-09,13:09:54,-0500,903617387643199488,stktoken,STK token,,"We'll be at the Singapore #FinTech Festival next week! Come say hello, we'll grab a coffee using crypto, with our app!  #ConferenceCryptoCoffee @sgfintechfest #ethereum #blockchain #tokensale #bitcoin",en,"[{'screen_name': 'sgfintechfest', 'name': 'sg fintech festival', 'id': '4750983733'}]",[],[],3,567,369,"['fintech', 'conferencecryptocoffee', 'ethereum', 'blockchain', 'tokensale', 'bitcoin']",[],https://twitter.com/STKtoken/status/928686097613381632,False,,0,,,,,,,,[],,,,
928682152509804544,928682152509804544,2017-11-09 12:54:13 Eastern Standard Time,2017-11-09,12:54:13,-0500,920265358950522880,cryptodrivers,Crypto Drivers,,"As Bitcoin becomes popular, I encounter a comparison: Gold vs Bitcoin.  Which is better? Let’s analyze in the #flood $btc $gold",en,[],[],[],4,18271,964,['flood'],"['btc', 'gold']",https://twitter.com/cryptodrivers/status/928682152509804544,False,,0,,,,,,,,[],,,,
928681468024500224,928681468024500224,2017-11-09 12:51:30 Eastern Standard Time,2017-11-09,12:51:30,-0500,216735143,felipehoffa,Felipe Hoffa,,"More than 1,000 websites are mining cryptocurrency in their homepage with your browser!!  @dougsillars @rick_viscomi @paulcalvano used BigQuery to dig into @HTTPArchive's data:    https://t.co/oYZIMwDi0K  #bitcoin  https://t.co/ILkRc3NUBq",en,"[{'screen_name': 'dougsillars', 'name': 'doug sillars', 'id': '17539957'}, {'screen_name': 'rick_viscomi', 'name': 'rick viscomi', 'id': '89405591'}, {'screen_name': 'paulcalvano', 'name': 'paul calvano', 'id': '1521995292'}, {'screen_name': 'httparchive', 'name': 'http archive 💾', 'id': '281524304'}]",['https://discuss.httparchive.org/t/the-performance-impact-of-cryptocurrency-mining-on-the-web/1126/8'],['https://pbs.twimg.com/media/DONWU-OX4AEVs_M.jpg'],12,213,227,['bitcoin'],[],https://twitter.com/felipehoffa/status/928681468024500224,False,,1,https://pbs.twimg.com/media/DONWU-OX4AEVs_M.jpg,,,,,,,[],,,,
928680945703583744,928680945703583744,2017-11-09 12:49:26 Eastern Standard Time,2017-11-09,12:49:26,-0500,18856867,zerohedge,zerohedge,,"The IRS said it detected a ""reporting gap"" between the 500,000 virtual currency users Coinbase reported between 2013 and 2015 and the less than 900 bitcoin users reporting gains or losses: BBG",en,[],[],[],36,149,292,[],[],https://twitter.com/zerohedge/status/928680945703583744,False,,0,,,,,,,,[],,,,
928662469752397824,928660562224988160,2017-11-09 11:36:01 Eastern Standard Time,2017-11-09,11:36:01,-0500,14338147,satoshilite,Charlie Lee,,"3/3 @brian_armstrong @OneMorePeter @spair @ErikVoorhees @wences   We all want the same thing. But let's scale Bitcoin the right way without sacrificing what makes Bitcoin valuable, it's decentralization and censorship resistance. 🚀",en,"[{'screen_name': 'brian_armstrong', 'name': 'brian armstrong', 'id': '14379660'}, {'screen_name': 'onemorepeter', 'name': 'peter smith', 'id': '2325706010'}, {'screen_name': 'spair', 'name': 'stephen pair', 'id': '14802014'}, {'screen_name': 'erikvoorhees', 'name': 'erik voorhees', 'id': '61417559'}, {'screen_name': 'wences', 'name': 'alexandro wences', 'id': '1220122913564741638'}]",[],[],40,184,1136,[],[],https://twitter.com/SatoshiLite/status/928662469752397824,False,,0,,,,,,,,[],,,,
928660562224988160,928660562224988160,2017-11-09 11:28:26 Eastern Standard Time,2017-11-09,11:28:26,-0500,14338147,satoshilite,Charlie Lee,,"1/ The companies behind Segwit2x (Coinbase, Blockchain, Bitpay, Shapeshift, Xapo) all have business models that depend on low transaction fees. They are in the prime position (customers &amp; funding) to help Bitcoin scale by building out layer 2 infrastructure, which reduces fees.",en,[],[],[],72,452,1569,[],[],https://twitter.com/SatoshiLite/status/928660562224988160,False,,0,,,,,,,,[],,,,
928646295249502208,928646295249502208,2017-11-09 10:31:44 Eastern Standard Time,2017-11-09,10:31:44,-0500,61417559,erikvoorhees,Erik Voorhees,,"For the avoidance of doubt, Core won this battle. Congrats to them. I'm glad SegWit activated at least, and I will not advocate further scaling upgrades. Regardless of the path, I'll continue building Bitcoin into the financial platform so desperately needed by the world.",en,[],[],[],142,268,1362,[],[],https://twitter.com/ErikVoorhees/status/928646295249502208,False,,0,,,,,,,,[],,,,
928640492811808769,928640492811808769,2017-11-09 10:08:41 Eastern Standard Time,2017-11-09,10:08:41,-0500,880470278408724481,utrust,Utrust,,Join our ICO now! 🚀  #bitcoin #ethereum #blockchain $btc $eth $crypto  https://t.co/EcQSSjN3ql,en,[],[],['https://pbs.twimg.com/media/DOMxT8YWAAA0HhE.jpg'],27,696,545,"['bitcoin', 'ethereum', 'blockchain']","['btc', 'eth', 'crypto']",https://twitter.com/UTRUST/status/928640492811808769,False,,1,https://pbs.twimg.com/media/DOMxT8YWAAA0HhE.jpg,,,,,,,[],,,,
928630602080964608,928630602080964608,2017-11-09 09:29:23 Eastern Standard Time,2017-11-09,09:29:23,-0500,22682896,charlieshrem,Charlie Shrem,,"I will be among the first to admit I was wrong. When I was told #SegWit2x I thought there would be consensus in everyones best interest, but over time learnt this wasnt the case. In the long term, I hope you all can see my (and most of our) intentions were good. I &lt;3 #Bitcoin",en,[],[],[],58,149,932,"['segwit2x', 'bitcoin']",[],https://twitter.com/CharlieShrem/status/928630602080964608,False,,0,,,,,,,,[],,,,
928563684259049472,928563684259049472,2017-11-09 05:03:28 Eastern Standard Time,2017-11-09,05:03:28,-0500,14717442,xentagz,Dennis Parker,,Watch out for know scammer @rogerkver. Roger will lure #bitcoin newcomers into his bitcoin dot com trap and make them believe #bcash is bitcoin. Tell your friends and please retweet to avoid confusion in the bitcoin community.  https://t.co/WhDnWopPhq,en,"[{'screen_name': 'rogerkver', 'name': 'roger ver', 'id': '176758255'}]",[],['https://pbs.twimg.com/media/DOLpthoW4AAHUAh.jpg'],44,400,548,"['bitcoin', 'bcash']",[],https://twitter.com/Xentagz/status/928563684259049472,False,,1,https://pbs.twimg.com/media/DOLpthoW4AAHUAh.jpg,,,,,,,[],,,,
928476503062462464,928476503062462464,2017-11-08 23:17:03 Eastern Standard Time,2017-11-08,23:17:03,-0500,574032254,coinbase,Coinbase,,We are actively monitoring today’s update on Bitcoin Segwit2x and will provide an update in the coming days.,en,[],[],[],197,183,793,[],[],https://twitter.com/coinbase/status/928476503062462464,False,,0,,,,,,,,[],,,,
928433657001504768,928433657001504768,2017-11-08 20:26:47 Eastern Standard Time,2017-11-08,20:26:47,-0500,5988062,theeconomist,The Economist,,People are buying Bitcoin because they expect other people to buy it from them at a higher price. This is foolish  https://t.co/ZiEjhnJfCl,en,[],['http://econ.st/2zHrWTJ'],[],148,700,941,[],[],https://twitter.com/TheEconomist/status/928433657001504768,False,,0,,,,,,,,[],,,,
928416323813732353,928416323813732353,2017-11-08 19:17:55 Eastern Standard Time,2017-11-08,19:17:55,-0500,40742821,tuurdemeester,Tuur Demeester,,"Today was a massive win for Bitcoin as decentralized, censorship resistant digital gold. Miners &amp; corps are not in charge, savers are!",en,[],[],[],36,282,1096,[],[],https://twitter.com/TuurDemeester/status/928416323813732353,False,,0,,,,,,,,[],,,,
928399867118006272,928399867118006272,2017-11-08 18:12:31 Eastern Standard Time,2017-11-08,18:12:31,-0500,1468271552,hubert_btc,Hubert,,"So B2X signatories had: - more than 20 millions custodial wallets - hundreds of millions of VC money - 85% of miners signalling  And they failed.  This shows that in bitcoin, these numbers aren't those which matter.",en,[],[],[],19,165,457,[],[],https://twitter.com/hubert_btc/status/928399867118006272,False,,0,,,,,,,,[],,,,
928362880575115265,928362880575115265,2017-11-08 15:45:33 Eastern Standard Time,2017-11-08,15:45:33,-0500,5988062,theeconomist,The Economist,,People are buying Bitcoin because they expect other people to buy it from them at a higher price. This is foolish  https://t.co/VEcXZrKARP,en,[],['http://econ.st/2hT0xne'],[],44,335,408,[],[],https://twitter.com/TheEconomist/status/928362880575115265,False,,0,,,,,,,,[],,,,
928334366681567232,928334366681567232,2017-11-08 13:52:15 Eastern Standard Time,2017-11-08,13:52:15,-0500,710463119886262272,cburniske,Chris Burniske,,Epic battle in the #bitcoin markets right now between *traders* selling due to no “$B2X dividend” &amp; *investors* buying due to no #SegWit2x  https://t.co/0FJt0Aj01J,en,[],[],['https://pbs.twimg.com/media/DOIbLmjW0AA0IOA.jpg'],94,688,1398,"['bitcoin', 'segwit2x']",[],https://twitter.com/cburniske/status/928334366681567232,False,,1,https://pbs.twimg.com/media/DOIbLmjW0AA0IOA.jpg,,,,,,,[],,,,
928324910920765440,928324910920765440,2017-11-08 13:14:40 Eastern Standard Time,2017-11-08,13:14:40,-0500,2275810436,vertcoin,Vertcoin,,"The SegWit2x hardfork has been cancelled, a victory for Bitcoin and the greater crypto-community.",en,[],[],[],24,236,793,[],[],https://twitter.com/Vertcoin/status/928324910920765440,False,,0,,,,,,,,[],,,,
928318481744793600,928318481744793600,2017-11-08 12:49:08 Eastern Standard Time,2017-11-08,12:49:08,-0500,26377478,laurashin,Laura Shin,,"#Bitcoin Hard Fork Called Off, Averting Major Disruptions And Turbulence In #Cryptocurrency -- price hits new all-time high of almost $7,800  https://t.co/jToY0tLX6d",en,[],['https://www.forbes.com/sites/laurashin/2017/11/08/bitcoin-hard-fork-called-off-averting-major-disruptions-and-turbulence-in-cryptocurrency/#2d3ecae95303'],[],18,207,347,"['bitcoin', 'cryptocurrency']",[],https://twitter.com/laurashin/status/928318481744793600,False,,0,,,,,,,,[],,,,
928315057200607232,928315057200607232,2017-11-08 12:35:31 Eastern Standard Time,2017-11-08,12:35:31,-0500,1333467482,coindesk,CoinDesk,,2x Called Off: Bitcoin Hard Fork Suspended for Lack of Consensus   https://t.co/FURramXnKt,en,[],['https://www.coindesk.com/2x-called-off-bitcoin-hard-fork-suspended-lack-consensus/'],[],54,741,985,[],[],https://twitter.com/CoinDesk/status/928315057200607232,False,,0,,,,,,,,[],,,,
928308522370195456,928308522370195456,2017-11-08 12:09:33 Eastern Standard Time,2017-11-08,12:09:33,-0500,20902138,alistairmilne,Alistair Milne,,The 2x fork is dead Long live #bitcoin  https://t.co/03PczBlVvc,en,[],[],['https://pbs.twimg.com/media/DOIDnu8W0AYZwsu.jpg'],54,550,966,['bitcoin'],[],https://twitter.com/alistairmilne/status/928308522370195456,False,,1,https://pbs.twimg.com/media/DOIDnu8W0AYZwsu.jpg,,,,,,,[],,,,
928308237597888512,928308237597888512,2017-11-08 12:08:25 Eastern Standard Time,2017-11-08,12:08:25,-0500,22682896,charlieshrem,Charlie Shrem,,"BREAKING: ""SegWit2X Suspending plans for the upcoming 2MB upgrade."" #Bitcoin  https://t.co/9eWcFOBm2A",en,[],['https://lists.linuxfoundation.org/pipermail/bitcoin-segwit2x/2017-November/000685.html'],[],175,1529,2096,['bitcoin'],[],https://twitter.com/CharlieShrem/status/928308237597888512,False,,0,,,,,,,,[],,,,
928307936119742465,928307936119742465,2017-11-08 12:07:13 Eastern Standard Time,2017-11-08,12:07:13,-0500,2799211554,whalepanda,WhalePanda,,"The #Bitcoin community wins once again. First #UASF, now #NO2X. I am proud to be part of this. 2x throwing in the towel.  https://t.co/KDR67ZqeZ7",en,[],['https://lists.linuxfoundation.org/pipermail/bitcoin-segwit2x/2017-November/000685.html'],[],50,384,1009,"['bitcoin', 'uasf', 'no2x']",[],https://twitter.com/WhalePanda/status/928307936119742465,False,,0,,,,,,,,[],,,,
928282706747650048,928282706747650048,2017-11-08 10:26:58 Eastern Standard Time,2017-11-08,10:26:58,-0500,253293158,theonevortex,Vortex,,Some things that were supposed to kill #bitcoin &amp; created sensational headlines:   1. Mike Hearn's Rage Quit 2. Halving 3. Blockchain not bitcoin 4. Ethereum 5. China shutting down exchanges 6. Bcash Fork 7. Segwit2x Fork  And we're still here. #Antifragile #honeybadger,en,[],[],[],14,130,442,"['bitcoin', 'antifragile', 'honeybadger']",[],https://twitter.com/theonevortex/status/928282706747650048,False,,0,,,,,,,,[],,,,
928274156667523073,928274156667523073,2017-11-08 09:53:00 Eastern Standard Time,2017-11-08,09:53:00,-0500,2939007435,hayekandkeynes,The Long View 🌑,,"Bitcoin compared to other bubbles. There is only one which surpasses it: the Dutch tulip mania.   The chart is from a newsletter from my  long time friends at Convoy investments. If you'd like to subscribe, email them at ir@convoyinvestments.com  https://t.co/ZdLSFXcvLn",en,[],[],['https://pbs.twimg.com/media/DOHka7iWsAAsU4Q.jpg'],107,696,810,[],[],https://twitter.com/HayekAndKeynes/status/928274156667523073,False,,1,https://pbs.twimg.com/media/DOHka7iWsAAsU4Q.jpg,,,,,,,[],,,,
928259813091500032,928259813091500032,2017-11-08 08:56:00 Eastern Standard Time,2017-11-08,08:56:00,-0500,927870719882616832,bitcoin_2x_org,Bitcoin2X,,AIRDROP LIVE-  https://t.co/4FhLLo8riW WEBSITE -  https://t.co/IFAfAQrWMW WHITEPAPER -  https://t.co/MLLIVPSEMB TELEGRAM -  https://t.co/xaeqzOLoA7 BITCOINTALK -  https://t.co/16IGiov01o ETHERDELTA -  https://t.co/WY7BpruVpC #BTC2x #BTC #Bitcoin  https://t.co/HqUNS9fxn4,en,[],"['https://docs.google.com/forms/d/e/1FAIpQLSdmexsKP87trSOOqVagciEQJ270wjFXKCyuRjbvlrgsGECxTA/viewform', 'http://bitcoin-2x.org/', 'http://bitcoin-2x.org/whitepaper.pdf', 'https://t.me/joinchat/GR59BhBzbnh1GHbGAU6nqQ', 'https://bitcointalk.org/index.php?topic=2375646', 'https://etherdelta.com/#0x15ef5b9447710eab904e63e6233ff540400d603f-ETH']",['https://pbs.twimg.com/media/DOHUDE1X0AAXTwz.jpg'],181,1215,628,"['btc2x', 'btc', 'bitcoin']",[],https://twitter.com/bitcoin_2x_org/status/928259813091500032,False,,1,https://pbs.twimg.com/media/DOHUDE1X0AAXTwz.jpg,,,,,,,[],,,,
928171527748669440,928171527748669440,2017-11-08 03:05:11 Eastern Standard Time,2017-11-08,03:05:11,-0500,541548869,earthtokens,Earth Token,,"#EARTH Token countdown to the Pre-sale, we are in single digits now, 9 days to go!  https://t.co/7FGPgn5RaO #fintech #bitcoin #blockchain  https://t.co/k5jrdnYF0y",en,[],['http://ow.ly/gdVf30gqPxj'],['https://pbs.twimg.com/media/DOGHFZ-UMAE-KuS.jpg'],3,246,231,"['earth', 'fintech', 'bitcoin', 'blockchain']",[],https://twitter.com/earthtokens/status/928171527748669440,False,,1,https://pbs.twimg.com/media/DOGHFZ-UMAE-KuS.jpg,,,,,,,[],,,,
928132580469227520,928132580469227520,2017-11-08 00:30:25 Eastern Standard Time,2017-11-08,00:30:25,-0500,14338147,satoshilite,Charlie Lee,,"I noticed this also. In my opinion, Nick Szabo is the closest we have to Satoshi, if not Satoshi himself. With Nick and all of Bitcoin Core devs against Segwit2x, why are people still pushing for this hardfork that will split the chain?  https://t.co/5jRvNMaK5n",en,[],['https://twitter.com/theonevortex/status/928060705986691072'],[],98,368,1169,[],[],https://twitter.com/SatoshiLite/status/928132580469227520,False,https://twitter.com/theonevortex/status/928060705986691072,0,,,,,,,,[],,,,
928077566640099328,928077566640099328,2017-11-07 20:51:49 Eastern Standard Time,2017-11-07,20:51:49,-0500,5988062,theeconomist,The Economist,,"When the bitcoin crash comes, and it cannot be too far away, it will be dramatic  https://t.co/zSu5KWKLIM",en,[],['http://econ.st/2zpqkuC'],[],21,219,282,[],[],https://twitter.com/TheEconomist/status/928077566640099328,False,,0,,,,,,,,[],,,,
928060041537736704,928060041537736704,2017-11-07 19:42:11 Eastern Standard Time,2017-11-07,19:42:11,-0500,5988062,theeconomist,The Economist,,People are buying Bitcoin because they expect other people to buy it from them at a higher price. This is foolish  https://t.co/FH75nN9eWR,en,[],['http://econ.st/2yCVBxb'],[],52,227,355,[],[],https://twitter.com/TheEconomist/status/928060041537736704,False,,0,,,,,,,,[],,,,
927995578084151296,927995578084151296,2017-11-07 15:26:01 Eastern Standard Time,2017-11-07,15:26:01,-0500,15935591,cmegroup,CME Group,,"#Bitcoin futures contract specifications are now available. Learn about tick size, block thresholds and more.  https://t.co/qiEE1BrPVF  https://t.co/njOVqAZPxe",en,[],['http://spr.ly/6016D6dwe'],['https://pbs.twimg.com/media/DODnDtoWsAAW0pj.jpg'],31,451,518,['bitcoin'],[],https://twitter.com/CMEGroup/status/927995578084151296,False,,1,https://pbs.twimg.com/media/DODnDtoWsAAW0pj.jpg,,,,,,,[],,,,
927971584735956998,927971584735956998,2017-11-07 13:50:41 Eastern Standard Time,2017-11-07,13:50:41,-0500,91478624,forbes,Forbes,,"Tim Draper On Bitcoin: 'In 5 Years If You Use Fiat Currency, They Will Laugh At You'  https://t.co/7VxftnRNEE",en,[],['http://www.forbes.com/sites/johnkoetsier/2017/11/07/tim-draper-on-bitcoin-in-5-years-if-you-use-fiat-currency-they-will-laugh-at-you/?utm_source=TWITTER&utm_medium=social&utm_term=ViEWS%20Alerts#76616c657269'],[],34,196,314,[],[],https://twitter.com/Forbes/status/927971584735956998,False,,0,,,,,,,,[],,,,
