id,conversation_id,created_at,date,time,timezone,user_id,username,name,place,tweet,language,mentions,urls,photos,replies_count,retweets_count,likes_count,hashtags,cashtags,link,retweet,quote_url,video,thumbnail,near,geo,source,user_rt_id,user_rt,retweet_id,reply_to,retweet_date,translate,trans_src,trans_dest
1118461286680072192,1118461286680072192,2019-04-17 06:28:45 Eastern Daylight Time,2019-04-17,06:28:45,-0500,1021396122122801152,datalightme,DataLight,,"Just 10 years ago first #Bitcoin transaction was sent and it’s astonishing to see industry growth and how many new assets have gained traction.   In this unique visualization by DataLight, you can track the top-10 crypto assets by market cap, from crypto’s early days until today.  https://t.co/JIYT3KagwD",en,[],[],[],104,999,2632,['bitcoin'],[],https://twitter.com/DataLightMe/status/1118461286680072192,False,,1,https://pbs.twimg.com/ext_tw_video_thumb/1118460863810351104/pu/img/Nb-QHOYz_ubAo1rT.jpg,,,,,,,[],,,,
1118294681111146496,1118294681111146496,2019-04-16 19:26:43 Eastern Daylight Time,2019-04-16,19:26:43,-0500,878219545785372673,cryptodonalt,DonAlt,,Have you ever asked yourself how much BTC you should own?  The optimal balance is found when you're both angry when Bitcoin dumps AND when it pumps.,en,[],[],[],102,149,1380,[],[],https://twitter.com/CryptoDonAlt/status/1118294681111146496,False,,0,,,,,,,,[],,,,
1118292620743102464,1118292620743102464,2019-04-16 19:18:32 Eastern Daylight Time,2019-04-16,19:18:32,-0500,943060751668805633,x__anderson,Anders L,,Christine Lagarde isn’t hiding anything it seems:  - She says this new technology will disrupt Finance. - She says Ripple and Circle will be the disruptors. - She says Bitcoin will not be a disruptor - Banks = adapt or die  Most honest and straight forward person in Finance.,en,[],[],[],46,235,837,[],[],https://twitter.com/X__Anderson/status/1118292620743102464,False,,0,,,,,,,,[],,,,
1118277787477889024,1118277787477889024,2019-04-16 18:19:35 Eastern Daylight Time,2019-04-16,18:19:35,-0500,61417559,erikvoorhees,Erik Voorhees,,"Kraken Exchange Joins Binance, ShapeShift in Delisting Bitcoin SV  https://t.co/rm9CiiGBUt via @CoinDesk",en,"[{'screen_name': 'coindesk', 'name': 'coindesk', 'id': '1333467482'}]",['https://www.coindesk.com/kraken-exchange-joins-binance-shapeshift-in-delisting-bitcoin-sv'],[],35,141,724,[],[],https://twitter.com/ErikVoorhees/status/1118277787477889024,False,,0,,,,,,,,[],,,,
1118276383690698753,1118276383690698753,2019-04-16 18:14:01 Eastern Daylight Time,2019-04-16,18:14:01,-0500,17158189,mikedrucker,Mike Drucker,,Not important but Jack Dorsey looks like a Lord of the Rings dwarf who’s trying to convince his friends to stop mining for gold and start investing in Bitcoin  https://t.co/oKDMsiSxez,en,[],[],['https://pbs.twimg.com/media/D4TqcODW0AAudgQ.jpg'],202,993,8789,[],[],https://twitter.com/MikeDrucker/status/1118276383690698753,False,,1,https://pbs.twimg.com/media/D4TqcODW0AAudgQ.jpg,,,,,,,[],,,,
1118188865817280513,1118188865817280513,2019-04-16 12:26:15 Eastern Daylight Time,2019-04-16,12:26:15,-0500,960867574899728384,typerium_io,Typerium®,,Time to boycott #vergefam and join #typegang... 🔥🔥🔥  TYPE 👉  https://t.co/yz1bXIW28P …  #typegang #nextverge #cryptocurrency #bitcoin #bullrun #noporn #shotsfired #itswar #letsgo #allthewayup #whenbeetle #whenlambo #whenmcaffee @officialmcafee  https://t.co/B7sJCmry9x,en,"[{'screen_name': 'officialmcafee', 'name': 'john mcafee', 'id': '961445378'}]",['https://coinmarketcap.com/currencies/typerium'],[],317,478,387,"['vergefam', 'typegang', 'typegang', 'nextverge', 'cryptocurrency', 'bitcoin', 'bullrun', 'noporn', 'shotsfired', 'itswar', 'letsgo', 'allthewayup', 'whenbeetle', 'whenlambo', 'whenmcaffee']",[],https://twitter.com/Typerium_io/status/1118188865817280513,False,,1,https://pbs.twimg.com/ext_tw_video_thumb/1118188656064331781/pu/img/Hzy5wU9EQyfG86Gl.jpg,,,,,,,[],,,,
1118178783092269056,1118178783092269056,2019-04-16 11:46:11 Eastern Daylight Time,2019-04-16,11:46:11,-0500,221919949,bob_janke,Bob Janke,,found a bitcoin in the washing machine,en,[],[],[],12,131,391,[],[],https://twitter.com/Bob_Janke/status/1118178783092269056,False,,0,,,,,,,,[],,,,
1118178742654967814,1118178742654967814,2019-04-16 11:46:01 Eastern Daylight Time,2019-04-16,11:46:01,-0500,1530689216,bittylicious_,Bittylicious • The oldest British crypto exchange,,"Bittylicious is delisting Bitcoin SV (BSV). This will be available until 22nd April (pending brokers keeping their listings alive).  Low volumes aside, we are doing this to show solidarity against the toxic litigious environment in the BSV space @PeterMcCormack @cz_binance",en,"[{'screen_name': 'petermccormack', 'name': 'peter mclasso ☠️', 'id': '893818632089763840'}, {'screen_name': 'cz_binance', 'name': 'cz 🔶 binance', 'id': '902926941413453824'}]",[],[],66,138,843,[],[],https://twitter.com/Bittylicious_/status/1118178742654967814,False,,0,,,,,,,,[],,,,
1118177239223472129,1118177239223472129,2019-04-16 11:40:03 Eastern Daylight Time,2019-04-16,11:40:03,-0500,1856523530,capitalandceleb,CCN - Capital & Celeb News,,One of World’s Biggest Travel Companies is Now Accepting Bitcoin  https://t.co/CqX7YMr5QB,en,[],['https://www.ccn.com/one-of-worlds-biggest-travel-companies-accepts-bitcoin'],[],14,192,482,[],[],https://twitter.com/CapitalAndCeleb/status/1118177239223472129,False,,0,,,,,,,,[],,,,
1118124028584169472,1118124028584169472,2019-04-16 08:08:36 Eastern Daylight Time,2019-04-16,08:08:36,-0500,2229769334,litebiteu,LiteBit.eu,,"We appreciate the opinion of our LiteBit customers and the crypto community at large. So we would like to ask your opinion about the Bitcoin SV, should we follow the example of other major exchanges and delist Bitcoin SV? What do you think?   https://t.co/EuDUVXiaCR  #delistbsv",en,[],['https://cointelegraph.com/news/shapeshift-to-delist-bitcoin-sv-kraken-considers-following-suit'],[],84,138,209,['delistbsv'],[],https://twitter.com/litebiteu/status/1118124028584169472,False,,0,,,,,,,,[],,,,
1118121629215645696,1118121629215645696,2019-04-16 07:59:04 Eastern Daylight Time,2019-04-16,07:59:04,-0500,116226042,ronaldnzimora,Ochiagha,,This country is going to shit.  Have a Plan B  Get an international passport  Start planing for a second passport / residency  Set up a bank account abroad and start putting money outside / buy bitcoin  Be prepared for the worst.,en,[],[],[],48,321,615,[],[],https://twitter.com/ronaldnzimora/status/1118121629215645696,False,,0,,,,,,,,[],,,,
1118051549643776000,1118051549643776000,2019-04-16 03:20:36 Eastern Daylight Time,2019-04-16,03:20:36,-0500,227399720,tomfgoodwin,Tom Goodwin,,Things that did not exist 856 years ago when Notre-Dam was built  Uber Instagram Bitcoin iPad Snapchat Apple Maps Angry Birds Kickstarter GoFundMe WhatsApp Apple Watch FB Messenger Candy Crush Pinterest Alexa Venmo WeWork WeChat Tinder Twitch Siri Square Stripe Slack,en,[],[],[],132,200,1444,[],[],https://twitter.com/tomfgoodwin/status/1118051549643776000,False,,0,,,,,,,,[],,,,
1117981197911486464,1117981197911486464,2019-04-15 22:41:03 Eastern Daylight Time,2019-04-15,22:41:03,-0500,61417559,erikvoorhees,Erik Voorhees,,"There has never been a global recession since Bitcoin was created. Next time it happens, there is an escape hatch.",en,[],[],[],53,154,649,[],[],https://twitter.com/ErikVoorhees/status/1117981197911486464,False,https://twitter.com/EpsilonTheory/status/1117934099027591169,0,,,,,,,,[],,,,
1117980820294262785,1117980820294262785,2019-04-15 22:39:33 Eastern Daylight Time,2019-04-15,22:39:33,-0500,938606626017370112,moonoverlord,moon,,Crypto Twitter coming together to roast Craig Wright and delist Bitcoin SV   https://t.co/9DlFwUtMdX,en,[],[],[],67,240,1613,[],[],https://twitter.com/MoonOverlord/status/1117980820294262785,False,,1,https://pbs.twimg.com/ext_tw_video_thumb/807950469943488512/pu/img/hYWDsOXoSNCybczy.jpg,,,,,,,[],,,,
1117930338272018433,1117930338272018433,2019-04-15 19:18:57 Eastern Daylight Time,2019-04-15,19:18:57,-0500,56528768,gregory_raymond,Grégory Raymond,,"President @EmmanuelMacron has announced a subscription to rebuild #NotreDame. Hey bitcoiners, let's prove to the french authorities #Bitcoin can be an amazing way to send funds quickly, without border and for a good cause ! #bitcoinfornotredame 1JX3k1e1acXENqoKqaAtKKEdE9C2j4WsDB  https://t.co/Xu1zULMqL1",en,"[{'screen_name': 'emmanuelmacron', 'name': 'emmanuel macron', 'id': '1976143068'}]",[],['https://pbs.twimg.com/media/D4OvtY6XkAAEzBK.png'],33,157,257,"['notredame', 'bitcoin', 'bitcoinfornotredame']",[],https://twitter.com/gregory_raymond/status/1117930338272018433,False,,1,https://pbs.twimg.com/media/D4OvtY6XkAAEzBK.png,,,,,,,[],,,,
1117842010793099265,1117842010793099265,2019-04-15 13:27:58 Eastern Daylight Time,2019-04-15,13:27:58,-0500,61417559,erikvoorhees,Erik Voorhees,,We stand with @binance and CZ's sentiments. We’ve decided to delist Bitcoin SV #BSV from @ShapeShift_io within 48 hrs.,en,"[{'screen_name': 'binance', 'name': 'binance', 'id': '877807935493033984'}, {'screen_name': 'shapeshift_io', 'name': 'shapeshift 🦊', 'id': '2561715571'}]",[],[],457,1405,7497,['bsv'],[],https://twitter.com/ErikVoorhees/status/1117842010793099265,False,,0,,,,,,,,[],,,,
1117828361269571586,1117828361269571586,2019-04-15 12:33:44 Eastern Daylight Time,2019-04-15,12:33:44,-0500,1399148563,krakenfx,Kraken Exchange,,Should Kraken delist Bitcoin SV (BSV)? #delistbsv,de,[],[],[],1076,1537,3624,['delistbsv'],[],https://twitter.com/krakenfx/status/1117828361269571586,False,,0,,,,,,,,[],,,,
1117819810702872576,1117819810702872576,2019-04-15 11:59:45 Eastern Daylight Time,2019-04-15,11:59:45,-0500,3306210644,notgrubles,grublés,,"Received a new message over @Blockstream Satellite. It appears to be a treasure hunt for $1,000,000 in #bitcoin, with included GPS coordinates for the first part of the hunt! 🤯🛰️🔎🗺️  https://t.co/M4mKMbQ8KU  https://t.co/HzkEJ8RFXc",en,"[{'screen_name': 'blockstream', 'name': 'blockstream', 'id': '2307692107'}]",['http://satoshistreasure.xyz'],"['https://pbs.twimg.com/media/D4NLBrSXsAAsP1_.jpg', 'https://pbs.twimg.com/media/D4NLBsCWwAESVIT.jpg', 'https://pbs.twimg.com/media/D4NLBseX4AEKXzu.jpg', 'https://pbs.twimg.com/media/D4NLHItWwAA-v2h.jpg']",69,420,1020,['bitcoin'],[],https://twitter.com/notgrubles/status/1117819810702872576,False,,1,https://pbs.twimg.com/media/D4NLBrSXsAAsP1_.jpg,,,,,,,[],,,,
1117810362206904320,1117810362206904320,2019-04-15 11:22:12 Eastern Daylight Time,2019-04-15,11:22:12,-0500,1333467482,coindesk,CoinDesk,,"JUST IN: @binance is delisting bitcoin SV $BSV days after CEO @cz_binance called Craig Wright, the fork's creator, a ""fraud.""  https://t.co/wPGiQc4J4q  @nikhileshde writes",en,"[{'screen_name': 'binance', 'name': 'binance', 'id': '877807935493033984'}, {'screen_name': 'cz_binance', 'name': 'cz 🔶 binance', 'id': '902926941413453824'}, {'screen_name': 'nikhileshde', 'name': 'nikhilesh de', 'id': '69614360'}]",['http://ow.ly/ZlM550qjK52'],[],110,437,2014,[],['bsv'],https://twitter.com/CoinDesk/status/1117810362206904320,False,,0,,,,,,,,[],,,,
1117790260690337792,1117790260690337792,2019-04-15 10:02:20 Eastern Daylight Time,2019-04-15,10:02:20,-0500,1333467482,coindesk,CoinDesk,,JUST IN: Crypto derivatives provider @ledgerx aims to become the first U.S. firm to offer physically settled bitcoin futures contracts. Report by @nikhileshde  https://t.co/R5k9knfLqm,en,"[{'screen_name': 'ledgerx', 'name': 'ledgerx', 'id': '1456730211823804422'}, {'screen_name': 'nikhileshde', 'name': 'nikhilesh de', 'id': '69614360'}]",['http://ow.ly/qBDP50qjuaG'],[],16,224,497,[],[],https://twitter.com/CoinDesk/status/1117790260690337792,False,,0,,,,,,,,[],,,,
1117781286796562432,1117781286796562432,2019-04-15 09:26:40 Eastern Daylight Time,2019-04-15,09:26:40,-0500,961445378,officialmcafee,John McAfee,,Come on people!!! It's time to brush up your basic math skills and run some f*^#$ng numbers!!!! It is mathematically impossible for Bitcoin to be less than $1 mil by the end of 2020. Bitcoin is not an effing stock!!! You can't apply stock paradigms or formulas and expect answers!  https://t.co/KM6qVX204R,en,[],[],['https://pbs.twimg.com/media/D4MoJqvXkAAa-mW.jpg'],275,273,1242,[],[],https://twitter.com/officialmcafee/status/1117781286796562432,False,,1,https://pbs.twimg.com/media/D4MoJqvXkAAa-mW.jpg,,,,,,,[],,,,
1117700779731763200,1117700779731763200,2019-04-15 04:06:46 Eastern Daylight Time,2019-04-15,04:06:46,-0500,14717442,xentagz,Dennis Parker,,Avoid Bitcoindotcom. This scam website is trying to convince #Bitcoin newcomers into believing #bcash (bitcoincash) is bitcoin.   Bcash is just an altcoin and has nothing to do with Bitcoin. Tell your friends and please retweet this to avoid confusion in the bitcoin community.  https://t.co/QxHa56W5pE,en,[],[],['https://pbs.twimg.com/media/D4Le30sXoAAM186.jpg'],31,354,686,"['bitcoin', 'bcash']",[],https://twitter.com/Xentagz/status/1117700779731763200,False,,1,https://pbs.twimg.com/media/D4Le30sXoAAM186.jpg,,,,,,,[],,,,
1117559074466430977,1117559074466430977,2019-04-14 18:43:41 Eastern Daylight Time,2019-04-14,18:43:41,-0500,259725229,valaafshar,Vala Afshar,,"Before today’s win, last time Tiger won the Masters, these didn’t exist:  Twitter iPhone📱 iPad Kindle 4G Android YouTube AWS 🍏 App Store Uber Airbnb Blockchain Bitcoin Square Stripe Spotify Instagram Snapchat WhatsApp Pinterest  Kickstarter Messenger Box Lyft Hulu Nest Fitbit  https://t.co/CKXVwhJq4A",en,[],[],['https://pbs.twimg.com/media/D4JeDMsX4AAclVA.jpg'],53,942,2363,[],[],https://twitter.com/ValaAfshar/status/1117559074466430977,False,,1,https://pbs.twimg.com/media/D4JeDMsX4AAclVA.jpg,,,,,,,[],,,,
1117502948026793985,1117502948026793985,2019-04-14 15:00:39 Eastern Daylight Time,2019-04-14,15:00:39,-0500,1856523530,capitalandceleb,CCN - Capital & Celeb News,,Bitcoin Disrupts France’s Massive $2.5 Trillion Life Insurance Market  https://t.co/6EhVZtjohW,en,[],['https://www.ccn.com/bitcoin-disrupts-trillion-french-life-insurance'],[],11,137,355,[],[],https://twitter.com/CapitalAndCeleb/status/1117502948026793985,False,,0,,,,,,,,[],,,,
1117452919392149509,1117452919392149509,2019-04-14 11:41:51 Eastern Daylight Time,2019-04-14,11:41:51,-0500,1856523530,capitalandceleb,CCN - Capital & Celeb News,,One Bitcoin Could Exceed $1 Million in 7 -10 Years: PayPal Director  https://t.co/KCG0vXEk32,en,[],['https://www.ccn.com/one-bitcoin-could-exceed-1-million-in-7-10-years-paypal-director'],[],62,612,1501,[],[],https://twitter.com/CapitalAndCeleb/status/1117452919392149509,False,,0,,,,,,,,[],,,,
1117442478221791239,1117442478221791239,2019-04-14 11:00:22 Eastern Daylight Time,2019-04-14,11:00:22,-0500,1598709350,danheld,Dan Held,,The world has an unlimited supply of fiat to buy a limited supply of 21M Bitcoin.,en,[],[],[],65,393,1664,[],[],https://twitter.com/danheld/status/1117442478221791239,False,,0,,,,,,,,[],,,,
1117437498278449153,1117437498278449153,2019-04-14 10:40:35 Eastern Daylight Time,2019-04-14,10:40:35,-0500,973920489998602242,cryptobtc_chris,CryptoBitcoinChris,,Look what popped up in the Bank of America training portal!  #byebyefiat #cryptorevolution #crypto #bitcoin #CryptocurrencyExchange  https://t.co/HnfiL4HeCR,en,[],[],['https://pbs.twimg.com/media/D4HvEJ6XsAI1ThJ.jpg'],32,229,550,"['byebyefiat', 'cryptorevolution', 'crypto', 'bitcoin', 'cryptocurrencyexchange']",[],https://twitter.com/CryptoBTC_Chris/status/1117437498278449153,False,,1,https://pbs.twimg.com/media/D4HvEJ6XsAI1ThJ.jpg,,,,,,,[],,,,
1117427286234386440,1117427286234386440,2019-04-14 10:00:00 Eastern Daylight Time,2019-04-14,10:00:00,-0500,1598709350,danheld,Dan Held,,"Costliness of money (annually):  Gold Mining: $105B  Paper Currency and Minting: $28B Banking System: $1,870B Governments: $27,600B Bitcoin Mining: $4.5B",en,[],[],[],30,562,1315,[],[],https://twitter.com/danheld/status/1117427286234386440,False,,0,,,,,,,,[],,,,
1117423979759685632,1117423979759685632,2019-04-14 09:46:52 Eastern Daylight Time,2019-04-14,09:46:52,-0500,18331071,hiromitsutakagi,Hiromitsu Takagi,,はあ？bitcoinが匿名マネーだって？草生える。  https://t.co/fjij2CKXxW 「電子マネーの普及にともなうプライバシーの問題は、すでに1980年代には指摘されている。その系譜のなかで生まれたのがビットコインだ。ビットコインはプライバシー保護が強い設計で、また企業や国家のような管理主体はない。」,ja,[],['https://www.nikkei.com/article/DGKKZO43669380S9A410C1MY5000/'],[],1,139,185,[],[],https://twitter.com/HiromitsuTakagi/status/1117423979759685632,False,,0,,,,,,,,[],,,,
1117391012027039746,1117391012027039746,2019-04-14 07:35:52 Eastern Daylight Time,2019-04-14,07:35:52,-0500,1856523530,capitalandceleb,CCN - Capital & Celeb News,,"Bitcoin Outperforms Nasdaq 100, S&amp;P 500, Grows Whopping 37% in 2019  https://t.co/HOJZ1JPE9e",en,[],['https://www.ccn.com/bitcoin-whopping-37-ytd-outperforms-sp-500-nasdaq-100'],[],21,288,900,[],[],https://twitter.com/CapitalAndCeleb/status/1117391012027039746,False,,0,,,,,,,,[],,,,
1117352329869766656,1117352329869766656,2019-04-14 05:02:09 Eastern Daylight Time,2019-04-14,05:02:09,-0500,1856523530,capitalandceleb,CCN - Capital & Celeb News,,"BitMEX CEO Hayes Comes Full Circle, Predicts $50,000 Bitcoin Price  https://t.co/DhLUAfxiCS",en,[],['https://www.ccn.com/bitmex-ceo-hayes-comes-full-circle-predicts-50000-bitcoin-price'],[],34,178,565,[],[],https://twitter.com/CapitalAndCeleb/status/1117352329869766656,False,,0,,,,,,,,[],,,,
1117222247855534085,1117222247855534085,2019-04-13 20:25:15 Eastern Daylight Time,2019-04-13,20:25:15,-0500,2207129125,cointelegraph,Cointelegraph,,Bitcoin in Lagos: Africa’s most populous city is setting its eye on BTC amid a supposedly dire economic outlook  https://t.co/wYN3CUoKz0,en,[],['https://cointelegraph.com/news/young-africa-looks-to-crypto-for-payment'],[],17,170,438,[],[],https://twitter.com/Cointelegraph/status/1117222247855534085,False,,0,,,,,,,,[],,,,
1117186577749479425,1117186577749479425,2019-04-13 18:03:31 Eastern Daylight Time,2019-04-13,18:03:31,-0500,339061487,apompliano,Pomp 🌪,,Bitcoin is so much better than fiat currencies that it can’t be ignored.  Eventually everyone understands.,en,[],[],[],101,237,1514,[],[],https://twitter.com/APompliano/status/1117186577749479425,False,,0,,,,,,,,[],,,,
1117158105563971584,1117158105563971584,2019-04-13 16:10:22 Eastern Daylight Time,2019-04-13,16:10:22,-0500,40742821,tuurdemeester,Tuur Demeester,,"Bitcoin adoption is roughly tracking the trend for internet adoption. I made this in 2014, predicting 500M holders by 2020. @Wences estimates that we're currently at 60M Bitcoin holders.  https://t.co/Z75MRWGBPh",en,"[{'screen_name': 'wences', 'name': 'alexandro wences', 'id': '1220122913564741638'}]",[],['https://pbs.twimg.com/media/D4DxMY1XsAEAzqh.jpg'],31,256,694,[],[],https://twitter.com/TuurDemeester/status/1117158105563971584,False,,1,https://pbs.twimg.com/media/D4DxMY1XsAEAzqh.jpg,,,,,,,[],,,,
1117121153833811970,1117121153833811970,2019-04-13 13:43:32 Eastern Daylight Time,2019-04-13,13:43:32,-0500,40742821,tuurdemeester,Tuur Demeester,,"""Why not another cryptocurrency instead of Bitcoin?"" answered by Xapo CEO @wences  https://t.co/2WucfF0a23  https://t.co/T9ilpBOBiP",en,"[{'screen_name': 'wences', 'name': 'alexandro wences', 'id': '1220122913564741638'}]",['https://www.kanaandkatana.com/valuation-depot-contents/2019/4/11/the-case-for-a-small-allocation-to-bitcoin'],"['https://pbs.twimg.com/media/D4DPhvWXoAA3xb3.jpg', 'https://pbs.twimg.com/media/D4DPsRnXsAADAA0.jpg', 'https://pbs.twimg.com/media/D4DPvo5X4AIutVQ.jpg']",45,332,780,[],[],https://twitter.com/TuurDemeester/status/1117121153833811970,False,,1,https://pbs.twimg.com/media/D4DPhvWXoAA3xb3.jpg,,,,,,,[],,,,
1117105465098371073,1117105465098371073,2019-04-13 12:41:12 Eastern Daylight Time,2019-04-13,12:41:12,-0500,1007357709103108096,cryptopigmedia,Cryptopig 🐷,,Giving away $300 of BITCOIN (3 winners x $100). To enter just follow @cryptopigmedia &amp; @Oly245 and retweet!  Must be following both users!   Winners picked on 21st April at random.   Good luck.  $BTC $ETH $XRP $TRX $ICX $ZIL $BOLT  https://t.co/VvFIVlJGs0,en,"[{'screen_name': 'cryptopigmedia', 'name': 'cryptopig 🐷', 'id': '1007357709103108096'}, {'screen_name': 'oly245', 'name': 'oly245', 'id': '96583499'}]",[],['https://pbs.twimg.com/media/D4DBeg9W0AApkWA.jpg'],435,508,437,[],"['btc', 'eth', 'xrp', 'trx', 'icx', 'zil', 'bolt']",https://twitter.com/cryptopigmedia/status/1117105465098371073,False,,1,https://pbs.twimg.com/media/D4DBeg9W0AApkWA.jpg,,,,,,,[],,,,
1117072469783977985,1117072469783977985,2019-04-13 10:30:05 Eastern Daylight Time,2019-04-13,10:30:05,-0500,164425558,jonerlichman,Jon Erlichman,,On this day in 1997: Tiger Woods wins his first Masters   Things that didn't exist then:   iPhone Google Facebook Twitter Netflix LinkedIn Tesla Uber Emojis Android Skype YouTube Spotify iTunes Xbox Instagram BlackBerry Wikipedia Bitcoin PayPal Myspace iPad Snapchat Airbnb SpaceX  https://t.co/0Ipqs8T34y,en,[],[],['https://pbs.twimg.com/media/D4CjfPbX4AAPCrR.jpg'],103,1035,3893,[],[],https://twitter.com/JonErlichman/status/1117072469783977985,False,,1,https://pbs.twimg.com/media/D4CjfPbX4AAPCrR.jpg,,,,,,,[],,,,
1117050594844467201,1117050594844467201,2019-04-13 09:03:10 Eastern Daylight Time,2019-04-13,09:03:10,-0500,1413027896,charliebilello,Charlie Bilello,,2019 Returns... Oil $USO: +38% Bitcoin $BTC: +35% Nasdaq 100 $QQQ: +21% REITs $VNQ: +19% MLPs $AMLP: +18% Small Caps $IWM: +18% S&amp;P 500 $SPY: +17% EM $EEM: +14% EAFE $EFA: +13% Commodities $DBC: +13% High Yield $HYG: +9% Investment Grade $LQD: +6% Bonds $AGG: +2% Gold $GLD: +0.5%,en,[],[],[],20,272,679,[],"['uso', 'btc', 'qqq', 'vnq', 'amlp', 'iwm', 'spy', 'eem', 'efa', 'dbc', 'hyg', 'lqd', 'agg', 'gld']",https://twitter.com/charliebilello/status/1117050594844467201,False,,0,,,,,,,,[],,,,
1117041957421891586,1117041957421891586,2019-04-13 08:28:50 Eastern Daylight Time,2019-04-13,08:28:50,-0500,339061487,apompliano,Pomp 🌪,,This week in crypto:  1. Bitstamp granted Bitlicense 2. PewDiePie now on DLive platform 3. Dharma live on Ethereum 4. Lawmakers seek crypto tax clarity 5. Coinbase launch crypto debit card 6. Blockstack files for $50M Reg A+ 7. Bitcoin still not dead :)  The virus is spreading 🚀,en,[],[],[],101,623,2564,[],[],https://twitter.com/APompliano/status/1117041957421891586,False,,0,,,,,,,,[],,,,
1116932882092761088,1116932882092761088,2019-04-13 01:15:25 Eastern Daylight Time,2019-04-13,01:15:25,-0500,22682896,charlieshrem,Charlie Shrem,,In surprised BSV is even listed anywhere. It’s an obvious scam controlled by an obvious scammer. It goes against the reason we are here in the first place. Delist BSV from all exchanges and let it die. #DelistBSV. Long live #bitcoin,en,[],[],[],168,560,2829,"['delistbsv', 'bitcoin']",[],https://twitter.com/CharlieShrem/status/1116932882092761088,False,,0,,,,,,,,[],,,,
1116920584665874432,1116920584665874432,2019-04-13 00:26:33 Eastern Daylight Time,2019-04-13,00:26:33,-0500,61417559,erikvoorhees,Erik Voorhees,,"That one entity has sole authority to create money is entirely antithetical to capitalism. One cannot be a capitalist and advocate for central banking any more than a capitalist advocates for central shoe cobbling, central car manufacturing, or central oil production. #bitcoin",en,[],[],[],30,173,757,['bitcoin'],[],https://twitter.com/ErikVoorhees/status/1116920584665874432,False,,0,,,,,,,,[],,,,
1116911895489810432,1116911895489810432,2019-04-12 23:52:01 Eastern Daylight Time,2019-04-12,23:52:01,-0500,404136159,jackvladamir,Σ,,Ini adalah thread tentang Bitcoin.  Kisah dari awal kemunculan Bitcoin sebagai cryptocurrency.  https://t.co/Y6iVUtBJGn,in,[],[],['https://pbs.twimg.com/media/D4ARb5ZU8AAzGo8.jpg'],6,609,1052,[],[],https://twitter.com/Jackvladamir/status/1116911895489810432,False,,1,https://pbs.twimg.com/media/D4ARb5ZU8AAzGo8.jpg,,,,,,,[],,,,
1116782036168011776,1116782036168011776,2019-04-12 15:16:00 Eastern Daylight Time,2019-04-12,15:16:00,-0500,2189541,starkness,elizabeth stark 🌋,,Announcing a crowdfunding campaign to help @hodlonaut defend against unfounded legal attacks. Any remaining funds will be donated to @btcven. Please spread the word and donate!   https://t.co/X95BoQbO8D  In the bitcoin community we stand up for each other. #WeAreAllHodlonaut 💪  https://t.co/jD6hmAMJUv,en,"[{'screen_name': 'hodlonaut', 'name': 'hodlonaut 🌮⚡🔑 🐝', 'id': '852259884175372290'}, {'screen_name': 'btcven', 'name': 'bitcoin venezuela ⚡️', 'id': '901796180'}]",['http://weareallhodlonaut.com'],['https://pbs.twimg.com/media/D3-acmpUIAAuzWo.jpg'],197,700,1848,['weareallhodlonaut'],[],https://twitter.com/starkness/status/1116782036168011776,False,,1,https://pbs.twimg.com/media/D3-acmpUIAAuzWo.jpg,,,,,,,[],,,,
1116711894625202176,1116711894625202176,2019-04-12 10:37:17 Eastern Daylight Time,2019-04-12,10:37:17,-0500,339061487,apompliano,Pomp 🌪,,"Every exchange should delist BSV simultaneously on May 1st in a sign of solidarity behind the only Bitcoin that ever mattered.  This community is the responsibility of the people. Sometimes we must do the hard thing, not because it is easy, but because it is right.  #DelistBSV",en,[],[],[],546,1429,5505,['delistbsv'],[],https://twitter.com/APompliano/status/1116711894625202176,False,,0,,,,,,,,[],,,,
