id,conversation_id,created_at,date,time,timezone,user_id,username,name,place,tweet,language,mentions,urls,photos,replies_count,retweets_count,likes_count,hashtags,cashtags,link,retweet,quote_url,video,thumbnail,near,geo,source,user_rt_id,user_rt,retweet_id,reply_to,retweet_date,translate,trans_src,trans_dest
1116588566828568581,1116588566828568581,2019-04-12 02:27:14 Eastern Daylight Time,2019-04-12,02:27:14,-0500,2575606459,federicotenga,Federico Tenga,,"Imagine being Satoshi. You create Bitcoin under a pseudonym, you take all the precautions needed to protect your real identity, you disappear to liberate Bitcoin from the father figure.  And then after 10 years you start threatening and suing people if they don't believe you 🤔",en,[],[],[],96,471,2760,[],[],https://twitter.com/FedericoTenga/status/1116588566828568581,False,,0,,,,,,,,[],,,,
1116463479404343297,1116463479404343297,2019-04-11 18:10:11 Eastern Daylight Time,2019-04-11,18:10:11,-0500,361289499,bitcoinmagazine,Bitcoin Magazine,,"83 days, 56 countries, and 293 passes later, the Lightning Torch is in the charitable care of @btcven.  And it couldn't come on a more fitting day. #LNTrustChain  #bitcoin  #WeAreAllHodlonaut    https://t.co/TpWYzbqn5D",en,"[{'screen_name': 'btcven', 'name': 'bitcoin venezuela ⚡️', 'id': '901796180'}]",['https://bitcoinmagazine.com/articles/vidi-vici-satoshi-lightning-torch-has-reached-its-final-destination/'],[],30,157,419,"['lntrustchain', 'bitcoin', 'weareallhodlonaut']",[],https://twitter.com/BitcoinMagazine/status/1116463479404343297,False,,0,,,,,,,,[],,,,
1116352595537403905,1116352595537403905,2019-04-11 10:49:34 Eastern Daylight Time,2019-04-11,10:49:34,-0500,294808909,khannib,Antoine Le Calvez,,"Bitcoin mining, in its 10 years of existence, consumed as much energy as US cars do in 3 days.",en,[],[],[],58,579,1985,[],[],https://twitter.com/khannib/status/1116352595537403905,False,,0,,,,,,,,[],,,,
1116317753860853760,1116317753860853760,2019-04-11 08:31:07 Eastern Daylight Time,2019-04-11,08:31:07,-0500,919638257402548224,cobrabitcoin,Cøbra,,"Julian Assange and @WikiLeaks were one of the first advocates and supporters of Bitcoin. They were the first to put Bitcoin in the mainstream spotlight. For that reason, we Bitcoiners owe them a huge debt, and should speak up about what's happening to Assange. Very sad.",en,"[{'screen_name': 'wikileaks', 'name': 'wikileaks', 'id': '16589206'}]",[],[],36,144,536,[],[],https://twitter.com/CobraBitcoin/status/1116317753860853760,False,,0,,,,,,,,[],,,,
1116165757858197509,1116165757858197509,2019-04-10 22:27:08 Eastern Daylight Time,2019-04-10,22:27:08,-0500,61417559,erikvoorhees,Erik Voorhees,,"By holding dollars you are ultimately trusting politicians. By holding Bitcoin you are ultimately trusting open source code. Trust in politicians tends to fall over time. Trust in open source code tends to rise over time. And so, with time, which system likely advances?",en,[],[],[],110,614,2194,[],[],https://twitter.com/ErikVoorhees/status/1116165757858197509,False,,0,,,,,,,,[],,,,
1116153513376210944,1116153513376210944,2019-04-10 21:38:29 Eastern Daylight Time,2019-04-10,21:38:29,-0500,339061487,apompliano,Pomp 🌪,,"┏┓   ┃┃╱╲ in ┃╱╱╲╲  this ╱╱╭╮╲╲   house ▔▏┗┛▕▔    we ╱▔▔▔▔▔▔▔▔▔▔╲           always buy Bitcoin,       regardless of the price  ╱╱┏┳┓╭╮┏┳┓ ╲╲  ▔▏┗┻┛┃┃┗┻┛▕",en,[],[],[],84,355,2231,[],[],https://twitter.com/APompliano/status/1116153513376210944,False,,0,,,,,,,,[],,,,
1116147326052110336,1116147326052110336,2019-04-10 21:13:54 Eastern Daylight Time,2019-04-10,21:13:54,-0500,902282851499917312,forbescrypto,Forbes Crypto,,"Coinbase and Visa are making bitcoin, ethereum, Ripple's XRP, and litecoin payments a reality:  https://t.co/nmhKUcqWpr by @BillyBambrough via @Forbes",en,"[{'screen_name': 'billybambrough', 'name': 'billy bambrough', 'id': '753850129'}, {'screen_name': 'forbes', 'name': 'forbes', 'id': '91478624'}]",['http://www.forbes.com/sites/billybambrough/2019/04/10/coinbase-and-visa-are-making-bitcoin-ethereum-ripples-xrp-and-litecoin-payments-a-reality/'],[],29,263,666,[],[],https://twitter.com/ForbesCrypto/status/1116147326052110336,False,,0,,,,,,,,[],,,,
1116144788569513984,1116144788569513984,2019-04-10 21:03:49 Eastern Daylight Time,2019-04-10,21:03:49,-0500,339061487,apompliano,Pomp 🌪,,"Since Bitcoin’s creation 10 years ago, the banks run by these 7 men have been fined over $160 billion for various crimes and regulatory violations.  I’ll trust Satoshi over them any day.  https://t.co/xSAXlgQj6Q",en,[],[],['https://pbs.twimg.com/media/D31XxM5WwAU9yy2.jpg'],163,936,3149,[],[],https://twitter.com/APompliano/status/1116144788569513984,False,,1,https://pbs.twimg.com/media/D31XxM5WwAU9yy2.jpg,,,,,,,[],,,,
1116099739173494784,1116099739173494784,2019-04-10 18:04:48 Eastern Daylight Time,2019-04-10,18:04:48,-0500,16732770,cnbcfastmoney,CNBC's Fast Money,,Bitcoin is up more than 30% this month and @BKBrianKelly says it could hit new highs by this date...  https://t.co/afC58AqIGW,en,"[{'screen_name': 'bkbriankelly', 'name': 'brrrian kelly', 'id': '19337489'}]",[],[],161,247,663,[],[],https://twitter.com/CNBCFastMoney/status/1116099739173494784,False,,1,https://pbs.twimg.com/media/D30uy1rWwAALj9w.jpg,,,,,,,[],,,,
1116020946568196102,1116020946568196102,2019-04-10 12:51:42 Eastern Daylight Time,2019-04-10,12:51:42,-0500,534493783,krugermacro,Alex Krüger,,Bitcoin. Institutional money is here.  https://t.co/ErWjz1vcDW,en,[],[],['https://pbs.twimg.com/media/D3znEyBXsAARZyD.png'],69,273,997,[],[],https://twitter.com/krugermacro/status/1116020946568196102,False,,1,https://pbs.twimg.com/media/D3znEyBXsAARZyD.png,,,,,,,[],,,,
1115972672368803841,1115972672368803841,2019-04-10 09:39:53 Eastern Daylight Time,2019-04-10,09:39:53,-0500,14561327,dhh,DHH,,"As China looks to fight air pollution, it eyes banning Bitcoin crypto-mining, as it deems it ""seriously wasted resources"", generating 10m tons of CO2/year.  https://t.co/DzQllllJ0l",en,[],['https://www.engadget.com/2019/04/10/china-ban-bitcoin-mining-wasted-resources/'],[],19,125,494,[],[],https://twitter.com/dhh/status/1115972672368803841,False,,0,,,,,,,,[],,,,
1115950674171256832,1115950674171256832,2019-04-10 08:12:28 Eastern Daylight Time,2019-04-10,08:12:28,-0500,1856523530,capitalandceleb,CCN - Capital & Celeb News,,The Philippines’ Central Bank Has Already Legalized 10 Bitcoin Exchanges  https://t.co/44LjvBkd5F,en,[],['https://www.ccn.com/the-philippines-central-bank-has-already-legalized-10-bitcoin-exchanges'],[],11,255,701,[],[],https://twitter.com/CapitalAndCeleb/status/1115950674171256832,False,,0,,,,,,,,[],,,,
1115712992220520449,1115712992220520449,2019-04-09 16:28:00 Eastern Daylight Time,2019-04-09,16:28:00,-0500,14717442,xentagz,Dennis Parker,,Is Facebookcoin a threat for #Bitcoin? @aantonop explains  https://t.co/kWwUQepG60,en,"[{'screen_name': 'aantonop', 'name': 'andreas', 'id': '1469101279'}]",[],[],42,233,588,['bitcoin'],[],https://twitter.com/Xentagz/status/1115712992220520449,False,,1,https://pbs.twimg.com/ext_tw_video_thumb/1115711064887496705/pu/img/Sf36AmSSwYJV-9Px.jpg,,,,,,,[],,,,
1115651578470567936,1115651578470567936,2019-04-09 12:23:58 Eastern Daylight Time,2019-04-09,12:23:58,-0500,420308365,nic__carter,nic carter,,Bitcoin critics today  https://t.co/sRPVZteb4u,en,[],[],['https://pbs.twimg.com/media/D3uXKVbXkAAid9b.jpg'],34,173,924,[],[],https://twitter.com/nic__carter/status/1115651578470567936,False,,1,https://pbs.twimg.com/media/D3uXKVbXkAAid9b.jpg,,,,,,,[],,,,
1115621406899884032,1115621406899884032,2019-04-09 10:24:05 Eastern Daylight Time,2019-04-09,10:24:05,-0500,2520888308,cryptobull,Crypto฿ull,,China banning bitcoin  https://t.co/oeB2zhMv6t,en,[],[],['https://pbs.twimg.com/media/D3t7UutXkAE_kn7.jpg'],43,239,1513,[],[],https://twitter.com/CryptoBull/status/1115621406899884032,False,,1,https://pbs.twimg.com/media/D3t7UutXkAE_kn7.jpg,,,,,,,[],,,,
1115600640393093121,1115600640393093121,2019-04-09 09:01:34 Eastern Daylight Time,2019-04-09,09:01:34,-0500,1598709350,danheld,Dan Held,,"After a nearly 40 year long “War on drugs” governments can’t keep drugs off the streets, out of elementary schools, not even out of federal prison.  And you're worried they'll be able to stop Bitcoin? 😂",en,[],[],[],36,135,700,[],[],https://twitter.com/danheld/status/1115600640393093121,False,,0,,,,,,,,[],,,,
1115594858289344512,1115594858289344512,2019-04-09 08:38:35 Eastern Daylight Time,2019-04-09,08:38:35,-0500,3179873194,cryptohustle,฿TF%$Brrrrrr!,,"China banning #bitcoin is literally an annual tradition that started in 2013. Here's a ""ban on mining"" article from last year.  https://t.co/VysAqBjmv8",en,[],['https://www.google.com/amp/s/www.forbes.com/sites/sarahsu/2018/01/15/chinas-shutdown-of-bitcoin-miners-isnt-just-about-electricity/amp/'],[],40,155,755,['bitcoin'],[],https://twitter.com/CryptoHustle/status/1115594858289344512,False,,0,,,,,,,,[],,,,
1115570520135798785,1115570520135798785,2019-04-09 07:01:52 Eastern Daylight Time,2019-04-09,07:01:52,-0500,1856523530,capitalandceleb,CCN - Capital & Celeb News,,"$546 Million: CME Bitcoin Futures Hits Record 1-Day Volume; Could Spike BTC Beyond $6,000  https://t.co/loNlZBqHL6",en,[],['https://www.ccn.com/cme-sees-meteroic-bitcoin-demand-546m-in-1-day'],[],41,386,982,[],[],https://twitter.com/CapitalAndCeleb/status/1115570520135798785,False,,0,,,,,,,,[],,,,
1115565389797314560,1115565389797314560,2019-04-09 06:41:29 Eastern Daylight Time,2019-04-09,06:41:29,-0500,30457138,latentexistence,Ella 🏳️‍⚧️🏳️‍🌈♿️,,China may be about to ban Bitcoin mining because it is horrifically wasteful. It uses more energy than entire countries.   https://t.co/nOYGQRewvU,en,[],['https://www.bloomberg.com/news/articles/2019-04-09/china-plans-to-ban-cryptocurrency-mining-in-renewed-clampdown'],[],12,315,804,[],[],https://twitter.com/latentexistence/status/1115565389797314560,False,,0,,,,,,,,[],,,,
1115535877634129920,1115535877634129920,2019-04-09 04:44:13 Eastern Daylight Time,2019-04-09,04:44:13,-0500,2272640503,iamjosephyoung,Joseph Young,,"CME bitcoin futures recorded $546 million in volume on April 4 and most of it came from Asia according to Bloomberg.  With China seeing strong OTC bitcoin buys (as reported by @cnLedger), it seems like the overall interest in crypto in Asia is rising fairly rapidly.",en,"[{'screen_name': 'cnledger', 'name': 'cnledger', 'id': '4919234126'}]",[],[],13,155,514,[],[],https://twitter.com/iamjosephyoung/status/1115535877634129920,False,,0,,,,,,,,[],,,,
1115523570002812929,1115523570002812929,2019-04-09 03:55:19 Eastern Daylight Time,2019-04-09,03:55:19,-0500,928759224599040001,crypto,Bloomberg Crypto,,"China, once home to about 70% of Bitcoin mining, plans to ban the crypto activity  https://t.co/uOjtPoM4z0",en,[],['https://trib.al/FzBPNlg'],[],104,207,403,[],[],https://twitter.com/crypto/status/1115523570002812929,False,,0,,,,,,,,[],,,,
1115442549206941698,1115442549206941698,2019-04-08 22:33:22 Eastern Daylight Time,2019-04-08,22:33:22,-0500,928759224599040001,crypto,Bloomberg Crypto,,CME Bitcoin futures volume hits record high as prices rebound  https://t.co/O9tbYVea9f  https://t.co/e1h8sCn8lX,en,[],['https://bloom.bg/2Un2qxL'],['https://pbs.twimg.com/media/D3rZFlzW0AEdn-G.png'],10,141,293,[],[],https://twitter.com/crypto/status/1115442549206941698,False,,1,https://pbs.twimg.com/media/D3rZFlzW0AEdn-G.png,,,,,,,[],,,,
1115384543102492672,1115384543102492672,2019-04-08 18:42:52 Eastern Daylight Time,2019-04-08,18:42:52,-0500,339061487,apompliano,Pomp 🌪,,Where did all the Bitcoin haters go that said Bitcoin was going to zero?!,en,[],[],[],352,318,2580,[],[],https://twitter.com/APompliano/status/1115384543102492672,False,,0,,,,,,,,[],,,,
1115274412239007744,1115274412239007744,2019-04-08 11:25:15 Eastern Daylight Time,2019-04-08,11:25:15,-0500,361289499,bitcoinmagazine,Bitcoin Magazine,,"#Bitcoin forks, visualized.    https://t.co/wS6uTZezfn  https://t.co/wqABMz9LW5",en,[],['https://bitcoinmagazine.com/articles/infographic-map-bitcoin-forks'],['https://pbs.twimg.com/media/D3pAHOtW4AIhgoY.jpg'],48,339,844,['bitcoin'],[],https://twitter.com/BitcoinMagazine/status/1115274412239007744,False,,1,https://pbs.twimg.com/media/D3pAHOtW4AIhgoY.jpg,,,,,,,[],,,,
1115264498561056768,1115264498561056768,2019-04-08 10:45:51 Eastern Daylight Time,2019-04-08,10:45:51,-0500,1856523530,capitalandceleb,CCN - Capital & Celeb News,,"Billionaire Tim Draper Slams’Paranoid’ Jamie Dimon, Doubles Down $250,000 Bitcoin Price  https://t.co/ML8BmoF3M4",en,[],['https://www.ccn.com/bitcoin-bull-tim-draper-jamie-dimon-250000-price'],[],12,173,502,[],[],https://twitter.com/CapitalAndCeleb/status/1115264498561056768,False,,0,,,,,,,,[],,,,
1115238322413154304,1115238322413154304,2019-04-08 09:01:50 Eastern Daylight Time,2019-04-08,09:01:50,-0500,1333467482,coindesk,CoinDesk,,JUST IN: Pantera-backed @sparkswap has launched to offer pro traders litecoin-to-bitcoin atomic swaps using the lightning network. Article by @La__Cuen  https://t.co/ulNX24dr57,en,"[{'screen_name': 'sparkswap', 'name': 'sparkswap', 'id': '1021509506264576000'}, {'screen_name': 'la__cuen', 'name': 'leigh cuen', 'id': '416161639'}]",['http://ow.ly/BljI50pwkrU'],[],19,140,462,[],[],https://twitter.com/CoinDesk/status/1115238322413154304,False,,0,,,,,,,,[],,,,
1115238124718833664,1115238124718833664,2019-04-08 09:01:03 Eastern Daylight Time,2019-04-08,09:01:03,-0500,1598709350,danheld,Dan Held,,Bitcoin raised $0 to become the internet of money.,en,[],[],[],26,154,1151,[],[],https://twitter.com/danheld/status/1115238124718833664,False,,0,,,,,,,,[],,,,
1115070888196464640,1115070888196464640,2019-04-07 21:56:31 Eastern Daylight Time,2019-04-07,21:56:31,-0500,4919234126,cnledger,cnLedger,,"1/ Chinese markets reveal strong buys. OTC (Over-The-Counter) trades, the almost only way to buy bitcoin with fiat in China, showing considerable $ premium (1 USDT = 7 CNY) over the official rate of 1 USD = 6.7 CNY.  https://t.co/bd0n0DGFVU",en,[],[],"['https://pbs.twimg.com/media/D3mAaq-UcAAH1EO.jpg', 'https://pbs.twimg.com/media/D3mAiwkUwAE0MKb.jpg']",14,130,305,[],[],https://twitter.com/cnLedger/status/1115070888196464640,False,,1,https://pbs.twimg.com/media/D3mAaq-UcAAH1EO.jpg,,,,,,,[],,,,
1115035169994366976,1115035169994366976,2019-04-07 19:34:35 Eastern Daylight Time,2019-04-07,19:34:35,-0500,1053688417689563136,koleyayyc,Koleya,,"#Bitcoin is money for people who don't believe in  Endless, pointless wars  Corruption  Unlimited government spending  The massive culture of needless consumption which defines modern society  Thank you @saifedean @BitcoinBrains and @francispouliot_ for helping me understand this",en,"[{'screen_name': 'saifedean', 'name': 'saifedean.com', 'id': '18469669'}, {'screen_name': 'bitcoinbrains', 'name': 'dave bradley', 'id': '2152077415'}, {'screen_name': 'francispouliot_', 'name': 'naked face (offline)', 'id': '1643500784'}]",[],[],289,507,2514,['bitcoin'],[],https://twitter.com/Koleyayyc/status/1115035169994366976,False,,0,,,,,,,,[],,,,
1115023316786409472,1115023316786409472,2019-04-07 18:47:29 Eastern Daylight Time,2019-04-07,18:47:29,-0500,339061487,apompliano,Pomp 🌪,,Bitcoin’s market cap just surpassed $92 billion.,en,[],[],[],86,309,1955,[],[],https://twitter.com/APompliano/status/1115023316786409472,False,,0,,,,,,,,[],,,,
1115017539325575168,1115017539325575168,2019-04-07 18:24:32 Eastern Daylight Time,2019-04-07,18:24:32,-0500,339061487,apompliano,Pomp 🌪,,BITCOIN,en,[],[],[],164,191,2072,[],[],https://twitter.com/APompliano/status/1115017539325575168,False,,0,,,,,,,,[],,,,
1114975369994612736,1114975369994612736,2019-04-07 15:36:58 Eastern Daylight Time,2019-04-07,15:36:58,-0500,51090589,bitcoindantes,Freedom Dantes,,Buy Bitcoin  It’s the only protest you’ll ever need to take part in.  It’s also the most disruptive and effective protest you’ll ever take part in too.  Real change starts with real money.  https://t.co/kK1yyE12xx,en,[],[],['https://pbs.twimg.com/media/D3kwLsIX4AEVGzR.jpg'],36,277,1098,[],[],https://twitter.com/BitcoinDantes/status/1114975369994612736,False,,1,https://pbs.twimg.com/media/D3kwLsIX4AEVGzR.jpg,,,,,,,[],,,,
1114928230635659264,1114928230635659264,2019-04-07 12:29:39 Eastern Daylight Time,2019-04-07,12:29:39,-0500,933567617549455360,jacobcanfield,Jacob Canfield 🐸,,Bitcoin transactions per block now at all time high. 🚀 We're taking over.  https://t.co/1QELlRWWnw,en,[],[],['https://pbs.twimg.com/media/D3kFFPqX4AEqbRp.jpg'],14,166,672,[],[],https://twitter.com/JacobCanfield/status/1114928230635659264,False,,1,https://pbs.twimg.com/media/D3kFFPqX4AEqbRp.jpg,,,,,,,[],,,,
1114893618853089281,1114893618853089281,2019-04-07 10:12:07 Eastern Daylight Time,2019-04-07,10:12:07,-0500,1856523530,capitalandceleb,CCN - Capital & Celeb News,,"Bitcoin Price Aims for ‘Parabolic’ Bull Market, Sets Long-Term Target at $72,000  https://t.co/udMjoYLS0p",en,[],['https://www.ccn.com/bitcoin-price-aims-for-parabolic-bull-market-sets-long-term-target-at-72000'],[],22,344,946,[],[],https://twitter.com/CapitalAndCeleb/status/1114893618853089281,False,,0,,,,,,,,[],,,,
1114887826036920320,1114887826036920320,2019-04-07 09:49:05 Eastern Daylight Time,2019-04-07,09:49:05,-0500,1643500784,francispouliot_,NAKED FACE (offline),,What Bitcoin builders are working on: - CoinJoin - Lightning Network - Full validating node tools - Tor integration - Communication alternatives to internet  - Security hardware - User experience/interfaces - Standardization/compatibility - cryptography enhancements in protocol,en,[],[],[],26,263,938,[],[],https://twitter.com/francispouliot_/status/1114887826036920320,False,,0,,,,,,,,[],,,,
1114864121026097153,1114864121026097153,2019-04-07 08:14:54 Eastern Daylight Time,2019-04-07,08:14:54,-0500,14717442,xentagz,Dennis Parker,,The true #Bitcoin inventor has been revealed  https://t.co/1LVyb8Rb3Q,en,[],[],[],187,344,1689,['bitcoin'],[],https://twitter.com/Xentagz/status/1114864121026097153,False,,1,https://pbs.twimg.com/ext_tw_video_thumb/1114863935818207232/pu/img/h4tEGvaxXiKXmdbj.jpg,,,,,,,[],,,,
1114642037167595522,1114642037167595522,2019-04-06 17:32:25 Eastern Daylight Time,2019-04-06,17:32:25,-0500,900770398513635328,talentpierre,talentpierre⚡️,,"What do you see? A satellite dish? No. A laptop?No. A #bitcoin #fullnode with a satellite dish?No. You see the freedom, the sovereignty and the equality of millions of people in #Africa #SouthAmerica #China and a lot of other countries. It's not a gamechanger. It's a worldchanger  https://t.co/U0SYcWbbzk",en,[],[],['https://pbs.twimg.com/media/D3gBA9jXoAECGLF.jpg'],26,194,675,"['bitcoin', 'fullnode', 'africa', 'southamerica', 'china']",[],https://twitter.com/talentpierre/status/1114642037167595522,False,,1,https://pbs.twimg.com/media/D3gBA9jXoAECGLF.jpg,,,,,,,[],,,,
1114551159489007616,1114551159489007616,2019-04-06 11:31:18 Eastern Daylight Time,2019-04-06,11:31:18,-0500,2933805082,fintechfrank,Frank Chaparro,,"Trader who called bitcoin's 84% decline in 2018 now sees $50,000 price target  https://t.co/LMliqCmm46",en,[],['https://finance.yahoo.com/news/trader-who-called-bitcoins-84-decline-in-2018-now-sees-50000-price-target-112129177.html'],[],59,473,1520,[],[],https://twitter.com/fintechfrank/status/1114551159489007616,False,,0,,,,,,,,[],,,,
1114515405614268416,1114515405614268416,2019-04-06 09:09:14 Eastern Daylight Time,2019-04-06,09:09:14,-0500,1856523530,capitalandceleb,CCN - Capital & Celeb News,,"Bitcoin Surging 19% Only the Beginning, Halving Will Propel to Meteoric Gains  https://t.co/iGWpBGEfYR",en,[],['https://www.ccn.com/bitcoin-surging-19-only-the-beginning-halving-will-propel-to-meteoric-gains'],[],16,277,742,[],[],https://twitter.com/CapitalAndCeleb/status/1114515405614268416,False,,0,,,,,,,,[],,,,
1114513554328248322,1114513554328248322,2019-04-06 09:01:52 Eastern Daylight Time,2019-04-06,09:01:52,-0500,1598709350,danheld,Dan Held,,"Bitcoin isn’t just a store of value, it’s becoming a platform with many features:  - Micropayments (LN) - Private transactions (LN) - Tokenized securities (Sidechains) - High volume payment network (LN) - Advanced smart contracts (Taproot/graftroot)",en,[],[],[],37,145,575,[],[],https://twitter.com/danheld/status/1114513554328248322,False,,0,,,,,,,,[],,,,
1114505710350376962,1114504435248652289,2019-04-06 08:30:42 Eastern Daylight Time,2019-04-06,08:30:42,-0500,902926941413453824,cz_binance,CZ 🔶 Binance,,"@APompliano One buyer triggered it, but plenty of money waiting to jump back in at the first sight of a trigger. If anyone is still worried that bitcoin is dead, well, think again.  We are all here.",en,[],[],[],37,178,1588,[],[],https://twitter.com/cz_binance/status/1114505710350376962,False,,0,,,,,,,,"[{'screen_name': 'APompliano', 'name': 'Pomp 🌪', 'id': '339061487'}]",,,,
1114504435248652289,1114504435248652289,2019-04-06 08:25:38 Eastern Daylight Time,2019-04-06,08:25:38,-0500,339061487,apompliano,Pomp 🌪,,This week in crypto:  1. One buyer pushes BTC over $5k 2. “Bitcoin” Google searches triple 3. SEC publishes token guidance  4. Binance launching in Singapore 5. More than 40 central banks are evaluating blockchain tech 6. Bitcoin still not dead :)  Building the foundation weekly!,en,[],[],[],123,1011,3905,[],[],https://twitter.com/APompliano/status/1114504435248652289,False,,0,,,,,,,,[],,,,
1114444781361537025,1114444781361537025,2019-04-06 04:28:35 Eastern Daylight Time,2019-04-06,04:28:35,-0500,66106683,simondixontwitt,Simon Dixon (Beware Impersonators),,CME Bitcoin Futures Volume Skyrockets 950% Since April 1st -  https://t.co/L2sor40bnB  https://t.co/kBvZSmitVP,en,[],"['http://Bitcoinist.com', 'https://bitcoinist.com/cme-bitcoin-futures-volume-skyrockets-950-since-april-1st/']",[],14,190,439,[],[],https://twitter.com/SimonDixonTwitt/status/1114444781361537025,False,,0,,,,,,,,[],,,,
1114438469676355585,1114438469676355585,2019-04-06 04:03:31 Eastern Daylight Time,2019-04-06,04:03:31,-0500,146008010,cryptomichnl,Michaël van de Poppe,,"Whether you buy at $3,100 or $4,700.   Doesn’t really matter in a few years.   Don’t try to ‘hit’ the actual bottom.  Average in, let it ride &amp; enjoy.   Can’t be wrong.   $BTC #BITCOIN",en,[],[],[],61,175,1067,['bitcoin'],['btc'],https://twitter.com/CryptoMichNL/status/1114438469676355585,False,,0,,,,,,,,[],,,,
1114272208250183683,1114272208250183683,2019-04-05 17:02:51 Eastern Daylight Time,2019-04-05,17:02:51,-0500,534493783,krugermacro,Alex Krüger,,Bitcoin  30 day change: +31% 1 year change: -26%  2 year change: +340% 3 year change: +1090%  Not too bad.,en,[],[],[],27,230,1291,[],[],https://twitter.com/krugermacro/status/1114272208250183683,False,,0,,,,,,,,[],,,,
1114247683340812288,1114247683340812288,2019-04-05 15:25:24 Eastern Daylight Time,2019-04-05,15:25:24,-0500,632528146,kerooke,Kevin Rooke,,"Bitcoin just broke an all-time high in transactions/block.  The record has now been broken twice in the last 10 days.  Dec 20, 2017: 2722 tx/block Mar 26, 2019: 2734 tx/block Mar 31, 2019: 2745 tx/block  https://t.co/6vxB8kSXob",en,[],[],['https://pbs.twimg.com/media/D3aaOitU0AAcHgf.jpg'],22,226,626,[],[],https://twitter.com/kerooke/status/1114247683340812288,False,,1,https://pbs.twimg.com/media/D3aaOitU0AAcHgf.jpg,,,,,,,[],,,,
1114244020530745345,1114244020530745345,2019-04-05 15:10:50 Eastern Daylight Time,2019-04-05,15:10:50,-0500,1856523530,capitalandceleb,CCN - Capital & Celeb News,,Bitcoin Whales Have Started Splashing – This Rally’s Just Getting Started  https://t.co/gHGRje8ZPn,en,[],['https://www.ccn.com/bitcoin-whales-have-started-splashing-this-rallys-just-getting-started'],[],13,167,436,[],[],https://twitter.com/CapitalAndCeleb/status/1114244020530745345,False,,0,,,,,,,,[],,,,
1114216099514540032,1114216099514540032,2019-04-05 13:19:53 Eastern Daylight Time,2019-04-05,13:19:53,-0500,942999039192186882,altcoinpsycho,Altcoin Psycho,,"$BTC   THE GUPPY HAS FLIPPED GREEN  Unless this is a fakeout, which has only happened twice on the bitcoin daily chart, the trend has officially been reversed.   This is where you should start longing every bullish SFP (with stops)  https://t.co/aGHoqSl7jT",en,[],[],['https://pbs.twimg.com/media/D3Z9ZLgUEAAmYMd.jpg'],507,389,2833,[],['btc'],https://twitter.com/AltcoinPsycho/status/1114216099514540032,False,,1,https://pbs.twimg.com/media/D3Z9ZLgUEAAmYMd.jpg,,,,,,,[],,,,
1114171982663299072,1114171982663299072,2019-04-05 10:24:35 Eastern Daylight Time,2019-04-05,10:24:35,-0500,1005186202054676480,c_bendiksen,Christopher Bendiksen,,Negativity towards #Bitcoin is inversely proportional to knowledge of Bitcoin.,en,[],[],[],44,274,1204,['bitcoin'],[],https://twitter.com/C_Bendiksen/status/1114171982663299072,False,,0,,,,,,,,[],,,,
1114127642389819392,1114127642389819392,2019-04-05 07:28:24 Eastern Daylight Time,2019-04-05,07:28:24,-0500,339061487,apompliano,Pomp 🌪,,"Quantitative Easing was simply a government sanctioned ICO.  The currency is backed by nothing, is printed out of thin air, and was handed to insiders under the guise of ""making the world a better place.""  Bitcoin is the general population's attempt to stop the madness.",en,[],[],[],129,548,2138,[],[],https://twitter.com/APompliano/status/1114127642389819392,False,,0,,,,,,,,[],,,,
1114055905249759232,1114055905249759232,2019-04-05 02:43:20 Eastern Daylight Time,2019-04-05,02:43:20,-0500,2593497397,lilmoonlambo,theweeknd.eth,,Nipsey Hussle was a fan on crypto and Bitcoin and knew it had serious room for growth in the future  #RIPNipseyHussle    https://t.co/6PcTBk0Pxm,en,[],['https://twitter.com/CRYPTOVERLOAD/status/1112818131251204097/video/1'],[],63,872,2690,['ripnipseyhussle'],[],https://twitter.com/LilMoonLambo/status/1114055905249759232,False,,0,,,,,,,,[],,,,
